,title,date,content
0,‘깜짝 수주’ 막판 뒷심 보여준 한국 조선업,2020.12.21,"한국조선해양 1조1863억원·삼성중공업 4082억원 ‘추가 계약’ 성공대우조선도 10월 2조274억원 수주…한국, 중국과 점유율 격차 좁혀 한국 조선업계가 잇따라 조단위 신규 선박 건조 계약을 체결하면서 막판 뒷심을 보여주고 있다. 현대중공업그룹의 조선지주사인 한국조선해양은 최근 일주일 새 약 2조6000억원 규모의 선박을 수주했다. 삼성중공업은 지난달 말 창사 이래 단일 선박 계약으로는 최대인 2조8072억원짜리 수주에 성공했다. 한때 40% 가까이 벌어졌던 중국과의 세계 시장 점유율 격차는 한 자릿수까지 떨어졌다.한국조선해양은 오세아니아, 파나마, 유럽지역 선사 등과 액화천연가스(LNG) 운반선 3척, 컨테이너선 4척, 액화석유가스(LPG) 운반선 2척, 석유화학제품 운반선(PC선) 1척 등 총 10척, 1조1863억원 규모의 선박을 수주했다고 21일 밝혔다. 한국조선해양은 지난 16일에도 유럽, 버뮤다 및 아시아 소재 선사들과 LNG 운반선 4척과 31만8000t급 초대형 원유운반선(VLCC) 2척 등 1조원 규모 계약을 체결했다. 지난 14일 유럽 선사와 30만t급 VLCC 4척(4000억원) 계약을 한 것까지 더하면 최근 일주일 동안에만 약 2조6000억원의 수주 실적을 올렸다.삼성중공업도 이날 오세아니아 선사로부터 LNG 운반선 2척, 4082억원을 수주했다고 밝혔다. 삼성중공업은 지난달 23일에도 유럽 선주와 2조8072억원 규모의 LNG 운반선 블록 및 기자재 공급계약을 체결했다. 지난 11월 초까지만 해도 수주 가뭄을 겪었던 삼성중공업은 단일 계약 기준 창사 이래 최대 규모인 이 계약으로 한숨을 돌렸다. 삼성중공업은 11월부터 이번 계약까지 총 13척의 LNG 운반선을 수주한 데 힘입어 누계 수주금액이 지난 10월 말 11억달러에서 현재 44억달러로 단숨에 4배가 됐다.대우조선해양은 지난 10월 유럽 선사로부터 LNG 운반선 6척을 총 2조274억원에 수주하면서, 연간 목표치의 과반을 넘어섰다. 업계 관계자는 “LNG 운반선 같은 대규모 계약은 장기간 협상이 이뤄지는데 연초부터 미뤄왔던 수요가 이제 몰리는 것으로 보인다”고 말했다. 코로나19로 인해 선가가 전반적으로 낮아진 상황에서 최근 컨테이너선 운임이 급증해 선사들이 신규 선박 구매를 늘린 것도 최근 한국 조선의 약진에 기여한 것으로 분석된다.한국 조선 3사와 중국 조선업체들 간 점유율 격차는 크게 줄어들었다. 영국의 글로벌 조선업계 시황 분석업체 클락슨리서치에 따르면 지난 6월 말 39%포인트까지 벌어졌던 글로벌 시장에서 올해 한국과 중국의 선박 수주량 격차는 지난 15일 기준 7.6%포인트까지 좁혀졌다.중국 조선업계는 연초 벌크선 대량 수주, 대규모 자국 발주로 앞서 나갔다. 하지만 국제해사기구(IMO) 등 조선·해운업 관련 기관들의 탄소배출 규제 강화 기조에 따라 한국이 강점을 보이는 LNG 추진선 등 첨단 기술 탑재 선박에 대한 수요가 늘면서 격차가 줄어든 것으로 분석된다.다만 연말 선전에도 불구하고 내년 전망이 밝지만은 않다. 업계 관계자는 “LNG 추진선 등의 수요 증가와 코로나19 백신 개발 등으로 올해보다는 나아지겠지만 코로나19 이전 수준으로 수요가 회복되기는 어려울 것으로 보인다”고 말했다.박효재 기자 mann616@kyunghyang.com▶ 인터랙티브:자낳세에 묻다▶ 경향신문 바로가기▶ 경향신문 구독신청하기©경향신문(www.khan.co.kr), 무단전재 및 재배포 금지"
1,"저유가 시대 해양플랜트 산업에 활력, ‘2020 국제해양플랜트 컨퍼런스 및 전시회’ 개최",2020.08.21," 오는 10월 13일부터 15일까지 부산 벡스코에서 진행2020 국제해양플랜트 컨퍼런스 및 전시회(Offshore Korea 2020, 약칭 OK 2020)가 오는 10월 13일부터 15일까지 부산 벡스코에서 개최된다. 코로나19로 침체된 해양플랜트 산업 시장에 활력을 불어넣고, 산업 경쟁력 강화에 그 목적이 있다.이번 행사는 산업통상자원부, 해양수산부, 부산광역시가 주최하고 부산조선해양기자재공업협동조합, 벡스코, 경연전람, 코트라, 한국조선해양플랜트협회, 키멕스 등 6개 기관이 공동 주관하며, 유가하락과 발주취소 등으로 해양플랜트 수주에 어려움을 겪고 있는 빅3 조선소 등을 비롯하여 주요 기자재 및 설비업체 등이 참여한 가운데 기존 전시회와는 다르게 컨퍼런스와의 연계강화 및 온라인 바이어 상담회를 통한 하이브리드 행사로 진행될 예정이다.제5회 국제 해양플랜트 기술 컨퍼런스 (Offshore Korea Technical Conference 2020)는 여러가지 어려운 여건에도 불구하고 전차년도와 동일한 규모로 벡스코 컨벤션홀에서 개최되며 2개 기조연설과 패널 토론, 8개 주제세션에서 총 32개의 주제발표가 이어진다. 컨퍼런스의 기조 연설자로는 세계 3대 가스산업 행사중의 하나인 '세계 가스총회'를 주최하는 국제가스연맹의 루이스 베르트랑 라페카스 사무총장이 나서 석유가스산업의 글로벌 에너지시장 트렌드를 다룰 예정이다. 또한 각 세션 별로 미래 해양플랜트 산업이 나아가야 할 '디지털화, 스마트건조, 경쟁력강화방안, 해체산업' 등 다양한 주제가 논의될 예정이다. 국가세션에는 최근 석유개발로 주목받고 있는 가이아나와 브라질의 석유개발 현황과 현지상황에 대한 내용이 발표될 예정이다. 이외에도 별도로 준비 중인 특별세션에는 지난 6월 빅3 조선소와 LNG 운반선 100여척 발주 MOU를 체결한 카타르 국영석유공사 발주담당자가 특별연사로 발표한다. 발주 계획 및 프로젝트 참가희망 국내기업 발표와 네트워킹을 위한 방한을 희망하고 있어 현재 관계부처와 조율 중이다.특히 코로나 19에 대한 지속적인 우려와 글로벌 유가급락으로 인한 수주절벽 사태를 맞아 업계 부담을 경감하기 위해 유료로 운영되어 오던 컨퍼런스를 전면 무료로 전환했다. 저유가와 신규발주 연기, 취소 등 조선·해양플랜트 업계의 위기상황을 고려하여 결정된 사안으로, 이는 산업의 회복을 앞당기는 계기가 될 전망이다.또한 동시 개최되는 OK전시회 관계자에 따르면 금번 전시회는 해양플랜트 산업의 장기 침체로 많은 국내 기자재 업체들이 생존을 위해 해양플랜트 산업을 떠나 LNG 등 친환경 선박으로 관심이 현재 넘어가 있는 상황에서 포스트 코로나 시대에 대비하기 위한 국내 해양플랜트 기자재 산업 지원 필요성에 초점을 맞춰 준비하였으며, 이후 해양플랜트 산업이 재개되더라도 국산 기자재 업계가 붕괴된 상황에서는 국내 조선소도 대외 경쟁력 약화로 인한 과거의 어려움을 답습할 수 밖에 없다는 위기감을 공감한 국내 해양플랜트 기자재 관련 중소기업과 조선사가 함께 모여 앞으로의 발전방향을 논의하는 기회의 장이 될것이라 예상했다. 포스트 코로나를 대비하기 위한 움직임으로 빅3 조선소 참가를 비롯해 총 132부스 규모로 개최되는 이번 OK 2020 전시회의 참가업체 모집은 이미 마감되었으며, 빅3 조선소도 최대규모의 참관단을 파견해 전시회를 통해 어느때 보다도 모기업과 기자재 업계가 소통할 수 있도록 박차를 가할 전망이다. KOTRA에서도 이번 전시기간중 해외 빅바이어 50개사를 유치하여 '2020 Global Offshore & Marine Plaza (GOMP 2020)' 라는 온라인 화상상담회를 개최한다. 행사 관계자는 ""최근 어려움이 지속되고 있는 조선·해양플랜트 산업계에 보탬이 되고자 최신정보를 공유하고 수출 판로를 모색하실 수 있도록 오랜시간 준비한 만큼 업계 관계자들의 많은 관심과 참석 바란다""고 전했다.행사 관계자는 ""최근 어려움이 지속되고 있는 조선/해양플랜트 산업계를 되살리기 위해 최신정보를 공유하고 수출 판로를 모색하기 위해 유관업계 관계자들의 많은 관심과 참석 바란다""며 ""특히 올해 전시회에서는 코로나19로 인한 참가기업의 마케팅 비용 부담을 감안하여 올해 전시회에 한해 전시회 참가비를 대폭 인하를 결정했다. 해양플랜트 업체의 부담을 줄이고 상생을 통해 국내 유일의 해양플랜트 전시회의 위상을 다시금 다질 계획""이라고 전했다.▶ 장도리 | 그림마당 보기▶ 경향신문 바로가기▶ 경향신문 구독신청하기©경향신문(www.khan.co.kr), 무단전재 및 재배포 금지"
2,친환경 조선 기자재 국산화 앞당긴다,2020.01.29,"ㆍ부산시, LNG선 실증 사업ㆍ조선산업 경쟁력 강화 기대부산시는 전국 최초로 액화천연가스(LNG)를 연료로 사용하는 선박(LNG선) 기자재의 실증을 위해 ‘다목적 해상 실증 플랫폼 구축사업’을 추진한다고 29일 밝혔다.총 사업비 385억원(국비 212억5000만원, 시비 118억5000만원, 민간자본 54억원) 규모로 올해부터 2024년까지 진행된다.이 사업은 국산 조선 기자재가 사용 실적이 없어 시장 진입에 실패하는 상황에서 부산시와 산업통상자원부가 사용 실적 확보를 통해 친환경 기자재 국산화를 추진하는 것이다.일반 선박 기자재의 국산화율은 90% 수준이나 LNG선 등 친환경 선박 기자재의 국산화율은 60%에 그친다.사업은 한국조선해양기자재연구원이 주관하며, 선박 기자재 기업과 함께 5000t급 LNG선 실증을 추진한다.실증하는 기자재는 탱크, 펌프, 열교환기, 배관연결장치, CO2회수장치, 선박평형수처리장치 등이다. 올해는 기본설계와 실증 선박 건조를 맡을 조선소를 선정할 예정이다.전국의 조선 기자재 업체는 1343곳으로 이 가운데 34%인 449곳이 부산에 집중돼 있다. 이에 실증 사업이 친환경 기자재 국산화를 앞당겨 조선·해양산업 경쟁력 강화 및 일자리 창출에 도움이 될 것으로 부산시는 내다봤다. 국내 조선 3사는 지난해 발주된 대형 LNG 운반선 63척 중 51척을 수주하는 등 세계 LNG 선박 시장을 장악하고 있다.권기정 기자 kwon@kyunghyang.com▶ 장도리 | 그림마당 보기▶ 경향신문 최신기사▶ 기사 제보하기©경향신문(www.khan.co.kr), 무단전재 및 재배포 금지"
3,‘수주가뭄’ 조선업계에 유지·보수사업 ‘단비’될까,2020.08.04," 조선 빅3 수주, 목표  20% 밑돌아 서비스 사업 키워 수익 개선 나서 조선업을 주력으로 하는 기업들이 최근 새로 선박을 만드는 대신 선박 개조 및 유지·보수·제어 등 관리 사업을 통해 수익성 개선에 나서고 있다. 실제로 실적을 올린 사례가 등장하면서 선박관리 사업이 코로나19 여파에 따른 ‘수주가뭄’ 충격을 줄여주고, 미래 먹거리 산업이 될 수 있다는 관측이 나온다.4일 업계에 따르면 대형 조선사들은 선박 서비스 사업 육성의 일환으로 스마트십 관련 기술 개발에 박차를 가하고 있다. 대우조선해양은 지난 6월 증강현실에 기반한 비대면 기술을 활용해 액화천연가스(LNG) 운반선 시운전에 성공했고, 삼성중공업도 지난 5월 최적의 연비를 낼 수 있도록 항로 정보를 제공하는 스마트 제어 셔틀탱커를 싱가포르 선사에 인도했다. 현대중공업지주의 선박관리 자회사 현대글로벌서비스는 5월 이사회를 열고 현대중공업으로부터 선박제어 사업을 양수하기로 의결하면서 스마트 제어 기술 개발에 집중하겠다는 계획을 밝혔다.현대중지주, 선박 관리 선제 투자 2분기 영업익 1043억 ‘흑자 전환’‘본업’ 선박 건조에 치중한 삼성중 7077억 적자…11분기째 마이너스조선업계가 선박관리 사업에 박차를 가하는 배경에는 코로나19에 따른 수주가뭄이 있다. 올 상반기에는 현대중공업, 대우조선해양, 삼성중공업 등 ‘조선 빅3’ 모두 수주 실적이 부진했다. 상반기 기준 대우조선해양이 가장 많은 선박을 수주했으나 연간 목표치(73억1000만달러)의 20%를 채우는 데 그쳤다. 현대중공업그룹의 조선 지주사인 한국조선해양은 목표치 157억달러 가운데 13%를, 삼성중공업은 수주 목표 84억달러의 6%를 겨우 달성했다. 보통 하반기에 수주가 몰리는 것을 감안해도 지금 같은 속도라면 목표 달성이 힘들 것이라는 관측이 많다. 특히 국내 조선사들의 주요 먹거리인 LNG운반선 수주가 부진하다. 영국의 조선·해운 분석기관인 클락슨리서치에 따르면 상반기 전 세계 LNG선 수주는 6척에 그쳤다. 지난해 같은 기간 31척의 5분의 1 수준이다.그나마 선박관리 사업에 일찍 투자한 기업들은 코로나19 국면에도 성과를 내고 있다. 2분기 실적 발표를 보면, 선박관리 자회사 현대글로벌서비스를 전략적으로 육성한 현대중공업지주와 선박 건조 본업에 치중한 삼성중공업의 희비는 엇갈렸다. 현대중공업지주는 2분기 연결기준(자회사 매출 포함) 매출 4조58억원, 영업이익 1043억원을 기록하며 흑자 전환에 성공했다. 현대글로벌서비스는 국제해사기구(IMO)의 강화된 배출가스 규제에 따른 친환경 선박으로 개조 수요가 증가했기 때문이라고 분석했다. 반면 삼성중공업은 2분기에만 7077억원 적자를 내며 11분기 연속 적자를 기록했다. 이는 지난해 전체 적자 규모를 뛰어넘는 것이다. 코로나19발 수주가뭄과 계약취소 뒤 수년째 주인을 찾지 못한 채 표류하고 있는 드릴십(시추선)이 실적 악화의 원인으로 꼽힌다.선주들이 선박 발주를 꺼리고 있지만 기존 선박관리에 대한 수요는 꾸준해 선박관리 사업의 전망은 밝은 편이다. 현대글로벌서비스는 우선 친환경 선박 개조 관련 수주잔량을 올해 인도분까지 갖추고 있는 만큼 코로나19 영향이 크지 않을 것으로 보고 있다. 사측은 유류 사업, 수리서비스, 운항 디지털화 등 다양한 분야로 진출해 조선업종 내 유일한 토털솔루션 기업으로 성장하겠다는 복안을 갖고 있다.박효재 기자 mann616@kyunghyang.com▶ 장도리 | 그림마당 보기▶ 경향신문 바로가기▶ 경향신문 구독신청하기©경향신문(www.khan.co.kr), 무단전재 및 재배포 금지"
4,"산업계, 코로나19 1차 대책회의…“정부가 구원투수로 나서달라”",2020.04.16,"국내 주력산업 협회들이 코로나19 사태로 어려움을 겪고 있다며 정부가 ‘구원투수’로 나서야 한다고 요청했다.대한상공회의소와 자동차·철강·석유화학·기계·조선 등 5개 업종협회는 16일 코로나19에 따른 1차 산업계 대책회의를 열어 당면 애로를 청취하고 해결 방안을 논의했다. 참석자들은 올 2분기에 수요절벽과 유동성 위기가 우려된다며 정부의 선제적 지원 대응을 주문했다.발제를 맡은 한국투자증권 김진우 애널리스트는 “코로나19의 경제적 영향이 1분기에는 부분적으로 나타났지만, 2분기부터는 본격화될 것으로 예상된다”고 전망했다. 이어 “2분기에 공급차질과 수요절벽이 겹친 부정적 수치들이 나오기 시작하면 경제주체의 불안심리가 가중될 수밖에 없다”고 말했다.김 애널리스트는 “2분기에 생산 차질과 매출 타격이 본격화하면서 세계 자동차산업은 7.7% 이상 축소될 것”이라고 밝혔다. 이어 “자동차 산업의 부진은 후방 산업인 철강이 2분기에 판매량 감소와 채산성 악화가 동시 발생할 것”이라며 “석유화학도 자동차와 가전, 섬유 등 관련 제품 수요가 2분기에 급격하게 축소되는 등 부정적 영향이 불가피한 상황”이라고 진단했다.한국철강협회 이재진 통상협력실장은 “코로나19와 저유가로 촉발된 경제적 위기가 보호무역 조치 확산으로 이어질 가능성을 우려한다”며 정부가 적극적으로 대응해야 한다고 건의했다.또한 철강재 수입신고의 정확성 확보와 유통이력 관리제 확대 등으로 향후 예상되는 무역분쟁을 예방할 수 있는 철강 교역·유통제도의 개선이 시급하다고 강조했다.철강협회는 중국이 대규모 인프라 투자에 나섰던 2008년 금융위기 때와 달리 지금 철강산업은 전 세계적 공장 가동 중단에 수요가 증발해 버팀목이 없는 상황이라고 밝혔다.산업계는 정부가 계획된 공공사업은 조기에 추진하고 20년 넘은 노후 상수도관과 열배관 교체사업을 새로 추가해 달라고 요청했다.한국자동차산업협회 김태년 운영위원장은 “미국, 유럽 등 해외시장의 감염병 확산으로 4월부터 글로벌 공급망 붕괴와 수요급감 쇼크가 닥칠 것으로 예상된다”며 “공공기관 차량구매 확대, 친환경차 보조금 강화, 취득세·개별소비세 감면, 온라인 거래 활성화 등 통해 내수부터 살아나도록 정책지원이 절실하다”고 말했다.자동차산업협회는 부품사와 완성차 업계는 총 33조원의 유동성 공급이 필요한 상황이라고 밝히면서 법인세·부가세·개별소비세 납부유예와 4대 보험 및 세금 납부기한 연장 등 간접적인 유동성 지원 방안을 주문했다.한국기계산업진흥회 최형기 상근부회장은 “통상 생산에서 수주까지 3∼12개월이 걸리는 기계 산업의 특성상 피해가 가시화된 후 대응하면 시기를 놓쳐버린다”고 지적했다. 최 부회장은 “공공·대학·국책연구소 등이 보유한 노후장비의 국산 조기교체와 정부조달 기계장비 구매 때 국산장비 우선구입 제도화 등 정부가 공공발주를 확대해 수요절벽에 선제적으로 대응해야 한다”고 말했다.한국조선해양플랜트협회 이병철 상근부회장은 “코로나19로 불확실성 증대와 유가 급락으로 1분기 전 세계 선박 발주량이 작년 동기 대비 71.3% 감소했고 국내 조선사의 주력 선종인 액화천연가스(LNG) 운반선 발주는 단 2척에 그쳤다”고 말했다.이 부회장은 “사태가 장기화하면 선박 인수 지연, 자금 회수 차질 등으로 유동성 문제가 불거질 우려가 있으므로 선박 제작금융의 만기 연장과 운전자금 공급 등 금융지원이 절실하다”고 강조했다. 한국석유화학협회 김평중 연구조사본부장은 “최근 석유화학산업은 글로벌 공급 과잉과 코로나19로 인한 수요침체라는 이중고를 겪고 있다”며 긴급 과제로 ‘나프타 탄력관세 영세율 적용’을 건의했다. 나프타는 석유화학 업종의 핵심 원자재인데 지난해에만 관세 비용이 950억원 발생했으며 일본, 중국 등이 영세율을 지속해서 적용하고 있는 만큼 긴급 영세율 적용이 필요하다는 입장이다.이밖에 참석자들은 특별연장근로 대폭 확대와 유연근무제 조속 개정 등 노동 규제의 완화와 탄소배출권 가격 안정화, 기존 화학물질에 대한 등록 유예기간 연장 등 환경규제 관련 애로 해소 등을 논의했다.대한상의 우태희 상근부회장은 “과거 위기에서 우리 경제가 버틸 수 있었던 이유는 주력 제조업, 기간산업이 받쳐줬기 때문”이라며 “코로나19 팬데믹 상황이 주력 산업의 경쟁력 훼손으로 이어지지 않도록 최악의 경우를 대비해 나가야 한다”고 강조했다.대한상의는 21일에는 반도체, 디스플레이 등 정보기술(IT) 산업계와, 23일에는 제약·바이오, 화장품, 의류·패션 등 소비재 산업계와 대책회의를 차례로 개최할 계획이다.전병역 기자 junby@kyunghyang.com▶ 장도리 | 그림마당 보기▶ 경향신문 바로가기▶ 경향신문 구독신청하기©경향신문(www.khan.co.kr), 무단전재 및 재배포 금지"
5,"일본 WTO에  ""한국 정부, 현대중공업과 대우조선해양 합병은 WTO협정 위배""",2020.02.12,"일본이 현대중공업과 대우조선해양의 합병 과정에서 한국 정부가 세계무역기구(WTO)의 규범을 위반했다고 주장하고 나섰다.12일 WTO가 홈페이지를 통해 공개한 한일 조선업 분쟁 양자협의서를 보면 일본은 WTO에 한국 정부의 조선업 구조조정 대책을 제소하면서 현대중공업과 대우조선해양의 합병 과정에 대해 문제를 제기했다.앞서 일본은 지난달 31일 한국 정부의 조선산업 구조조정 관련 조치 등을 두고 WTO 분쟁해결절차 상의 양자협의를 요청했다. 양자협의는 WTO 분쟁해결절차의 첫 단계로 공식 제소가 시작된 것으로 본다.일본이 한국 조선업 구조조정과 관련한 WTO 분쟁해결을 요청한 것은 이번이 두 번째다. 2018년 12월 양자협의가 이뤄졌으나 이후 일본은 공식 재판 절차인 패널 설치를 요구하지 않았다. 그러다가 이번에 산업은행과 대우조선의 주식거래 관련을 포함해 다시 제소한 것이다.일본은 산업은행이 지난해 초 대우조선해양 지분 약 5970만주를 현대중공업에 현물출자하는 대신 현대중공업그룹 조선해양 부문 지주사인 한국조선해양으로부터 전환주 912만주와 보통주 610만주를 받기로 한 내용을 이번에 포함했다. 자금이 부족할 경우 산은이 추가로 1조원 재정 지원을 보장하기로 한 내용도 추가했다. 또 한국 정부가 선수금반환보증(RG) 발급과 신규 선박 건조 지원 방안을 내놓은 것을 양자협의 요청의 사유로 적시했다.일본 정부는 “한국 정부가 직접적인 금융 제공을 포함해 자국의 조선사를 재정적으로 지원하는 일련의 조치를 했다”며 “이는 WTO의 보조금 협정에 위배되는 조치”라고 강조했다. 일본은 산업은행, 수출입은행, 한국무역보험공사가 조선업 구조조정 차원에서 대우조선해양 등에 지원한 대출, 보증, 보험 등 역시 WTO 보조금협정 위반이라고 지적했다.일각에서는 일본의 이번 제소가 현대중공업과 대우조선해양 간 기업결합심사에도 영향을 미치는 것 아니냐는 우려도 나오고 있다. 현대중공업그룹은 7월 국내 공정거래위원회를 시작으로 6개국에서 본격적으로 기업결합심사를 받고 있으며 지난 10월에는 카자흐스탄에서 첫 승인을 받았다. 정유미 기자 youme@kyunghyang.com▶ 장도리 | 그림마당 보기▶ 지금 많이 보는 기사▶ 댓글 많은 기사©경향신문(www.khan.co.kr), 무단전재 및 재배포 금지"
