,title,date,content
186,물류도 탈탄소 바람···속도 내는 기업들,2021.07.18," 친환경 선박·수소 활용 등 탄소중립 잰걸음전례 없는 폭염과 폭우, 산불로 기후위기의 심각성을 체감하면서 탄소중립을 향한 발걸음이 빨라지고 있다. 바다 위, 하늘 위라고 예외는 아니다. 1년간 인간이 배출하는 510억t의 온실가스 중 16%가 교통과 운송 분야에서 나온다. 특히 전 세계 온실가스 배출량의 5~10%는 배에서 나오는 것으로 알려졌다. 국제해사기구(IMO) 해양환경보호위원회(MEPC)는 지난 6월 10~17일(현지시간) 열린 제76차 회의에서 2023년부터 2026년까지 4년간 매년 2%씩 탄소배출을 줄이는 안을 채택했다. IMO는 ‘2020 플랜’을 통해 2050년까지 선박이 배출하는 이산화탄소 배출량을 70% 줄이고, 50% 이상의 온실가스를 감축하겠다는 목표를 세웠는데 이번 감축안이 1차 계획이다.e퓨얼·SMR 등 물류 분야 탈탄소 진행유럽연합(EU) 집행위원회는 지난 7월 14일 2030년까지 1990년 대비 온실가스 순배출량을 최소 55% 감축하기 위한 정책 수단을 담은 ‘핏포 55’를 발표했다. 여기에서 EU 탄소 배출권거래제(ETS)를 개정해 해상과 항공 운수 분야도 포함하는 방안을 제안했다. 위원회는 또한 바이오 연료 등 지속가능한 연료를 더 활발히 활용하기로 했다. 탄소를 많이 배출하는 항공·선박 연료에 탄소세를 부과해 항공 및 해양 부문에서 장기적으로 탄소 연료가 지속가능한 연료보다 더 비싸게 만들기로 했다. 글로벌 흐름이 운송 분야의 탈탄소를 향하면서 국내 조선·해운 산업의 대응도 구체화되고 있다. IMO가 탄소배출 규제에서 연간 4% 감축을 주장한 미국과 EU 대신 한국, 일본, 노르웨이 등 조선 국가의 손을 들어줬지만 그렇다고 여유를 가질 처지는 아니다. 정부는 조선업계, 대학, 연구소와 함께 수소·암모니아를 활용한 ‘한국형 친환경선박(일명 그린십-K)’을 개발하기로 했다. 내년부터 2031년까지 총 2540억원을 투입하는 사업으로 지난 6월 29일 예비타당성 조사를 통과했다. 친환경추진 선박은 수소·암모니아 등 친환경연료를 활용하는 저탄소·무탄소 선박과 전기·하이브리드 선박 등 차세대 추진시스템을 갖춘 고부가가치 선박을 의미한다. 정부는 친환경선박 핵심기술·설계기술 개발로 선박 온실가스 배출량을 2008년 대비 70% 감축한다는 목표를 세웠다. 조선업계는 지난 4월 ‘2050 탄소중립’을 선언했다. 기술적 초격차를 유지하기 위해 생태계 전반의 친환경화를 통한 탄소중립이 불가피하다는 인식을 공유한 것이다. 한국조선해양은 세계 최대 컨테이너선사인 머스크와 메탄올 추진선 수주를 협상하고 있다. 메탄올 추진선은 LNG추진선보다 진일보한 기술로 벙커C유보다 황산화물을 99% 줄일 수 있다. 소형 모듈 원자로(SMR)를 선박 추진에 사용하는 방안도 연구되고 있다. 삼성중공업을 비롯해 현대중공업, 대우조선해양 등 조선소들이 원자력연구원 등과 공동연구를 하고 있다. 선박 운용기간인 20년 동안 연료 공급 없이 운항할 수 있는 게 장점이다. 이정익 카이스트 원자력및양자공학과 교수는 “원자력만 아니라 재생에너지, 수소 등 다양한 추진방식을 검토하는데 수소나 재생에너지 추진은 아직 검증해야 할 기술이지만 원자력 추진은 전 세계에서 가장 오랫동안 검증된 기술”이라면서 “비록 군용으로 활용했지만, 민간에서도 이미 운영하는 나라가 있어서 가장 확실한 탈탄소 선박추진기술”이라고 설명했다. 자동차의 경우 전기·수소차로 이행하는 전환기 동안에는 탄소중립 연료인 ‘e퓨얼(efuel)’ 활용을 확대해야 한다는 제안도 나온다. e퓨얼은 전기분해로 얻어진 수소에 이산화탄소, 질소 등을 합성해 생산된 연료를 말한다. 궁극적으로 가솔린과 디젤과 같은 물성을 갖는 e가솔린·e디젤을 활용하면 기존 내연기관을 사용하면서도 탄소중립에 기여할 수 있다는 장점이 있다. 전기배터리 전환이 어려운 선박, 항공, 상용차 분야의 탄소중립 수단이 될 수 있다는 기대를 모으지만 가격이 비싸고, 에너지 효율이 아직 낮아 현 기술 수준에서는 경제성이 떨어지는 것으로 평가된다.7월 15일 대전 ICC호텔 그랜드볼룸에서 온·오프라인으로 열린 ‘2050 탄소중립 목표 달성을 위한 녹색(그린) 암모니아 협의체 협약식’에서 관련 기관 관계자들이 협약서를 들고 기념 촬영을 하고 있다. 산업통상자원부 제공육상 물류는 전기차·수소차로 이분화수소는 해운·항공, 육상 전 분야에서의 활용이 활발해질 것으로 보인다. 국제에너지기구는 대형 장거리 운송에서 이산화탄소 가격이 t당 100달러, 해운·항공 분야에서 탄소비용이 t당 170달러에 이를 경우 수소가 가격경쟁력을 가질 수 있다고 예상하고 있다. 수소는 무겁고, 장거리를 다니는 운송수단에서 더 적합하다. 반면 시내 등 단거리를 주행하는 경우 배터리가 더 적절하다. 결국 육상 물류 분야에서는 소형 물류 차량의 경우 전기차로, 중대형은 수소차가 양분할 것으로 예상된다. 수소와 연관돼 ‘그린 암모니아’도 주목받는다. 그린 암모니아는 이산화탄소 배출 없이 재생에너지와 연계해 생산한 그린 수소를 이용해 제조한 암모니아를 말한다. 산업통상자원부에 따르면 재생에너지로 물을 분해해 만든 그린 수소를 공기에서 분리한 질소와 합성해 암모니아로 만들어 들여올 수 있다. 이렇게 가져온 암모니아에서 질소를 제거하면 다시 수소로 사용할 수 있다. 암모니아는 액화수소와 달리 상온에서 쉽게 액화되고 액화수소 대비 단위 부피당 1.7배나 수소 저장용량이 크다. 재생에너지로 만든 수소를 저장하는 운반책으로 쓰기 적절하다. 전 세계적으로 이미 운송 수단 및 유통 인프라가 잘 갖춰진 점도 유리하다. 물류 시장의 전기화는 소비자들의 기후위기 경각심이 커질수록 더 빨라질 것으로 보인다. 실제 유럽계 화장품 회사인 로레알은 최근 한 물류회사와 운송 계약을 체결하면서 “전기차 구매비용을 지원할 테니 자사 제품은 무조건 전기차로 배송해달라”는 요구를 한 것으로 알려졌다. 유승훈 서울과학기술대학교 에너지정책학과 교수는 “정부의 규제가 있어서라기보다 소비자들이 저탄소 제품을 원하기 때문”이라면서 “유럽에선 탄소를 많이 배출하는 기업의 제품은 쓰지 않겠다는 시민단체의 불매운동이 큰 힘을 발휘하기 때문에 유럽 기업 입장에선 배송을 포함한 전 과정상에서의 탄소배출을 줄이려는 노력을 할 수밖에 없다”고 말했다.물류 분야 탈탄소가 힘을 받으려면 화석연료를 우대하는 세제도 개편해야 한다는 지적이 있다. 배정환 전남대학교 경영전문대학원 교수는 “단기적으로는 선박용 경유나 중유에 대한 면세제도를 없애고 바이오 중유에 세금 감면 등의 혜택을 부여하는 게 중요하다”면서 “중장기적으로는 수소연료전지에 기반을 둔 선박 시스템이나 재생에너지를 초고압직류송전(HVDC) 방식으로 공급받아 전력 손실과 무게를 줄이는 전동화 시스템을 개발할 필요가 있다”고 말했다."
187,"두산인프라코어, ‘현대두산인프라코어’로 16년만에 사명 변경",2021.09.10," 두산인프라코어가 16년 만에 현대두산인프라코어로 사명을 바꾸고 현대중공업그룹 건설기계사업 계열사로 새롭게 출발한다.두산인프라코어는 10일 오전 인천 동구 본사에서 임시주주총회를 열고 현대두산인프라코어(Hyundai Doosan Infracore Co,. Ltd.)로 사명을 변경하는 정관변경 안건이 의결됐다고 밝혔다. 두산인프라코어 사명이 변경된 것은 2005년 두산인프라코어로 사명이 확정된 이후 16년 만이다. 현대와 두산 브랜드를 동시에 사용해 시너지를 극대화할 목적이라고 현대중공업그룹 건설기계 지주사 현대제뉴인은 설명했다. 이날 임시주주총회에서는 조영철 현대제뉴인 사장이 신규 사내이사로 선임됐으며 상호 변경, 홈페이지 주소 변경 등을 포함한 일부 정관 변경 건도 원안대로 통과됐다. 사내이사로 선임된 조 사장은 현대오일뱅크 재무부문장과 현대중공업 최고재무책임자(CFO)를 거쳐 현재 한국조선해양 CFO와 현대제뉴인 대표이사를 겸임하고 있다.손동연 두산인프라코어 사장은 “향후 현대중공업 그룹 내 여러 계열사와의 시너지가 기대된다”면서 “이를 통해 회사가 성장하고 주주가치가 제고될 수 있도록 모든 임직원이 지속적 노력을 다하겠다”고 말했다. 두산인프라코어는 이날 주총에서 재무구조 개선 및 장기적 배당 재원 마련을 위한 액면가 감액 무상감자 안건도 통과시켰다. 앞서 두산인프라코어는 현대제뉴인에 편입되며 5 대 1 액면가 감액 방식의 무상감자를 하고, 연내 최대 8000억원 규모의 유상증자도 추진한다는 계획을 밝힌 바 있다.무상감자와 유상증자는 회사의 재무구조를 개선과 신규사업 투자를 위한 것으로, 장기적 관점으로는 성장을 위한 조치라는 것이 회사 측 입장이다.하지만 소액주주들은 시가총액이 9000억원대인 두산인프라코어가 8000억원에 달하는 대규모 유상증자를 실시하면 주주 가치 훼손이 불가피하다며 강하게 반발하고 있다.두산인프라코어 소액주주모임 10여명은 이날 주총에 앞서 기자회견을 열고 “소액주주들의 금전을 착취하는 행위”라며 경영진을 규탄했다.이날 무상감자안이 의결되면서 액면가 5000원의 보통주는 액면가 1000원으로 감액된다. 무상감자에 따른 두산인프라코어 주식 매매 거래 정지 예정기간은 10월8일부터 25일까지이며 신주 상장 예정일은 10월26일이다."
188,"정부, 탄소중립 핵심기술 'CCUS' 조기 상용화 속도... ""신산업 육성 방침""",2021.09.08," ‘2050 탄소중립’을 실현하기 위한 핵심 기술로 배출되는 이산화탄소를 포집·활용·저장(CCUS)하는 기술이 거론되는 가운데, 한국 정부가 CCUS 기술의 조기 상용화를 위해 민관협력에 속도를 내겠다고 밝혔다. 정부는 CCUS 기술을 탄소중립 신산업으로 육성할 방침이다. 산업통상자원부는 8일 민관합동 K-CCUS 추진단 상설 사무국 개소식을 개최하고 CCUS 기술의 조기 상용화와 기후위기대응 신산업화를 위한 민관협력 강화방안을 논의했다고 밝혔다. 현장에는 강경성 산업부 에너지산업실장을 비롯해 SK이노베이션, 한국조선해양, 한화토탈 등 민간기업과 공기업 및 협회 관계자 총 40여명이 참석했다. K-CCUS 추진단은 CCUS 기술 개발 및 상용화를 위한 민관협력의 가속화를 위해 지난 4월 발족했다. 이후 추진단은 이사기관 구성, 추진단장 선임, 전문위원회 및 운영위원회 구성 등 체계를 정비해왔으며 현재까지 총 69개 기관회원과 분야별 전문가 90여명이 참여하고 있다. 이날 추진단은 정책기획, 기술지원, 인력개발, 대외협력 4개 분야 전담팀을 구성했다. 추진단은 CCUS 산업육성, 국내외 기술·정보 교류 활성화, 기술개발, 인력양성 및 국제협력을 바탕으로 본격적인 업무를 수행하겠다고 밝혔다. 먼저 추진단은 ‘CCUS 아카데미’를 오는 27일에 개설하고 CCUS 기업의 재직자, 연구자, 학생과 일반인을 대상으로 탄소 포집·저장·활용·정책 관련 맞춤 교육을 진행해 매년 120명 이상의 CCUS 전문인력을 양성할 방침이다. 10월부터는 주요 업종별 릴레이 세미나를 집중 개최한다. 10월 1~2주차에는 발전·산업계의 탄소포집 기술 고도화와 기술 확산 방안을 논의한다. 3주차에는 국내외 이산화탄소 저장 및 플랜트·서비스산업 연계 방안을 주제로 한 세미나가 열린다. 마지막 4주차에는 이산화탄소를 활용한 신사업의 조기 창출 방안을 모색하기 위한 자리가 열린다. 이 밖에도 추진단은 국내 전문가 40여명으로 구성된 전문위원회와 분야별 업종 기업·협회 등으로 구성된 협의체를 구성해 정책 수요를 발굴할 예정이다. 또한 기술 확산과 산업 생태계 창출 방안도 마련해 추후 정부에 제안할 방침이다. 이날 정부는 개소식 이후 이어진 간담회에서 올해 말까지 주요 탄소 다배출 업종을 대상으로 탄소 포집·활용 저장 실증을 착수하고, 동해 가스전을 활용한 탄소포집저장기술 통합 실증 예타와 대규모 CCU 실증 지원 예타 등을 추진할 계획이라고 밝혔다. 강경성 에너지산업실장은 “CCUS 기술은 탄소중립 핵심기술로 중요성이 확대되고 있으며, 이산화탄소 포집과 수송, 저장 및 활용을 연계하는 대표적인 융·복합 산업으로 기업 간 연대와 민관협력이 필수적”이라며 “정부도 업계와의 긴밀한 소통을 바탕으로 산업기반 조성과 제도개선을 적극 추진해 CCUS 기술을 탄소중립 신산업으로 육성하겠다”고 밝혔다."
189,"현대重, 두산인프라코어 품고 ‘글로벌 톱5’로···권오갑 회장 “지원 아끼지 않을 것”",2021.08.20," 현대중공업그룹이 8개월에 걸친 두산인프라코어 인수전을 최종 마무리했다. 국내 1위 건설기계 업체를 품은 현대중공업그룹은 건설기계 부문을 그룹의 핵심 사업으로 육성해 2025년 글로벌 5위 기업에 올려놓겠다는 포부를 밝혔다. 20일 현대중공업그룹은 건설기계 중간지주사인 현대제뉴인이 지난 19일 두산인프라코어 인수를 위한 거래 대금을 완납했다고 밝혔다. 지난해 12월 두산인프라코어 인수 우선협상대상자로 선정된 후 8개월 만이다.인수대금은 8500억원으로 현대제뉴인은 이 중 주식매매계약 정산대금 677억원과 최근 마무리된 두산인프라코어 DICC(두산인프라코어차이나) 면책 관련 비용 915억원을 제외한 6909억원을 두산중공업에 완납했다. 현대제뉴인은 국내 건설기계 시장 점유율 1, 2위 업체인 두산인프라코어와 현대건설기계를 자회사로 두며 단숨에 건설기계 분야 세계 9위에 올라섰다. 아울러 현대중공업그룹은 자산 규모를 4조원가량 늘리며 국내 재계 순위 8위에 오르게 됐다. 현대중공업그룹은 지난달 주요국 기업결합심사를 완료한 뒤 현대중공업그룹을 이끄는 권오갑 현대중공업지주 회장과 조영철 한국조선해양 사장을 현대제뉴인의 공동 대표이사로 선임하며 건설기계를 그룹의 핵심 사업으로 육성하겠다는 의지를 드러냈다. 2025년까지 세계 시장 점유율을 5% 이상으로 확대해 건설기계 부문 글로벌 5위 기업으로 도약한다는 구상이다. 영국 건설중장비 전문지 KHL 옐로테이블에 따르면 2019년 기준 두산인프라코어와 현대건설기계의 세계 시장 점유율은 각각 2.1%, 1.5%로 이를 합한 두 기업의 점유율은 3.6%다.20일 두산인프라코어 인천 공장을 방문한 권오갑 현대중공업지주 회장(가운데)이 현대중공업그룹 가족으로 새출발하는 직원들을 격려하고 있다. 현대중공업그룹 제공권오갑 회장은 20일 인수 완료 후 첫 일정으로 두산인프라코어 생산현장을 찾아 직원들을 격려하고 아낌없는 지원을 약속했다.권 회장은 “두산인프라코어가 어려운 환경 속에서도 지금 경쟁력을 갖춘 것은 모두 임직원들의 노력 덕분”이라며 “두산인프라코어가 국내를 넘어 글로벌 ‘톱-티어’ 기업으로 한 단계 더 성장할 수 있도록 모든 지원을 아끼지 않겠다”고 말했다. 이날 권 회장과 조영철 현대제뉴인 사장, 정기선 현대중공업지주 부사장 등 주요 경영진은 두산인프라코어 인천 공장의 주요 생산시설을 둘러보고 현대중공업그룹에 새로 합류하는 직원들을 만났다.현대중공업그룹 관계자는 “권 회장과 그룹 경영진이 두산인프라코어 인수를 끝내자마자 생산 현장을 방문한 것은 두산인프라코어에 대한 기대가 그만큼 크다는 의미”라며 “건설기계 부문을 그룹의 3대 사업으로 구축하겠다는 의지를 나타낸 것”이라고 말했다."
190,물류도 탈탄소 바람···속도 내는 기업들,2021.07.18," 친환경 선박·수소 활용 등 탄소중립 잰걸음전례 없는 폭염과 폭우, 산불로 기후위기의 심각성을 체감하면서 탄소중립을 향한 발걸음이 빨라지고 있다. 바다 위, 하늘 위라고 예외는 아니다. 1년간 인간이 배출하는 510억t의 온실가스 중 16%가 교통과 운송 분야에서 나온다. 특히 전 세계 온실가스 배출량의 5~10%는 배에서 나오는 것으로 알려졌다. 국제해사기구(IMO) 해양환경보호위원회(MEPC)는 지난 6월 10~17일(현지시간) 열린 제76차 회의에서 2023년부터 2026년까지 4년간 매년 2%씩 탄소배출을 줄이는 안을 채택했다. IMO는 ‘2020 플랜’을 통해 2050년까지 선박이 배출하는 이산화탄소 배출량을 70% 줄이고, 50% 이상의 온실가스를 감축하겠다는 목표를 세웠는데 이번 감축안이 1차 계획이다.e퓨얼·SMR 등 물류 분야 탈탄소 진행유럽연합(EU) 집행위원회는 지난 7월 14일 2030년까지 1990년 대비 온실가스 순배출량을 최소 55% 감축하기 위한 정책 수단을 담은 ‘핏포 55’를 발표했다. 여기에서 EU 탄소 배출권거래제(ETS)를 개정해 해상과 항공 운수 분야도 포함하는 방안을 제안했다. 위원회는 또한 바이오 연료 등 지속가능한 연료를 더 활발히 활용하기로 했다. 탄소를 많이 배출하는 항공·선박 연료에 탄소세를 부과해 항공 및 해양 부문에서 장기적으로 탄소 연료가 지속가능한 연료보다 더 비싸게 만들기로 했다. 글로벌 흐름이 운송 분야의 탈탄소를 향하면서 국내 조선·해운 산업의 대응도 구체화되고 있다. IMO가 탄소배출 규제에서 연간 4% 감축을 주장한 미국과 EU 대신 한국, 일본, 노르웨이 등 조선 국가의 손을 들어줬지만 그렇다고 여유를 가질 처지는 아니다. 정부는 조선업계, 대학, 연구소와 함께 수소·암모니아를 활용한 ‘한국형 친환경선박(일명 그린십-K)’을 개발하기로 했다. 내년부터 2031년까지 총 2540억원을 투입하는 사업으로 지난 6월 29일 예비타당성 조사를 통과했다. 친환경추진 선박은 수소·암모니아 등 친환경연료를 활용하는 저탄소·무탄소 선박과 전기·하이브리드 선박 등 차세대 추진시스템을 갖춘 고부가가치 선박을 의미한다. 정부는 친환경선박 핵심기술·설계기술 개발로 선박 온실가스 배출량을 2008년 대비 70% 감축한다는 목표를 세웠다. 조선업계는 지난 4월 ‘2050 탄소중립’을 선언했다. 기술적 초격차를 유지하기 위해 생태계 전반의 친환경화를 통한 탄소중립이 불가피하다는 인식을 공유한 것이다. 한국조선해양은 세계 최대 컨테이너선사인 머스크와 메탄올 추진선 수주를 협상하고 있다. 메탄올 추진선은 LNG추진선보다 진일보한 기술로 벙커C유보다 황산화물을 99% 줄일 수 있다. 소형 모듈 원자로(SMR)를 선박 추진에 사용하는 방안도 연구되고 있다. 삼성중공업을 비롯해 현대중공업, 대우조선해양 등 조선소들이 원자력연구원 등과 공동연구를 하고 있다. 선박 운용기간인 20년 동안 연료 공급 없이 운항할 수 있는 게 장점이다. 이정익 카이스트 원자력및양자공학과 교수는 “원자력만 아니라 재생에너지, 수소 등 다양한 추진방식을 검토하는데 수소나 재생에너지 추진은 아직 검증해야 할 기술이지만 원자력 추진은 전 세계에서 가장 오랫동안 검증된 기술”이라면서 “비록 군용으로 활용했지만, 민간에서도 이미 운영하는 나라가 있어서 가장 확실한 탈탄소 선박추진기술”이라고 설명했다. 자동차의 경우 전기·수소차로 이행하는 전환기 동안에는 탄소중립 연료인 ‘e퓨얼(efuel)’ 활용을 확대해야 한다는 제안도 나온다. e퓨얼은 전기분해로 얻어진 수소에 이산화탄소, 질소 등을 합성해 생산된 연료를 말한다. 궁극적으로 가솔린과 디젤과 같은 물성을 갖는 e가솔린·e디젤을 활용하면 기존 내연기관을 사용하면서도 탄소중립에 기여할 수 있다는 장점이 있다. 전기배터리 전환이 어려운 선박, 항공, 상용차 분야의 탄소중립 수단이 될 수 있다는 기대를 모으지만 가격이 비싸고, 에너지 효율이 아직 낮아 현 기술 수준에서는 경제성이 떨어지는 것으로 평가된다.7월 15일 대전 ICC호텔 그랜드볼룸에서 온·오프라인으로 열린 ‘2050 탄소중립 목표 달성을 위한 녹색(그린) 암모니아 협의체 협약식’에서 관련 기관 관계자들이 협약서를 들고 기념 촬영을 하고 있다. 산업통상자원부 제공육상 물류는 전기차·수소차로 이분화수소는 해운·항공, 육상 전 분야에서의 활용이 활발해질 것으로 보인다. 국제에너지기구는 대형 장거리 운송에서 이산화탄소 가격이 t당 100달러, 해운·항공 분야에서 탄소비용이 t당 170달러에 이를 경우 수소가 가격경쟁력을 가질 수 있다고 예상하고 있다. 수소는 무겁고, 장거리를 다니는 운송수단에서 더 적합하다. 반면 시내 등 단거리를 주행하는 경우 배터리가 더 적절하다. 결국 육상 물류 분야에서는 소형 물류 차량의 경우 전기차로, 중대형은 수소차가 양분할 것으로 예상된다. 수소와 연관돼 ‘그린 암모니아’도 주목받는다. 그린 암모니아는 이산화탄소 배출 없이 재생에너지와 연계해 생산한 그린 수소를 이용해 제조한 암모니아를 말한다. 산업통상자원부에 따르면 재생에너지로 물을 분해해 만든 그린 수소를 공기에서 분리한 질소와 합성해 암모니아로 만들어 들여올 수 있다. 이렇게 가져온 암모니아에서 질소를 제거하면 다시 수소로 사용할 수 있다. 암모니아는 액화수소와 달리 상온에서 쉽게 액화되고 액화수소 대비 단위 부피당 1.7배나 수소 저장용량이 크다. 재생에너지로 만든 수소를 저장하는 운반책으로 쓰기 적절하다. 전 세계적으로 이미 운송 수단 및 유통 인프라가 잘 갖춰진 점도 유리하다. 물류 시장의 전기화는 소비자들의 기후위기 경각심이 커질수록 더 빨라질 것으로 보인다. 실제 유럽계 화장품 회사인 로레알은 최근 한 물류회사와 운송 계약을 체결하면서 “전기차 구매비용을 지원할 테니 자사 제품은 무조건 전기차로 배송해달라”는 요구를 한 것으로 알려졌다. 유승훈 서울과학기술대학교 에너지정책학과 교수는 “정부의 규제가 있어서라기보다 소비자들이 저탄소 제품을 원하기 때문”이라면서 “유럽에선 탄소를 많이 배출하는 기업의 제품은 쓰지 않겠다는 시민단체의 불매운동이 큰 힘을 발휘하기 때문에 유럽 기업 입장에선 배송을 포함한 전 과정상에서의 탄소배출을 줄이려는 노력을 할 수밖에 없다”고 말했다.물류 분야 탈탄소가 힘을 받으려면 화석연료를 우대하는 세제도 개편해야 한다는 지적이 있다. 배정환 전남대학교 경영전문대학원 교수는 “단기적으로는 선박용 경유나 중유에 대한 면세제도를 없애고 바이오 중유에 세금 감면 등의 혜택을 부여하는 게 중요하다”면서 “중장기적으로는 수소연료전지에 기반을 둔 선박 시스템이나 재생에너지를 초고압직류송전(HVDC) 방식으로 공급받아 전력 손실과 무게를 줄이는 전동화 시스템을 개발할 필요가 있다”고 말했다."
