,title,date,content
284,변광용 거제시장 “대우조선 매각 철회해야”,2021.09.17,"문재인 대통령에게 서한문변광용 경남 거제시장이 ‘대우조선 매각 반대’ 서한문을 16일 문재인 대통령에게 보냈다. 변 시장은 이 서한문에서 “대우조선은 지역의 1200여 개 협력사·기자재업체와 산업생태계를 이루며 경남도와 거제시의 경제를 든든히 뒷받침했다”며 “지금과 같은 방식으로 대우조선의 매각이 이뤄지면 전후방 산업의 동반 몰락과 함께 대량실업 등 지역경제는 치명적인 타격을 입을 것”이라고 강조했다.  변 시장은 “대우조선은 국내 조선 ‘빅3’ 중에서 유일하게 4년 연속 흑자를 기록하고 있다”며 “매각의 근거로 작성된 맥킨지 보고서는 2016년 당시 세계 조선 경기 최악의 상황을 반영한 것으로, 슈퍼사이클로 진입하고 있는 지금의 변화를 전혀 예견치 못한 것이다”라고 했다. 그러면서 “유럽연합(EU)이 기업결합의 승인조건으로 제시한 액화천연가스(LNG)선 독과점 해소까지 수용하면서까지 대우조선을 매각하는 것은 최근 대통령이 직접 거제시를 찾아 발표한 K조선 재도약 전략과 정면으로 배치되는 것”이라고 덧붙였다. 앞서 거제시의회도 10일 ‘대우조선 매각 관련 공정거래위원회 심사 촉구 결의안’을 채택하고 한국조선해양의 대우조선 인수·합병의 공정위 불승인 결정을 요구했다."
285,삼성重 2조원대 선박수주… 올해 총 100억달러 돌파,2021.10.19,"한국조선해양도 4000억대 계약“조선업계 호황 장기간 이어질듯”삼성중공업이 2조 원대 수주에 성공하며 올해 누계 수주액 100억 달러(약 11조8770억 원)를 돌파했다. 현대중공업그룹 조선 지주사인 한국조선해양도 4000억 원대 계약을 따내며 하반기(7∼12월) 수주 랠리를 이어갔다. 삼성중공업은 유라시아 지역 선주와 셔틀탱커 7척에 대한 블록·기자재 및 설계 공급계약을 17억 달러(약 2조453억 원)에 체결했다고 18일 공시했다. 셔틀탱커는 해양플랜트에서 뽑아 올린 원유를 해상에서 곧바로 선적해 육지의 석유 생산기지까지 나르는 선박이다. 이로써 삼성중공업은 올해 액화천연가스(LNG) 운반선 13척, 컨테이너선 44척, 원유운반선(셔틀탱커 포함) 14척 등 71척을 수주했다. 수주 금액은 총 103억 달러로, 연간 수주 목표(91억 달러)를 13% 초과 달성했다. 삼성중공업 수주액이 100억 달러를 돌파한 것은 2007년 126억 달러 이후 처음이다. 이날 한국조선해양은 마셜아일랜드 소재 선사로부터 4160억 원 규모의 초대형 컨테이너선 2척을 수주했다고 공시했다. 한국조선해양은 현재까지 204척, 199억 달러를 수주해 연간 수주 목표(149억 달러)의 약 133%를 달성했다. 조선업계에서는 친환경 선박 발주 등으로 조선 시황 호조가 장기간 이어질 것으로 전망하고 있다."
286,"정몽준 장남 정기선, 현대重 사장 승진",2021.10.13,"한국조선해양 대표에도 내정재계 안팎 “3세 경영 본격화”조선-에너지-건설기계 3대 핵심에부회장 선임해 책임경영체제 강화현대중공업그룹이 조선·에너지·건설기계 등 3대 주력 사업에 부회장을 선임해 책임경영체제를 강화하는 인사를 단행했다. 현대중공업 대주주인 정몽준 아산사회복지재단 이사장의 장남 정기선 부사장(39)이 대표이사 사장으로 승진하며 경영 최일선에 나선다. 현대중공업은 정 부사장을 그룹 지주사인 현대중공업지주와 조선 부문 지주사인 한국조선해양 대표이사 사장에 내정했다고 12일 밝혔다. 한국조선해양 가삼현 사장과 현대중공업 한영석 사장, 현대오일뱅크 강달호 사장, 현대두산인프라코어 손동연 사장 등 4명은 부회장으로 승진했다.  재계 안팎에서는 정 사장이 그룹 주축인 한국조선해양 대표이사로 선임된 것을 두고 현대중공업그룹 3세 경영이 본격화됐다는 평가가 나온다. 한국조선해양은 최근 자회사인 현대중공업을 기업공개(IPO)하면서 친환경·스마트 선박 등 차세대 원천기술을 확보하는 컨트롤타워로 위상을 재정립했다. 정 사장이 취임 후 핵심사업인 조선해양 분야 미래 주도권 싸움에 드라이브를 걸 것이라는 분석이 나오고 있다.  2009년 현대중공업 대리로 입사한 정 사장은 그룹 내 신사업 전략을 주도했다. 2017년 말부터 공동대표를 맡은 현대글로벌서비스는 선박 AS에 더해 친환경 선박 개조와 선박 디지털화 사업으로 영역을 확장하며 매출 1조 원이 넘는 자회사로 성장했다. 현대중공업지주 경영지원실장으로 올 초 사우디아라비아 아람코와 수소 프로젝트 추진 협력을 주도했고 LG전자 KT 등과 인공지능(AI) 산업 협의체인 ‘AI원팀’을 출범시키는 등 신사업 발굴에 적극 나섰다.  지난해 말부터는 그룹 내 ‘미래위원회’ 위원장을 맡으며 20, 30대 직원들과 현장 소통도 강화하고 있다. 정 사장은 현대중공업지주 주식 415만5485주(5.26%), 한국조선해양 주식 544주, 현대건설기계 주식 152주 등을 갖고 있다. 정 사장과 함께 현대글로벌서비스 공동대표를 맡았던 안광헌 부사장과 이기동 부사장은 사장으로 승진했다. 조선사업 대표인 이상균 사장은 현대중공업 공동대표에 선임됐고 건설기계부문 중간지주회사 현대제뉴인은 손동연 부회장이 공동대표로 내정됐다."
287,"현대重, 정몽준 장남 정기선 사장으로 승진…3세 경영 본격화",2021.10.12,"현대중공업 대주주인 정몽준 아산사회복지재단 이사장의 장남 정기선 부사장(39)이 그룹 지주사인 현대중공업지주와 조선 부문 지주사인 한국조선해양 대표이사 사장으로 승진하며 책임경영에 나선다.   현대중공업은 12일 조선 에너지 건설기계 등 3대 핵심 사업부문 별로 부회장을 선임해 부문별 책임경영체제를 확립하는 등의 인사를 단행했다.   한국조선해양 가삼현 사장과 현대중공업 한영석 사장, 현대오일뱅크 강달호 사장, 현대두산인프라코어 손동연 사장 등 4명은 부회장으로 승진했다. 현대중공업은 예년보다 한 달 정도 일찍 계열사 대표 인사를 낸 배경에 대해 “내년 사업계획을 조기에 확정하고, 변화하는 경영환경에 적극 대응하는 차원”이라고 설명했다.  재계 안팎에서는 정 사장이 그룹의 주축인 한국조선해양 대표로 선임된 것을 두고 현대중공업그룹의 3세 경영이 본격화됐다는 평가를 하고 있다. 한국조선해양은 최근 사업회사인 현대중공업을 기업공개(IPO)하면서 친환경·스마트 선박 등 조선해양 미래 원천기술을 확보하는 컨트롤타워로 위상이 커졌다.   2009년 현대중공업 재무팀 대리로 입사한 정 사장은 이번 사장 승진으로 경영자로서의 입지 강화는 물론 그룹 핵심사업인 조선 분야를 진두지휘하게 됐다. 정 사장은 현재 그룹 지배구조 최상위인 현대중공업지주 주식 415만5485주(5.26%), 한국조선해양 주식 544주, 현대건설기계 주식 152주, 현대일렉트릭앤에너지시스템 주식 156주를 갖고 있다.  현대중공업 측은 정 사장의 승진에 대해 “계열사별 사업전략 및 성장기반 마련에 적극 노력해 왔다. 최근에는 신사업 발굴과 디지털경영 가속화, 사업시너지 창출 등 그룹의 미래전략 수립에 역량을 발휘하고 있다”고 밝혔다. 2017년 말부터 현대글로벌서비스 공동대표(부사장)를 맡아 알짜 자회사로 성장시켰다는 것이다. 최초 서비스인 선박 AS에 더해 친환경 선박 개조와 선박 디지털화를 통한 스마트선박 플랫폼 사업으로 영역을 확장하며 지난해 매출 1조89억 원, 영업이익 1566억 원을 거뒀다. 전년 대비 매출은 24.7% 영업이익은 44.3% 증가한 수치다.   계열사 컨트롤타워인 현대중공업지주 경영지원실장(부사장)을 맡으며 올초 사우디 아람코와 수소 프로젝트 추진 협력을 주도하는 등 신사업 전략 및 성장기반 마련에 성과를 거뒀다. 지난해 말부터 그룹 내 ‘미래위원회’ 위원장을 맡으며 각 계열사 소속 20, 30대 직원들과 바이오 및 수소, AI 등의 미래 사업 가능성을 모색하는 등 현장 소통 경영도 강화하고 있다. LG전자 KT 등 대기업들과 인공지능(AI) 산업 협의체인 ‘AI원팀’ 멤버로 적극 활동하며 실무 능력도 인정받았다.   현대중공업그룹은 정 사장과 함께 현대글로벌서비스 공동대표를 맡았던 안광헌 부사장과 이기동 부사장도 각각 사장으로 승진시켰다. 현대오일뱅크 생산기획통인 주영민 글로벌사업본부장도 사장으로 승진했다.   이밖에 조선사업 대표를 맡고 있는 이상균 사장이 현대중공업 공동대표에 내정돼 한영석 부회장과 함께 회사를 이끌게 됐다. 현대오일뱅크 주영민 사장 역시 강달호 부회장과 함께 공동대표에 내정됐다. 건설기계부문 중간지주회사인 현대제뉴인에는 손동연 부회장이 기존 조영철 사장과 함께 공동대표로 내정됐고, 현대두산인프라코어는 조영철 사장과 오승현 부사장 공동 대표체제로 운영될 예정이다. 현대건설기계 대표이사에는 최철곤 부사장이 내정됐다."
288,현대重 “초격차 기술에 7600억 투자”,2021.09.03,"온라인기업 설명회서 청사진 제시IPO로 최대 1조800억 조달 기대친환경 미래 선박 기술 개발 투자스마트 조선소-해상수소 사업도현대중공업이 16일 유가증권시장 상장을 앞두고 기업공개(IPO) 후의 구체적인 전략을 공개했다. 친환경과 디지털을 앞세워 조선사업에서의 세계적 초격차를 공고히 할 계획이다. 현대중공업은 2일 온라인으로 진행한 기업 설명회에서 IPO 후의 기업 청사진을 △친환경 선박의 퍼스트무버(선도적 혁신자) △선제적 투자를 통한 초격차 달성으로 제시했다. 친환경 미래 선박 기술 개발, 스마트 조선소 구축, 해상 수소 사업 투자를 미래 핵심 3대 사업으로 꼽았다. 이번에 상장되는 회사는 과거 상장법인 현대중공업과 다르다. 새로운 현대중공업은 현대중공업그룹 중간지주사인 한국조선해양 자회사로 울산조선소 등의 조선해양 사업을 하는 회사다. 유가증권시장에서 옛 현대중공업이 한국조선해양으로 사명을 바꾸며 사라진 지 2년여 만에 새로운 현대중공업이 상장되는 것이다. 현대중공업은 IPO로 최대 1조800억 원을 조달할 것으로 기대하고 있다. 이 중 7600억 원을 미래 핵심 3대 사업 강화에 쓸 계획이다. 우선 탄소중립(탄소를 배출한 만큼 흡수해 결과적으로 배출량을 ‘0’으로 하는 것) 시대를 맞아 오염물질 배출이 적은 친환경 선박, 자율운항을 비롯한 디지털 선박 기술 개발에 3100억 원을 투자한다. 수소 및 암모니아 선박, 전기추진 기술 등을 선제적으로 확보해 조선사업의 수익성을 늘릴 방침이다. 울산조선소는 2030년까지 정보기술(IT) 역량이 더해진 스마트조선소로 거듭난다. 3200억 원을 투입해 이동통신, 사물인터넷(IoT) 등 디지털을 활용한 조선공정의 관리 및 운영으로 공정 효율성을 높이면서 안전한 작업환경도 갖출 것으로 기대하고 있다. 수소 분야에는 세계 최고 수준의 조선 및 해양플랜트 기술력을 바탕으로 1300억 원을 투자한다. 해상 신재생 발전과 친환경 수소 생산 및 운송 기반 구축 사업을 본격화할 예정이다. 현재 한국조선해양이 100%를 보유하고 있는 지분 구조는 이번 IPO를 통해 전체 지분의 20%가량인 1800만 주가 신주 발행되면서 바뀐다. 현대중공업은 2, 3일 기관투자가 대상 수요 예측 후 6일 최종 공모가를 확정할 예정이다. 미래에셋증권과 한국투자증권, 크레디트스위스증권이 대표 주관사로 나서며 7, 8일 일반 투자자 대상 청약을 거쳐 유가증권시장에 상장할 예정이다. 현대중공업은 7월 말까지 조선해양부문에서 올해 연간 목표 72억 달러(약 8조3500억 원)를 20% 초과한 86억 달러어치를 수주하는 등의 견조한 실적 성장세, 순 차입금 비율이 34.9%인 안정적 재무구조를 바탕으로 투자자들의 긍정적 평가를 이끌어낼 것으로 기대하고 있다. 영국 시장조사업체 MSI가 세계 조선시장이 2025년까지 연평균 16%씩 성장하며 수요가 공급을 초과할 것이라고 예상하는 등 업황도 긍정적이다. 한영석 현대중공업 사장은 “친환경 미래 기술에 집중적으로 투자해 지난 50년에 이어 다가올 50년에서도 조선업계 1위의 위상을 공고히 할 것”이라고 강조했다."
289,"[영남 파워기업]16일 코스피 상장 앞둔 현대중공업, 장기 불황 극복하고 재도약",2021.09.06,"머스크 초대형 컨테이너선 8척 등선박 수주 급증하며 제2의 호황기단체교섭 타결 등 노사관계도 훈풍물량 소화 위해 고용도 대폭 늘릴 듯울산 현대중공업 본사 본관 앞에는 큰 소나무 한 그루가 서있다. 수령 300년이 넘는 이 소나무는 고 정주영 명예회장이 1971년 그리스 선박 회사인 리바노스(Livanos)사 사주에게 “조선소가 들어설 곳”이라며 보여준 울산 미포만 사진에도 나온다. 당시 정 명예회장은 이 사진과 함께 영국 조선소에서 빌린 유조선 설계도면, 거북선이 새겨진 500원짜리 지폐를 보여주며 설득해 26만 t급 대형 유조선 2척을 수주했다. 현대중공업은 이때부터 산을 깎고 바다를 매립해 공장을 짓고 한편에서는 선박을 건조하기 시작했다. 1974년 6월 28일, 드디어 리바노스사에서 수주한 유조선 명명식이 열렸다. 명명식 사진은 중고교 교과서에 실릴 정도로 한국 경제 발전의 상징 가운데 하나였다. 한국 제조업의 상징으로 꼽혀온 현대중공업이 2008년 세계 금융위기 이후 10여 년간 조선업 장기 불황을 극복하고 올 들어 선박 수주가 급증하면서 제2의 호황기를 맞고 있다. 현대중공업은 8월 세계 최대 선사인 머스크로부터 1만6000TEU급 초대형 컨테이너선 8척을 수주했다. 이 선박 계약식에는 노조 대표인 금속노조 현대중공업지부 조경근 지부장도 참석했다. 조 지부장은 “노동조합도 안전과 품질 등 모든 면에서 무결점 선박을 건조할 수 있도록 최선을 다하겠다”고 선주사에 밝혀 주목을 받았다. 이 컨테이너선 8척을 포함해 현대중공업은 올 들어 8월까지 총 65척, 88억 달러 규모의 선박을 수주했다. 이는 올해 현대중공업 조선 수주 목표의 122%에 이른다. 영국의 조선·해운 시황 분석 기관인 클라크슨리서치에 따르면 올해 1∼7월 전 세계 누계 선박 발주량은 2970만 CGT(표준화물선환산톤수)로 작년 같은 기간의 949만 CGT보다 213% 증가했다. 한국은 이 중 1276만 CGT(43%)를 수주해 2008년 이후 최대 실적을 기록했다. 조선업 호황은 전방산업인 해운업 호황과 관련이 깊다. 대표적인 컨테이너선운임 지표인 상하이발컨테이너운임지수(SCFI)는 8월 27일 기준 4,385.62포인트로 16주 연속 최고가를 경신했다. 해운 운임 강세는 세계 경제가 코로나19의 영향에서 벗어나면서 물동량이 증가하고 있기 때문. 또 지난 수년간의 선박 발주 감소에 따른 선박 부족과 주요 항만의 적체 현상 등이 겹친 데 따른 것이다. 수주 회복과 함께 현대중공업 노사관계에도 훈풍이 불고 있다. 현대중공업 노사는 2019년 대우조선해양 인수를 위한 물적 분할을 놓고 노조가 파업을 벌이는 등 갈등을 겪었으나 올 7월에 2019, 2020년 2년 치 단체교섭을 타결하며 대전환을 맞았다. 교섭 타결 직후 노사가 함께 ‘조선 산업 발전을 위한 노사 선언’ 선포식을, 8월에는 ‘노사 공동 안전결의대회’를 열었다. 고용도 대폭 늘릴 계획이다. 한국조선해양플랜트협회는 늘어나는 물량을 소화하기 위해서는 내년에 현대중공업을 비롯한 울산지역 조선업계에 5000여 명의 기술 인력이 추가로 필요할 것으로 전망했다.  현대중공업 사내협력회사협의회 관계자는 “주 52시간제로 연장근로와 특근이 제한되면서 실질임금이 하락해 인력 확충에 어려움을 겪고 있다”고 말했다. 한편 16일 코스피 상장을 앞두고 있는 현대중공업은 2일 온라인 기업설명회를 통해 ‘친환경 선박의 퍼스트 무버(First Mover), 선제적 투자 통한 초격차 달성’이라는 비전을 발표했다.  한영석 대표는 “현대중공업은 세계 1위 조선사업과 엔진사업을 바탕으로 글로벌 조선산업의 패러다임 변화를 선도할 것”이라며 “친환경 미래 기술에 집중적으로 투자해 지난 50년에 이어 다가올 50년에도 조선업계 1위의 위상을 공고히 할 것”이라고 밝혔다. 현대중공업은 울산 동구 전하동 일대 635만 m²에 10개의 선박 건조 독을 갖춰 국내 조선업체 중 최대 생산 능력을 보유하고 있다. 지난해 매출 8조3102억 원에 영업이익은 325억 원, 수주는 53억600만 달러였다."
290,패널 66%-철광석 56%↑… 원재료값 급등에 “남는게 없다”,2021.08.19,"주요 상장사 상반기 보고서 분석조선3사, 실적 호조에도 3조 손실… 車-전자-식품업계도 ‘재료값 쇼크’“물고기 낚아도 다 뜯긴채 올라와”… 전문가들 “상승세 연말까지 지속”각국 경기 부양책에 따른 수요 회복과 이상 기후의 영향으로 주요 원자재 가격이 급등하면서 기업들이 금융당국에 제출한 공식 보고서에 원재료 가격 상승을 주요 위험 요인으로 꼽은 것으로 확인됐다. 이미 조선, 식음료 등의 업종에서는 원재료 가격 상승으로 상반기에 적자로 돌아서거나 영업이익이 축소되는 등 경영수지 악화가 현실로 나타났다.  18일 본보가 주요 상장사 반기보고서를 분석한 결과 전자 자동차 조선 배터리 식품 등 업종별 주요 원재료 가격이 큰 폭으로 오른 것으로 조사됐다.  전자업계는 패널, 레진(합성수지), 구리 등의 가격이 급등하면서 가전 부문의 타격이 컸다고 밝혔다. 삼성전자는 반기보고서에서 “소비자가전(CE) 부문 주요 원재료인 TV·모니터용 디스플레이 패널 가격이 전년 대비 약 66% 상승했다”고 언급했다. LG전자도 경기 부양에 따른 수요 증가와 북미 한파 등의 영향으로 강철과 레진 가격이 각각 14.0%, 16.2% 올랐다고 공시했다. 유가 상승으로 인한 물류비 부담도 악영향을 미쳤다.  자동차·조선업계에는 철강과 후판(두께 6mm 이상 철판) 가격 인상이 부담으로 작용하고 있다. 현대자동차는 차량 제조에 쓰이는 철판 원자재인 철광석 가격이 올 상반기 t당 158달러로 지난해 같은 기간보다 56.4% 올랐다고 밝혔다. 한국조선해양은 반기보고서에 이 기간 후판 가격이 48.1% 올랐다고 공시했다. 한국조선해양, 대우조선해양, 삼성중공업 등 조선 3사는 올해 상반기 수주실적이 한 해 목표량의 74.4%를 올렸음에도 불구하고 총 3조 원의 영업 손실을 냈다. 선박 건조비의 20%를 차지하는 후판 비용 상승이 각 회사별로 수천억 원대의 공사손실 충당금으로 반영돼 실적이 나빠졌다.  전기자동차 배터리 업계의 주요 원재료 가격 상승도 심상치 않다. 리튬·니켈 가격 폭등에 따라 양극재(19.5%·LG에너지솔루션 공시)와 실리카(15.2%·삼성SDI 공시) 가격이 모두 전년 대비 오른 것으로 나타났다. 식품업계도 원재료 가격 상승에 몸살을 앓고 있다. 수요 증가는 물론이고 한파, 가뭄 등 이상기후에 따른 곡물 수급 불안정까지 더해져 실적이 나빠지고 이를 메우기 위한 소비자 가격 상승까지 이어지고 있다. 올해 상반기 팜유(62.2%·농심 공시)와 대두(22.6%·CJ제일제당 공시) 가격이 치솟으며 식품기업 실적에 악영향을 미쳤다. 농심과 오뚜기의 상반기 영업이익은 전년 대비 각각 56.6%, 21.6% 감소했다. 한 제조업계 주요 기업 임원은 “업계 상황이 ‘노인과 바다’ 같다. 물고기를 낚긴 낚았는데 올라오면서 다 뜯겨나가는 구조”라고 비유했다. 전문가들은 이 같은 상황이 올해 하반기(7∼12월)까지는 이어질 것으로 전망하고 있다. 천소라 KDI 연구위원은 “현재의 원재료·물류비 상승은 글로벌 경기 회복 단계에서 수요 공급 불일치로 나타나는 병목현상이다. 최근 지표에서도 원재료 값 상승세가 이어지고 있어 올해 하반기 산업계에 주된 위험 요인으로 작용할 것”이라고 분석했다."
291,현대重그룹 건설기계 지주사 현대제뉴인 출범,2021.07.28,"두산인프라코어 등 자회사로 편입… 초대 대표이사 권오갑-조영철 선임현대중공업그룹은 건설기계 분야 중간지주사 현대제뉴인이 공식 출범했다고 27일 밝혔다. 조선사업을 맡은 한국조선해양에 이은 두 번째 중간지주사다.  현대중공업그룹은 현대제뉴인에 현대건설기계 지분 33.1%를 현물 출자하고 현대제뉴인이 두산인프라코어 인수자금 마련을 위해 실시하는 2179억 원 유상증자에 참여하기로 결정했다. 그룹은 26일 현대중공업지주 이사회를 열어 이같이 결정했다. 이렇게 되면 현대제뉴인이 현대건설기계, 두산인프라코어를 자회사로 두는 건설기계 분야 계열구조가 완성된다. 현대제뉴인은 8월 중 인수대금을 완납하고 두산인프라코어 편입을 마무리할 방침이다. 한국 러시아 베트남 중국 터키에서 기업결합 승인도 마무리됐다. 현대제뉴인 대표이사로는 권오갑 현대중공업그룹 회장과 조영철 현대중공업그룹 최고재무책임자(CFO)가 공동 선임됐다. 조 대표는 사장으로 승진했다. 권 회장은 현대중공업지주, 한국조선해양 대표를 겸임한다.  ◇현대중공업그룹 ＜승진＞ ▽사장 △한국조선해양 준법경영실장 오세헌"
292,"제주, 전기추진 선박-충전 설비 실증사업 추진",2021.07.01,"제주도가 한국조선해양기자재연구원, 제주테크노파크원과 함께 전기추진 선박 및 충전 설비 실증사업을 추진한다. 이 사업은 제주지역 다기능 어항에 전기추진 선박을 건조하고 충전할 수 있는 실증설비를 갖추는 것이다.  전기추진 선박 관련 산업 및 기업 활성화를 위한 연구거점으로 활용하기 위해 한국조선해양기자재연구원이 제주분원을 개설해 실증사업을 주도한다. 제주도는 친환경 선박 개발 보급 등에 선도적인 역할을 한다. 전기자동차 사용 후 배터리의 효율적 활용을 위한 협력도 한다. 이를 위해 실무 협의체를 꾸려 운영할 예정이다.  제주도 관계자는 “화석연료를 사용하는 선박은 운항이나 항구에 머물면서 엔진 가동에 따른 매연이 심각하다”며 “전기추진 선박이 실용화되면 친환경 선박 개발을 주도하고 온실가스와 미세먼지 감축 등 해양 환경오염 문제를 해결하는 데 도움이 될 것”이라고 말했다."
