,title,date,content
294,보양식도 새벽배송 물건도…‘우리 강아지 줄래!’,2021.08.02," 유통업계 ‘펫팸족’ 공략 앞다퉈CU, 삼계탕 등 3종 보양식 출시11번가는 용품 ‘새벽배송’ 시작GS, 전문몰 인수 등 과감 투자유통업계가 반려동물 시장 선점을 위해 ‘펫팸족(반려동물+가족)’ 공략에 나섰다. 한국인 4명 중 1명 이상이 반려동물과 사는 시대를 맞아 전문몰을 인수하고 전용 브랜드를 출시하는 등 다양한 서비스를 선보이고 있다. 편의점 CU는 2일 반려동물의 기력 회복을 위한 보양식을 출시했다(사진). 삼계탕·오리탕·북어탕 3종으로 구성돼 반려견과 반려묘 모두 먹을 수 있다. CU는 “닭가슴살과 인삼 등 사람이 먹어도 되는 재료가 들어갔다”면서 “반려동물 먹거리에 아낌없이 투자하는 사람이 늘어 상품을 출시했다”고 설명했다. CU에 따르면 올해 상반기 반려동물 제품 매출은 전년 동기 대비 48.7% 성장했다. 이는 지난해 매출 신장률인 30.5%를 훌쩍 넘어선다. 2018년 반려동물 용품 브랜드 ‘하울고’를 내놓은 CU는 점포에 반려동물 용품코너인 ‘CU 펫샵’을 운영 중이다.  이커머스 플랫폼 11번가는 반려동물 전문 쇼핑몰 ‘스토어봄’의 새벽배송 서비스와 제휴를 맺고 반려동물 용품 1500종을 대상으로 서비스를 시작한다. 11번가는 스토어봄 새벽배송 시작을 기념해 최대 20% 할인과 3만원 이상 구매 시 무료배송 혜택을 제공키로 했다.  대형 유통기업 중 반려동물 사업에 가장 공을 들이는 곳은 GS리테일이다. GS리테일은 지난달 21일 사모펀드 IMM PE와 반려동물 전문몰 ‘펫프렌즈’를 공동인수했다. 반려동물 전문몰 업계에서 1위인 펫프렌즈는 고객이 입력한 반려동물 데이터를 기반으로 맞춤 서비스를 제공한다. GS리테일은 펫프렌즈 외에도 반려동물 스타트업에 투자하며 자회사로 ‘어바웃펫’을 두고 있다.경쟁사들도 전열을 가다듬고 있다. 이마트가 운영하는 몰리스펫샵은 지난해 12월 네이버 스마트스토어에 입점하는 등 온라인플랫폼을 활용한 판로 다각화에 나섰다. 롯데마트는 지난 3월 펫팸족을 위한 멤버십 ‘펫클럽’을 선보였다. 펫클럽은 반려동물과 사는 고객이면 누구나 비용 없이 가입할 수 있다. 반려동물 용품 할인과 구매액에 따른 다양한 혜택을 받을 수 있다. 식품기업인 동원F&B와 하림, 풀무원도 전용 브랜드를 통해 다양한 상품을 출시하고 있다. 업계에서는 저출생·고령화로 1~2인 가구가 증가하는 만큼 반려동물 시장도 커질 것으로 보고 있다. 한국농촌경제연구원은 2020년 3조4000억원인 반려동물 연관 산업 규모가 2027년에는 6조원을 웃돌 것으로 추정했다. KB금융지주 경영연구소가 발표한 ‘2021 한국반려동물보고서’를 보면 2020년 말 기준 한국 가구의 29.7%(604만가구)는 반려동물 가구다. 반려동물을 키우는 사람은 1448만명으로, 한국인 4명 중 1명 이상이 반려동물과 함께 살고 있다. 반려동물이 없는 가구 중 향후 개나 고양이를 키워보고 싶다고 답한 비율은 47.8%에 달해 반려동물 가구는 계속 증가할 것으로 나타났다. 업계 관계자는 “과거 펫사업이 단순 판매에 집중하는 수준이었다면 지금은 온라인플랫폼을 통해 24시간 관리해주는 토털서비스로 넘어가는 도약기에 있다”며 “반려동물에 대한 관심이 높아지면서 장기적 관점으로 소비자와 접점 채널을 늘리고 있다”고 말했다. 다만 국내 업체들의 낮은 인지도와 브랜드 신뢰도 등은 풀어야 할 숙제다. 업계에 따르면 반려동물 용품 시장의 70%는 해외 브랜드가 장악하고 있다. 반려동물 병원 등을 중심으로 시장이 형성돼 신규 사업자 진입도 쉽지 않다. 또 다른 업계 관계자는 “수십년 앞서서 연구하고 투자한 미국과 유럽 기업의 장벽을 넘는 게 쉽지는 않다”면서 “플랫폼 등을 이용해 유통의 강점을 살리는 확실한 차별점이 있어야 할 것”이라고 말했다."
295,"대기업 여성 노동자, 남성보다 연봉 3160만원 덜 받고 근속연수도 4.3년 짧아 [유리천장 박살 프로젝트]",2021.08.06," 남녀 임금 격차, OECD국 중앙값 2.3배여성이 남성의 절반 미만인 곳도 155곳‘고용평등인덱스’ 의무 공개인 프랑스 등선진국들, 기업 내 성차별 감독·제재지난해 국내 상장사 여성 노동자는 남성보다 1562만원 적은 연봉을 받은 것으로 조사됐다. 경향신문이 5일 지난해 국내 증시에 상장된 기업 2167개(유가증권시장 768개, 코스닥시장 1399개)가 금융감독원에 신고한 2020년 사업보고서를 분석한 결과, 여성의 임금(중앙값)은 3900만원으로 남성(5462만2464원)의 71.4%였다. 남녀 직원의 임금 격차를 뜻하는 ‘페이갭’은 28.6%였다. 경제협력개발기구(OECD) 회원국 중앙값 12.5%(2019년 기준)의 2.3배에 이른다. 페이갭이 50% 이상인 곳, 즉 여성의 임금이 남성의 절반이 안 되는 상장사도 155곳이었다. 239개사를 제외하고는 모두 OECD 회원국 중앙값 12.5% 이상이었다. 전체 상장사의 88.8% 수준이다. 페이갭이 12.5% 미만인 기업이 239곳, 12.5% 이상 한국 중앙값 32.5% 미만인 곳은 1068곳, 32.5% 이상인 곳은 860곳이었다. 근속연수는 남녀 직원 각각 6.50년과 5.17년으로 남성 직원이 1.33년 길었다. 여성들은 남성보다 더 짧게 근무하고, 임금도 낮은 셈이다. 상장기업 전체 직원 중 여성 직원 비율은 23.9%로 4명 중 1명꼴이었다. ■여성 연봉 높은 곳, 1위 삼성전자·2위 네이버대기업의 페이갭은 더욱 벌어졌다. 상장사 조사와는 별개로 경향신문이 따로 분석한 지난해 매출액 기준 국내 100대 기업(한국경영자총협회 선정, 사업보고서 제출 대상 91개사 분석)의 남성과 여성 임금 차는 35.7%였다. 여성은 5700만원을 받아 남성(8860만원)의 64.3%에 그쳤다. 여성이 남성보다 연봉 3160만원을 덜 받은 것이다. 근속연수는 남성이 13.0년, 여성은 4.3년 짧은 8.7년이었다. 성별 임금격차가 가장 크게 벌어진 곳은 아시아나항공(58.0%)이었다. 100대 기업 중 페이갭이 OECD 회원국 중앙값인 12.5%보다 낮은 곳은 KT(12.2%) 한 곳뿐이었다. 페이갭이 50%대인 회사는 아시아나항공을 비롯해 LG상사, 여천NCC, SK인천석유화학, 현대오일뱅크, SK종합화학 등 6곳이었다. 상장사 전체에서는 여성 임금이 남성 임금보다 높은 곳도 있었지만, 대기업은 예외 없이 남성의 임금이 높았다. 여성 직원 비율은 14.9%로 상장사(23.9%)보다 낮았다. 좋은 일자리로 꼽히는 대기업의 남녀 격차가 큰 것이다. 여성 연봉이 가장 높은 곳은 삼성전자로 9800만원이었다. 그 뒤를 이은 네이버, SK텔레콤, 삼성SDS, KT 등 ‘연봉 톱5’ 중 삼성전자를 제외한 4곳이 모두 정보통신업이라는 점도 눈길을 끈다. 연봉 최하위는 아시아나항공(2900만원)으로 삼성전자의 3분의 1에도 못 미쳤다.  여성 비율과 근속연수 차이 등이 페이갭의 절대적인 요소라고 볼 수도 없었다. 여성이 더 많고 근속연수가 긴 기업에서도 여성에게 적은 임금을 지급하는 경향은 뚜렷했다. 롯데쇼핑, 아모레퍼시픽, 이마트, CJ ENM, LG생활건강, 아시아나항공, GS리테일 등 7개사는 여성 노동자가 절반이 넘지만, 이 중 아시아나항공과 GS리테일은 페이갭이 각각 58.0%, 45.3%나 됐다. 근속연수가 여성이 더 긴 6곳 중 3곳(LG상사·GS글로벌·포스코인터내셔널)에서도 페이갭이 40~50%대였다. ■성별 임금 감사·공시 체계 마련은 세계적 흐름세계 각국은 성별 임금격차를 줄이려 다각도의 노력을 쏟고 있다. 기존 성별 임금 차별 금지 규정의 효과가 미흡하다는 판단으로, 좀 더 실질적인 성과로 이어질 수 있는 법 개정과 제도 정비, 개선방안 마련에 나서고 있는 중이다. 대표적인 곳이 영국이다. 영국은 2019년 평등법을 개정해 상시 250인 이상 사업장은 매년 정부가 운영하는 젠더 임금격차 서비스 홈페이지에 성별 임금격차와 임금 4분위별 남녀 비중 등 7개 항목을 게시하도록 의무화했다. 프랑스는 50인 이상을 고용하는 기업들을 대상으로 기업 홈페이지를 통해 고용평등 인덱스를 공개하도록 했다. 고용평등 인덱스는 노동부가 성별 임금격차, 임금 상승 격차, 승진 차이, 출산휴가 복귀 후 임금이 상승된 노동자의 비율 등을 점수화한 것인데, 인덱스를 공표하지 않거나 시정조치를 이행하지 않으면 총임금에 비례하는 벌칙을 부과한다. 스위스는 사업장의 남녀차별 방지를 목적으로 1995년 제정된 ‘남녀평등법’이 남녀 임금격차를 충분히 해소하지 못한다고 판단해 2018년 임금분포공시제의 운영방식을 새롭게 규정하는 내용으로 법을 개정했다. 상시 100인 이상 노동자를 고용한 공공·민간 부문 사용자는 연방젠더평등처 프로그램을 통해 4년마다 동일임금분석을 실시하고, 감사를 거쳐 결과를 노동자에게 서면 통지해야 한다. 상장사들은 연차결산보고서에 동일임금분석 결과를 공표해야 한다. 독일은 500인 이상, 오스트리아는 151인 이상, 벨기에는 50인 이상 사업장을 대상으로 성별 임금격차를 상세히 분석한 임금분석 보고서를 작성해 노조나 직장평의회 등에 제공할 것을 의무화했다. 공신력 있는 데이터 구축과 투명한 공개가 문제 해결의 출발점인데, 한국은 개별 기업이나 기관의 정보 공개에 인색하다. 1999년 금융감독원 출범 전부터 상장사 등을 대상으로 사업보고서 제출 때 기업별 성별 임금과 근속연수 등을 공시항목에 넣어 기재하도록 했지만, 성별 구분 없이 내거나 관련 정보를 누락해도 제재는 없다. 투자 판단에 영향을 미치는 주요 사항이 아니라는 게 이유다. 실제로 경향신문이 상장사 페이갭을 분석한 결과 금액 단위를 지키지 않거나 근속연수, 임금통계 일부 등을 누락한 부실 공개가 많았다.이은형 국민대 경영학부 교수는 “글로벌 투자 기준 자체가 달라지고 있다. 성별 정보는 매우 중요한데, 주요 공시사항이 아니라고 한다면 시대 흐름을 못 읽고 있는 것”이라고 지적했다. 이 교수는 “블룸버그가 매년 성평등 증진에 기여한 기업을 선정해 발표하는 성평등지수(Gender Equality Index)가 큰 관심을 모을 만큼 성평등은 기업 운영의 핵심 가치로 떠오르고 있고, 돈의 흐름도 그 방향”이라며 “정부도 성별 공시에 좀 더 적극 개입해야 하고 허술한 공시 시스템을 방조해선 안 된다”고 강조했다.  김진성 한국기업지배구조원 ESG평가팀장도 “환경·사회·지배구조(ESG)와 같은 비재무 관련 정보들에 대한 관심과 수요는 계속 높아질 것”이라며 “해외에선 비재무정보 공개 표준화 작업까지 추진 중인 만큼 우리도 대비가 필요하다”고 말했다. 기업들의 반발이 심하지만, 정부 차원에서 미리 관련 공시 가이드를 구체적으로 지원하고 제대로 감독하는 것이 더 큰 미래비용을 치르지 않게 하는 길이라는 의미다.▶ 명단 보는 법 - 상장회사 여성임원 0명은 흰색, 1명에서 50% 미만은 회색, 50% 이상은 검은색으로 표시했다. 기업 명 옆에는 페이갭 수준을 3가지 (양호☆, 보통○, 심각△)로 나눠 표시했다. 페이갭이 OECD 평균(12.5%)보다 작은 기업은 ☆, 12.5% 이상, 한국평균(32.5%) 미만인 곳은 ○, 32.5% 이상인 곳은 △이다.  ▶ 페이갭(Pay Gap) 산출 방법 - 금융감독원 전자공시시스템(DART)에 2020년 사업보고서를 공개한 2326개 기업의 사업보고서를 분석해 남녀 임금격차 실태를 조사했다. 임금이 잘못 기재된 것으로 추정되거나 일부 자료를 누락한 기업, 직원이 전부 남성 또는 여성만 있는 기업 등 159개 기업은 제외했다. 사업분야별 직원을 성별로 합산하고 인원수로 나눠 구했다. 기간제 직원을 포함했고, OECD 방식대로 임금 중앙값(중위임금)을 기준으로 산출했다. 페이갭 = 남성임금-여성임금 / 남성임금 * 100"
296,"매장의 유통기한 임박 상품, 당근마켓에서 최대 60% 싸게",2021.07.27," 유통기한이 임박한 상품을 당근마켓에서 최대 60% 할인해 판매하는 서비스가 생겼다. GS리테일은 27일 당근마켓과 함께 ‘마감할인판매’ 서비스를 시작했다고 밝혔다.편의점 GS25와 슈퍼마켓 GS더프레시의 1만6000여 오프라인 매장 내 유통기한이 임박한 상품을 지역 생활 커뮤니티 앱 당근마켓을 통해 판매한다. 매장 직원이 유통기한이 임박한 상품 정보를 매장결제단말(POS) 시스템에 등록하면 당근마켓 앱으로 전달된다. 당근마켓 이용자가 앱에서 ‘생활서비스’ 항목을 누르거나 검색창에 ‘GS마감할인’을 입력하면 위치정보를 바탕으로 매장과 상품 정보를 확인할 수 있다. 상품 결제 시 당근마켓 앱으로 QR코드가 전송되고 지정된 시간 안에 매장을 방문해 QR코드로 인증하면 구매 절차가 끝난다 다만 담배, 주류 등 온라인에서 판매할 수 없는 일부 품목은 제외됐다. GS리테일 관계자는 “최근 유통기한보다 더 긴 소비기한 표시제 도입이 추진되는 등 충분히 소비할 수 있음에도 버려지는 자원 손실 문제를 해소하기 위해 서비스를 도입했다”면서 “판매자와 구매자 모두 윈윈할 수 있는 쇼핑생태계를 조성하는데 기여할 것으로 예상한다”고 말했다."
297,'15분 전쟁' 쿠팡이츠 가세로 유통업계 속도경쟁,2021.07.08," 유통업계의 배송 속도 경쟁이 갈수록 치열해지고 있다.    익일 새벽배송이나 당일 배송을 넘어 1시간 내 배송 서비스가 잇달아 등장하고 있어서다. 8일 유통업계에 따르면 GS리테일은 지난 22일 배달 전용 주문 모바일 앱인 ‘우딜-주문하기’를 통해 ‘49분 번개배달’ 서비스를 선보였다.GS수퍼마켓 상품을 판매하는 ‘우동(우리동네)마트’ 카테고리에서 구매하면 GS수퍼마켓 인근 지역에 한해 49분 내 배달한다. GS리테일 관계자는 “그동안 GS수퍼마켓을 통해 ‘1시간 배송’ 서비스를 했는데 10여분 단축했다”면서 “번개배달 서비스 도입 이후 주문이 4배가량 늘었다”고 말했다.CJ올리브영은 화장품 즉시 배송서비스인 ‘오늘드림 빠름배송’의 평균 배송 시간을 올 상반기 45분으로 단축했다.2018년 12월 선보인 이 서비스는 전국 올리브영 매장과 연계해 오전 10시부터 오후 8시 사이에 주문하면 3시간 내 배송하는 것이었지만 지난해에는 평균 배송시간을 55분으로 줄였다. 이에 힘입어 지난해 빠름배송이 포함된 오늘드림 전체 주문 건수는 전년 대비 12배 증가했다.롯데슈퍼도 지난 11월 서울 잠실점에서 ‘퇴근길 1시간 배송’ 서비스를 시작한 뒤 올초 서비스 지역을 서울 강북과 경기·인천 일부 지역으로 확대했다. 이에 따라 현재 23개 점포에서 오후 4~8시에 앱으로 주문하면 1시간 안에 배송한다.    배달 앱 시장에서는 쿠팡이 지난 6일부터 식품·생필품 배달 서비스에 나서면서 배달의민족 ‘B마트’와 맞붙었다. 쿠팡이츠는 현재 서울 송파구 일대에서만 시범 운영 중이지만 서울 전역으로 점차 서비스를 확대한다는 계획이다. 쿠팡이츠는 배달에 10~15분 소요된다고 안내하고 있다.유통업계 관계자는 “상품이 비슷하다 보니 결국 다른 데서 차별화를 시도할 수밖에 없다”며 “빠른 배송의 소비자 만족도가 높아 업체마다 시간 단축에 애쓰고 있다”고 말했다.그러나 ‘더 빠른’ 배송을 위한 경쟁이 업체간 출혈 경쟁과 배달원의 안전사고로 이어질 수 있다는 우려도 나온다. 실제 당일 배송 및 익일배송 서비스를 제공하는 주요 온라인 쇼핑몰은 물류비용 때문에 영업손실을 보고 있다. 쿠팡이츠와 배달의민족은 단건 배달(배달원 1명이 주문 1건 처리)을 놓고 수수료 수입보다 더 큰 비용을 투입하고 있다. 또 지난해 서울 지역 교통사고 사망자가 12.4% 감소한 가운데 이륜차 사망자는 2018년 39명, 2019년 49명, 지난해 50명으로 늘어났다. 서울시는 1인 가구 증가와 함께 비대면 배달이 늘어난 결과로 분석했다.최근 배달 종사자 노동조합인 라이더유니온은 배달플랫폼의 인공지능(AI) 배차와 관련, “회사는 빠른 배달 경쟁을 하면서 소비자의 칭찬을 받지만 실제 일을 하는 노동자는 사고 위험에 노출돼 있다”고 말했다."
298,"""15분 배송 전쟁""...쿠팡 참전에 판 커진 즉시배달",2021.07.08," 15분 배송 경쟁이 시작됐다. 쿠팡의 배달앱 쿠팡이츠가 즉시 배달 서비스에 뛰어들면서 퀵커머스(Quick Commerce)시장이 달아오르고 있다. 퀵커머스는 지역별로 소규모 물류센터를 구축해 상품 주문 시 30분~1시간 내 배송하는 서비스다. 소량의 상품을 빨리 구매하려는 1인 가구가 주요 고객이다. 8일 쿠팡이츠에 따르면 서울 송파구에서 신선식품 등을 즉시 배송하는 ‘쿠팡이츠 마트’ 시범 서비스가 지난 6일 시작됐다. 배달 소요 예상 시간은 10~15분이다. 쿠팡이츠는 시범 테스트 후 서울 강남권으로 서비스를 확대할 예정이다. 우아한형제들이 운영하는 배달의민족(배민)은 2018년 11월 ‘B마트’로 국내에선 처음 퀵커머스 시장에 도전했다. 배민은 수도권 등에 물류 센터 30여곳을 운영하며, 7000여개 상품을 30분~1시간 내로 배달한다. 요기요를 운영하는 독일 딜리버리히어로(DH)의 자회사 딜리버리히어로스토어스코리아도 지난해 9월 ‘요마트’를 출시하고 생필품 3000여개 상품을 배달한다. 이들 업체는 도심 물류거점에 상품을 매입해 보관하다가 주문이 들어오면 마진을 붙여 되팔고 있어, 상품 가격이 일반 유통업체들에 비해 상대적으로 비싼 편이다. B마트가 처음 나올 때만 해도 업계에서는 집 앞 편의점 등에서 살 수 있는 물건을 돈 주고 배달까지 해가며 소비를 할지에 대한 의문이 적지 않았다. 하지만 배달에 익숙한 2030세대와 1인 가구를 중심으로 수요가 늘어 매출이 증가세를 보이고 있다. 우아한형제들의 2020년 감사보고서에 따르면 2019년 511억원 수준이던 상품 매출은 2020년 2187억원으로 4배 넘게 성장했다. 빠른 성장세에 동네 상권의 중심인 슈퍼에서도 유사 서비스를 내놓고 있다.  GS리테일은 지난달 22일 배달 전용 주문 앱 ‘우딜-주문하기’를 통해 ‘49분 번개배달’ 서비스를 출시했다. GS수퍼마켓 상품을 판매하는 ‘우리동네 마트’ 카테고리에서 구매하면 GS수퍼마켓 인근 지역에 한해 49분 내 배달한다. GS리테일 관계자는 “앱 론칭 이후 지난 7일까지 누적 주문이 14만여건을 넘고 주문도 평소보다 4배가량 늘어나는 등 반응이 좋다”며 “배달이 주는 양질의 서비스를 누리고자 하는 소비자가 늘고 있다”고 말했다. 그 외 11번가 등 이커머스 업계도 뛰어들어 퀵커머스가 유통업계의 격전지로 부상했다. 딜리버리히어로는 “퀵커머스는 차세대 이커머스 업계의 중요한 시장이 될 것”이라며 “오는 2030년에는 퀵커머스 시장 규모가 4480억유로(약 628조원)에 달할 것으로 보인다”고 추정했다. 다만 퀵커머스는 도심 내 중소형 물류센터를 운영하는 만큼 많은 배송 인프라가 필요해 출혈 경쟁이 불가피할 것이라는 우려가 나온다. 배달 속도를 높이기 위한 시스템도 만들어야 한다. 정연승 단국대 경영경제대 교수(한국유통학회장)는 “상품 저가경쟁을 넘어 라스트마일(소비자가 주문한 상품이 문 앞에 배송되기 직전의 단계)에서 서비스를 다각화하는 경쟁이 벌어지고 있다”며 “물류 시스템과 빅데이터 등의 정보기술 활용 등으로 수요를 예측하고 관리하려면 규모가 필요해 결국 자본력의 싸움이 될 것”이라고 말했다. 배송 경쟁이 분단위로 격화하면서 배송 기사들의 안전을 담보하기가 힘들 수 있다는 우려도 나온다. 배달 종사자 노동조합인 라이더유니온은 지난달 배달플랫폼의 인공지능(AI) 배차와 관련한 회견에서 “회사는 빠른 배달 경쟁을 하면서 소비자의 칭찬을 받지만 실제 일을 하는 노동자는 사고 위험에 노출될 수 밖에 없다”고 주장했다."
299,편의점도 ‘즉시 배달 합니다’,2021.06.21,"GS25 등 ‘퀵커머스’ 자체 앱 구축 국내 편의점들이 자체 배달 전용 애플리케이션(앱)을 구축하는 등 퀵커머스(즉시 배송) 서비스를 강화하고 있다. GS리테일은 22일부터 편의점 GS25와 GS수퍼마켓의 배달 전용 주문 모바일 앱인 ‘우딜-주문하기’(우딜앱·사진)를 운영한다고 21일 밝혔다. 기존에는 고객이 GS25 상품을 배달 주문할 때 ‘요기요’ 앱이나 ‘카카오톡 주문하기’를 이용해야 했지만, 이제 우딜앱을 통해서도 주문할 수 있게 됐다. GS리테일은 지난해 8월부터 일반인 도보 배달자 전용 앱인 ‘우친-배달하기’(우친앱)를 선보였다. 우딜앱으로 주문이 들어오면 도보 배달자들은 우친앱으로 연락을 받아 상품을 배달한다. 도보 배달자는 7만5000명을 넘어섰고, 고객에게 상품이 도달하는 시간은 평균 17분으로 나타났다. GS리테일 관계자는 “편의점을 포함한 전국 1만5000여개 오프라인 매장을 라스트마일 딜리버리(고객에게 가는 마지막 구간의 배송) 플랫폼으로 활용하는 데 우딜앱과 우친앱이 핵심 역할을 할 것”이라고 말했다. 앞서 편의점 이마트24도 카카오톡과 요기요를 통해서만 배달 서비스를 해오다 자체 모바일 앱과 네이버 주문으로 배달 채널을 확대했다. 최근 수요가 빠르게 늘어 이달 1일부터 14일까지 배달 상품 매출이 전월 동기 대비 65% 증가했다.고영득 기자 godo@kyunghyang.com▶ [뉴스레터] 식생활 정보, 끼니로그에서 받아보세요!▶ 경향신문 프리미엄 유료 콘텐츠가 한 달간 무료~▶ [2021경향포럼] 탄소중립을 위해 필요한 혁신©경향신문(www.khan.co.kr), 무단전재 및 재배포 금지"
