,title,date,content
151,"편의점 GS25, 대세 ‘펭수’와 협업… 라이선스 계약",2020.01.30,"편의점 GS25를 운영 중인 GS리테일이 펭귄 캐릭터 ‘펭수’와 협업에 나선다.GS리테일은 EBS 프로그램 ‘자이언트 펭TV’와 라이선스 계약을 맺었다고 30일 밝혔다.GS리테일은 소비자에게 재미와 위로를 전할 수 있는 다양한 상품과 행사를 선보일 계획이다.특히 다음달에는 펭수 노트와 스티커, 밸런타인데이 기획 상품 등을 출시한다. 이와 함께 화이트데이에는 마그넷 등을 넣은 묶음 상품을 내놓을 예정이다.이와 함께 전국 편의점 GS25 매장 입구에 펭수를 활용한 포스터를 붙인다.회사 측은 “올해 30주년을 맞은 GS25의 소비자를 향한 진심을 펭수가 효과적으로 전달할 것이라 판단했다”며 “키덜트(어린이를 뜻하는 ‘Kid’와 어른을 뜻하는 ‘Adult’의 합성어) 소비 층 등을 흡수할 수 있을 것”이라고 설명했다.펭수는 EBS가 EBS1 채널과 유튜브 ‘자이언트 펭TV’에서 선보인 키 210cm의 펭귄 캐릭터로 거침없는 돌직구 발언으로 큰 인기를 얻고 있다. 지난 29일 기준 유튜브 구독자 수는 200만 명에 달한다.GS리테일 관계자는 “펭수는 편의점 업계 단독으로 진행하는 이번 협업을 통해 차별화한 기쁨을 전달할 수 있도록 노력할 것”이라고 덧붙였다.동아닷컴 박상재 기자 sangjae@donga.com▶ 네이버 홈에서 [동아일보] 채널 구독하기▶ 트롯가수 응원은 '트롯픽'에서 / 집 볼 때 쓰는 메모장 '집보장'ⓒ 동아일보 & donga.com, 무단 전재 및 재배포 금지"
152,"편의점 GS25, 수제 맥주 성산일출봉 판매… 상품군 강화 나서",2020.01.23,"GS리테일이 운영하는 편의점 GS25가 수제 맥주 상품군을 강화한다.GS리테일은 수제 맥주인 ‘성산일출봉’을 지난 8일부터 판매에 나섰다고 23일 밝혔다.성산일출봉은 골든에일로 알코올 도수는 5.1도다. 고급 홉(hop·삼과의 덩굴식물)과 제주도 물, 자체 배향한 효모 등을 넣었다. 강한 풍미를 지녔다는 것이 회사 측 설명이다.GS리테일은 뿐만 아니라 수제 맥주 4캔을 1만 원에 판매하는 판촉 행사를 강화하는 방안을 적극 검토하고 있다. 최근 종량세(알코올 도수에 따른 과세) 전환에 따라 가격 경쟁력이 높아졌기 때문이다.한구종 GS리테일 맥주 담당 상품 구매자(MD)는 “종량세 전환 정책에 힘입어 수제 맥주를 10종까지 확대해 나갈 계획”이라고 말했다.수제 맥주는 최근 들어 국내 시장에서 판매량이 증가하는 추세다. GS리테일에 따르면 전체 캔맥주(500㎖ 용량 기준) 매출액 중 수제 맥주가 차지하는 구성비는 2018년 2.1%에서 지난해 7.0%로 크게 뛰었다.회사 측은 ‘홈술(집에서 마시는 술)’과 ‘혼술(혼자 마시는 술)’ 흐름에 맛있는 맥주를 찾는 소비자가 증가하고 있는 것으로 분석했다.동아닷컴 박상재 기자 sangjae@donga.com▶ 네이버 홈에서 [동아일보] 채널 구독하기▶ 트롯가수 응원은 '트롯픽'에서 / 초대형전광판 혜택 '아이돌픽!ⓒ 동아일보 & donga.com, 무단 전재 및 재배포 금지"
153,"[유통 단신]제이비프레시, 제주에 먹거리 공장 신설",2020.02.11,"■ 제이비프레시, 제주에 먹거리 공장 신설제주지역 GS25 편의점에 도시락, 김밥 등 신선 먹거리를 공급하는 식품업체 제이비프레시는 8일 제주시 조천읍에 893m² 규모의 신선 먹거리 공장(사진)을 신설했다고 10일 밝혔다. 이 공장은 하루 최대 5만 인분 이상의 먹거리를 생산할 수 있는 대량생산 시스템을 구축했으며 품질 향상을 위한 별도의 연구실도 운영한다. GS리테일은 해당 공장을 여는 데 필요한 자동화 생산시설 및 품질위생관리 체계 구축 노하우를 제공했다. GS리테일 관계자는 “제주도민에게 안심하고 맛있는 상품을 지속적으로 제공할 수 있도록 노력하겠다”고 말했다.  ■ 롯데 5개 브랜드 통합 주문 앱 ‘롯데잇츠’ 오픈10일 글로벌 외식기업 롯데지알에스는 롯데리아, 엔제리너스, 크리스피크림도넛, TGI프라이데이스, 빌라드샬롯 등 총 5개 브랜드의 자체주문 서비스를 제공하는 통합 애플리케이션 ‘롯데잇츠’를 오픈한다고 밝혔다. 해당 앱에서는 배달뿐 아니라 매장 방문 시 대기 시간을 줄여주는 ‘잇츠오더’ 서비스를 이용할 수 있다. 고객 편의를 위해 전자영수증 발행과 선불카드 기능도 도입했다. 롯데지알에스는 통합 앱 출시를 기념해 3월 10일까지 무료 쿠폰 프로모션을 진행할 예정이다.  ■ 현대百, 14일까지 밸런타인데이 프로모션10일 현대백화점은 서울 압구정본점 등 전국 15개 점포에서 14일까지 밸런타인데이 프로모션을 진행한다고 밝혔다. 압구정본점은 해당 기간 지하 1층 행사장에서 프린프린, 스푼홀릭 등 10여 개 브랜드가 참여하는 ‘밸런타인데이 기프트 이벤트’를 연다. 대표 상품은 ‘프린프린 생과일 마카롱’(4000원), 먹는 꽃다발 ‘쇼콜리디아 벚꽃 브라우니’(3만2000원) 등이다. 현대백화점 측은 “평소 백화점에서 만나보기 힘든 이색 브랜드가 대거 참여할 예정”이라고 말했다. ▶ 네이버 홈에서 [동아일보] 채널 구독하기▶ 트롯가수 응원은 '트롯픽'에서 / 집 볼 때 쓰는 메모장 '집보장'ⓒ 동아일보 & donga.com, 무단 전재 및 재배포 금지"
154,내실 다지며 공격 경영… 에너지-유통-건설 강자로,2020.01.01,"[한국기업 100년 퀀텀점프의 순간들]＜12＞ 안목경영 돋보인 GS그룹65(구씨) 대 35(허씨). 경남 진주시 지수면 승산리의 거부(巨富)였던 허만정은 1946년 사돈이 된 LG 창업회장 구인회에게 35%의 비율로 창업자금을 지원했다. 이 자금은 이듬해인 1947년 LG그룹의 모태인 락희화학공업사를 세우는 밑천이 됐다. 사업이 커지자 두 집안은 각자 낸 원금에 따라 비율을 정했다. 이 지분은 두 집안이 반세기 넘게 동업 관계를 유지해온 비결이 됐다. 2000년대 초 GS가 LG에서 계열 분리할 때도 복잡한 지분 관계를 놓고 어떤 잡음도 나오지 않았다. LG와 ‘아름다운 이별’을 하게 된 GS는 2005년 정유·유통을 주력으로 하는 15개 계열사를 거느린 그룹으로 거듭났다. 분리된 지 15년 만에 GS는 에너지·유통서비스·건설을 3대 축으로 64개 계열사를 거느린 글로벌 기업으로 성장했다. 특히 지난해 기준으로 전체 매출 가운데 수출이 차지하는 비중이 전체의 절반(36조 원)을 넘어섰다. 조용한 듯 공격적으로 사업을 펼치는 ‘내실 경영’과 신사업을 발굴해 적극 투자하는 ‘안목 경영’이 GS가 퀀텀점프 할 수 있었던 배경으로 꼽힌다.○ 조용히 사업 넓히는 내실 경영 신문물에 적극적이었던 집안에서 자란 허만정은 셈에 밝았다. 돈 되는 사업에 투자하며 재산을 불려 다른 사업에 투자했다. 하지만 구씨와의 동업에 있어서는 경영 전면에 나서지 않는 것을 원칙으로 삼았다. 그는 “경영은 구씨 집안이 알아서 잘할 테니 돕는 일에만 충실하라”고 자식들에게 당부할 정도로 조용히 재무, 회계 등의 안살림에 집중했다.  내실을 다지면서 사업 영역을 넓혀온 허씨 집안의 가풍은 GS의 경영 철학으로 이어졌다. 허창수 GS그룹 명예회장이 2005년 그룹 출범식에서 제시한 슬로건은 ‘밸류(가치) 넘버원 GS’이었다. 무엇보다 그는 모든 의사 결정이 이사회에서 이뤄지는 ‘이사회 중심의 자율 경영’과 ‘전문경영인 중심의 책임 경영’ 등을 강조했다. 외형 확장에는 좀더 공격적이었다. 2000년대 글로벌 경제위기로 불황이 길어지는 시기에도 GS는 공격적 인수합병으로 사업 영역을 확장했다. 2009년 ㈜쌍용을 인수하며 출범한 GS글로벌은 해외사업 확장의 플랫폼이 됐다. 2012년 GS에너지를 설립한 이후에는 2013년 신평택발전, 청라에너지 등 활발하게 인수합병 작업을 해나가고 있다.  발전사업에서는 ‘뚝심 경영’을 발휘했다. 2005년 LG에너지를 인수해 GS EPS를 출범시킨 GS는 이후 발전소를 늘려가며 2017년 민간 발전사 가운데 발전용량 1위에 올랐다. 허 명예회장이 “필요한 투자를 두려워하거나 실기하는 일이 없도록 하라”고 강조한 성과다. 수익성을 중심에 둔 판단은 때로 과감히 포기하는 결정의 기반이 되기도 했다. 2008년 대우조선 인수를 포기한 게 대표적인 예다. 2010년에는 편의점과 슈퍼에 집중하기 위해 GS리테일의 백화점과 마트 부문을 매각하기도 했다. 허 명예회장은 공격 경영의 하나로 글로벌 경영을 추진했다. 2011년 9월 중국 산둥성 칭다오에서 열린 GS그룹 사장단 회의는 그룹 출범 이후 처음으로 해외에서 열렸다. GS그룹 해외 사장단 회의가 GS의 글로벌 경영에 ‘마중물’ 역할을 해오면서 2017년 GS에너지와 GS글로벌이 ‘BSSR석탄광’ 지분 인수를 통해 인도네시아 석탄 생산광 사업에 진출했고 GS리테일의 슈퍼마켓과 편의점이 각각 인도네시아와 베트남에서 사업을 펼치고 있다.○ 신사업 알아보는 ‘안목 경영’ 지난해 말 허 명예회장의 뒤를 이은 허태수 그룹 회장은 해외시장의 변화를 감지하고 이를 경영 전반에 반영하는 그룹의 ‘센서’ 역할을 해왔다. 그는 2007년부터 GS홈쇼핑을 이끌며 여러 통념을 뒤집은 새로운 시도를 해왔다. 2010년에는 GS홈쇼핑이 보유했던 케이블 방송을 모두 매각해 업계를 깜짝 놀라게 했다. 그는 이렇게 확보한 자금을 모바일 사업에 투자하며 홈쇼핑의 모바일화를 주도해왔다. 2007년 GS홈쇼핑 대표이사 취임 이후 홈쇼핑 업계가 저가 경쟁을 벌이자 과감하게 트렌드 리더 홈쇼핑을 내세우며 패션 중심으로 품질 경쟁을 주도한 것도 그의 작품이었다. 이런 안목과 과감한 결단으로 GS홈쇼핑은 2017년 12월 홈쇼핑 시장 최초로 취급액 4조 원을 달성했다. 허 회장은 평소 “기업경영이란 외부 생태계의 변화를 빠르게 인식하고 대응해 나가는 과정”이라는 말을 자주한다. 그의 이런 소신은 스타트업과 협력, 디지털 트랜스포메이션 등으로 나타나고 있다. 허 회장은 미국 샌프란시스코 현지에 자회사 GSL 랩스를 설립해 직원들이 최신 실리콘밸리의 기술과 혁신문화를 배울 수 있도록 하고 있다. GS홈쇼핑 직원 위주로 시작된 이러한 혁신교육은 여러 계열사의 요청으로 그룹 전반으로 확산되고 있다.염희진 기자 salthj@donga.com▶ 동아일보 단독 뉴스 / 트렌드 뉴스▶ 네이버 홈에서 [동아일보] 채널 구독하기ⓒ 동아일보 & donga.com, 무단 전재 및 재배포 금지"
155,“혁신” 강조한 허태수… GS에 변화 돌풍 몰아친다,2020.01.15,"취임 첫 공식행사서 경영화두 제시… “외부와 협업 오픈 이노베이션실리콘밸리 검증 혁신 방법론… GS계열사에 적극 전파할 것”허태수 GS그룹 회장이 지난해 12월 그룹 회장으로 취임한 이후 첫 공식 행사에서 ‘혁신’을 강조했다. 올해 초 신년 모임에서 디지털을 중심으로 한 변화를 강조한 데 이어 혁신을 독려하면서 GS 내 변화의 바람이 불고 있다는 이야기가 나오고 있다. 허 회장은 14일 서울 강남구 은행권청년창업재단 디캠프(D.camp)에서 열린 ‘스탠퍼드 디자인 싱킹 심포지엄 2020’에 참석해 임직원들에게 혁신을 경영 화두로 제시했다. 이 자리에는 GS칼텍스, GS에너지, GS리테일, GS홈쇼핑 등 계열사 경영진을 비롯한 100여 명의 임직원이 참석했다. 허 회장은 전날에도 심포지엄에 참석해 디자인 싱킹과 관련한 사례를 살펴봤다. 미국 스탠퍼드대 ‘이노베이션&디자인연구센터’(혁신센터)가 주최한 이 행사는 디자인 싱킹을 소개하고 연구 결과물을 공유하는 자리다. 디자인 싱킹은 감성과 직관적 사고를 결합해 창의적 성과를 도출하는 방법론을 의미한다. 구글, 애플, 에어비앤비 등 선진 기업들이 업무에 활용하고 있다. 이날 스탠퍼드대 디자인연구센터장이자 약 40년 동안 기계공학과 교수로 재직하고 있는 래리 라이퍼 교수를 비롯해 서종민 박사, 김소형 박사, 장하원 연구원 등은 디자인 싱킹 방법론에 대해 소개하고 다양한 산업군에 적용된 사례를 선보였다. 허 회장은 라이퍼 교수 등과의 환담에서 “스타트업을 포함한 다양한 비즈니스 파트너들과 협력관계를 구축해 건강한 영향력을 주고받는 것이 기업과 사회에 지속 가능성을 높이는 길”이라며 “외부와 협업하는 오픈 이노베이션과 실리콘밸리에 있는 선진 기업들이 도입해 검증받은 혁신 방법론을 각 계열사에 적극 전파하겠다”고 말했다. 라이퍼 교수는 “혁신을 받아들이기 위해 적극적으로 심포지엄에 참여해 준 GS에 깊은 감사의 말씀을 드린다”며 “아시아 기업이 각각의 문화에 맞게 발전할 수 있도록 스탠퍼드 이노베이션 센터가 적극적으로 지원해 나가겠다”고 화답했다. GS 측은 허 회장이 신년 첫 행보로 심포지엄을 택한 것은 ‘혁신을 한시도 늦추거나 뒤로 미룰 수 없다’는 판단에서 비롯된 것이라고 설명했다. 허 회장은 2007년 GS홈쇼핑 대표이사에 취임한 뒤 모바일 쇼핑으로의 전환을 진두지휘해 2017년 홈쇼핑 업계 최초로 취급액 4조 원을 돌파하기도 했다. 허 회장이 신성장동력 발굴을 위해 2011년부터 직간접적으로 투자에 나선 글로벌 스타트업 수는 약 500곳, 총 투자금액은 3000억 원 수준이다. 스타트업과의 상호 협력으로 미래 성장동력을 찾는 ‘GWG(Grow with GS)’ 행사도 2015년부터 3개월에 한 번 열어 현재까지 23회 이어지고 있다. GS는 스탠퍼드대와 지속적으로 교류하는 한편 미국 캘리포니아주 실리콘밸리 일대에 벤처투자법인을 설립해 다양한 스타트업과 협력을 확대할 계획이다. GS 관계자는 “스탠퍼드대와 교류 등을 통해 혁신의 수준을 높이겠다”고 말했다.허동준 기자 hungry@donga.com ▶ 네이버 홈에서 [동아일보] 채널 구독하기▶ 트롯가수 응원은 '트롯픽'에서 / 초대형전광판 혜택 '아이돌픽!ⓒ 동아일보 & donga.com, 무단 전재 및 재배포 금지"
156,2030 “골프로 작은 사치”… 관련산업 37% ‘쑥’,2020.11.30,"2030 골프용품 판매 신장률, ‘골프 주류’ 4050세대 앞질러스크린 즐기는 20대 연습용품 찾고 필드 나가는 30대 의류 구매 많아유통업계도 앞다퉈 골프시장 진출… 시장규모 3년 뒤 9조 넘을 듯골프 산업이 계속 커지고 있다. 신종 코로나바이러스 감염증(코로나19) 이후 상대적으로 감염 우려가 덜한 야외 운동으로 골프가 각광받으면서다. 해외여행이 사실상 불가능해지면서 해외 골프 활동 인구들이 국내에 머물고 있는 점도 골프 인구 증가세에 힘을 보탰다. 특히 젊은 MZ세대(밀레니얼+Z세대)가 대거 골프에 입문하면서 관련 시장도 커지고 있다. 지난해 6조7000억 원이었던 골프 산업 시장 규모는 2023년 9조2000억 원까지 성장할 것으로 보인다.젊은 골프 초보자들의 골프 관련 소비 증가는 올해 가장 눈에 띄는 변화다. 옥션이 지난달 18일부터 이달 17일까지 지난해 동기 대비 연령별 골프 관련 용품 판매량을 조사한 결과에 따르면 2030세대의 골프용품 전체 판매 신장률은 37%였다. 골프 인구의 다수를 차지하는 4050세대의 31%보다 높은 수치다.  흥미로운 것은 2030세대 내에서도 골프를 즐기는 양상이 달랐다는 점이다. 먼저 20대는 골프 연습 자체에 집중하고 있었다. 옥션 내에서 이들의 골프연습용품 구매량은 61% 증가해 가장 높은 판매 신장률을 보였다. 30대는 패션에 더욱 신경을 쓰는 모습이었다. 20대보다 상대적으로 필드에 자주 나가기 때문인 것으로 풀이된다. 30대 남성골프의류 판매량은 지난해 동기보다 112% 증가했고, 여성골프의류도 26% 늘었다. 필드용품을 찾는 이들도 40% 증가했다. 현대경제연구원에 따르면 올해 상반기(1∼6월) 골프 예약 서비스업체 엑스골프를 통한 골프장 예약 건수는 19만8000건이었다. 지난해 동기 대비(17만5000건) 약 13.2% 증가한 수치다. 특히 코로나19 영향이 본격화된 올해 3월 이후 예약 건수는 8.1% 상승했다. 골프장, 스크린골프장 방문객 수 역시 코로나19가 시작된 2월부터 9월까지 각각 20%, 46% 늘었다.  골프 시장 규모가 점차 커지면서 유통업계도 ‘골프 인구 붙잡기’에 안간힘을 쓰는 모습이다. GS리테일은 이달 20일 경기 파주에 골프 복합 매장 ‘GS25 파주부흥점’을 선보였다. 인근 골프장 방문 수요를 노려 골프 관련 용품 10여 종과 250개 상품을 판매한다. CJ ENM 오쇼핑부문은 최근 골프웨어 브랜드 ‘장 미쉘 바스키아’를 론칭하고 프리미엄 골프웨어 시장에 진출했다. 코오롱인더스트리FnC도 올해 5월 MZ세대 대상 골프 전문 온라인 셀렉트숍 ‘더카트골프’를 내놨다. 최근에는 미국 골프웨어 브랜드 ‘그레이슨’과 ‘라다’를 단독 입점시킨 데 이어 내년부터는 영국 런던 기반 ‘매너스 골프’도 선보인다. 옥션 관계자는 “올해 골프 시장의 변화는 젊은 골프 초보자들이 주도하고 있다. 가치 소비를 중시하는 이들은 골프를 통해 ‘스몰 럭셔리’를 실현하는 것으로 평가된다”며 “유튜브 등 온라인을 통해 쉽게 골프를 배우고 스크린골프 등 즐기는 방법도 다양해져 골프 관련 산업은 앞으로 더욱 커질 것으로 전망된다”고 말했다.박성진 기자 psjin@donga.com▶ 네이버에서 [동아일보] 채널 구독하기▶ 증발에 운다…그렇게 부모가 되지 못했다▶ “말이 안 통해”… 극과 극이 만난다면?ⓒ 동아일보 & donga.com, 무단 전재 및 재배포 금지"
157,"젊은층 대거 입문, 골프시장 커진다…20대는 연습-30대는 패션 신경, 왜?",2020.11.29,"골프 산업이 계속 커지고 있다. 신종 코로나바이러스 감염증(코로나19) 이후 상대적으로 감염 우려가 덜한 야외 운동으로 골프가 각광받으면서다. 해외여행이 사실상 불가능해지면서 해외 골프 활동 인구들이 국내에 머물고 있는 점도 골프 인구 증가세에 힘을 보탰다. 특히 젊은 MZ세대(밀레니얼+Z세대)가 대거 골프에 입문하면서 관련 시장도 커지고 있다. 지난해 6조7000억 원이었던 골프 산업 시장 규모는 2023년 9조2000억 원까지 성장할 것으로 보인다.   젊은 골프 초보자들의 골프 관련 소비 증가는 올해 가장 눈에 띄는 변화다. 옥션이 지난달 18일부터 이달 17일까지 지난해 동기 대비 연령별 골프 관련 용품 판매량을 조사한 결과에 따르면 2030세대의 골프용품 전체 판매 신장률은 37%였다. 골프 인구의 다수를 차지하는 4050세대의 31%보다 높은 수치다.   흥미로운 것은 2030세대 내에서도 골프를 즐기는 양상이 달랐다는 점이다. 먼저 20대는 골프 연습 자체에 집중하고 있었다. 옥션 내에서 이들의 골프연습용품 구매량은 61% 증가해 가장 높은 판매 신장률을 보였다. 30대는 패션에 더욱 신경을 쓰는 모습이었다. 20대보다 상대적으로 필드에 자주 나가기 때문인 것으로 풀이된다. 30대 남성골프의류 판매량은 지난해 동기보다 112% 증가했고, 여성골프의류도 26% 늘었다. 필드용품을 찾는 이들도 40% 증가했다.  현대경제연구원에 따르면 올해 상반기(1~6월) 골프 예약 서비스업체 엑스골프를 통한 골프장 예약 건수는 19만8000건이었다. 지난해 동기 대비(17만5000건) 약 13.2% 증가한 수치다. 특히 코로나19 영향이 본격화된 올해 3월 이후 예약 건수는 8.1% 상승했다. 골프장, 스크린골프장 방문객 수 역시 코로나19가 시작된 2월부터 9월까지 각각 20%, 46% 늘었다.   골프 시장 규모가 점차 커지면서 유통업계도 ‘골프 인구 붙잡기’에 안간힘을 쓰는 모습이다. GS리테일은 이달 20일 경기 파주에 골프 복합 매장 ‘GS25 파주부흥점’을 선보였다. 인근 골프장 방문 수요를 노려 골프 관련 용품 10여 종과 250개 상품을 판매한다. CJ ENM 오쇼핑부문은 최근 골프웨어 브랜드 ‘장 미쉘 바스키아’를 론칭하고 프리미엄 골프웨어 시장에 진출했다. 코오롱인더스트리FnC도 올해 5월 MZ세대 대상 골프 전문 온라인 셀렉트숍 ‘더카트골프’를 내놨다. 최근에는 미국 골프웨어 브랜드 ‘그레이슨’과 ‘라다’를 단독 입점시킨 데 이어 내년부터는 영국 런던 기반 ‘매너스 골프’도 선보인다.  옥션 관계자는 “올해 골프 시장의 변화는 젊은 골프 초보자들이 주도하고 있다. 가치 소비를 중시하는 이들은 골프를 통해 ‘스몰 럭셔리’를 실현하는 것으로 평가된다”며 “유튜브 등 온라인을 통해 쉽게 골프를 배우고 스크린골프 등 즐기는 방법도 다양해져 골프 관련 산업은 앞으로 더욱 커질 것으로 전망된다”고 말했다.박성진 기자 psjin@donga.com▶ 네이버에서 [동아일보] 채널 구독하기▶ 증발에 운다…그렇게 부모가 되지 못했다▶ “말이 안 통해”… 극과 극이 만난다면?ⓒ 동아일보 & donga.com, 무단 전재 및 재배포 금지"
