,title,date,content
433,“생필품 10분 배달”… 유통업체들 ‘속도전’,2021.07.09,"쿠팡, 송파구서 즉시 배송 서비스‘직고용’으로 라이더 안정적 확보GS-CJ-롯데도 배송시간 앞당겨“퀵커머스로 유통업계 요동칠 것”‘배달 예상 시간 10∼15분.’ 쿠팡이 음식배달플랫폼 ‘쿠팡이츠’를 통해 최근 서울 송파구 일부 지역에서 시작한 식품, 생필품 즉시 배송 서비스 ‘쿠팡이츠 마트’ 화면 상단에 있는 문구다. 2019년부터 배달의민족(우아한형제들)이 선보인 ‘B마트’와 유사한 서비스다. 아직 송파구 내에서도 석촌동과 송파1동 등 일부 지역에서만 서비스가 가능한 상태지만 이를 지켜보는 유통업계의 긴장감은 높다. 유통업계 한 관계자는 “쿠팡이 서비스 지역을 확장하면서 10∼15분이라는 ‘배달 속도’를 유지하기 위해 대규모의 물류 인프라 투자를 할 것으로 보인다”며 “퀵커머스 경쟁이 본격화하면 유통업계 지형이 또 한 번 요동칠 것”이라고 말했다.  8일 유통업게에 따르면 쿠팡은 쿠팡이츠 마트 시범사업을 시작하면서 ‘직고용 라이더’ 모집도 시작했다. 3개월 계약직인 ‘쿠팡이츠 친구’는 월 250만 원 이상의 안정적인 수익을 보장하고, 배송 수단인 이륜차와 유류비, 통신비 등을 지원한다. 주5일 근무와 4대 보험 가입, 경조사비 지원 등 복리후생도 붙는다. 기존 쿠팡이츠 배달원인 ‘쿠팡파트너’는 개인사업자 신분으로 배달대행사나 플랫폼 자체와 계약을 맺는다. 원하는 만큼 일할 수 있지만 고정 수입은 없다. 그 대신 언제든지 다른 플랫폼으로 옮겨 탈 수 있기 때문에 쿠팡 입장에선 배달원 수를 안정적으로 유지하기 힘든 한계가 있다.  ‘쿠팡이츠 친구’ 직고용을 두고 쿠팡이 10∼15분 내 배달하는 퀵커머스를 위해 수급이 불안정한 일반 라이더 대신 직접 고용을 택했다는 분석이 나온다. 쿠팡은 ‘로켓배송’ 도입 당시에도 업계 최초로 배달기사를 직고용해 서비스 속도와 질을 높였다. 유통업계 관계자는 “‘단건 배달’로 빠르게 시장 점유율을 늘린 쿠팡이츠 서비스처럼 쿠팡이츠 마트도 30∼60분이 소요되는 기존 B마트보다 압도적인 배달 속도를 내세우며 확장하려는 전략”이라고 말했다.  쿠팡이츠 마트의 물류센터(다크스토어) 위치는 서울 송파구 석촌동 인근으로 알려졌다. 송파구는 쿠팡 본사가 있는 데다, 국내 최대 규모 아파트 단지인 ‘헬리오시티’ 등 주거시설이 밀집해 있어 퀵커머스 테스트베드로는 최적지라는 평가를 받는다.  ‘퀵커머스’ 시장이 뜨거워지면서 다른 유통업체들도 퀵커머스 시장 경쟁력을 위해 배달 속도를 높이거나 배달 범위를 빠르게 늘리고 나섰다. GS리테일은 최근 배달 전용 주문 모바일 앱 ‘우딜(우리동네딜리버리)’을 통해 ‘49분 번개배달’ 서비스를 선보였다. GS수퍼마켓 인근 지역에 한해 49분 내 배달하는 서비스로 기존 ‘1시간 배송’을 11분 단축시킨 것이다. CJ올리브영은 2018년 말 선보인 화장품 3시간 내 배송서비스인 ‘오늘드림 빠름배송’의 평균 배송 시간을 올해 상반기 45분으로 줄였다. 롯데쇼핑은 롯데슈퍼가 지난해 11월 잠실점에서 시작한 ‘퇴근길 1시간 배송’ 서비스 대상 지역을 올해 초 서울 강북과 경기, 인천 일부 지역으로 확대했다. 퇴근길 1시간 배송 서비스는 오후 4∼8시에 주문하면 1시간 내 배송해주는 서비스로, 현재 23개까지 대상 점포가 늘어났다. 이강욱 보스턴컨설팅그룹 소비재유통부문 파트너는 “음식 배달로 촉발된 시장이 다양한 영역의 퀵커머스로 확장하고 있다”며 “물류 거점을 만들어 내는 것이 ‘속도전’에서 가장 중요한 요소”라고 말했다."
434,"‘마켓컬리·쿠팡로켓배송’ 나 떨고 있니… 메쉬코리아, 오아시스마켓과 합작법인 설립",2021.07.15,"‘주식회사 브이’ 출범하반기 내 차세대 퀵커머스 서비스 공개신선식품·각종 생활용품 실시간 배송신규 서비스 플랫폼 공동 운영메쉬코리아 ‘물류’·오아시스마켓 ‘새벽배송’ 시너지예비 유니콘 업체 JV 설립 첫 사례IT 기반 종합 유통물류 브랜드 ‘부릉(VROONG)’을 운영하는 메쉬코리아는 신선식품 새벽배송 전문 업체 오아시스마켓과 함께 합작법인(JV) ‘주식회사 브이’를 출범한다고 15일 밝혔다. 주식회사 브이는 새로운 퀵커머스 서비스 플랫폼을 론칭하고 운영하기 위해 설립됐다. 합작법인은 메쉬코리아와 오아시스마켓이 공동 운영하기로 했다.신규 법인의 서비스는 실시간 퀵커머스와 새벽배송을 결합한 새로운 B2C 플랫폼을 기반으로 하반기 내에 선보일 예정이라고 메쉬코리아 측은 전했다. 빅데이터와 인공지능(AI)를 기반으로 하는 실시간 유통물류 운영 능력과 전국 규모 온·오프라인 물류 인프라, 상품 소싱 경쟁력 등을 결합해 내년 200조 원 규모로 성장이 예상되는 이커머스 시장에서 존재감을 발휘한다는 방침이다. 합작법인은 유정범 메쉬코리아 대표와 김연준 오아시스마켓 대표가 각자 대표로 경영에 참여한다. 자본금은 총 50억 원 수준으로 지분율은 오아시스마켓이 50%+1주, 메쉬코리아가 50%-1주를 보유한다. 메쉬코리아에 따르면 새롭게 선보일 퀵커머스 플랫폼을 활용해 소비자는 실시간 식음료 주문 뿐 아니라 신선식품 마트 장보기와 의류 및 도서, 애견상품 등 일상생활에 필요한 다양한 상품을 빠르게 받아볼 수 있다. 메쉬코리아 관계자는 “두 회사가 추구하는 미래 비전이 정확히 부합해 이번 합작법인 설립을 결정했다”며 “폭발적으로 성장하는 이커머스 시장 내에서 퀵커머스와 새벽배송에 대한 수요가 집중적으로 높아지고 있는 가운데 메쉬코리아와 오아시스마켓이 보유한 IT 자산과 새벽배송 시장 운영 노하우가 시너지를 발휘할 것으로 기대한다”고 말했다. 국내에서 예비 유니콘기업으로 평가 받는 두 업체가 지분을 출자해 합작회사를 선보이는 사례는 이번이 최초다. 메쉬코리아는 전국 450개 규모 물류 인프라를 보유하고 있다. 최근에는 김포 풀필먼트센터(FC)를 확장해 오픈하고 도심형물류거점 마이크로풀필먼트센터(MFC)를 서울 강남과 송파에 마련했다. 카카오커머스, 위메프오 등과 협업해 실시간 배송 및 라이브커머스 등 다양한 퀵커머스 서비스를 선보였다. IT와 빅데이터 솔루션을 토대로 상품 주문부터 배송, 재고관리, 반품 등 전 과정을 통합 관리하는 체계를 갖췄고 이를 기반으로 네이버와 GS리테일, 현대자동차 등으로부터 대규모 투자를 이끌어내기도 했다.42개 오프라인 직영점을 운영 중인 오아시스는 지난 2011년 설립돼 국내 신선식품 새벽배송 시장에서 강자로 부상하고 있다. 필수 장보기 상품들은 국내 최저가를 지향하고 있고 소비자가 복수의 상품을 구매 시 한 박스에 담아 포장지에 사용되는 자원을 최소화하는데 많은 공을 들이고 있다. 환경을 생각하는 ‘착한기업’ 이미지로 소비자들에게 각인됐다는 평가다. 2018년 온라인 사업 진출 이후에도 이커머스 업계 유일한 흑자 기업으로 발돋움하고 있으며 최근 7500억 원의 기업가치를 인정받아 500억 원 규모 신규 투자 유치에 성공했다.유정범 메쉬코리아 대표는 “국내를 포함한 글로벌 이커머스 시장은 특정 기업 홀로 경쟁하고 생존할 수 없는 복잡한 구조로 빠르게 다변화되고 있다”며 “오랜 시간 이커머스 시장 공략을 위해 인프라 및 솔루션 구축, 상품 소싱 등 본질에 집중해 온 두 업체의 시너지는 퀵커머스 시장 주도권을 쥘 수 있는 충분한 경쟁력을 갖췄다고 확신한다”고 말했다. 김영준 오아시스마켓 대표는 “마트 장보기와 식음료 주문에 대한 실시간 배송은 물론 소비자 생활에 필요한 모든 상품을 보다 빠르게 제공할 수 있는 종합 퀵서비스 플랫폼으로 성장시킬 것”이라고 전했다."
435,부엌 밖으로 나온 공유주방… 상권분석에 창업지원까지,2021.07.06,"공유주방 업체 늘어 경쟁 치열해져… 임대만으론 우수 상점 유치 어려워실패 사업자 재기 컨설팅 나서고… 주문-배달 빅데이터 분석해 제공민간 공유주방 산업이 단순 공간 임대업을 넘어 외식 사업자를 키우는 플랫폼으로 진화하고 있다. 공유주방은 조리 공간과 설비를 여러 외식, 식품제조 사업자가 나눠 쓰는 개념으로 신종 코로나바이러스 감염증(코로나19)으로 인한 배달 문화 확산과 맞물려 빠르게 늘어났다. 경쟁이 치열해지면서 주문 시스템과 상권 분석을 제공하는 것뿐만 아니라 외식 사업자나 푸드 스타트업을 직접 육성하는 업체도 나타나고 있다. 국내 첫 공유주방 업체인 위쿡이 대표적이다. 위쿡의 공유주방을 거쳐 간 외식, 식품제조 사업자는 현재 입점해 있는 275개 사업자를 포함한 565개에 이른다. 이렇게 쌓인 노하우로 위쿡은 최근 단순 공유주방 서비스에서 나아가 외식 사업자 육성에 나섰다. 실패한 사업자의 재기를 컨설팅하는 ‘위쿡 리스타트’ 시제품 개발 단계의 사업자를 지원하는 ‘위쿡 드라이브’ 등을 운영하고 있다. 이는 2012년 공유주방 사업으로 시작했다가 액셀러레이터로 사업을 확장해 스타트업에 투자하고 있는 미국 ‘유니온키친’의 행보와 비슷하다. 위쿡 관계자는 “공유주방 설비는 물론이고 그동안 쌓인 요식업 데이터, 사내 식음료 전문가 등 다양한 자원을 동원해 외식업 창업을 지원하고 있다”고 말했다. 올해 들어선 대기업과 잇따라 손잡고 ‘푸드 스타트업’ 육성에 나섰다. GS리테일과 5개 푸드 스타트업을 선정해 12주간의 육성 과정을 거쳐 시장에 진출토록 하는 ‘넥스트 푸디콘(푸드+유니콘)’ 프로젝트를 진행했다. 또 롯데액셀러레이터와 푸드 스타트업 육성 프로젝트 ‘미래식단’도 진행하고 있다. 정보기술(IT)과의 결합을 내세우는 공유주방도 등장했다. 서울을 비롯한 수도권 8곳에 배달전문 공유주방을 운영하고 있는 고스트키친은 주문 접수 및 배차 시스템 ‘고스트TMS’를 제공해 각종 배달 앱을 통한 주문부터 배달까지 모든 과정을 자동화했다. 고스트키친은 전 지점의 데이터를 주기적으로 분석해 입점 사업자들에게 제공하기도 한다. 비교적 소규모로 점포 수를 빠르게 늘리고 있는 ‘공유주방1번가’도 매장 내 중앙관제센터에서 주문 및 배달 대행 접수, 한번에 여러 건의 배달 주문을 처리하는 시스템까지 자동화했다. 공유주방 업체 관계자는 “공유주방 점포가 우후죽순 늘어나면서 단순한 주방설비 임대만으로는 우수한 입점 사업자를 유치하기 쉽지 않다”고 말했다. 공식적인 집계는 없지만 국내 공유주방 점포 수는 약 200개, 주방 수로 보면 2000개에 이르는 것으로 추정된다. 바로고의 공유주방 점포 ‘도시주방 마포점’ 내 다이닝홀. 바로고 제공 배달, 유통 등에서 노하우를 갖춘 기업들도 공유주방 사업에 뛰어들고 있다. 근거리 물류전문 업체 바로고는 8월 서울 강남구에 ‘도시주방 역삼점’을 오픈한다고 5일 밝혔다. 지난해 10월 서울 마포구에 연 ‘도시주방 마포점’에 이은 두 번째 공유주방 점포다. 총 661m² 규모에 기존 주방 설비와 함께 다이닝홀, 별도의 픽업 공간 등을 갖출 예정이다. 바로고 관계자는 “바로고의 배달 노하우를 입점 상점에 직접 전수하고 상점 매출로 이어질 수 있도록 다양한 컨설팅을 지원할 것”이라고 말했다."
436,"GS25, ‘랍스터 급식’ 김민지씨와 협업… 이불돈까스 등 ‘고등급식’ 7종 판매",2021.06.09,"편의점 GS25가 ‘랍스터 급식’으로 화제가 됐던 영양사 김민지 씨(사진)와 협업해 ‘고등급식’을 판매한다고 8일 밝혔다.  김 씨는 고등학교 영양사로 근무하면서 랍스터, 장어, 캐비아 등 고급 식재료를 사용한 급식으로 화제를 모으며 교육부 장관 표창을 받았다. 이후 지난해 10월 GS그룹 본사의 영양사로 채용된 뒤 GS그룹 구내식당의 메뉴를 개발해 왔다. GS25를 운영하는 GS리테일 관계자는 “구내식당 메뉴가 만족도가 높아 이를 정식 상품으로도 개발하게 됐다”고 밝혔다. 고등급식 시리즈는 이달 3일 나온 이불돈까스도시락, 더블킹새우버거 2종을 비롯해 총 7종으로 판매된다. 고등급식이라는 이름에는 김 씨가 근무하던 ‘고등학교’의 의미는 물론이고 ‘급이 다른 식사’라는 뜻이 담긴 ‘고등(높은 수준)’도 중의적으로 표현하고 있다.사지원 기자 4g1@donga.com ▶ 네이버에서 [동아일보] 채널 구독하기▶ 당신의 소중한 순간을 신문으로 만들어 드립니다▶ 멀티미디어 스토리텔링 ‘The Original’ⓒ 동아일보 & donga.com, 무단 전재 및 재배포 금지"
437,"“배달 창구 늘려라”… 진화하는 편의점 배달, 자체 앱서도 주문 ‘OK’",2021.06.17,"이마트24, 자체앱-네이버서 서비스GS25, 배달 중개 플랫폼 개발배달음식 시장 17조… 잇따라 진출“매출증대 효과 커 경쟁 가속화”편의점 업계가 배달 서비스를 확대하고 나섰다. 신종 코로나바이러스 감염증(코로나19)으로 배달 시장이 급격히 커진 가운데 신성장동력을 찾기 위해 틈새시장 공략에 나선 것이다. 편의점 이마트24는 17일부터 이마트24 자체 앱과 ‘네이버 주문하기’ 코너를 통해 배달 서비스를 제공하겠다고 16일 밝혔다. 편의점 업계 최초로 자사의 모바일 앱을 이용해 배달 주문이 가능하도록 한 것이다. ○ ‘배달 창구 늘리기’ 경쟁원래 이마트24는 배달 중개 플랫폼인 요기요, 카카오톡 선물하기를 통해 1200개 매장에 배달 서비스를 운영해 왔다. 이마트24는 “배달 창구를 최대한 다양하게 해 고객 유입을 늘리려는 차원”이라면서 “자사 앱으로 배달 서비스를 개시하면 자체 할인 행사를 여는 등 더 많은 혜택을 제공할 수 있을 것으로 예상된다”고 설명했다.  이는 코로나19로 비대면 문화가 일상이 된 가운데 폭발적으로 성장한 배달 시장을 겨냥한 전략이다. 통계청에 따르면 지난해 치킨이나 피자 같은 배달 음식 서비스 거래액은 17조3828억 원으로 전년(9조7328억 원)보다 78.6% 늘었다. 이는 관련 통계가 작성된 이후 최대치로, 3년 새 536% 증가한 수치다.  최근 편의점 업계는 앞다퉈 배달 서비스를 강화하고 있다. 세븐일레븐은 지난해 2월부터 배달 서비스를 시작해 전국 4000여 개 점포에서 800여 종의 상품 배달 서비스를 운영하고 있다. 세븐일레븐 관계자는 “도시락, 디저트부터 치킨이나 핫도그까지 간단하게 끼니로 때우기 좋은 음식의 배달 수요가 많은 편”이라고 말했다. ○ 자체 배달 중개 플랫폼 만들기도 배달 시장의 성장성을 고려해 배달 중개 플랫폼을 자체적으로 만들기도 한다. 지난해 7월 GS25는 ‘우리동네 딜리버리’ 서비스를 시작했다. 소비자들이 요기요, 카카오톡 주문하기로 주문하면 배달원이 도보로 편의점에서 물건을 수령한 뒤 고객에게 배달하도록 중개해 주는 앱이다. 한 명의 배달원이 한 집에만 제품을 배달하는 ‘단건 배달’로 운영되며, 평균 배송 시간은 17분이다. GS25를 운영하는 GS리테일 관계자는 “향후 배달 서비스를 이용하는 소비자가 훨씬 더 늘어날 것에 대비해 자체 중개 플랫폼을 갖춰 놓은 것”이라며 “배송 시간이 짧아 소비자들의 만족도가 높다”고 설명했다. 편의점의 배달 매출은 꾸준히 늘고 있다. 이마트24에 따르면 4월 대비 5월의 배달 서비스 매출은 3배 이상으로 증가했다. 특히 추가 증정 상품 등 행사 상품을 구매하는 비율이 높았다. 세븐일레븐의 1∼15일 배달 이용건수도 전월 동기 대비 72.4% 늘었다. 편의점 업계 관계자는 “코로나19를 거치면서 배달은 라이프스타일의 하나로 굳어졌다”며 “새로운 시장을 개척하기 위해 배달 서비스를 확대하려는 편의점 업계의 경쟁이 계속될 것”이라고 말했다.사지원 기자 4g1@donga.com▷ [코로나 고별] 2화 ‘멀어진 아버지’▷ [코로나 고별] 1화 ‘사라진 어머니’▶ 네이버에서 [동아일보] 채널 구독하기ⓒ 동아일보 & donga.com, 무단 전재 및 재배포 금지"
438,"‘남성 차별·혐오 논란’ 무신사, 창업자 사퇴 후 공동 대표체제 가동",2021.06.04,"강정구·한문일 신임 공동대표 선임7월 1일 취임연이은 젠더 갈등에 창업자 조만호 대표 사퇴온라인 패션 플랫폼 무신사는 강정구 프로덕트부문장과 한문일 성장전략본부장을 신임 공동 대표이사로 선임했다고 4일 밝혔다. 지난 3일 조만호 대표가 무신사의 남성 차별·혐오 논란에 대한 책임을 통감해 사의를 표명한 데 이어 하루 만에 신임 대표가 정해졌다. 조만호 대표는 무신사 대표직을 내려놓으면서 이사회 의장 역할을 수행하겠다고 밝혔다. 무신사 스토어 운영에는 참여하지 않고 해외 사업을 포함한 회사의 중장기 전략 수립 국내 패션 브랜드 성장을 위한 지원 활동에 주력할 계획이라고 했다.이번에 공동대표에 선임된 강정구 프로덕트부문장은 지난 2017년 무신사에 합류해 스토어 개발과 기획, 디자인 조직 구성 등을 주도했다고 한다. 무신사스토어 사용 편의를 개선하고 커머스 중심 플랫폼 기술 고도화에 주력해온 것으로 알려졌다.한문일 공동대표는 지난 2018년 무신사에 입사해 무신사테라스와 무신사스튜디오, 솔드아웃 등 신규 사업 분야를 이끄는 역할을 수행했다. 외부 투자 유치와 기업 인수 등 업무도 맡은 것으로 전해졌다.무산사는 이번 신임 공동 대표이사 체제를 통해 사업 전략과 프로덕트 부문 전문성을 강화하고 경쟁력을 높여나갈 것으로 기대하고 있다. 무신사스토어 입점 브랜드를 위한 지원 시스템과 인프라 강화에도 적극적으로 나선다는 방침이다.신임 공동대표는 다음 달 1일 공식 취임 예정이다.남성 혐오 논란을 야기한 무신사 이벤트 이미지한편 무신사는 지난 3일 사임한 조만호 대표가 창업해 국내 최대 규모 온라인 패션 플랫폼으로 성장한 업체다. 조 대표가 사의를 표명한 이유는 무신사스토어에서 남성 소비자에 대한 차별과 남성 혐오 논란이 불거졌기 때문이다. 남성 차별의 경우 무신사는 지난 3월 여성 소비자에게만 할인쿠폰을 지급해 소비자들로부터 항의를 받았다. 당시 여성 소비자에게만 지급된 쿠폰은 여성용 제품 구매 시에만 사용할 수 있다고 해명했지만 실제로 남성 제품을 구매할 때도 사용할 수 있는 것이 확인돼 조 대표가 사과문을 올렸다. 당시 이에 대한 항의 의견을 게시한 소비자에게 불이익을 주면서 논란이 가중되기도 했다. 특히 소비자들은 남성 소비자를 기반으로 성장한 무신사가 남성을 차별했다는 점을 강도 높게 비판했다. 해당 사안에 대해 무신사는 최종적으로 시스템 오류 때문에 발생한 일이라고 결론지었다. 이후 무신사스토어 회원 모두에게 매월 20% 할인쿠폰을 지급하고 있다. 최근에는 이벤트 이미지에 들어간 손가락 모양이 ‘남성 혐오(남혐)’를 표시했다는 주장이 나오면서 남혐 논란까지 번졌다. GS리테일 편의점 GS25의 행사 포스터 이미지 논란과 비슷한 맥락이다. 무신사 측은 해당 이미지는 모두 삭제한 상태라고 전했지만 이미지 제작 이유와 담당 부서 등 관련 내용과 후속 조치에 대한 입장 발표와 설명은 없었다.  동아닷컴 김민범 기자 mbkim@donga.com▶ 네이버에서 [동아일보] 채널 구독하기▶ 당신의 소중한 순간을 신문으로 만들어 드립니다▶ 멀티미디어 스토리텔링 ‘The Original’ⓒ 동아일보 & donga.com, 무단 전재 및 재배포 금지"
