,title,date,content
418,이재용 부회장 구속에 삼성 주가 ‘들썩’…오늘은 오를까,2021.01.19,"국정농단 공모 혐의로 구속된 이재용 삼성전자 부회장 구속 소식에 삼성그룹 주가가 들썩이고 있다.19일 한국거래소에 따르면 전날(18일) 대장주 삼성전자 주가는 전일 대비 3000원(3.41)% 떨어진 8만5000원에 마감됐다. 삼성물산은 1만500원(6.84%) 하락한 14만3000원, 삼성SDI는 3만1000원(4.21%) 내린 70만6000원, 삼성생명은 4100원(4.96%) 떨어진 7만8500원, 삼성전기는 4000원(1.99%) 내린 19만7500원 등을 보였다.이와 함께 삼성중공업(-2.74%) 삼성증권(-2.29%) 삼성엔지니어링(-3.65%) 삼성화재(-2.42%) 등도 일제히 하락세를 보였다.그동안 삼성그룹주는 이 부회장이 뇌물공여 등의 혐의로 지난 2017년 2월 재판에 넘겨진 뒤 재판 결과에 따라 들썩여 왔다. 대법원이 서울고법에 파기환송을 결정한 2019년 8월 29일 삼성전자 주가는 전일 대비 1.70% 하락했다. 반면 서울고법이 이 부회장에게 징역 2년6개월에 집행유예 4년을 선고한 2018년 2월 5일 삼성전자 주가는 0.46% 상승했다.국정농단 사건으로 재판에 넘겨진 이재용 삼성전자 부회장이 18일 서울 서초구 서울고등법원에서 열린 국정농단 사건 파기환송심 선고 공판에 출석하고 있다. 윤성호 기자증권가에서는 단기적으로는 이번 일이 삼성전자 주가에 대한 조정의 빌미가 될 수 있다고 지적했다. 하지만 실적 호전이 이어지고 있기 때문에 장기 상승 추세는 이어질 것이란 전망이 더 우세하다. 또 중장기적으로는 반도체 업황이 좋은 만큼 삼성전자의 실적에는 큰 이변이 없을 것으로 봤다.최유준 신한금융투자 연구원은 뉴시스에 “지난 2017년 8월 이 부회장 1심 실형 선고 후 삼성그룹 주가는 부진한 흐름을 보였으나 영향은 단기에 그쳤다”며 “당시 삼성전자는 8거래일 만에 주가를 회복했는데 이를 보면 오너 부재로 경영 의사결정에 대한 일부 불확실성은 있을 수 있으나 과거 사례로 볼 때 주가는 본업 가치를 따라갔다고 판단한다”고 분석했다.최 연구원은 현재 주가 레벨이 과거 대비 높아 변동성이 더 커질 가능성은 있으나 영향력은 점차 경감될 것으로 전망했다.다만 증권업계 일각에서는 이 부회장의 구속으로 인해 지배구조 재편 논의 등이 지연될 수 있다며 이로 인한 변수들을 고려해 투자에 유의할 것을 조언했다.정동익 KB증권 연구원은 “이 부회장의 법정 구속으로 상속세 납부 및 기업 지배구조 개편을 위한 분할, 합병, 매각 등 인위적인 지배구조 재편 논의는 당분간 표면화되기 어려울 것으로 보인다”며 “따라서 주식시장 상황과 기업의 펀더멘털에 근거한 투자 판단이 필요할 것으로 보인다”고 내다봤다.박세환 기자 foryou@kmib.co.kr▶ 네이버에서 국민일보를 구독하세요(클릭)▶ 국민일보 홈페이지 바로가기GoodNews paper ⓒ 국민일보(www.kmib.co.kr), 무단전재 및 수집, 재배포금지"
419,"‘실효성 없다’는 삼성 준법감시위, 내년 이후에도 지속될까",2021.01.19,"이재용 삼성전자 부회장이 구속되면서 삼성준법감시위원회의 지속 가능성에 관심이 쏠린다. 재판부는 준법감시위가 실질적 역할을 수행하지 못하고 있다고 판단했다. 그럼에도 재계는 준법감시위가 유지될 것으로 전망했다.준법감시위는 지난해 2월 5일 김지형 위원장을 선임해 공식 출범했다. 이후 삼성전자, 삼성물산, 삼성SDI, 삼성전기, 삼성SDS, 삼성생명보험, 삼성화재해상보험 등 7개 계열사의 준법 의무 위반 여부를 판단해 개선사항을 권고 중이다.이 부회장은 지난해 5월 준법감시위의 권고에 따라 무노조 경영 폐지, 세습 경영 중단 등의 ‘뉴삼성’을 선언하며 준법감시위 지속을 약속했다.그러나 재판부는 지난 18일 이 부회장에 실형을 선고하며 준법감시위가 실효성이 없다는 결론을 내놨다. 일상적인 준법 감시 활동은 가능하지만 미래에 발생 가능한 위법 사항을 선제적으로 예방하거나 감시하기 어렵다는 이유에서다.준법감시위는 선고와 무관하게 기존의 역할을 수행하겠다는 입장이다. 보스톤컨설팅그룹(BCG)에 사업지원 TF(전담 조직)의 역할 재정립 등 지배구조 관련 연구 용역을 맡긴 데 이어 법적 위험 유형화 관련 연구 용역도 의뢰할 예정이다.이달 21일 정기회의와 26일 7개 계열사 대표이사(CEO) 면담도 예정대로 진행한다. 준법감시위 관계자는 19일 “전문심리위원들이 지적했던 부분들에 대해 준법위원들도 인지하고 있다”며 “기존에 부여받은 역할을 충실히 해나가겠다”고 말했다.출범과 함께 위촉된 준법위원들의 임기는 2년으로 내년 2월 마무리된다. 준법감시위는 이후에도 역할을 수행할 것이라는 게 재계 관측이다. 이 부회장도 지난해 10월과 지난 11일 준법감시위와 가진 두 차례 면담에서 준법감시위의 지속적·독립적 활동을 보장하겠다고 강조했다.재계 관계자는 “이 부회장의 양형에 준법감시위가 역할을 하지 못했다는 이유로 준법감시위를 해체하면 사법부에 반발하는 것으로 보일 우려가 있다”며 “추후 이어질 재판과 가석방 가능성 등을 고려하면 준법위는 유지될 것으로 본다”고 말했다.권민지 기자 10000g@kmib.co.kr▶ 네이버에서 국민일보를 구독하세요(클릭)▶ 국민일보 홈페이지 바로가기GoodNews paper ⓒ 국민일보(www.kmib.co.kr), 무단전재 및 수집, 재배포금지"
420,삼성준법감시위 만난 이재용 “독립적인 활동 보장할 것”,2021.01.12,"새해 첫 면담서 밝혀… 만남 정례화도 약속이재용(사진) 삼성전자 부회장이 11일 삼성준법감시위원회와 새해 첫 만남을 가졌다. 지난해 10월 첫 만남에 이은 두 번째 만남이다.삼성준법감시위원회는 이날 오전 9시30분 이 부회장과 준법위원 전원이 참석한 가운데 1시간15분간 면담을 했다고 밝혔다.준법위는 면담에서 삼성의 준법 문화 정착을 위한 이 부회장의 역할에 대한 의견을 전달했다. 이 부회장은 향후 준법위의 독립적인 활동을 보장할 것을 약속했다. 이 부회장은 지난달 30일 결심공판 최후진술에서도 “준감위가 본연의 역할을 하는 데 부족함이 없도록 충분히 지원하겠다”고 했다.준법위는 이 부회장과의 면담을 정례화하기로 했다. 다만 추후 면담 일정은 구체화하지 않았다.준법위는 면담 이후 열린 임시회의에서 ‘최고 경영진의 준법위반 리스크 유형화 및 이에 대한 평가지표, 점검항목 설정’에 관해 외부 연구용역을 발주하기로 했다. 전문심리위원 평가에 따라 준법위 차원의 개선안을 마련하겠다는 취지다.준법위에 따르면 삼성전자, 삼성SDI, 삼성SDS, 삼성전기, 삼성물산 등은 올해부터 주주총회를 온라인으로 병행해 개최한다. 삼성생명과 삼성화재는 내년부터 온라인으로 실시하는 방안을 검토 중이다. 이는 준법위가 삼성전자와 6개 관계사에 주주총회 온라인 병행 개최 및 전자투표제 도입을 권고한 것에 따른 영향이다.준법위는 지난 17일 임시회의에서 주주와의 열린 소통과 코로나19 사태로 인한 주주총회 참여 제약을 최소화하기 위해 주주총회 온라인 개최를 권고했다.권민지 기자 10000g@kmib.co.kr▶ 네이버에서 국민일보를 구독하세요(클릭)▶ 국민일보 홈페이지 바로가기GoodNews paper ⓒ 국민일보(www.kmib.co.kr), 무단전재 및 수집, 재배포금지"
421,KT 먹통에 국제 바둑대회도 중단… 한국기원 ‘진땀’,2021.10.25,"삼성화재배 월드바둑마스터스 8강전 중단온라인으로 해외를 연결한 국제기전이 KT 통신망 ‘먹통 사태’로 중단됐다. 한국기원은 중국기원에 양해를 구하고 대국을 1시간을 지연했지만 인터넷 접속 장애로 원활하게 진행되지 않자 결국 순연 개최를 결정했다.한국기원은 25일 서울 성동구 한국기원과 베이징 중국기원을 온라인으로 연결해 개최한 2021 삼성화재배 월드바둑마스터스 본선 8강전 첫날 대국을 인터넷 접속 장애에 따라 중단했다. 이날 정오로 예정된 이창석 8단과 양딩신(중국) 9단, 신진서 9단과 한승주 8단의 대국은 26일로 연기됐다. 이동훈 9단과 자오천위(중국) 8단, 박정환 9단과 롄샤오(중국) 9단의 대국도 26일에 예정돼 있다.한국기원은 오전 11시20분쯤 인터넷 접속 장애를 인지하고 중국기원에 전화를 걸어 양해를 구한 뒤 오후 1시부터 8강전을 재개했다. 하지만 대국 초반 인터넷 접속은 원활하게 이뤄지지 않았고, 40여분 만에 두 대국이 중단됐다. 중단된 대국은 이어지지 않고 새롭게 시작된다.한국기원을 포함한 바둑계는 코로나19 대유행에 따라 각국을 온라인으로 연결해 대회를 개최하고 있다. 이제 국제기전에도 온라인망이 활용된다.온라인 국제기전에선 크고 작은 사고가 빈번하다. 지난해 8월 농심신라면배 세계바둑최강전에선 판팅위(중국) 9단을 상대한 박정환 9단의 마우스 클릭 착점을 인식하지 못한 시스템 ‘먹통’으로 시간패가 선언돼 국내외 바둑팬들의 원성을 샀다."
422,"[사설] KT 시스템 먹통, 철저히 따지고 책임 물어라",2021.10.26,"어제 오전 11시를 전후해 KT의 유무선 인터넷 서비스가 전국적으로 1시간가량 먹통이 됐다. 음식점 결제부터 인터넷 검색, 온라인 주식 거래,  배달플랫폼, 병의원 진료 시스템 등이 마비됐다. 더불어민주당 대선 후보 이재명 경기지사의 지사직 사퇴 기자간담회도 일시 중단됐고 온라인으로 열린 삼성화재배 월드바둑마스터스 8강전도 연기됐다. 단순한 서비스 장애를 넘어 국민의 일상이 멈춘 것이다. 점심 시간을 맞아 많은 음식점들이 “현금이나 계좌이체로 결제해 달라”며 내건 안내문은 마치 우리 사회가 20년 전으로 돌아간 듯한 느낌을 갖게 했다.무엇보다 국가 기간통신사업자인 KT의 안이한 시스템 관리 문제는 철저히 짚고 가야 한다. KT는 사고와 관련, “라우팅(네트워크 경로 설정) 오류를 원인으로 파악했다”고 밝혔다. KT는 2018년 11월 서울 KT 아현지사 화재로 서대문구, 마포구, 용산구 지역의 통신이 마비된 일을 겪었다. 3년이 지났음에도 똑같은 내부 관리 소홀로 인해 전국적 규모의 시스템 차질을 초래한 것은 KT가 과거 대란에서 교훈을 전혀 못 얻었음을 보여줬다. 더욱이 KT는 사고 초기 “대규모 디도스(분산서비스 거부) 공격이 발생한 것으로 파악된다”며 마치 외부 소행인 양 책임회피성 발표를 해 빈축을 샀다. 국민과의 소통에도 실패한 것이다. KT는 자영업자 등 국민들이 입은 유무형 피해에 대해 보상을 해줘야 함은 물론 책임 소재를 철저히 물어 두 번 다시 이런 일이 발생하지 않도록 해야 한다.이번 사태는 네트워크가 모든 걸 이어주는 초연결사회에서 통신 장애가 얼마나 큰 재난이 될 수 있는지를 보여줬다. 남북이 분단된 현실에서 인터넷 시스템의 오류는 안보 문제와 직결될 수도 있다. 단순히 통신사 내부 실수로 일단락돼서는 안 되는 이유다. 민관 합동으로 통신망 및 전산망 관리 실태 조사도 필요하다."
423,“화장한 적 없다” 참다참다 폭발한 남자배구 선수,2021.08.19,"남자프로배구팀 삼성화재 블루팡스의 김인혁이 “눈화장을 하고 경기에 뛴다”는 식의 억측성 악플에 큰 고통을 호소했다.김인혁은 18일 인스타그램에 자신이 그간 받은 화장과 관련한 댓글 일부를 공개했다. 그러면서 “십 년 넘게 수년 간 들었던 오해들, 무시가 답이라 생각했는데 저도 지친다”며 “저를 옆에서 본 것도 아니고 저에 대해서 아무것도 모르시면서 수 년 동안 절 괴롭혀온 악플, 이제 그만해달라. 버티기 힘들다, 이젠”이라고 괴로워했다.그가 공개한 댓글에는 화장을 지적하는 내용이 주를 이뤘다. 한 네티즌은 “화장 좀(하지마라)”고 적었고 또 다른 네티즌은 “왜 화장을 하냐. 많이 부담스럽다”고 했다.김인혁은 “화장 한 번도 한 적 없다. 남자 안 좋아한다. 여자 친구도 있었다. 공개만 안했지”라고 설명했다. 성인물에 출연한 적도 없다는 말도 했다.그는 특히 많은 이들이 눈화장을 강력한게 의심한 것을 두고 “마스카라 안 했다. 눈 화장도 안 했다. 스킨, 로션만 발랐다. 이것도 화장이라면 인정하겠다”고 썼다.그는 경기 때마다 경기력 외 외모에 대해 언급하는 악플과 쪽지가 이어진다며 “진짜 버티기 힘들다. 변명할 필요없다고 생각했지만, 이젠 그만해달라”고 간절히 부탁했다."
424,[포토] 차-킥보드 사고 3년만에 8배 급증,2021.07.04,삼성화재는 4일 지난해 전동킥보드와 차량 간 충돌 사고가 1447건 접수됐으며 이는 2017년 대비 8배 가량 늘어난 것이라고 밝혔다. 삼성화재는 사고 영상을 분석한 결과 전동킥보드 이용자의 교통법규 미준수에 따른 사고가 많았다고 설명했다. 사진은 이날 서울 서대문구 신촌역 인근에 세워져 있는 대여용 전동킥보드.연합뉴스
425,"前 프로배구 박상하, ‘14시간 감금 폭행’ 누명 벗어",2021.04.20,"피해 주장했던 김모씨 “박상하와 일면식도 없었다”유명인 이용한 거짓 폭로로 밝혀져지난 2월 학교 폭력(학폭) 의혹을 인정하고 은퇴를 선언한 프로배구 센터 박상하(35·전 삼성화재)에 대한 ‘14시간 감금·폭행’ 의혹이 풀렸다.법률사무소 대환은 20일 당시 박상하의 학폭 피해자라고 주장한 김모 씨가 지난 12일 ‘본인이 유포한 학폭 의혹이 모두 거짓이었다’고 자백했다고 밝혔다.대환은 “조사 결과 김씨는 중학교 시절 박상하와 일면식도 없는 사이였고, 자신이 중학교 시절 당한 학폭 피해를 이슈화하기 위해 유명인인 박상하의 이름을 언급한 것일 뿐, 박상하에게는 폭력을 당한 사실이 없다”고 전했다.이어 대환은 김씨가 자신의 주장이 허위였다는 내용의 사실 확인서를 제출했으며, 박상하에 대한 사과의 말을 육성으로 녹음해 남겼다고 밝혔다.지난 2월 체육계·연예계 학폭이 불거지자 인터넷 익명 게시판에는 현역 프로배구 선수인 박상하가 학폭 가해자라는 주장이 올라왔다. 해당 글 작성자는 박상하가 피해자를 감금하고 14시간 동안 집단 폭행했다는 내용도 언급해 충격을 줬다.당시 박상하는 학교폭력 의혹을 인정하고 소속팀이던 삼성화재를 통해 “상처를 받은 분들께 죄송하다. 진심으로 사과한다”며 은퇴를 선언했다. 그러나 박상하는 동창생 납치 및 감금, 14시간 집단 폭행에 대해서는 “사실이 아니다”라고 강하게 주장하며 글을 올린 김씨를 형사 고소했다.박상하 은퇴의 결정타로 작용했던 인터넷 게시물이 허위로 밝혀지면서 그의 선수 복귀 여부에 관심이 쏠리고 있다. 삼성화재가 은퇴 처리하면서 박상하는 자유 신분 선수가 된 상황이다. 영입을 타진하는 구단이면 어디든지 자유롭게 협상할 수 있다. 일각에선 14시간 감금 의혹은 해소됐으나 박상하 스스로 중·고교 시절 폭력 행사 사실을 인정했던 만큼 복귀까지의 과정이 쉽진 않으리란 관측도 나온다.노유림 인턴기자▶ 네이버에서 국민일보를 구독하세요(클릭)▶ 국민일보 홈페이지 바로가기GoodNews paper ⓒ 국민일보(www.kmib.co.kr), 무단전재 및 수집, 재배포금지"
426,용인시 ‘시각장애인 안내견 환영’ 캠페인…왜?,2021.04.19,"경기도 용인시가 시각장애인 안내견에 대한 인식개선을 위해 대대적인 캠페인에 나선다.캠페인은 지난달 용인시 관내 한 음식점에서 시각장애인 안내견의 출입을 거부한 사례 발생이 직접인 계기로 안내견에 대한 인식을 개선하는 차원이라는 것이 용인시의 설명이다.시각장애인 안내견은 현행법에 따라 대중교통수단은 물론 공공장소, 식당 및 숙박시설 등에서 정당한 사유 없이 거부할 수 없지만 여전히 이 같은 사실을 잘 알지 못하거나 안내견에 대한 인식 부족으로 출입을 거부하는 상황이 발생하고 있기 때문이다.용인시는 오는 12월까지 (사)한국외식업중앙회 용인시지부, 대중교통 업체, 대형마트, 처인·기흥·수지 3개구 장애인복지관 등과 협력해 ‘장애의 선을 넘는 용인’ 캠페인을 진행한다고 19일 밝혔다.시는 ‘시각장애인 안내견을 환영합니다’라고 적힌 스티커를 식당, 숙박시설, 대중교통업체에 배부하고 안내견에 대한 설명과 에티켓 등이 담긴 포스터를 대형마트, 아파트 게시판 등에 게시할 계획이다.안내견에 대해 설명하는 동영상도 만들어 사회관계망서비스(SNS)와 광고판 등에 송출한다.또 리플릿을 제작해 각 구청에서 연 2회 일반음식점을 대상으로 실시하고 있는 위생교육 시 안내견 인식개선 교육을 병행할 예정이다.시는 캠페인을 통해 시각장애인의 생활권을 보장하고 안내견에 대한 비장애인의 인식개선을 도모할 방침이라며 ‘삼성화재안내견학교’와 협업해 기획했다고 말했다. 시는 본격적인 캠페인 진행에 앞서 이날 용인시청에서 백군기 시장과 박태진 삼성화재안내견학교 교장 등 관계자들이 참석한 가운데 간담회를 열었다.박태진 교장은 “용인시에서 안내견의 양성과 활동에 관심을 갖고 적극 지원해주셔서 감사드린다”며 “이번 캠페인이 좋은 본보기가 돼 다른 지자체에도 널리 확산하는 계기가 됐으면 좋겠다”고 말했다.백군기 시장은 “장애인 보조견은 장애인들이 스스로 독립된 삶을 살아갈 수 있도록 도와주는 고마운 동반자로 우리 모두 함께 관심을 가지고 따뜻이 맞이해야 한다”면서 “용인시는 보조견을 환영한다. 모든 장애인분들이 편안한 일상을 누릴 수 있도록 다양한 정책을 발굴해 추진해 나가겠다”고 밝혔다.한편 시각장애인 안내견은 체계적인 훈련을 거친 후 시각장애인의 보행을 돕는 역할을 하고 있다.‘시각장애인 안내견’이라고 쓰인 노란 조끼를 착용하고 안내견 인식 목줄을 두르고 있다.시각장애인 안내견 훈련은 삼성화재안내견학교에서 맡고 있으며, 전국 65마리의 안내견 중 총 3마리가 용인시에서 활동하고 있다.용인=강희청 기자 kanghc@kmib.co.kr▶ 네이버에서 국민일보를 구독하세요(클릭)▶ 국민일보 홈페이지 바로가기GoodNews paper ⓒ 국민일보(www.kmib.co.kr), 무단전재 및 수집, 재배포금지"
