,title,date,content
266,10월 15일 궂긴 소식,2020.10.14,"◆ 정순애씨 별세: 허옥희(전주시의원)씨 시모=14일 오전 7시 전주 효자장례타운. 발인 16일 오전 9시. (063)228-4441.◆ 김세준씨 별세: 김정심씨 남편, 지숙 지선(한국형사정책연구원 선임연구위원) 지영(서경운수 이사) 영화(한국일보 논설위원)씨 부친, 김규형(삼성화재 전무) 김혁(SKB 미디어전략본부장)씨 장인, 류소영(구암고 교사)씨 시부=13일 오후 7시8분 서울성모병원. 발인 16일 오전 7시. (02)2258-5940. ◆ 장재영씨 별세: 철영(한준호 국회의원실 보좌관)씨 형=14일 오전 8시 연세대세브란스병원. 발인 16일 오후 2시. (02)2227-7500. ◆ 김무란씨 별세: 황보승희(국민의힘 국회의원)씨 조모=13일 오전 8시40분 포항제일장례식장. 발인 15일 오전 9시. (054)293-1161.◆ 윤규복씨 별세: 승로 승연(국립현대미술관 홍보고객과 홍보관) 승하씨 부친=14일 오전 5시35분 고대구로병원. 발인 16일 오전 7시. (070)7606-4197.▶더불어 행복한 세상을 만드는 언론, 한겨레 구독하세요!▶네이버 채널 한겨레21 구독▶2005년 이전 <한겨레> 기사 보기[ⓒ한겨레신문 : 무단전재 및 재배포 금지]"
267,[유레카] 이재용과 버핏의 비밀회동 의미 / 곽정수,2020.09.21,"“피고인 이재용은 2015년 7월11일 미국에서 워런 버핏을 직접 만나 (삼성생명 지주회사가 보유한 사업자회사 지분의) 매각 방안을 논의하고 …” 삼성물산-제일모직 불법 합병 사건의 공소장 중 일부다. 베일에 가려져 온 삼성 경영권 승계 비밀작전의 마지막 퍼즐이 풀리는 순간이다. 삼성 승계 논란은 이건희 회장이 1994년 아들에게 61억원을 증여한 것을 시작으로 30년 가까이 이어졌다. 그 과정은 매우 복잡하지만, 핵심은 하나다. “이재용이 그룹의 핵심인 삼성전자를 확실히 지배할 수 있는 방법 찾기.” 이 부회장의 전자 지분은 0.7%에 그친다.삼성의 해법은 이재용→삼성물산→생명→전자로 이어지는 소유지배구조 구축이었다. 1996년 이 부회장이 에버랜드 전환사채를 헐값에 인수해 지분 31%를 확보하고, 직후 에버랜드가 생명 지분 19%를 인수했다. 제일모직(에버랜드와 합병)이 2015년 물산과 합친 것도 물산이 가진 전자 지분 5% 때문이었다.그러나 삼성생명이 가진 전자 지분(8.8%)의 처리는 계속 수수께끼였다. 생명이 고객 돈으로 산 전자 주식으로 이 부회장의 지배력을 뒷받침하는 것은 ‘금산분리’ 원칙에 어긋나, 이재용 체제의 아킬레스건으로 꼽혀왔다. 2017년 3월 뇌물공여사건 수사 결과에 궁금증을 풀어줄 중요한 단서가 등장했다. “삼성생명이 금융지주사로 전환될 수 있도록 도와달라.” 이 부회장은 2016년 2월15일 박근혜 전 대통령을 만나 부탁했다. 삼성생명의 금융지주사 전환은 ‘삼성 봐주기’ 논란을 우려한 금융위원회의 반대로 무산됐다. 하지만 삼성이 (생명이 보유한) 전자 주식의 처리에 착수했음이 처음으로 드러나 큰 관심을 모았는데, 구체적인 내용은 여전히 베일 속에 있었다. 이 부회장은 버핏과 은밀히 만나 그 방안을 협의했다. 삼성생명을 지주회사(삼성화재 등 금융계열사 주식 보유)와 사업자회사(전자 주식 보유)로 나눈 뒤, 지주회사가 가진 자회사 지분을 버핏에게 팔되, 자회사가 전자 주식을 7~10년 보유하며 의결권을 우호적으로 행사하는 내용이었다. 삼성은 “검토단계였다”고 해명했다. 하지만 이 부회장이 직접 버핏과 협상했고, 금융위에 금융지주사 전환을 요청한 것은 계획이 추진됐음을 보여준다. 또 삼성은 “지엽말단적인 일”이라고 의미를 축소했다. 그러나 이 부회장이 불법 합병 등과 관련해 직접 보고받거나 지시한 적이 없다는 주장은 설득력을 잃게 됐다. 곽정수 논설위원 jskwak@hani.co.kr▶더불어 행복한 세상을 만드는 언론, 한겨레 구독하세요!▶네이버 채널 한겨레21 구독▶2005년 이전 <한겨레> 기사 보기[ⓒ한겨레신문 : 무단전재 및 재배포 금지]"
268,"카카오 자회사들, 금융권 공략 위해 자금확보 나서",2020.09.28,"카카오페이, 내년초 기업공개 “외부자금 조달로 새 성장동력 확보”카카오뱅크도 내년 상장 추진카카오 자회사 카카오페이가 최근 ‘공모주 청약’ 열풍을 일으킨 카카오게임즈에 이어 내년 초 기업공개(IPO)에 나선다. 모바일금융서비스 카카오페이는 28일 “기업공개를 위해 케이비(KB)증권을 대표상장주관사로 선정하고 금융감독원에 감사인 지정 신청을 끝냈다”고 밝혔다. 카카오페이 관계자는 “보험과 증권 등 새로운 사업에 쓸 자금을 마련하기 위해 상장을 준비하고 있다. 외부 자금을 조달해 새로운 성장동력을 확보할 계획”이라고 설명했다. 카카오페이가 기업공개를 결정한 것은 코로나19로 인해 모바일 결제 등이 보다 보편화되면서 신사업을 확장하기에 좋은 기회가 온 것으로 판단했기 때문으로 보인다. 카카오페이 가입자는 지난해 2분기 3000만명에서 올해 2분기 3400만명으로 꾸준히 증가했다. 간편결제와 간편송금이 장점인 카카오페이는 올 초 카카오페이증권을 출범시키는 등 사업영역도 확장했다. 카카오페이증권은 이달 초 200만 계좌를 돌파했다. 카카오페이는 올 상반기 삼성화재와 제휴해 디지털 보험사를 만들려는 계획은 철회했지만, 독자적으로 디지털보험 사업도 할 계획이다. 자금유치의 필요성도 커졌다. 카카오페이의 적자규모는 아직 크다. 영업이익은 2017년 273억원 적자, 2018년 965억원 적자, 2019년 653억원 적자를 기록했다. 무료송금을 마케팅 무기로 삼아 이용자를 끌어모으는 데 성공했지만, 무료(2019년부터 월 10회 초과분 유료)로 제공하는 송금서비스의 비용부담이 그만큼 컸기 때문이다. 카카오페이는 지난 7월 대주주인 카카오(56.1%)와 앤트파이낸셜(43.9%)로부터 콜옵션 행사를 따른 유상증자를 통해 1600억원의 자금을 확보하기도 했다. 인터넷 전문은행 카카오뱅크도 지난 23일 이사회를 열어 내년께 상장을 목표로 기업공개 추진을 결의했다. 카카오뱅크는 “자본확충 수단을 확보하기 위한 차원”이라고 설명했다. 아이티(IT)기업 카카오가 만든 핀테크 자회사들이 금융권 공략을 적극적으로 자금확보에 나서는 모양새다. 성종화 이베스트증권 연구원은 “카카오의 신사업은 페이와 모빌리티가 고성장을 주도하고 있고, 카카오뱅크의 실적도 가파르게 개선되고 있다”고 말했다. 이완 기자 wani@hani.co.kr▶더불어 행복한 세상을 만드는 언론, 한겨레 구독하세요!▶네이버 채널 한겨레21 구독▶2005년 이전 <한겨레> 기사 보기[ⓒ한겨레신문 : 무단전재 및 재배포 금지]"
269,"토스, 보험 플랫폼으로 ‘한발’…IT 진격에 보험업계 긴장",2020.08.14,"핀테크업체인 토스가 보험 서비스를 아우를 수 있는 플랫폼을 만들었다. 네이버와 카카오가 보험 서비스 진입을 모색하는 등 아이티(IT)업체들이 기존 금융 시장인 보험을 공략하는 속도가 가팔라지고 있다. 모바일금융서비스 토스를 운영하는 비바리퍼블리카는 14일 보험설계사 영업지원 전용 어플리케이션(앱)인 ‘토스보험파트너’와 토스 사용자들이 보험 설계사를 선택할 수 있는 ‘나만의 보험 전문가’ 서비스를 시작했다고 밝혔다. 이를 통해 토스 사용자가 ‘토스보험파트너’에 가입한 보험설계사와 연결돼 상담할 수 있는 방식이다. 예를 들어 토스 사용자는 앱에서 보험진단 또는 보험료 청구 상담 등 필요한 서비스를 고른 뒤 토스가 추천한 보험설계사의 경력과 자기소개 등을 확인하고 상담 설계사를 선택할 수 있다. 사용자가 상담 뒤 후기를 남길 수 있게 해, 좋은 서비스를 제공한 설계사가 더 많은 선택을 받을 수 있게 할 예정이다. 주목할 점은 토스보험파트너가 손해보험 및 생명보험 협회에 등록한 40만여명의 설계사 모두를 가입대상으로 하고 있다는 것이다. 보험사에 소속된 설계사나 여러 보험을 비교해 팔 수 있는 법인보험대리점(GA) 설계사 모두 가입시키겠다는 것이다. 이에 따라 토스 사용자는 마치 택시 앱을 통해 개인택시든 법인택시든 가리지 않고 부를 수 있는 것처럼 구별 없이 상담을 받는게 가능하다. 토스 관계자는 “소비자들은 보험 상담을 받으려면 인적사항이나 보험 정보를 사진으로 찍어서 보내야 하는 등 개인정보 보호가 불투명한 부분이 있었고, 설계사들 역시 비싼 값에 소비자 정보를 사오다보니 무리한 영업을 하는 경우가 있었다”고 전했다. 토스는 설계사나 소비자에게 무료로 서비스를 제공하겠다고 했다. 기존 보험사들은 막강한 온라인 소비자 접근성을 가진 토스의 진출을 우려 섞인 눈으로 보고 있다. 한 보험사 관계자는 “보험설계사들이 토스보험파트너에 가입하기 위해서는 고객 2명의 정보를 입력해야하는데, 토스가 손쉽게 가입자정보를 얻으려하고 있다”고 지적했다. 또 토스가 어떤 방식으로 설계사를 추천하는지 알고리즘에 대한 공개도 필요하다는 시각이 있다. 또다른 보험사 관계자는 “아이티업체들이 들어와 보험사들은 ‘브랜드 없는 상품 공급자’로만 전락할 수 있다는 걱정이 있다”고 했다. 토스 외 거대 아이티기업들의 보험 시장 진출은 가시화되고 있다. 네이버는 일단 현대해상·디비(DB)손해보험, 케이비(KB)손해보험과 제휴해 자동차보험 견적서비스를 출시하려다 주춤한 상태다. 카카오페이는 삼성화재와 합작회사를 만들려다 단독 보험사 설립으로 방향을 틀었다. 이들은 국내 1위의 인터넷 포털과 메신저를 가진 플랫폼 업체다. 아이티기업들은 보험산업 진출을 통해 소비자 결제 정보 뿐만 아니라 의료·건강 데이타까지 접근할 수 있는 것에 주목한 것으로 알려졌다. 이완 기자 wani@hani.co.kr▶더불어 행복한 세상을 만드는 언론, 한겨레 구독하세요!▶네이버 채널 한겨레21 구독▶2005년 이전 <한겨레> 기사 보기[ⓒ한겨레신문 : 무단전재 및 재배포 금지]"
270,[거리의 칼럼] 강남역 7번 출구 / 김훈,2020.07.20,"서울지하철 2호선 강남역 7번 출구로 나오면 삼성전자, 삼성생명, 삼성화재의 고층빌딩들이 하늘에 닿을 듯하다. 지하공간에는 삼성갤럭시, 삼성딜라이트, 영삼성의 신제품 매장이 이어져 있다. 이 삼성타운 맞은편에는 세계 최고 수준의 성형외과들이 모여 있다. 이 일대는 ‘강남 사모’, ‘강남 언니’들의 아름다움의 고향인데, 요즘에는 남성 고객이 늘고 있다.7번 출구 옆에서 삼성전자 백혈병 피해자 단체인 ‘반올림’은 1023일 동안, 천막 속에 모여서 농성을 계속했다. 천막의 크기는 택시 2대 정도였다. ‘반올림’은 2018년 7월에 농성을 끝내고, 이 자리를 ‘삼성피해자공동투쟁’에 물려주었다. ‘공동투쟁’은 천막을 택시 3대 크기로 늘렸다. 관할 구청은 이 남루한 불법 노상 적치물을 철거하지 못하고 있는데, 그 속내를 나는 모른다.삼성에 의한 피해를 주장하는 노동조합, 철거민, 암환자 단체들이 이 거리에 현수막을 걸어놓고 스피커로 억울함을 절규하고, 경찰들이 소음 정도를 측정한다.성형타운 앞 시시티브이(CCTV) 철탑 위에서 삼성 해고노동자 김용희씨는 355일간 고공농성을 했다. 이 철탑 위의 시시티브이는 24시간 이 거리를 사진 찍고 있다.온갖 욕망과 아우성, 번영과 소외, 첨단과 낙후가 뒤엉킨 이 거리는 올 때마다 평온하고 질서 잡혀 있다. 점심시간에는 회사 신분증을 목에 건 젊은 직장인들이 맛집 앞에 줄을 선다. 네거리 신호등에 따라 자동차들은 정확하게 움직이고 배달 라이더들이 코너링한다. 이 거리의 아우성은 듣는 이가 없어서 적막하고, 모든 표정들이 모여서 무표정하다. 나는 이 거리가 난해하다.작가▶더불어 행복한 세상을 만드는 언론, 한겨레 구독하세요!▶네이버 채널 한겨레21 구독▶2005년 이전 <한겨레> 기사 보기[ⓒ한겨레신문 : 무단전재 및 재배포 금지]"
271,‘50대 임원’ 대거 세운 삼성전자…38살 전무도,2020.01.21,"삼성전자, 162명 승진자 발표  49살 젊은 부사장 나오고 38세 외국인 전무도 2명  여성 5명은 전무·상무급  노조와해 관여 인사팀 임원들 “정기 인사안 작성 관여 안해”그룹 총수 이재용 부회장의 재판 등으로 뒤숭숭한 삼성전자가 부사장과 전무 등 고위 임원에 57살 이하 젊은 임원을 다수 발탁했다. 1970년생(49살) 부사장과 1981년생(38살) 외국인 전무도 2명 나왔다. 회사 쪽은 “젊은 리더들을 승진시켜 미래 최고경영자(CEO) 후보군을 두텁게 했다”고 밝혔다. 지난해 12월 삼성전자서비스노조 와해 사건 등으로 유죄 판결을 받은 삼성전자 인사팀 임원들은 이번 인사안 마련에 관여하지 않았다고 회사 쪽은 말했다.  삼성전자가 21일 발표한 임원급 인사를 보면, 부사장 14명, 전무 42명, 상무 88명, 연구개발직 펠로우 3명, 마스터 15명 총 162명이 승진했다. 지난 2017년(221명)에 이어 두번째로 큰 폭의 임원 승진 인사다. 2018년 인사에서 승진한 임원은 158명이었다. 승진 연한을 앞당겨 승진한 발탁 사례는 전무급 이상 고위직 13명 포함 모두 24명이다.5세대(5G) 이동통신망용 모뎀칩·단말기 개발로 잘 알려진 최원준 무선사업부(IM) 전략제품개발1팀장이 49살 젊은 나이로 부사장 승진해 눈길을 끈다. 최 부사장은 무선 통신 칩셋 회사 아데로스(2011년 퀄컴에 인수)에서 칩셋 설계를 맡은 바 있다. 회사 쪽은 “5G 스마트폰인 갤럭시S10을 상용화하고 갤럭시노트10을 적기에 출시한 공로를 인정받았다”고 인사 배경을 설명했다.  영상디스플레이사업부에선 최용훈 엘이디(LED)개발그룹장이 영화용 엘이디 및 초대형 엘이디 디스플레이 ‘더 월’ 개발을 주도한 공로로 부사장 승진했다. 반도체(DS) 부문에선 메모리사업부의 송재혁 Flash PA팀장이 브이낸드(V-Nand) 기술력을 한 세대 끌어올린 공로로 부사장으로 승진했다. 같은 사업부 최진혁 디자인 플랫폼개발실장도 에스에스디 등 메모리 솔루션 제품 컨트롤러를 개발해 부사장 승진했다. 파운드리사업부에선 심상필 파운드리제조기술센터장(기흥·화성·평택단지)과 정기태 피에이(PA)2팀장이 부사장이 됐다. 안수진 전무  신규로 임원이 된 외국인과 여성은 각각 4명과 5명이다. 지난달 미국에서 열린 시이에스쇼(CES)에서 인공인간 ‘네온’을 선 보인 프라나브 미스트리 상무와 글로벌 경영전략을 담당하는 마티유 아포테커 상무도 각각 38살 나이에 전무가 됐다. 여성 승진자 5명 가운데선 송명주 생활가전사업부 글로벌 피엠그룹장과 안수진 메모리사업부 Flash PA팀 소속 상무가 전무로 승진했다. 안 전무는 반도체를 다루는 디바이스솔루션(DS)부문 최초의 여성 전무다. 발탁승진은 2017년 13명에서 올해 24명으로 2배 가까이 늘었다. 금융계열사 사장단도 전부 50대로 바뀌었다. 삼성생명은 21일 전영묵(56) 삼성자산운용 대표이사(부사장)를 신임 대표로 추천했다. 현성철(60) 삼성생명 현 대표보다 4살 어리다. 김대환(57) 삼성생명 경영지원실장도 지난해 12월 노조 와해 혐의로 실형을 선고 받은 원기찬(60) 현 사장을 대신해 삼성카드 대표 자리에 추천됐다. 심종극(57) 삼성생명 FC영업본부장도 삼성자산운용 대표로 추천됐다. 최영무(57) 삼성화재 대표와 장석훈(57) 삼성증권 대표는 유임됐다. 지난해 12월 노조 와해 혐의로 유죄를 받은 삼성전자 인사팀이 이번 인사에 관여했을지도 관심사다. 당시 유죄를 현직 가운데선 강경훈 삼성전자 인사팀 부사장과 박용기 삼성전자 인사팀 부사장, 목장균 노무담당 전무 등 인사팀 임원이 포함돼 있었다. 이들이 실무에서 배제되지 않았다면 각 부서 평가를 취합, 관리하는 인사팀 업무에 관여했을 가능성도 있다. 삼성전자는 “이들의 담당 업무가 그룹 인사와 직접 연관돼 있지 않다”며 개입 가능성을 부인했다.신다은 박수지 기자 downy@hani.co.kr▶네이버에서 한겨레 구독하기▶신문 보는 당신은 핵인싸!▶조금 삐딱한 뉴스 B딱![ⓒ한겨레신문 : 무단전재 및 재배포 금지]"
272,[속보] 삼성준법감시위 “부패행위부터 경영승계까지 조사한다”,2020.01.09,"법조계·시민사회계·학계 7명 구성 “이재용 만나 독립조직 확답” 7명 계열사 우선 협약…중공업은 빠져 “위원회 방향 구체적으로 안 정해져 개별 사안은 2월 출범 후 밝히겠다”  이재용 삼성전자 부회장 결심공판을 앞두고 삼성그룹이 만들기로 한 ‘준법감시위원회’가 9일 윤곽을 드러냈다.대법관을 지낸 김지형 법무법인 지평 대표 변호사는 이날 서울 서대문구 법무법인 지평 사무실에서 기자간담회를 열고 준법감시위 내정자 명단을 발표했다. 김 변호사가 위원장을 맡고 이인용 삼성전자 사회공헌업무 총괄 고문이 위원으로 참여한다. 외부 위원 5명은 소비자주권시민회의 사무총장을 맡은 고계현 위원과 대검찰청 차장검사 출신 봉욱 변호사, 권태선 시민사회단체연대회의 공동대표, 김우진 서울대 경영대 교수, 심인숙 중앙대 법학전문대학원 교수다. 김지형 대표변호사는 “삼성의 변혁 의지를 의심했고 양형사유 면피 사유가 될 수 있다는 점을 우려했지만 먼저 변화의 문을 열었기에 받아들였다”며 “대신에 위원회 구성에서 운영까지 독립성을 갖게 해 달라고 했고 이 부회장을 만나 이 부분에 대한 확답도 받았다”고 했다. 김 변호사는 “외부위원을 압도적으로 많이 선정하려 했고, 영역별 전문성을 고려해 우리사회 대표성을 확보하려 했다. 이인용 고문도 삼성 관여 없이 독자적으로 판단해 참여를 권유했다”고 했다.위원회는 이달 말 삼성전자·삼성물산·삼성생명·삼성에스디아이·삼성전기·삼성에스디에스·삼성화재 7개 계열사와 우선적으로 협약을 맺고 감시위를 운영할 예정이다. 미국기업에 뇌물을 공여한 혐의로 벌금을 문 삼성중공업은 빠졌다. 김 변호사는 “7개 계열사가 선정된 이유는 저도 잘 모른다”며 “기회가 될 때 설명하겠다”고 했다.김 변호사는 “필요한 범위 내에서 준법지원인의 지원을 받고 자료 제출도 요구하겠다. 시스템 개선에 관해 이사회에 직접 권고하고 의견 제시하고 이행 점검을 지속적으로 해 나가겠다”고 했다. 또 “계열사 이사회가 위원회 요구를 적극적으로 수용하게 하고, 이를 수용하지 않는 경우 이를 적시해서 위원회에 통보한 뒤 이를 수용하지 않으면 위원회 홈페이지에 공표할 예정”이라고 했다. 총수와 최고경영자를 견제하는 방안도 제시했다. 김 변호사는 “법 위반 사항을 직접 조사고 회사 최고경영진의 법 위반 행위에 대해 위원회가 홈페이지를 통해 곧바로 직접 신고를 받는 체계를 만들겠다”며 “법 위반 리스크를 적발할 경우 필요한 조치를 취하는 절차도 마련할 것”이라고 했다. 다만 그 조치가 형사고발을 포함하는지에 대해선 밝히지 않았다. 김 변호사는 “준법감시의 성역을 두지 않겠다”며 “불법 리스크가 있는 대외후원금, 계열사 간 내부거래, 협력업체와의 하도급 거래, 일감 몰아주기 등 공정거래분야, 뇌물수수 부정청탁 등 부패행위에만 그치지 않고 노조와 경영권 승계 문제에서 예외가 될 수 없다”고 했다.준법감시위는 계열사 이사회 의결 절차를 거쳐 오는 2월 초순께 공식 출범할 예정이다. 정보 접근 범위나 형사고발 여부, 위원회 운영 방향에 대해선 “아직 정해지지 않았다. 위원들이 모인 뒤 정할 것”이라고 했다. 김 변호사는 유성기업 사측 대리인을 맡고 있어 부적절하다는 의견이 제시되자 “불필요한 오해를 줄이는 최소한의 조치가 필요할 듯 해서 철회했다. 기아차 등 다른 기업의 사측대리사건은 좀 더 숙고해 보겠다”고 했다. 신다은 기자 downy@hani.co.kr▶네이버에서 한겨레 구독하기▶신문 보는 당신은 핵인싸!▶조금 삐딱한 뉴스 B딱![ⓒ한겨레신문 : 무단전재 및 재배포 금지]"
273,‘리치웨이’발 확진자 21명으로…“빌딩 방문자 검사 받아야”,2020.06.05,"5일 10시 기준 서울시 코로나 확진 20명 증가수도권 개척교회 관련 3명·보험사 관련 1명 늘어서울시 관악구 건강용품 판매업체 ‘리치웨이’ 관련 코로나19 확진자가 서울에서 11명 늘어났다. 방역당국은 지난 5월21~6월3일 리치웨이가 입주한 서울 관악구 시흥대로552 석천빌딩을 방문한 사람은 증상 유무와 관계없이 코로나19 검사를 받으라고 권고했다.서울시 나백주 시민건강국장은 5일 브리핑에서 “5일 오전 10시 기준 서울시 신규 코로나 확진자는 전날 0시 대비 20명 늘었고 이 중 리치웨이 관련이 11명, 수도권 개척교회 관련 3명, 삼성화재 논현지점 관련이 1명”이라고 밝혔다. 나 국장은 리치웨이 확진자와 관련해 “2일 이곳에서 판매 활동을 하는 70대 남성이 처음 확진된 뒤 3일 5명, 4일 11명, 오늘 4명이 추가로 확진돼 총 확진자는 21명이 됐으며 이중 서울 지역 확진자가 15명”이라고 밝혔다. 서울시는 업체 직원과 방문자 등 199명 검사를 진행하고 있다.이날 중앙재난안전대책본부는 5월21일~6월3일 리치웨이 입주 건물을 방문한 이들은 코로나19 검사를 받으라는 내용의 안전 안내 문자를 보냈다. 서울시는 이 기간 해당 건물을 방문한 이들이 500여명에 이르는 것으로 추산하고 있다.한편 서울시는 이날 서울시치과의사회 주최로 ‘제17회 서울국제치과기자재전시회(SIDEX 2020)’가 서울 코엑스에서 열리는 것과 관련해 재차 우려를 표명했다. 나 국장은 “시민들 우려를 고려해 (전날) 집합제한명령을 했다”라며 “(행사를) 자제해줄 것을 기대했는데 진행이 되다 보니 불가피하게 방역수칙 명령을 하게 된 상황”이라고 말했다. 이날 낮 12시30분부터 시작돼 오는 7일까지 열리는 이 행사엔 7000여명이 참여할 것으로 예상된다.송경화 기자 freehwa@hani.co.kr▶더불어 행복한 세상을 만드는 언론, 한겨레 구독하세요!▶네이버 뉴스판 한겨레21 구독▶2005년 이전 <한겨레> 기사 보기[ⓒ한겨레신문 : 무단전재 및 재배포 금지]"
