,title,date,content
51,폐암치료제 ‘레이저티닙’ 17개국서 임상 3상 돌입… 글로벌 신약 기대감,2020.04.01,"Bio 의약 - 유한양행미국-유럽 등에 현지법인 설립지역 특화 전략으로 시장 공략올해로 창립 94주년을 맞은 유한양행(대표 이정희)은 100년 기업을 앞두고 있다. 유한양행은 지속적인 성장을 바탕으로 글로벌 수준의 역량을 갖춘 유한 100년사를 창조하기 위해 기업의 미래 성장 발판을 다지며 도약을 준비하고 있다. 유한양행이 개발 중인 폐암치료 신약 물질 ‘레이저티닙’이 순조로운 개발경과를 보이고 있는 등 신약 중심의 글로벌 기업을 향한 행보가 눈길을 끈다.‘레이저티닙’ 다국가 임상 3상 진입 유한양행이 오픈 이노베이션 전략을 활용해 성공적인 개발을 이끌고 있는 3세대 돌연변이형 상피세포성장인자수용체(EGFR) 억제 폐암치료제 레이저티닙은 2018년 11월 미국 얀센바이오테크에 총액 1조4000억 원 규모로 기술을 수출하고 양사가 공동개발 중인 신약물질이다. 학계와 증시 등에서 유력한 글로벌 신약 후보로 주목받고 있다. 지난해 12월 11일에는 식품의약품안전처로부터 레이저티닙(lazertinib, YH25448)에 대한 임상 3상 시험을 승인받고, 올해 2월부터는 1차 치료제로서 개발을 위한 임상 3상 시험에 돌입했다.  임상 3상 시험은 전 세계 17개국에서 진행할 예정으로 작년 12월에 한국 식약처로부터 첫 번째 임상시험승인(IND)을 받은 이후 기관별 개시 모임을 진행해 환자 모집을 진행하고 있다. 국내에서는 세브란스병원, 삼성서울병원, 서울대병원, 서울성모병원, 서울아산병원 등 27개 병원이 참여한다. 세르비아 및 말레이시아에도 임상시험 계획 승인 신청을 완료해 이를 지속적으로 확대한다는 계획이다. 이번 임상 3상(LASER301)은 EGFR 돌연변이 양성 비소세포폐암 환자 380명을 대상으로 1차 치료제로서의 안전성과 유효성을 비교하는 시험이다. 최근 유한양행은 회사의 미래 성장동력에 있어 가장 중요한 핵심 역량인 연구개발(R&D) 부문의 투자를 지속적으로 확대하고 있다.  유한양행의 2019년 R&D 투자금액은 1324억 원 규모로 2016년 864억 원 대비 50% 이상 증액됐다. 올해 전체적인 연간 연구개발 투자 규모는 2000억 원에 이를 것으로 전망된다.  이정희 사장은 “단기적인 이익 성장에만 몰두하지 않고 앞으로의 노력을 통해 미래를 준비할 수 있는 부분에 특히 역점을 두고 있다”면서 “신약 개발은 오랜 시간과 많은 투자가 선행되지만 결코 포기할 수 없는 우리의 소명으로 중장기적 관점에서 R&D를 더욱 강화해 나아가야 할 것”이라고 말했다. 오픈이노베이션 통한 연구개발 역량 확대 주력 레이저티닙은 유한양행의 대표적인 오픈 이노베이션 결실의 하나로 꼽힌다. 2015년 오스코텍의 미국 자회사 제노스코에서 도입된 폐암치료제 레이저티닙은 도입 시 전임상 직전 단계의 약물을 유한양행에서 물질 최적화, 공정 개발, 전임상과 임상을 통해 가치를 높여 얀센바이오텍에 수출한 건으로 전형적인 오픈이노베이션 사례라 할 수 있다. 유한양행은 2015년부터 이정희 사장 취임 후 신약개발 전문 기업으로 거듭나기 위해 오픈 이노베이션을 적극적으로 추진해 왔다.  2015년 초 9개였던 혁신 신약 파이프라인은 현재 30개 가까이 늘어났고 이 중 절반 이상이 오픈 이노베이션을 통한 외부 공동 연구과제로 이뤄졌다. 유한양행은 기술력이 있는 외부 업체와의 기술을 공유한 후 우리가 잘할 수 있는 분야에 집중하여 가치를 끌어올린 후 글로벌 제약사에 기술을 이전하거나 공동 개발하는 방식으로 오픈이노베이션을 지속적으로 확대해왔다. 국내 기업인 엔솔바이오사이언스로부터 도입한 퇴행성 디스크치료제 YH14618을 임상 2상 단계까지 개발한 다음 2018년 미국 스파인바이오파마에 기술 이전했다.  최근에는 제넥신의 약효지속 플랫폼 기술이 접목된 비알코올성지방간 치료제 YH25724를 2019년 7월1일 독일 베링거인겔하임에 기술 수출을 했다. 또 미국 항체 신약전문 기업 소렌토사와 설립한 합작투자회사 이뮨온시아의 IMC-001은 대표적인 면역항암제로 국내 최초 임상 1상을 성공적으로 완료했다.  유한양행은 이제 국내를 비롯한 전 세계로 플랫폼의 범위를 확장하고자 한다. 2018년 미국의 Yuhan USA 법인을 설립하고 두 곳에 사무소(샌디에이고, 보스턴)를 두어 신규 기술 확보의 교두보로 활용하고 있다. 2019년에는 호주에도 현지 법인을 설립했고, 올해 하반기에는 미국과 더불어 바이오 제약산업의 선진 중심지인 유럽에도 현지법인 설립을 계획하고 있다. 유한양행은 이를 통해 확대된 플랫폼을 전 세계 지역별 특성별로 맞춤 적용해 글로벌 오픈이노베이션 전략을 추구할 계획이다.  조선희 기자 hee3110@donga.com▶ 네이버에서 [동아일보] 채널 구독하기▶ 집 볼 때 쓰는 메모장 '집보장'ⓒ 동아일보 & donga.com, 무단 전재 및 재배포 금지"
52,"종근당, 매출 ‘1조 클럽’… 셀트리온도 가입 유력",2020.02.10,"국내 제약바이오 해외 진출 성과… 한미, 작년 1조1136억… 2년 연속이달말 실적공시 유한양행-녹십자 9월까지 누적 매출 1조원 넘어국내 주요 제약바이오 업체들이 나란히 연 매출 1조 원대 벽을 넘어서면서 규모의 경제를 갖추기 시작했다는 평가가 나온다. 유한양행이 2014년 국내 제약사 최초로 매출 1조 원을 넘어선 지 5년 만에 1조 원 클럽 가입 제약사가 속속 뒤를 잇고 있다. 주요 제약사들은 안정적인 실적을 발판삼아 연구개발(R&D) 투자도 가속화한다는 방침이다.  9일 업계에 따르면, 종근당은 지난해 1조786억 원 매출을 공시해 창사 이래 처음으로 매출 1조 원 문턱을 넘었다. 자체 개발 의약품과 도입 신약 등이 고르게 성장하는 가운데 고지혈증 치료제 등 만성질환 관련 전문의약품이 실적을 견인했다.  종근당 전문의약품 중 다국적 제약사 MSD에서 도입한 당뇨 치료제 자누비아가 안정적인 매출 실적(1405억 원)을 이어간 데 이어 당뇨 치료제 듀비에를 포함해 자체 개발 신약이 매출 200억 원을 넘어섰다. 이로써 종근당은 2014년 매출액 5441억 원에서 5년 만에 매출 규모가 두 배 가까이로 뛰었다. 전문의약품 매출 확대 속에 R&D에도 투자를 늘리면서 미래 성장동력을 동시에 확보하려는 노력이 차츰 성과로 이어지고 있다는 평가다. 종근당은 지난해 R&D에 1375억 원을 투자한 데 이어 올해는 이를 1500억 원까지 늘린다는 계획이다. 한미약품도 7일 지난해 매출을 1조1136억 원으로 공시해 2년 연속으로 1조 원 클럽을 달성했다. 자체 개발한 고혈압 치료 복합신약 아모잘탄패밀리가 981억 원의 매출을 올렸다. 한미약품은 국내 제약바이오 기업 중 최고 수준인 2098억 원을 R&D에 투자할 정도로 연구 역량을 중시하는 기조를 이어가고 있다. 이와 함께 이달 말 2019년도 실적을 공시하는 유한양행과 GC녹십자는 지난해 9월까지 매출로만 1조 원을 넘어섰다. 한국제약바이오협회는 “1조 원 클럽에 가입한 주요 제약바이오 기업들은 R&D 투자 비중이 높고 글로벌 진출 성과가 가시화되는 업체라는 공통점이 있다”고 설명했다.  실제 매출 실적을 보면 국내 제약바이오 기업들의 글로벌 진출 성과가 두드러진다. 한미약품의 중국 현지 법인인 북경한미약품의 지난해 매출은 전년 대비 11.5% 성장해 2544억 원에 달했다. 업계에 따르면, 글로벌 바이오시밀러 시장 개척에 주력해온 셀트리온과 그룹 내 해외 판매를 담당하는 셀트리온헬스케어도 사상 첫 매출 1조 원대를 기록할 가능성이 높다. 지난해 9월까지 매출만 각각 7400억 원, 7800억 원대이다. 삼성바이오에피스는 유럽 시장에서만 지난해 바이오시밀러 제품에 대해 8500억 규모의 판매 실적을 거뒀다고 발표하기도 했다.  국내 제약바이오 기업들의 해외 시장 성공 사례는 후발 주자에게도 자극이 되고 있다는 평가다. 업계 관계자는 “지난해 매출 1조 원 클럽뿐만 아니라 5000억 원대 기업들도 늘어났다”며 “규모를 발판삼아 글로벌 경쟁력을 갖출 수 있느냐가 업계의 주요 관심사”라고 설명했다.임현석 기자 lhs@donga.com▶ 네이버 홈에서 [동아일보] 채널 구독하기▶ 트롯가수 응원은 '트롯픽'에서 / 집 볼 때 쓰는 메모장 '집보장'ⓒ 동아일보 & donga.com, 무단 전재 및 재배포 금지"
53,코로나 위기에도… 제약업계 나눔은 계속됩니다,2020.12.21,"오페라 공연-미술 공모전 개최… 문화예술로 나눔 실천코로나로 이중고 겪는 환자-의료진에 희망 메시지 전달텀블러 사용-에너지 절약 등 ‘친환경 경영’ 행보도 눈길신종 코로나바이러스 감염증(코로나19) 사태가 가실 줄 모르고 이어지자 주요 제약업체들의 행보도 빨라졌다. 사업적으로 대응하는 것 뿐 아니라 사회공헌활동(CSR)을 통해 어려움을 겪는 환자나 주변 이웃들을 돌아보기 위해 나선 것. 코로나19로 우울감이 커진 이들을 위한 문화예술 나눔, 일회용품 사용량 증가에 따라 친환경 행보 등을 보인 기업도 적지 않다. 코로나 확산, 사회공헌활동 ‘비대면’ 전환 종근당은 2011년부터 투병 중인 환자와 가족들을 위해 전국 주요 병원을 직접 찾아가는 ‘오페라 희망이야기 콘서트’와 환아들을 위한 ‘키즈 오페라’ 공연을 진행하고 있다.  올해는 코로나19 사태로 방문 공연 취소했지만 언택트 공연으로 코로나19로 지친 환자들을 위로했다. 네이버TV를 통해 ‘오페라 희망이야기 콘서트’를 온라인 생중계하는 방식으로 진행한 것이다. 11월 ‘세상을 향한 따뜻한 울림’을 주제로 진행된 공연은 코로나19 장기화로 사회적 고립감과 심리적 피로감을 호소하는 국민들에게 응원의 메시지를 전하는 자리였다. 팝칼럼니스트 김태훈이 사회를 보고 트리니티필하모닉오케스트라와 베이스 손태진, 소프라노 오신영, 뮤지컬배우 민우혁, 가수 박기영 등 유명 아티스트들이 출연해 오페라부터 뮤지컬, 팝페라 등 다양한 음악을 선보였다. 특히 키즈오페라는 2020년 창작 작품인 ‘칙칙폭폭 씽씽’의 공연을 영상으로 만든 후 동화책에 QR 코드를 삽입하여 아이들이 독서와 함께 영상을 감상할 수 있도록 제작했다. 동화책은 전국의 병원 및 소아암 쉼터에 배포할 예정이다. 종근당 관계자는 “코로나19 장기화로 지친 국민들과 의료현장에서 고군분투하고 있는 의료진, 방역당국 관계자들에게 위로와 응원의 선물이 되길 기대한다”고 밝혔다. JW그룹은 장애인이 문화 활동을 통해 사회에 감동을 줄 수 있도록 지원하고 있다. 매년 선보이는 달력에 장애인 미술가의 작품을 싣는 식이다. JW그룹은 “장애인들이 세상과 소통하고 편견 없는 세상을 만들기 위해 차별화된 메세나 활동을 실천하고 있다”며 “음악, 미술 등 문화예술 분야에서 재능을 발휘하고 건강한 사회구성원으로 성장할 수 있도록 다양한 지원을 펼치고 있다”고 설명했다. 홀트 장애인 합창단인 ‘영혼의 소리로’를 18년째 후원하고, 장애인 미술대전 ‘JW 아트 어워즈’를 매년 개최하는 것이 대표적이다. 특히 ‘JW 아트 어워즈’는 유일하게 기업이 주최하는 장애인 대상 종합미술공모전으로, 그림에 많은 관심과 소질이 있지만 전문적인 지원과 교육을 받지 못하는 장애 예술가들이 재능을 발휘할 수 있도록 마련돼 있다. 정부나 지자체가 아닌 기업이 주최하는 장애인 대상 종합미술 공모전은 ‘JW 아트 어워즈’가 최초다.  대웅제약은 아름다운가게, 피치마켓과 함께 발달장애인들이 몸이 아플 때 혼자서도 질병 증상을 표현하여 필요한 의료 서비스를 받을 수 있도록 2019년부터 ‘참지마요 프로젝트’를 진행하고 있다. 쉬운 글 도서와 질병표현을 돕는 의사소통 카드 그림책을 만들고 대학생 봉사단과 임직원봉사단이 교육봉사활동을 하는 프로젝트다.  올해 코로나19 확산 속에서도 대웅제약은 ‘참지마요 프로젝트’를 지속 전개했다. 작년에는 느린 학습자가 질병 증상을 쉽게 이해할 수 있도록 도움을 주는 ‘참지마요 쉬운 글 도서’를 발간한 데 이어 올해에는 코로나19와 감염병 예방을 위한 쉬운 글 도서를 제작했다. ‘코로나19 쉬운 글 도서’는 상대적으로 바이러스에 대한 정보 습득이 어려운 발달장애인을 위해 코로나19 감염 경로, 잠복기, 주요 증상 등을 이해하기 쉽게 일러스트 형태로 구성했다. 이어 ‘감염병 예방에 대한 쉬운 글 도서’도 제작, 배포해 발달장애인이 코로나19는 물론이고 감염병에 대한 적절한 대처가 가능하도록 했다. 또 코로나19 상황을 고려하여 제작된 쉬운 글 도서로 대학생 봉사단과 발달장애인이 각각 멘토와 멘티가 되어 비대면 교육을 진행했다. 대웅제약 임직원 봉사단 또한 온라인을 통해 발달장애인 멘티와 질병표현을 위한 AAC 카드(의사소통 그림책) 제작에 적극 참여했다.임직원은 사회공헌활동 주체  유한양행은 지난해부터 환경에 관심 있는 직원들이 자발적으로 모여 ‘그린온(Green On)이라는 사내환경캠페인을 기획, 진행했다. 텀블러 사용하기, 종이 줄이기, 에너지 절약하기의 3가지 주제로 직원들에게 안 쓰는 텀블러를 기증받아 필요한 직원에게 나눠주는 ‘텀블러 주인 찾아주기’ 캠페인과 ‘그린쿠폰제’ ‘계단 마라톤대회’도 진행 중이다. 올해는 연구소 공장으로 확대하여 진행하며 임직원들의 친환경 인식 개선과 확산을 이끌어내고 있다. 코로나19 시대 일회용품 사용량이 급증하며 친환경 이슈에 집중되는 가운데 직원들의 자발적 참여로 조성된 친환경 문화가 회사의 환경경영과 시너지를 내고 있는 것이다. 연구소의 경우 냉장시약 배송 시 버려지는 아이스팩 문제를 해결하고자 시약업체와 협의, 회수시스템을 구축했다. 연구원들이 분리수거한 아이스팩은 시약업체에서 정기적으로 수거하여 재활용한다. 이를 통해 연간 1000개 이상의 아이스팩을 재활용 할 것으로 기대하고 있다.  GC녹십자는 1992년 이후 매년 각 사업장에서 두 차례 정기적으로 실시하던 ‘사랑의 헌혈’ 행사를 2008년부터 세 차례로 늘려 매년 총 12회의 ‘사랑의 헌혈’ 행사를 개최하고 있다. GC녹십자의 ‘사랑의 헌혈’ 행사는 제약기업 중 최대 인원이 동참하고 있는 헌혈 행사로 1992년 첫 행사 이후 누적 참여자가 1만5000여 명에 달한다. GC녹십자는 지금까지 총 8000장이 넘는 헌혈증을 병원 및 소아암 환자 지원 단체 등에 기부해왔다. 헌혈증은 수혈에 드는 비용 중 건강보험재정으로 처리되지 않는 자기부담금 일부를 공제해주기 때문에 많은 양의 수혈을 필요로 하는 중증 환자들에게 실질적인 도움을 줄 수 있다. 김현수 기자 kimhs@donga.com▶ 네이버에서 [동아일보] 채널 구독하기▶ 증발에 운다…그렇게 부모가 되지 못했다▶ “말이 안 통해”… 극과 극이 만난다면?ⓒ 동아일보 & donga.com, 무단 전재 및 재배포 금지"
54,"이뮨온시아, 레고켐바이오와 ‘면역조절 항체 결합체’ 공동연구 계약",2020.12.10,"면역항암제 전문업체 이뮨온시아는 레고캠바이오사이언스(레고켐바이오)와 ‘면역조절 항체 결합체(AIC, Antibody Immune-modulator Conjugates)’ 후보물질 발굴을 위한 공동연구 계약을 체결했다고 10일 밝혔다.이번 계약에 따라 두 업체는 이뮨온시아 항체를 기반으로 레고켐바이오 고유 ‘항체-약물 결합(ADC, Antibody-Drug Conjugates)’ 기술을 활용해 다양한 면역조절물질을 결합시킨 신약 후보물질을 도출하고 전임상 효능을 평가한다.AIC는 최근 주목받는 새로운 기전의 약물이다. 항체에 면역조절 약물(Immune-modulator)을 결합해 종양 특이적 면역활성을 유도하고 이를 통해 종양의 성장을 억제하는 것으로 알려졌다. 항체에 암세포를 살상하는 톡신(toxin)을 결합한 ADC와 유사한 형태이며 최근 해외에서는 AIC 전문 개발업체들이 다국적제약사로부터 대규모 투자를 받거나 나스닥에 신규 상장하면서 크게 주목받고 있는 추세인 것으로 알려졌다.볼트 바이오테라퓨틱스(Bolt Biotherapeutics)는 지난 7월 화이자(Pfizer)로부터 면역조절 항체 결합체 BDC-1001 임상개발에 사용될 9350만 달러(약 1018억 원) 규모 투자를 유치한 바 있다. 지난달 나스닥 상장 신고서를 제출한 실버백테라퓨틱스(Silverback) 역시 종양타깃 항원 도메인에 면역활성 작용제를 결합한 형태의 면역조절 항체 결합체가 주요 파이프라인을 이루고 있다.송윤정 이뮨온시아 대표는 “이번 공동연구를 통해 두 업체가 가진 장점들을 활용해 경쟁력 있는 신약 후보물질을 발굴할 수 있을 것”이라고 말했다.이뮨온시아는 유한양행과 나스닥 상장사 미국 소렌토테라퓨틱스(Sorrento Therapeutics)가 합작해 설립한 면역항암제 전문 바이오벤처기업이다. 2개의 임상단계 파이프라인과 다수 전임상 단계 파이프라인을 보유하고 있다.동아닷컴 김민범 기자 mbkim@donga.com▶ 네이버에서 [동아일보] 채널 구독하기▶ 증발에 운다…그렇게 부모가 되지 못했다▶ “말이 안 통해”… 극과 극이 만난다면?ⓒ 동아일보 & donga.com, 무단 전재 및 재배포 금지"
55,‘창의·융합을 통한 혁신인재 양성 유한대학교’,2020.10.29,"‘유한생명바이오학과, 의료뷰티학과, 자유전공학과 신설’유한대는 2021학년도에 총 2017명을 모집한다. 6개 학부 34개 학과를 운영하고 있으며, 수시에서 일반고 전형, 특성화고 전형을 통해 학생을 모집할 계획이다. 수시 2차에는 △일반고 597명 △특성화고 146명 등 743명을 선발한다. 유한대는 올해 입학 전형방법을 간소화했다. 수험생의 입시 부담을 줄이기 위해 모든 학과의 면접을 폐지했다. 모든 학과에서 기본교과 100%를 반영한다. 올해도 지난해와 마찬가지로 고등학교 1∼3학년 성적 가운데 최우수 2개 학기 성적 100%를 반영한다.  ‘Yuhan TRUST 직무능력인증제’ 및 ‘지역공유 취·창업지원처’를 통한 취업지원 프로그램, 가족회사 전담제를 시행해 ‘입학이 곧 취업인 대학’을 구현한 점이 강점이다. 또 △자율개선대학 선정 △자율협약형 혁신지원사업 선정 △후진학 선도형 지원사업에 선정 △사회맞춤형 산학협력 선도전문대학 육성(LINC+)사업 △고숙련 일학습 병행제(P-TECH) 운영기관 선정 등 수많은 정부 재정지원 사업에 선정돼 장학금 혜택이 많은 편이다. 최근 전문대 재학생단계 일학습병행 사업에 선정됨에 따라 학생 중심의 교육 운영과 지역사회와 함께하는 사회적 가치를 창출하는 전문대학으로 자리 잡았다. 유한대는 패밀리기업인 유한양행, 유한건강생활, 유한화학과 유한생명바이오학과, 의료뷰티학과의 원활한 교육프로그램 운영을 위한 상호협력 협약식을 가졌다. 상호협력 협약을 체결해 대학과 유한 패밀리기업 간의 강력한 유대감 형성과 상호 협력을 위해 공동 노력할 예정이다. 제약, 뷰티의 강점을 가지고 있는 유한가족기업의 강력한 유대관계가 신설학과인 유한생명바이오학과, 의료뷰티학과와 관련해 큰 강점으로 부각될 것이며, 국제적인 바이오, 뷰티분야의 전문적 지식을 갖춘 맞춤형 인재를 육성 할 것으로 기대된다. 생명·바이오 산업의 전망은 밝다. 특히 유한생명바이오학과는 패밀리기업이자 제약·바이오 분야의 선두기업인 유한양행, 유한화학과의 상호협력을 통해 우수 인재를 발굴하고 수도권 최고의 바이오 전문가 양성을 위한 교육 프로그램을 제공할 예정이다. 유한생명바이오학과는 제약·바이오 산업의 실무 전반을 다루는 3년제 기본 교육과정을 바탕으로 바이오 기초이론, 바이오 제조공정 및 품질관리 등을 교육할 뿐만 아니라 임상시험 분석전문가, 화장품 분석전문가, 실버 조리·식품 전문가와 같은 대학 내 기존 학과(전공) 교육과의 융합교육을 통해 다양한 분야의 바이오 전문가 양성을 목표로 하고 있다. 유한대 의료뷰티학과는 K-뷰티를 통해 2022년까지 세계 3대 화장품 수출국과 뷰티 강국으로 도약하겠다는 정부의 계획에 발맞춰 패밀리기업인 유한건강생활과 함께 글로벌 중심의 메디컬 뷰티학과로 K-뷰티 산업의 글로벌 리더를 양성하고, 뷰티 산업의 과학화를 통해 삶의 질을 향상시키고, 뷰티 미용 산업의 자립형 전문가를 양성한다. 의료뷰티학과는 ‘건강한 삶’, ‘아름다움’, ‘삶의 질 향상’에 대한 인간의 본성과 시대적 욕구가 높아지면 개인의 미적 가치를 높이는 토털뷰티와 개인 맞춤형 의학적 지식을 융합하고, 화장품 및 메디컬케어를 과학적이고 체계적으로 교육 및 실습해 실용적이고 차별화되고 개인화된 의료뷰티 전문가를 양성하고 있다. 유한대 자유전공학과는 미래사회를 이끄는 창의적이고 자율적인 인재를 키우고 있다. 폭넓고 다양한 기초교육을 통해 학생 개개인의 진로 탐색 기회를 제공하고 학생 적성에 맞는 맞춤형 교육과정을 운영해 재학생의 역량향상의 기회를 제공한다. 유한대 내 다양한 전공을 경험할 수 있는 기회와 학생주도형 융·복합전공의 설계 통한 경험학습 기반 창의교육과정을 제공한다. 자유전공학과는 학문 간 경계를 넘어선 포괄적 사고와 창의력, 문제해결능력을 길러주기 위한 목표를 가지고 운영될 예정이다. 학생들은 자유전공으로 1학기 동안 진로 탐색과 융·복합 교육과정을 진행한다. 이후 학생들은 한 학기 동안의 진로탐색 결과를 바탕으로 다양한 전공 선택이나 융합전공 신설의 기회를 갖게 된다.▶ 네이버에서 [동아일보] 채널 구독하기▶ 증발에 운다…그렇게 부모가 되지 못했다▶ “말이 안 통해”… 극과 극이 만난다면?ⓒ 동아일보 & donga.com, 무단 전재 및 재배포 금지"
