,title,date,content
137,"연만희 보건장학회 이사장, 고려대에 유한양행 우선주 2000주 기부",2021.10.27,"27년간 이어져 온 49학번 대선배의 마라톤 기부연만희 보건장학회 이사장, 고려대에 94년부터 약 10억7000만 원 전해와재단법인 보건장학회의 연만희 이사장(전 유한양행 고문, 경제 49)이 고려대의 연구 진흥을 위해 본인이 소유한 유한양행 우선주 2000주(약 1억2000만 원 상당)를 기부했다.   이번 기부는 연만희 이사장이 고려대에 전해온 세 번째 유가증권 기부로, 1994년부터 2021년까지 기부 총액은 10억7000여만 원에 이른다. 고려대는 기부금으로 ‘연만희 연구기금’으로 조성하고 내년부터 3년간 ‘유일한 박사의 경영 철학이 ESG(ESG: Environmental, Social and Governance) 경영에 미치고 있는 영향에 관한 연구’를 지원할 계획이다.  고려대학교는 연만희 이사장과 조욱제 유한양행 사장을 초청하여 26일 오후 3시 고려대 본관에서 ‘연만희 보건장학회 이사장 연구기금 기부식’을 가졌다. 기부식에서 연만희 이사장은 “이북 출신이고 아버지도 일찍 여읜 제가 이만큼 성공한 것은 모교인 고려대와 유일한 박사님 덕분”이라며 “고려대에서 유일한 박사님 관련 연구를 진행해 사회에 기여하는 경영 철학이 널리 퍼지기를 바란다”고 말했다. 정진택 고려대 총장은 “또한 지식 창출뿐 아니라 연구자 중심의 실용적 연구를 바탕으로 사회 공헌까지 이어지는 개방형 산학협력 생태계 조성(‘오픈 이노베이션’)을 도모하고 있다”라며 “고려대의 혁신과 도전을 한결같이 응원해 주시는 대선배님께 감사를 드린다”고 답했다.  연만희 이사장은 유한양행에 평사원으로 입사해 전문경영인이 된 입지전적 인물로 알려져 있다. 1961년 경력직 평사원으로 입사해 유한양행 전무이사, 대표이사 사장, 회장에 이어 유한재단 이사장을 역임했다. 유한양행에 입사한 지 61년째인 2021년, 25년간 맡아온 유한양행 고문직을 스스로 내려놨다. 보건장학회는 ‘국민 보건 향상을 위한 보건 연구와 문화 향상에 필요한 지원’을 위해 고 유일한 박사가 기증한 유한양행 주식과 제약업계의 기부금 출연을 바탕으로 1963년 설립된 재단법인이다. 연만희 이사장은 1988년부터 보건장학회의 이사장을 맡고 있다."
138,"유한양행, 삼성서울병원·아임뉴런과 희귀병 치료제 연구·개발 협력",2021.02.04,"‘신개념 치료기술 및 혁신신약 개발 연구협력’ 업무협약기초연구부터 사업화까지 ‘원스톱’ 신약개발 생태계 조성유한양행은 삼성서울병원 미래의학연구원, 아임뉴런바이오사이언스와 신개념 치료기술 및 혁신신약 개발 연구협력을 위한 업무협약(MOU)을 체결했다고 4일 밝혔다.이번 MOU는 희귀 난치 질환 분야 환자에 대한 맞춤 정밀의학 실현을 목표로 한다. 협력을 통해 세 업체는 ▲뇌질환, 유전자질환, 암 등 난치질환 환자 맞춤형 정밀의학 관련 의료 및 보건학술, 기술정보 교류 ▲신개념 치료기술을 통한 과제 발굴 및 공동연구 ▲혁신신약 공동개발 상호협력 등을 추진한다.특히 이번 협약은 제약업체와 병원, 바이오벤처가 공동 협력 목표를 설정하고 기초연구부터 중개, 임상연구, 사업화까지 ‘원스톱’ 신약개발 생태계를 조성했다는 데 의미가 깊다는 평가다. 이들 업체는 신규 치료 타깃을 발굴하고 신개념 치료기술을 개발하는 한편 신약 후보밀질 발굴과 공동연구 협력을 수행할 예정이다. 유한양행과 아임뉴런이 개발한 신약 후보물질의 중개임상연구(Translational clinical research)도 협력하게 된다.앞서 유한양행은 성균관대, 아임뉴런 등과 ‘산학융합 뇌질환 R&BD 생태계 구축 협력사업’을 체결한 바 있다. 성균관대 자연과학캠퍼스 내 ‘CNS 연구센터(가칭)’ 설립을 추진하는 등 뇌질환 신약개발 R&D 역량을 집중·강화하기 위해 지속가능한 산학협력 R&BD 생태계 조성 추진을 개시했다. 여기에 이번 협약으로 유한양행은 중추신경계(CNS) 질환 중심 혁신신약 개발 생태계 완성에 한 발 더 다가섰다고 강조했다.이정희 유한양행 사장은 “뇌질환을 포함한 난치질환 치료제 개발을 위해서는 기존 오픈이노베이션을 뛰어넘는 유기적 협력이 필요하다”며 “난치질환 치료제 개발에 필수적인 새로운 기술과 이를 임상에 적용할 수 있는 중개연구를 함께 엮는 이번 협약을 통해 보다 효율적으로 난치병 치료제를 개발할 수 있을 것으로 기대한다”고 말했다.이규성 삼성서울병원 미래의학연구원장은 “이번 협약 목적은 치매 등 뇌질환과 암, 유전자 질환 등에 대해 맞춤 정밀의학을 실현하는 것”이라며 “신개념 치료기술과 혁신신약을 개발하기 위해 지원을 아끼지 않겠다”고 전했다.동아닷컴 김민범 기자 mbkim@donga.com▶ 네이버에서 [동아일보] 채널 구독하기▶ [환생 4화] 또 다른 환생을 위해 나는 오늘도 달린다▶ 멀티미디어 스토리텔링 ‘The Original’ⓒ 동아일보 & donga.com, 무단 전재 및 재배포 금지"
139,삼성바이오-유한양행 파트너십… ‘휴미라’ 복제약 국내 첫 판매키로,2021.03.16,"삼성바이오에피스의 자가면역질환 치료제 ‘아달로체’가 한국에서 유한양행을 통해 판매된다. 삼성바이오에피스는 유한양행과 자가면역질환 치료제 ‘아달로체’의 국내 판매를 위한 마케팅 파트너십을 체결했다고 15일 밝혔다. 아달로체는 글로벌 매출 1위 의약품인 ‘휴미라’의 바이오시밀러(바이오의약품 복제약)로 국내 최초로 판매 허가를 받은 제품이다. 류머티스 관절염, 강직성 척추염, 크론병 같은 자가면역질환을 치료하는데 쓰인다. 국내 휴미라 처방 규모는 1000억 원 수준이다. 삼성바이오에피스는 2017년 9월 아달로체의 국내 판매 허가를 획득한 이후, 이 치료제의 오리지널 의약품 개발사 애브비(ABBVIE)와 라이선싱 합의를 통해 관련 치료제의 출시를 준비해 왔다.김성모 기자 mo@donga.com ▶ 네이버에서 [동아일보] 채널 구독하기▶ 영원한 이별 앞에서 ‘환생’의 문을 열다▶ 멀티미디어 스토리텔링 ‘The Original’ⓒ 동아일보 & donga.com, 무단 전재 및 재배포 금지"
140,"유한양행, 항체 플랫폼 기술 보유한 ‘에이프릴바이오’와 공동 신약개발 업무협약",2021.01.27,"글로벌 바이오신약개발 협력에이프릴바이오, 항체 절편 활용 플랫폼 기술 보유유한양행 “항체신약개발 분야 역량·경쟁력 제고 기대”유한양행은 재조합 항체 의약품을 제작할 수 있는 항체 절편 활용 플랫폼 기술(SAFA)을 보유한 ‘에이프릴바이오’와 전략적 연구협력관계를 구축하는 공동 신약개발 업무협약(MOU)을 체결했다고 27일 밝혔다. ‘SAFA(Serum Albumin Fragment Associated)’ 기술은 재조합 단백질 반감기를 증대시키고 유용한 재조합 항체 의약품을 제작할 수 있는 항체 절편 활용 플랫폼이다. 지난해 SAFA 기술을 활용한 ‘APB-R3(항 염증 질환 치료)’ 물질이 혁신기술로 인정받아 제3회 바이오의약품 대상을 수상하기도 했다. 유한양행과 에이프릴바이오는 글로벌 신약 개발을 위해 SAFA 기술을 활용해 공동 관심 분야에 대한 연구를 수행하고 상호교류를 추진할 계획이다. 적극적으로 개방형 혁신(오픈이노베이션)을 진행하고 있는 유한양행은 전략적 투자도 왕성하게 이어가고 있다. 지난해 에이프릴바이오에 30억 원을 전략적으로 투자한 바 있다.이정희 유한양행 사장은 “에이프릴바이오의 독자 플랫폼 기술인 항체 라이브러리 기술과 지속형 SAFA 기술 등을 활용해 다양한 치료제 영역에서 글로벌 혁신신약을 개발할 수 있을 것으로 기대한다”며 “유한양행의 항체신약개발 분야 역량을 강화하고 글로벌 시장에서 경쟁력 있는 바이오신약 개발이 가속화될 것으로 보고 있다”고 말했다.차상훈 에이프릴바이오 대표는 “이번 협약은 항체신약 관련 기술과 SAFA 플랫폼 기술의 우수성을 높이 평가받았다는데 큰 의의가 있다”며 “국내 최고 연구 역량과 임상경험을 가진 유한양행과 협업은 현재 개발 중인 다양한 항체 및 지속형 단백질 치료제의 성공적 개발에 크게 이바지할 것으로 기대한다”고 전했다.한편 에이프릴바이오는 올해 코스닥 시장에 기술평가에 의한 특례상장을 준비 중이다.동아닷컴 김민범 기자 mbkim@donga.com▶ 네이버에서 [동아일보] 채널 구독하기▶ 증발에 운다…그렇게 부모가 되지 못했다▶ “말이 안 통해”… 극과 극이 만난다면?ⓒ 동아일보 & donga.com, 무단 전재 및 재배포 금지"
141,"국내 31호 신약 완성… 유한양행, 폐암 치료제 ‘렉라자’ 개발 성공",2021.01.18,"유한양행 ‘렉라자’, 폐암 신약으로 식약처 허가EGFR 변이에 내성 강한 3세대 표적치료제지난 2015년부터 6년 만에 최종 허가 획득매일 1회 240mg 경구제로 개발유한양행이 국내 31호 신약으로 새로운 폐암 치료제 개발에 성공했다. 유한양행은 상피세포 성장인자 수용체(EGFR, Epidermal Growth Factor Receptor) T790M 돌연변이 양성 비소세포폐암 치료제로 개발한 ‘렉라자(성분명 레이저티닙)’가 식품의약품안전처(식약처)로부터 최종 허가를 획득했다고 18일 밝혔다.폐암은 국내 사망률 1위에 해당하는 치명적인 암이다. 다른 장기로 전이된 폐암의 5년 생존율은 8.9% 수준으로 생존율이 매우 낮다. 올해 국내 폐암 환자 수는 약 3만 명 규모로 추정된다. 잠실야구장을 가득 채우고도 남는 수준이다. 비소세포폐암은 전체 폐암 중 가장 높은 비중을 차지한다. 이 가운데 30~40%가 EGFR 변이 양성으로 진단되는 것으로 알려졌다. 해당 환자에게는 1~2세대 표적치료제를 사용하지만 이중 약 50~60% 환자가 T790M 돌연변이에 의해 내성을 갖게 돼 치료에 더 이상 반응하지 않는 한계가 있다.유한양행 혁신신약 렉라자는 T790M 돌연변이 내성에 강한 3세대 표적치료제다. 뇌혈관장벽(Blood-Brain-Barrier)을 통과할 수 있어 뇌전이가 발생한 폐암환자에게 우수한 효능과 내약성을 보였다. 이번 식약처 허가로 1, 2세대 EGFR 표적치료제에 내성이 생긴 T790M 돌연변이 양성 국소 진행성 또는 전이성 비소세포폐암 환자 치료에 렉라자를 사용할 수 있게 됐다.유한양행은 렉라자를 지난 2015년 전임상 직전 단계에서 도입해 물질 최적화와 공정 개발, 전임상과 임상을 진행했다. 약 6년에 걸친 개발기간을 거쳐 최종 허가를 받은 것이다. 안명주 삼성서울병원 혈액종양내과 교수는 “렉라자는 국내 개발 신약으로는 처음으로 세계적으로 권위 있는 저널 ‘란셋온콜로지’에 게재돼 유효성과 안전성을 인정받았다”며 “이번 허가가 EGFR T790M 돌연변이 양성인 비소세포폐암환자에게 적합한 치료 옵션이 될 것으로 기대한다”고 말했다. 안명주 교수는 이번 허가에 주요 배경이 된 임상 논문의 제1저자로 알려졌다.조병철 연세암병원 폐암센터장 교수는 “이번 렉라자 국내 허가는 시사하는 바가 매우 크다”며 “임상적으로 의미 있는 항종양 효과와 안전성을 통해 우리나라 폐암환자들에게 좋은 치료 대안이 될 것으로 예상한다”며 “글로벌 임상을 통해 전 세계 폐암환자에게 희망의 치료제가 될 것으로 기대하고 있다”고 전했다. 조병철 교수는 렉라자 허가임상을 주도하면서 현재 다국가 임상3상 1차 치료제 연구를 이끌고 있다.이정희 유한양행 대표이사는 “렉라자는 유한양행의 신약개발 역량과 국내 연구자들의 헌신적인 노력으로 탄생한 혁신신약”이라며 “개발 단계부터 뜨거운 관심과 긍정적인 의학적 평가를 받아온 국산 신약으로 환자들에게 새로운 치료 옵션을 제공할 수 있게 돼 감회가 새롭다”고 밝혔다.한편 렉라자는 하루 1회 240mg(80mg, 3정 패키지) 경구제로 매일 일정한 시간에 식사와 관계없이 복용하면 된다. 글로벌 파트D 임상은 미국과 스페인, 영국 등에서 총 29명을 대상으로 현재 진행 중이다.동아닷컴 김민범 기자 mbkim@donga.com▶ 네이버에서 [동아일보] 채널 구독하기▶ 증발에 운다…그렇게 부모가 되지 못했다▶ “말이 안 통해”… 극과 극이 만난다면?ⓒ 동아일보 & donga.com, 무단 전재 및 재배포 금지"
142,"유한양행, 임직원 온라인 경매 수익금 726만원 기부",2021.01.08,"임원 및 부서장 애장품 71개 경매 출품온라인 라이브 방송으로 직원에 낙찰수익금 전액 복지기관 기부 예정유한양행은 지난달 임직원을 대상으로 진행한 온라인 경매 수익금 전액을 지역사회에 기부한다고 8일 밝혔다.이번 임직원 온라인 경매는 지난 2019년에 이어 두 번째로 열린 것으로 코로나19 확산 방지를 위해 온라인 라이브 경매방송 방식으로 진행됐다. 임원과 부서장이 기부한 물품을 직원들이 낙찰 받는 방식으로 이뤄졌다.이정희 유한양행 사장을 포함해 임원 및 부서장 47명이 자발적으로 애장품 71개를 기부했다. 명품넥타이와 지갑 등 패션소품과 와인, 위스키 등 주류, 골프채, 모피코트, 최신 갤럭시탭 새 제품 등 고가 물건이 경매물품으로 나왔다.지난달 28일부터 4일 동안 점심시간마다 진행된 경매는 전문 방송설비를 갖춘 본사 스튜디오에서 실시간 방송으로 진행됐다. 하루 평균 직원 300여명이 접속해 높은 호응을 얻었다. 직원들의 적극적인 참여로 모든 경매물품이 시중가보다 높은 가격에 낙찰됐다고 유한양행 측은 설명했다. 수익금은 총 726만 원이다. 해당 수익금 전액은 임직원 봉사단이 활동하는 지역사회 3개 복지기관에 각각 기부될 예정이라고 한다.유한양행 관계자는 “이번 기부금이 코로나19로 어려운 이웃들에게 조금이나마 활력이 될 수 있기를 기대한다”고 말했다.한편 유한양행은 지난 연말 어려운 이웃을 위해 유한재단과 유한킴벌리, 유한화학 등 가족 회사들과 함께 현금 5억 원을 조성해 사회복지공동모금회에 기탁했다.동아닷컴 김민범 기자 mbkim@donga.com▶ 네이버에서 [동아일보] 채널 구독하기▶ 증발에 운다…그렇게 부모가 되지 못했다▶ “말이 안 통해”… 극과 극이 만난다면?ⓒ 동아일보 & donga.com, 무단 전재 및 재배포 금지"
143,"[경제계 단신]유한양행, 폐암 신약 ‘렉라자정’ 식약처 허가 外",2021.01.19,"■ 유한양행, 폐암 신약 ‘렉라자정’ 식약처 허가유한양행은 비(非)소세포폐암치료제 ‘렉라자정’이 식품의약품안전처로부터 판매 허가를 받았다고 18일 밝혔다. 이는 약 3년 만에 나온 31번째 국산 신약이다. 유한양행은 2005년 9월 항궤양제 ‘레바넥스’에 이어 16년 만에 두 번째 신약의 판매 허가를 받았다. 렉라자정은 현재 1차 치료에 쓰이는 1, 2세대 항암제 치료 환자 중 변이가 나타난 환자에게 사용 가능한 치료제다. 특정 유전자에 변이가 있는 진행성 폐암 환자 중 표적 치료제(EGFR-TKI)로 폐암 치료를 받은 적이 있는 환자에게 사용된다.■ 밀레 “셰프 일대일 프리미엄 상담 서비스” 밀레코리아는 셰프가 신제품을 활용해 요리를 시연하는 일대일 구매 상담 서비스를 시작한다고 18일 밝혔다. 서비스는 밀레 익스피리언스 센터 강남점과 청담점에서 가능하다. 셰프가 밀레 신제품 ‘제너레이션 7000’ 시리즈 오븐, 커피머신 등을 통해 요리를 선보일 예정이다. 방역을 위해 1인 1팀으로 진행하며 강남점은 수요일과 금요일 두 차례, 청담점은 월요일 두 차례다. 참가비는 무료다.■ 우정사업본부, 모바일 교통카드 출시 우정사업본부는 코레일과 제휴해 수수료 없이 충전하는 모바일 교통카드 서비스인 ‘포스트페이 × R+(레일플러스)’를 18일 선보였다. 우본의 간편결제 서비스 ‘포스트페이’와 코레일의 레일플러스를 연동한 것이다. 포스트페이 애플리케이션에서 비대면으로 계좌를 개설한 뒤 사용하면 된다. 스마트폰 잠금을 해제하지 않고 화면을 켠 채로 교통 단말기에 갖다 대면 결제할 수 있다. 전국 버스와 지하철, 철도, 고속도로 등에서 이용할 수 있다. 우본은 서비스 개시를 기념해 다음 달 19일까지 서비스 이용자 100명을 추첨해 3000원의 충전금을 지원하는 행사를 연다.▶ 네이버에서 [동아일보] 채널 구독하기▶ 증발에 운다…그렇게 부모가 되지 못했다▶ “말이 안 통해”… 극과 극이 만난다면?ⓒ 동아일보 & donga.com, 무단 전재 및 재배포 금지"
144,[경제계 인사]유한양행,2021.03.22,"◇유한양행 ＜승진＞ ▽부사장 △약품사업본부장 이병만 △생산본부장 이영래 ▽전무 △해외사업부장 신명철 △생활건강사업부장 김성수 △종합병원사업부장 유재천 △경영관리본부장 김재훈 △개발부문장 강대식 ▽상무 △합성신약부문장 안경규 △의약공정부문장 오상호 △일반병원사업부장 홍승훈 △약국사업부장 조민철 △전략실장 윤태진▶ 네이버에서 [동아일보] 채널 구독하기▶ 영원한 이별 앞에서 ‘환생’의 문을 열다▶ 멀티미디어 스토리텔링 ‘The Original’ⓒ 동아일보 & donga.com, 무단 전재 및 재배포 금지"
145,유한양행 대표이사 조욱제씨,2021.03.20,"유한양행은 19일 서울 동작구 대방동 본사에서 주주총회를 열고 신임 대표이사 사장에 조욱제 부사장을 선임했다.▶ 네이버에서 [동아일보] 채널 구독하기▶ 영원한 이별 앞에서 ‘환생’의 문을 열다▶ 멀티미디어 스토리텔링 ‘The Original’ⓒ 동아일보 & donga.com, 무단 전재 및 재배포 금지"
146,‘렉라자’ 앞세워 글로벌 50대 제약기업 목표,2021.06.28,"유한양행유한양행(대표 조욱제)이 6월 20일 창립 95주년을 맞았다. 유한양행 조욱제 사장은 95주년 기념식에서 “혁신신약 개발, 사업 영역 확장, 글로벌 시장 진출 가속화를 통해 유한 100년 시대에는 진정한 글로벌 제약사로 도약할 것”이라고 말했다. 한국형 ESG 경영 선도 평가 1925년 21년 만에 고국 땅을 밟은 청년 유일한은 일제강점기 질병에 가난으로 고통 받는 한국인들을 보고 “건강한 국민만이 잃어버린 주권을 찾을 수 있다”는 생각으로 이듬해인 1926년 의약품산업을 선택해 유한양행을 창립한다.  당시 유한양행은 의약품 수입을 독점해 오던 일본 상사들과 경쟁하면서 민중 사이에 만연해 있던 피부병·결핵·학질, 기생충 감염 등을 치료하기 위해 각종 의약품을 공급하는 한편 소독제·위생재료, 혈청, 백신 등을 보급해 질병 퇴치에 노력했다. 외국 의약품의 수입에만 의존할 수 없다고 판단하고 자체 생산에 돌입해 1933년 자체 1호 개발품인 ‘안티푸라민’의 생산을 필두로 구충제, 피부병약을 제조해 판매하기 시작했다. 1936년에는 본격적으로 제약공장과 실험연구소를 경기 소사에 건립하고 회사 형태를 주식회사로 변경했다. 이 과정에서 임직원들에게도 회사 주식을 분배하며 실질적인 종업원 지주제를 시행하게 된다. 그 뒤 1960년대에 제약업계로서는 처음으로 기업공개를 단행하고 주식을 상장해 경영의 합리화를 기했다. 또 자본과 경영을 분리해 현대적 경영 체제를 갖추며 우리나라 기업 경영의 모범이 된다. 유일한 창업자는 1971년 타계할 때 전 재산을 공익법인인 ‘한국사회및교육원조신탁기금’(현재 유한재단과 유한학원)에 기부하며 기업 이윤이 영구적으로 사회에 환원될 수 있는 시스템을 만들었다.업계 최초 매출 1조 원 시대 열어 1979년에는 현대적 생산시설을 갖춘 안양공장을 준공해 1985년 4월 국내 최초로 KGMP(우수의약품 제조 및 품질 관리기준) 적격 업체로 지정받았다. 1988년에는 업계 최초 중앙연구소가 KGLP(비임상시험 관리기준) 적격 시험기관 지정을 받았다.  1970, 80년대에는 국제화 시대에 발맞춰 합작투자 법인인 유한킴벌리, 유한크로락스, 한국얀센 등을 설립해 기업의 고속성장의 발판을 마련했다.  1990년대에는 자체 개발한 기술을 미국과 일본에 수출하고 인도에 합작투자회사를 설립해 체계적인 제약사로 발돋움하는 기틀을 마련했고, 2005년 경기 용인에 중앙연구소, 2006년 충북 청주(오창)에 cGMP 수준 설비의 신공장을 준공해 최고의 시설과 기술을 갖춘 제약회사로 거듭나게 됐다. 2013년 제약업계 매출 1위 기업으로 올라선 유한양행은 2014년 업계 최초 매출 1조 원을 달성한다. 100년 역사를 가진 국내 제약산업의 전체 매출이 20조 원 정도로 추정되는 가운데 매출 1조 원 기업 출현은 제약산업이 규모의 경제를 이루는 시발점에 섰다는 점과 더불어 이제 국내를 넘어서 글로벌 시장 진출을 위한 기초체력을 갖추게 된 것을 시사한다.R&D 선순환 구조 정착 유한양행 조욱제 사장은 글로벌 50대 제약사로 상징되는 진정한 ‘글로벌 기업’으로 도약을 준비하고 있다. 5년 앞으로 다가온 유한 100년에는 ‘Great Yuhan, Global Yuhan’이라는 기업 비전 실현에 다가선다는 것이다.  혁신신약 개발, 사업 영역 확장, 글로벌 진출 가속화가 그 키워드다. 그 중심에 세계적 신약의 가능성이 엿보이는 폐암 치료제 신약 ‘렉라자’(성분명 레이저티닙)가 있다 무엇보다 최근 유한양행은 회사의 미래성장동력에 있어 가장 중요한 핵심 역량인 연구개발(R&D) 부문의 본격적인 투자를 지속적으로 확대하고 있다.  특히 올 초 폐암 치료제인 렉라자는 식품의약품안전처로부터 31번째 신약 허가를 받아 곧 시판이 이뤄질 것으로 보인다.  특히 렉라자는 얀센과의 협력을 통한 병용 글로벌 3상, 1차 치료제를 목표로 하는 유한양행 단독 3상이 차질 없이 진행되고 있어 글로벌 신약으로 한걸음 더 다가서게 됐다.  3세대 돌연변이형 EGFR 억제 폐암 치료제 렉라자는 2018년 11월 미국 얀센바이오테크에 총액 1조4000억 원 규모로 기술 수출을 하고 공동 개발 중인 신약물질이다. 학계와 증시 등에서 유력한 글로벌 신약 후보로 주목받고 있다.  고통 받는 환자들에게 치료 기회를 확대할 신약으로 기대를 모은다."
