,title,date,content
0,20년 이상’ ‘흑자 랠리’ 기업 13곳…“금융위기 넘고 코로나도 이겨내는 중”,2020.09.09," KT&G, SK텔레콤 등 13개 기업이 분기보고서 제출이 의무화된 2000년 이후 올해 2분기까지 82분기 연속 흑자를 기록한 것으로 나타났다. 2008년 글로벌 금융위기와 최근 코로나19 확산이라는 악조건 속에서도 20년 이상 한 차례도 빠짐없이 흑자를 이어온 것이다.9일 기업평가사이트 CEO스코어가 금융감독원 전자공시시스템에 분기보고서를 제출하는 345개 사의 영업이익(개별 기준) 추이를 조사한 결과 13개 기업이 82분기 연속 흑자 행진을 한 것으로 파악됐다. ‘연속 흑자 기업’ 명단에는 KT&G, SK텔레콤, 현대모비스, 유한양행을 비롯해 GS홈쇼핑, CJ ENM, 신세계, 고려아연, 에스원, 농심, 한섬, 국도화학, 이지홀딩스가 이름을 올렸다.이 가운데 평균 영업이익률이 가장 높은 회사는 KT&G로 35.5%를 기록했다. SK텔레콤(19.3%)과 한섬(15.5%)은 15%를 넘겼고, 고려아연(13.3%), 이지홀딩스(12.8%), 에스원(12.6%), CJ ENM(11.8%), GS홈쇼핑(11.2%), 현대모비스(10.8%), 유한양행·신세계(각 10.0%)도 이익률이 10%를 넘었다. 농심과 국도화학은 각각 6.2%와 5.1%의 평균 영업이익률을 기록했다.이밖에도 2000년 2분기부터 분기보고서를 제출해 온 삼성화재(평균 영업이익률 5.0%)도 81분기 연속 흑자를 기록한 것으로 나타났다. 이들 14개 기업을 제외하고 70분기 이상 장기간 연속 흑자를 기록한 기업은 금호석유화학, 광동제약, LG생활건강, 엔씨소프트, 네이버, 카카오 등 모두 17개 사에 이른다. 글로벌 초우량 기업인 삼성전자는 금융위기 충격으로 2008년 4분기 적자를 기록했고, 이후 46분기 연속 흑자에 그쳤다.하지만 코로나19 등의 영향으로 지난해 19개였던 모든 분기 연속 흑자 기업 중 올해 포스코, 현대제철, 호텔신라, 넥센타이어 등 6개사가 탈락했다. 코로나19로 철강업과 관광숙박업, 자동차부품 산업 등이 타격을 입으며 이들 기업이 적자전환에 이른 것으로 분석된다.정환보 기자 botox@kyunghyang.com▶ 장도리 | 그림마당 보기▶ 경향신문 바로가기▶ 경향신문 구독신청하기©경향신문(www.khan.co.kr), 무단전재 및 재배포 금지"
1,셀트리온·삼성 ‘투톱’ 글로벌 질주,2020.02.27,"[기획]국내 제약바이오산업 분석· ①국내 바이오의약품산업의 현주소· ②국내 바이오의약품 개발현황· ③글로벌 제약기업의 바이오의약품 개발추세· ④K-바이오산업 발전의 핵심열쇠 ‘오픈이노베이션’생명의 소중함을 지키고 국민의 건강증진을 목표로 하는 우리나라 제약바이오산업은 인구고령화로 인해 의약품수요가 증가하면서 규모가 날로 성장하고 있습니다. 국내 의약품시장은 지난 5년 동안 매년 4.5%의 성장률을 보이면서 세계시장의 1.6%, 순위 12위를 차지할 정도로 성장을 거듭했습니다.하지만 지난해 일어난 인보사사태, 임상혼용 등 여러 사건을 통해 제약바이오산업에 대한 국민신뢰도가 크게 떨어진 것도 사실입니다. 따라서 이제 제약바이오기업들은 지난 과오를 반면교사(反面敎師)로 삼아 세계로 나아가면서 제약바이오산업을 새로운 미래국가성장동력으로 삼아야합니다. 이에 헬스경향은 대한민국 제약산업의 현주소와 나아가야할 길을 제시하고자 [국내 제약바이오산업 분석]이라는 기획기사를 준비했습니다. <편집자주>제약산업은 기술집약도가 높지만 그만큼 고위험사업이기도 하다. 하나의 신약개발에 보통 10년 이상 소요되며 연구개발비 역시 무려 1~2조원이 소요된다. 이 때문에 국내 제약기업들은 상대적으로 개발이 빠른 바이오의약품에 관심을 돌리고 있는 상황이다.국내 바이오산업은 1992년 한국생공(현 바이오니아)이 설립되면서 시작됐다. 1990년대 중반까지 매년 20~30개의 바이오벤처기업이 설립됐으며 2000년에는 200개 이상의 기업이 시장에 진출했다. 하지만 이후 황우석사태, 우회상장 등의 이유로 국내 바이오산업에 대한 신용이 추락했다.다행스럽게도 2010년부터 오픈이노베이션(기업이 업체, 대학, 연구기관과 컨소시엄을 구축하는 등 외부전문가와 협업해 미래기술투자에 대한 불확실성을 줄이는 방식)이 활성화되면서 2015년 한미약품, 한올바이오파마, 유한양행, JW중외제약 등이 글로벌제약사와 라이센싱을 체결하기 시작했다.특히 2017년에는 셀트리온이 최초로 의미 있는 실적을 증명하면서 기대감이 증폭했다. 현재 셀트리온의 주력제품으로는 류마티스관절염·궤양성대장염 등 자가면역질환치료제인 ‘렘시마SC’, 유방암치료제 ‘허쥬마’ 혈액암치료제 ‘트룩시마’가 있다.셀트리온 관계자는 ”현재 셀트리온은 14만 리터급 바이오의약품 생산설비를 보유하고 있다“며 ”향후 시장수요를 고려해 다각도로 생산능력 확대를 검토하고 있으며 국내에 3공장을 신설하거나 해외증설을 고려하고 있다“고 말했다.또 세계최대 바이오의약품 위탁개발생산업체(CDMO)인 삼성바이오로직스는 스위스 로자, 독일 베링거인겔하임과 차별성을 위해 제조공정기술(MSAT)를 도입, 대량생산의 기틀을 마련했다. 또 세포배양혁신, 정제라인 단순화를 통해 다른 CDMO와 차별화시켰다. 삼성바이오로직스는 2018년 4월 1일 미국 사이토다인과 최소구매물량 공급계약을 체결했다.한편 다른 국내 제약기업 역시 꾸준히 바이오의약품기술을 수출하고 있다. 한미약품, 동아ST, SK케미칼, 유한양행, 코오롱생명과학, JW중외제약 등이 현재 글로벌제약사에 신약후보물질을 기술수출 중이다. 단 아직까지 상업적 성공단계의 신약이 없어 신약물질사용권리가 반환되는 추세다. 대표적으로 지난해 7월 한미약품이 미국 얀센으로부터 당뇨 빛 비만치료신약물질 ‘HM12525A’의 권리를 돌려받았다.헬스경향 이원국 기자 21guk@k-health.com▶ 장도리 | 그림마당 보기▶ 지금 많이 보는 기사▶ 댓글 많은 기사©경향신문(www.khan.co.kr), 무단전재 및 재배포 금지"
2,‘백신 입찰 담합’ 대형 제약사들 무더기 기소,2020.09.21," 국가예방접종사업 입찰 과정에서 담합한 혐의로 대형 제약업체와 임직원들이 무더기로 재판에 넘겨졌다.21일 법조계에 따르면 서울중앙지검 공정거래조사부(부장검사 김민형)는 SK디스커버리, 보령바이오파마, 녹십자, 유한양행, 광동제약, 글락소스미스클라인, 한국백신판매 등 7개 법인과 임직원 8명 등 총 15명을 독점규제 및 공정거래에 관한 법률 위반 등 혐의로 지난달 초 불구속 기소했다. 이들은 정부가 발주한 자궁경부암 백신 등 입찰에 참여하면서 담합한 혐의를 받는다. 서울중앙지법 형사25-1부(재판장 김선희)는 22일 오후 2시 SK디스커버리 등에 대한 첫 공판준비기일을 열 예정이다.유설희 기자 sorry@kyunghyang.com▶ 장도리 | 그림마당 보기▶ 경향신문 바로가기▶ 경향신문 구독신청하기©경향신문(www.khan.co.kr), 무단전재 및 재배포 금지"
3,오늘의 부고 - 2020년 8월 18일,2020.08.17," ■박춘거 유한양행 전 사장 별세, 박한경씨 남편상, 박은주·현주·은경씨 부친상, 변홍식 삼성창원병원 영상의학과 교수·장윤식 에콜레이드 대표·윤승철 단국대학교 교수 장인상=16일 삼성서울병원. 발인 19일 오전 8시30분 (02)3410-3151■이영자씨 별세, 박종신·종진·영희·계봉·경란·경미씨 모친상, 김용익 건강보험공단 이사장 장모상=17일 국민건강보험공단 일산병원. 발인 19일 (031)900-0444■김옥순씨 별세, 류재성·재동·재란씨 모친상, 김문영 미디어피아 대표 장모상=17일 충북 제천시 제일장례식장. 발인 19일 (043)645-4114■최영희씨 별세, 이일영 비뇨기과 의사 부인상, 정환씨·제환 한국일보 디지털마케팅 팀장·헌경 이화의원 원장·복경씨 모친상, 황상진 한국일보 논설위원실장·이경환 LA미치과 원장 장모상, 이지현·강인영(약사)씨 시부상=16일 오후 2시 삼성서울병원. 발인 19일 오전 8시 (02)3410-3151■김학봉씨 별세, 진홍 국회입법조사처 전산서기관·현기 머큐리 부장·상용 서울경제신문 정치부 차장·소현 우석대학교 학사지원센터장 부친상, 이혜란 KT 광화문지사 차장·신혜정씨(부평건강가정지원센터)·정은경 하나은행 일원역지점 차장 시부상, 김소희씨(신한은행 흑석동지점) 조부상, 신성아씨(고창 해리고) 외조부상=17일 자정 전주효사랑장례문화원. 발인 19일 오전 9시 (063)250-4444▶ 장도리 | 그림마당 보기▶ 경향신문 바로가기▶ 경향신문 구독신청하기©경향신문(www.khan.co.kr), 무단전재 및 재배포 금지"
4,오늘의 인사 - 2020년 7월 2일,2020.07.01," ■법무부 ◇고위공무원 승진 △법무부 정책기획관 최정석 ◇부이사관 승진 △법무부 운영지원과장 김정열 ◇서기관 전보 △북한인권기록보존소장 심경보 △서울보호관찰소 행정지원과장 조상민■국가보훈처 △국립대전현충원장 이경근 △광주지방보훈청장 임성현 △보상정책국 생활안정과장 조경철 △복지증진국 복지운영과장 박용주 △서울북부보훈지청장 윤명석 △경기남부보훈지청장 김남영 △경기북부보훈지청장 황후연 △경기동부보훈지청장 김장훈 △강원서부보훈지청장 이광현 △국립이천호국원장 이순희 △울산보훈지청장 김상출 △경남서부보훈지청장 강석두 △전남동부보훈지청장 김영진 △국립5·18민주묘지관리소장 유형선 △국립임실호국원장 김덕석■특허청 ◇일반직 고위공무원 전보 △특허심판원 심판장 서을수■문화재청 ◇과장급 전보 △국립문화재연구소 국립가야문화재연구소장 김지연 ◇과장급 임용 △국립문화재연구소 문화재보존과학센터장 정소영■통계청 ◇일반고위직공무원 전보 △통계교육원장 은순현■방위사업청 ◇부이사관 승진 △사업감사담당관 김세환 △연구개발총괄팀장 김상호 ◇과장급 전보 △신속획득사업팀장 김현욱 △지휘통제통신계약팀장 김미옥■한국방송광고진흥공사 △광고진흥본부장 김종영■주택금융공사 <전보> ◇지역본부장 △수도권서부 조생현 △동남권 곽해일 △서남권 조성교 ■한국전기안전공사 <승진> ◇1급 △전북지역본부장 박정훈 △전기안전연구원장 김진태 ◇2급(갑) △비서실장 박성근 △기획혁신처 기획부장 표정재 △대전세종충남지역본부 충남중부지사장 강현경 △전기안전연구원 안전연구부장 오치영 △경남지역본부 경남서부지사장 정순홍 △경기지역본부 평택안성지사장 배창수 △광주전남지역본부 전남서부지사장 박병하 <전보> ◇1급 △감사실장 박영웅 △충북지역본부장 정명해 ◇2급(갑) △서울지역본부 서울남부지사장 황광수 △충북지역본부 충주음성지사장 이세호 △검사점검처 검사부장 임성진 △전북지역본부 익산지사장 최동환 △경기지역본부 경기중부지사장 최병우 △강원지역본부 강원동부지사장 조세익 △서울지역본부 서울서부지사장 김희봉 △경기지역본부 경기서부지사장 한재진 △광주전남지역본부 여수지사장 조성만 △감사실 종합감사부장 강수봉 △서울지역본부 서울북부지사장 김종섭 △대구경북지역본부 경북북부지사장 백승락 △대전세종충남지역본부 서산태안지사장 이은석 ■한국수력원자력 ◇본사 △기획본부장 공영택 △재무처장 김형일 △설비기술처장 최헌규 △원전사후관리처장 최득기 △감사총괄부장 오석동 △기업문화부장 김행섭 △회계세무실장 최영재 △설비관리실장 소유섭 △정비총괄부장 김현주 △계측제어설비부장 김영진 ◇고리원자력본부 △대외협력처장 장정일 △제1발전소 1호기 안전관리실장 이병국 △제2발전소 기술실장 이돈국 ◇한빛원자력본부 △제3발전소장 김근수 △제3발전소 운영실장 박원서 ◇월성원자력본부 △대외협력처장 윤상조 △제3발전소장 김성면 △제3발전소 운영실장 김형민 ◇한울원자력본부 △대외협력처장 류명석 △신한울제1건설소장 조석진 △신한울제1건설소 기전실장 김종철 ◇새울원자력본부 △대외협력처장 윤유영 △경영지원실장 이한용 △산청양수발전소장 김태곤 △중앙연구원장 김한곤 ■한국감정원 ◇본부장 △수도권본부장 정상규 △서남권본부장 백승규 ◇실·처장 △ICT추진실장 임성기 △부동산통계처장 김능진 △평가관리처장 채성훈 △녹색건축처장 윤종돈 △시장분석연구실장 강성덕 ◇지사장 △서울강남지사장 김상윤 △서울남부지사장 권용수 △경기남부지사장 서경화 △경기동부지사장 이남훈 △경기북부지사장 최경천 △경기서부지사장 박영래 △춘천지사장 이정섭 △강릉지사장 윤종훈 △천안지사장 마정호 △충주지사장 이정환 △광주지사장 김재남 △제주지사장 장덕자 △부산서부지사장 김종한 △울산지사장 윤관성 △진주지사장 박창일 △대구지사장 한익현 △안동지사장 장우석■한국학중앙연구원 △사무국장 임정훈 △장서각 왕실문헌연구실장 김덕수 △〃 고문서연구실장 정수환■한국보건사회연구원 ◇선임연구위원 △김태완 박세경 신현웅 여유진 ◇연구위원(1급) △최현수 함영진 ◇연구위원(2급) △채수미 ◇부연구위원 △김성아 김세진 ◇책임전문원(1급) △이연희 ◇책임행정원(1급) △조남주 ◇선임행정원 △구은지■한국개발연구원(KDI) △공공경제연구부장 이호준■한국인터넷진흥원 △블록체인진흥단장 오진영 △특구사업지원단장 채승완■한국고전번역원 △기획처장 겸 고전번역전문도서관장 권경열■한국수목원관리원 ◇신규 임용 △국립세종수목원장 이유미■예술의전당 △공연예술본부장 박상훈 △감사실장 태승진 △미래전략실장(직무대행) 김세연 △공연사업부장 양우제 △교육사업부장 김미희 △영상문화부장 손미정■유한양행 ◇부사장 △업무총괄 조욱제 ◇상무 △생활건강사업부장 김성수 △종합병원사업부장·일반병원사업부장 유재천 △특목사업부장 정동균 △마케팅부문장 정주영 △해외사업부장 신명철■하나금융투자 ◇상무대우 승진 △실물투자금융3실장 정원재 △유동화금융실장 서한서 △투자심사실장 윤현석 △영업부금융센터장 김용수 ◇부서장 선임 △IT지원실장 신승철 △인력지원실장 정석용 △준법감시실장 이의수 △신림역지점장 김원림 △범어동지점장 정용범 △압구정금융센터장 김동희 △인천지점장 정진일 △은평지점장 김상진 △익산지점장 유성수 ◇부서장 전보 △정보보호실장 남혁기 △Structured Finance2실장 김태훈 △미금역지점장 김형건 △롯데월드타워WM센터 부센터장 이선희 △일산지점장 전민호■BNK투자증권 ◇승진(이사대우) △FICC솔루션부 김남원■신한생명 ◇부사장 신규 선임 △DB마케팅그룹 이기흥 ◇상무 신규 선임 △금융소비자보호총괄책임자(CCO) 유희창 ■동양생명 ◇임원 승진 △상무보 FC본부장 정강출■오렌지라이프 ◇임원 △부사장(고객유지트라이브장) 김태환 △상무(소비자보호SMG그룹장·CCO) 원경민■GC녹십자 △부사장 임승호■헬릭스미스 ◇전무 △재무경영본부 이재호■세계한인무역협회(월드옥타) ◇지회장 △뉴질랜드 크라이스트처치 손헬렌 △싱가포르 김종윤■한국기자협회 ◇승진 △대외협력본부장 이원희■한국일보 △주필 이충재 <뉴스룸국> △국장 이태규 △제1부문장 박일근 △제2부문장 김정곤(사회부장 겸임) △제3부문장 이영태 △디지털뉴스부장 박선영 △멀티미디어부 기획영상팀장 김주영 △디지털전략부 디지털전략팀장 김주성 <신문국> △국장 정진황 △에디터 겸 논설위원 조재우 최형철 조철환 △에디터 겸 IT전문선임기자 최연진 △에디터 겸 영화전문기자 라제기■아시아투데이 △연예기획부장 조성준■광주매일신문 △전무이사 겸 편집국장 이경수 △사업본부장 오성수■분당서울대병원 <보직임용> △폐센터장 이재호 △척추센터장 김기정 △외과과장 강성범 △흉부외과장 임청 △산부인과장 이정렬 △이비인후과장 김정훈 △신경과장 박경석 △가정의학과장 김주영 △중환자진료부장 윤호일■숭실대 △총무처장 이양주 △AI융합연구원부원장 겸 사이버교육사업단장 이형민 △숭실사이버대학교 총무처장 노현■단국대 △대학원장 마상영 △교육대학원장 겸 사범대학장 고상숙 △정보·지식재산대학원장 이은재 △외국어대학장 김주성 △스포츠과학대학장 이석준 △치과대학장 이해형 △약학대학장 박소영 △대학원 교학처장 최수한 △입학처장 최창환 △국제처장 김재일 △천안캠퍼스 대학생활상담센터장 이애경 △〃 평생교육원장 이영애 △산학협력단장 김호동 △총무인사처장 정우성 △취창업지원처장 윤응구 △천안캠퍼스 산학협력부단장 오승근■성신여대 △교학부총장 박종수 △대학원장 김륜옥 △교육대학원장 박형준 △교무처장 심성아 △연구산학협력단장 윤기헌 △교육혁신원장 강태훈 △성신인권센터장 김명선▶ 장도리 | 그림마당 보기▶ 경향신문 바로가기▶ 경향신문 구독신청하기©경향신문(www.khan.co.kr), 무단전재 및 재배포 금지"
