,title,date,content
220,"‘렉키로나’ 유럽 뚫고, 신약 기술 수출… K-제약·바이오, 다시 날다",2021.11.16,"국내 바이오 신약중 첫 유럽승인국내 제약·바이오 업체가 신종 코로나바이러스 감염증(코로나19) 치료제의 유럽 승인, 신약 기술 수출 등을 잇달아 성사시키며 비상하고 있다. 특히 셀트리온의 경우 후보물질 개발부터 임상 3상, 제품화 단계까지 직접 완료해 의미가 크다는 평가가 나온다. 셀트리온은 자사가 만든 코로나19 항체 치료제 ‘렉키로나’가 국내 바이오 신약 중 최초로 유럽 시장에서 정식 허가를 받았고 현재 30여 개국과 계약을 논의 중이라고 15일 밝혔다. 12일(현지 시간) 유럽연합 집행위원회(EC)는 셀트리온이 개발한 렉키로나를 공식 승인했다. 11일 유럽의약품청(EMA) 산하 약물사용자문위원회(CHMP)로부터 승인 권고 의견을 획득한 지 단 하루 만에 이뤄진 조치다.  업계 관계자는 “보통은 승인 권고를 받고 1, 2개월 걸리는데 매우 이례적”이라며 “팬데믹 상황에서 신속하게 치료 옵션을 확보하려 했던 것으로 보인다”고 했다.  그동안 유럽에서는 글로벌 제약사 길리어드 사이언스가 만든 에볼라 치료제 ‘렘데시비르’가 코로나19 치료제로 대부분 쓰였다. 업계는 유럽에서 코로나19 전용 치료제로 허가받은 것이 렉키로나가 유일해 수요가 클 것으로 보고 있다. 셀트리온 관계자는 “EMA의 허가를 받기 이전부터 여러 국가와 논의하며 수출 준비를 해온 상태”라며 “현재 여러 국가와 계약을 구체적으로 논의 중”이라고 했다. 코로나19 치료제 개발과 백신 위탁생산(CMO)을 놓친 다른 제약사들도 절치부심 끝에 기술 수출 등으로 성과를 내고 있다. 15일 종근당은 인도네시아 합작법인 ‘CKD OTTO’가 알제리 최대 국영 제약사 사이달과 총 3200만 달러(약 380억 원) 규모의 항암제 수출 계약을 체결하고 1차 물량을 출하했다고 밝혔다. 향후 5년간 인도네시아 현지 공장에서 생산하는 항암주사제를 알제리에 수출할 계획이다.  종근당은 올해 6월 췌장염 치료제 ‘나파벨탄’의 코로나19 치료제 가능성을 발견하고 현재 임상 3상을 진행 중이다. 한미약품은 이달 7일 캐나다 제약사 앱토즈 바이오사이언스와 급성골수성백혈병 치료 신약 기술 수출 계약을 체결했다. 계약금으로 1250만 달러(약 148억 원)를 받고 단계별 임상 개발 및 허가 단계에 따른 상업화 기술료(마일스톤) 등으로 총 4억2000만 달러(약 4961억 원)를 받는다.  SK바이오팜은 이달 11일 글로벌 투자사 ‘6 디멘션 캐피털(6D)’과 중추신경계 제약사를 설립하고 중국 시장에 본격적으로 진출했다. 회사는 미국과 유럽에서 판매 중인 뇌전증 신약 ‘세노바메이트’를 포함해 6개 신약 파이프라인의 중국 판권을 신생 법인에 기술 수출해 1억5000만 달러(1780억 원) 규모의 지분을 획득하고 선계약금, 마일스톤 등을 확보했다. 업계 관계자는 “신약 해외 승인, 기술 수출 등으로 제약사들의 해외 비즈니스 경험이 올라가고 있다”며 “특히 셀트리온은 치료제 후보물질 탐색부터 제품화까지 포기하지 않고 완수해 국내 제약업계에 시사점을 안겨준 것 같다”고 했다."
221,"삼바 등 K-바이오, 위드 코로나 시대 해외사업 발굴 나서",2021.11.10,"밀라노 국제의약품박람회 개막국내 20여개사 참가 경쟁력 알려한국 제약·바이오 기업들이 이탈리아에서 열리는 국제의약품박람회(CPhI Worldwide 2021)에 참가해 해외 사업 발굴에 나선다. 9일(현지 시간) 이탈리아 밀라노에서 삼성바이오로직스를 비롯한 국내 20여 개 기업이 참가한 가운데 CPhI가 막을 올렸다. 11일까지 사흘 동안 열리는 이번 박람회에는 전 세계 170개국에서 1400여 개 기업이 참가한다. 세계 최대 규모의 의약품 연례 전시회로 꼽히는 CPhI는 원료의약품과 완제의약품뿐만 아니라 의약품 포장재와 설비, 물류 등 관련 사업 전체를 아우르는 제약·바이오 업계 글로벌 교류의 장이다. 지난해에는 신종 코로나바이러스 감염증(코로나19) 유행 때문에 온라인으로만 열렸지만 올해는 온·오프라인 동시 행사로 개최된다. 국내 기업 중 최대인 260m² 크기의 단독 부스를 마련한 삼성바이오로직스는 ‘미래를 향한 무한 가능성(Infinite Possibilities for the Next Decade)’을 주제로 단일 공장 세계 최대 규모 생산시설인 제4공장 소개에 나선다. 지난해 11월 인천 송도 글로벌캠퍼스에서 착공한 제4공장은 내년 부분 생산을 눈앞에 두고 있다. 총 1조7400억 원을 투입해 2023년 전체 가동을 목표로 하는 제4공장은 생산량 25만6000L로 현재 단일 공장 기준 세계 최대 생산시설인 제3공장(18만L)의 자체 기록을 스스로 넘어설 예정이다. 삼성바이오로직스는 부스의 대형 파노라마 패널을 활용해 자체 세포주 ‘에스초이스(S-CHOice)’ 등 바이오의약품 위탁생산개발(CDMO) 사업 분야에서의 경쟁력도 알린다. 함께 전시회에 나서는 JW홀딩스는 의약품과 헬스케어 등 2개 구역으로 구성된 독립 부스에서 종합 영양수액제 위너프와 항생제를 소개한다. 한미약품은 완제의약품과 원료의약품 분야에서 다국적 제약사 등과 만나며 해외 판로를 개척할 계획이다. 제약·바이오 업계 관계자는 “많은 나라가 ‘위드 코로나’ 상황으로 접어드는 가운데 제약·바이오 기업들이 본격적인 글로벌 사업 재개를 알리는 행사”라고 말했다."
222,"[단독]한미, 코로나19 백신 파트너십 전문가 그룹 본격화",2021.07.14,"한미 코로나19 백신 파트너십 전문가 그룹이 지난달 첫 회의를 열고 주제별로 소그룹을 구성중인 것으로 알려졌다. 올해 5월 한미정상회담에서 논의된 ‘글로벌 백신 허브 프로젝트’가 본격화되는 양상이다. 국내 제약·바이오 업계는 메신저리보핵산(mRNA) 백신의 기술 이전 여부에 관심을 모으고 있다. 전 세계에서 백신 접종 양극화 현상이 심각화 되는 가운데, K제약바이오가 백신 허브로 거듭날지 주목된다. 강병원 의원실 제공14일 이상민·강병원 더불어민주당 의원과 최형두 국민의힘 의원 주최로 국제보건협력전략 세미나가 개최됐다. 행사에는 보건복지부와 외교부, 기획재정부 국장급이, 업계에서는 안재용 SK바이오사이언스 대표가 발표자로 나서는 등 정부·외교·민간 채널이 총출동 했다. 또 온라인 세미나를 활용해 리차드 햇체트 전염병대비혁신연합(CEPI) 대표와 조 세렐 빌앤멜린다게이츠 재단 대외협력 총괄이사도 주제 발표에 참여했다.  강병원 의원실 제공세미나에서는 한국의 ‘글로벌 백신 허브’ 도약이 핵심 내용으로 논의됐다. 이와 관련해 이강호 보건복지부 보건산업정책국장은 ‘속도’를 강조했다. 이 국장은 “현재 모든 나라가 생산 설비를 확충하고 있기 때문에 내년 상반기까지가 굉장히 중요하다”고 밝혔다. 이와 관련해 정부와 업계가 발빠르게 대응하고 있다고 강조했다. 한미정상회담에서 양국은 글로벌 백신 허브화를 추진하기로 한 바 있는데, mRNA 등 미국 기술력과 한국의 생산 능력을 결합하는 게 골자다. 이를 위해 정부는 지난달 9일 한미 전문가들이 1차 회의를 진행했으며, 현재 세부적인 논의를 위해 소그룹을 구성하고 있다고 했다.  강병원 의원실 제공국내에서는 업계 생산 능력을 체크하고, 원부자재 개발을 빠르게 진행해왔다. 이 국장은 “지난달 글로벌 백신 허브화 추진 태스크포스(TF)를 구성하고 3차례 회의를 진행했으며 민간 협의체도 구성했다”고 밝혔다. 또 “원부자재 생산 능력도 중요한데 기업들이 이를 잘 추진하고 있다”고 덧붙였다. 한미사이언스는 최근 mRNA 핵심 원료 6종 생산에 성공한 바 있다. 보건복지부와 한국제약바이오협회는 지난달 말 한미약품·에스티팜·GC녹십자 3개 주축 기업과 ‘차세대 mRNA 백신 플랫폼 기술 컨소시엄’을 출범하기도 했다.   정부는 ‘위탁생산+자체생산=백신 수출 및 자급화’ 공식을 목표로 하고 있다. 안재용 SK바이오사이언스 대표는 이날 세미나에서 “자체 개발 중인 백신이 곧 임상 3상에 진입하며 내년 초 상업화할 계획”이라고 밝혔다. 최근 코로나19 재확산을 일으킨 변이에 대해서는 “오리지널 프로토타입을 만들어 놓으면 변이에 대응하는데 오래 걸리지 않는다”며 “이에 대한 연구도 동시에 진행하고 있다”고 했다. 그는 코로나19 대응에 정부와 외교 채널이 총동원되고 있으며 민간에서도 전방위적인 대응이 필요하다고 강조했다.   실제로 현재 아프리카 등 저개발국에서는 백신 수급에 어려움을 겪고 있다. 토니 블링컨 미국 국무장관은 “이대로 가다간 2024년까지 전세계적 집단면역 수치인 70%에 도달하지 못할 것”이라고 우려했다. 세미나에서 햇체트 CEPI 대표는 “코백스 퍼실리티(COVAX Facility·국제 백신 공유 프로젝트)는 현재까지 135개 나라에 1억 회 분량의 백신을 보급했으며 올해 말까지 20억 회 분의 백신을 보급하는 것이 목표”라며 “백신 불평등을 해소해야 한다”고 강조했다. 이와 함께 4조92억 원 규모를 투자하는 5개년 계획을 밝혔다. 이어 “한국의 바이오 산업은 빠르게 성장했으며 글로벌 백신 허브로 도약하는 데 강력하게 지지한다”고 했다."
223,혁신신약 개발로 ‘K바이오’ 위상 높인다,2021.06.28,"국내 제약-바이오 업계 ‘신약 파이프라인’ 강화신종 코로나바이러스 감염증(코로나19) 확산 이후 주목을 받고 있는 국내 제약·바이오 업계가 신약 개발에 박차를 가하고 있다. 기존 사업의 경쟁력을 끌어올려 해외 진출 등 글로벌 경쟁력을 다져가는 회사들도 나타나고 있다. 정부도 이를 돕기 위해 발 벗고 나섰다. 최근 국내 제약사들이 ‘블록버스터’ 신약을 개발할 수 있도록 임상시험 인프라를 대폭 확충하는 등 적극적으로 지원한다는 방침을 밝혔다. ‘K신약’ 개발 한창27일 제약·바이오 업계에 따르면 한미약품은 지난해 매출의 21%인 2261억 원을 연구개발(R&D)에 과감히 투자했다. 신약 후보물질을 발굴하기 위해서다. 한미약품은 2011년 이후 12건의 신약 후보물질 기술 도입 및 수출을 일궈냈다. 한미약품이 현재까지 확보한 파이프라인은 30개 정도. 600여 명의 연구 인력이 자체개발하고, 바이오벤처 등으로부터 기술 도입과 공동연구 등을 이끌었다.    올해 3월에는 한미약품의 호중구 감소증 치료제 ‘롤론티스’가 국내 33번째 국산 신약으로 허가 받았다. 이 약은 현재 미국 시판 허가를 위한 마지막 단계에 진입했다. 같은 시기에 비소세포폐암 치료 신약 ‘포지오티닙’은 미국 식품의약국(FDA)으로부터 패스트트랙 지정을 받기도 했다. 한미약품 관계자는 “파트너사인 스펙트럼이 포지오티닙의 FDA 시판허가 신청을 위해 최선을 다하고 있다”며 “다양한 분야에서의 혁신신약 개발을 할 수 있도록 회사의 모든 역량을 집중할 계획”이라고 말했다. 일동제약도 신약 개발에 총력을 기울이고 있다. 지난해 일동제약은 전체 매출의 14%인 786억 원을 연구개발에 썼다. 올해는 1분기(1∼3월)에만 전년 동기 대비 70% 늘어난 261억 원을 신약 개발에 투자했다. 일동제약은 고형암 치료제, 제2형 당뇨병 치료제, 간 질환 치료제, 파킨슨병 치료제 등 유망한 신약 파이프라인을 확보한 상태다. 일동제약 관계자는 “특히 제2형 당뇨병치료제 후보물질을 핵심과제로 삼고 있다. 전임상 시험에서 경쟁 물질에 비해 우수한 혈당 강하 효과를 보였다”고 했다. 종근당은 지난해 1500억 원가량을 연구개발에 쏟아부었고, 국내 제약사 중 가장 많은 22건의 임상시험을 승인 받았다. 합성신약, 바이오신약, 개량신약 개발에 역량을 집중하는 모양새다. 보령제약은 바이젠셀에 대한 재무적 투자를 넘어 신약 파이프라인 개발과 마케팅을 공동으로 진행하며 시너지를 기대하고 있다. 바이젠셀은 면역항암치료제 2종과 면역억제치료제 1종 등 3가지 플랫폼 기술을 보유하고 있다. 글로벌 공략해 ‘퀀텀점프’ 노린다  기존에 개발 중인 신약을 무기로 해외 시장을 두드리는 업체들도 눈에 띈다. 대웅제약은 이달 초 미국 제약사인 뉴로가스트릭스와 위식도역류질환 신약 ‘펙수프라잔’의 라이선스아웃 계약을 체결했다. 지난해에는 브라질과 멕시코 업체에 수출 계약을 체결했고, 중국에서는 의약품관리국(NMPA)으로부터 3상 임상시험 계획을 승인 받는 등 중국 시장 진출에도 박차를 가하고 있다. 회사 관계자는 “펙수프라잔은 단일품목으로 총 1조 원이 넘는 기술이전 계약을 달성했다. 글로벌 블록버스터 신약으로 육성될 것”이라고 했다.  GC녹십자는 희귀질환 치료제로 해외 시장을 공략한다. 녹십자는 2012년 세계에서 두 번째로 희귀질환 헌터증후군에 대한 치료제를 개발한 바 있다. 이를 기반으로 지난해 9월 중국에서 최초 헌터증후군 치료제로 품목 허가를 획득했다. 올해 1월에는 일본에서 시판 허가까지 받았다. JW중외제약은 최근 ‘어타페넴’ 원료로 만든 항생제를 미국에서 출시했다. 국내에서 이 항생제 원료를 사용한 완제품이 미국 시장을 공략한 건 이번이 처음이다. 글로벌 어타페넴 항생제 시장은 지난해 기준 4억100만 달러(약 4500억 원) 규모이며, 미국 시장이 절반 이상을 차지하고 있다. 올해로 창립 95주년을 맞은 유한양행은 신약 개발과 해외 시장을 동시에 노린다. 유한양행의 폐암치료제인 ‘렉라자’는 여러 국가에서 임상 3상을 진행 중이다. 글로벌 신약으로 한걸음 다가섰다는 평가를 받고 있다. 유한양행 관계자는 “최근 3년간 5건의 4조 원 규모 기술 수출 성과를 이뤘다. 중장기적 관점에서 연구개발에 투자했기 때문에 가능했던 일”이라며 장기적인 발전을 위해 투자를 이어가겠다는 의지를 내비쳤다."
224,"[단독]제약업계, AI 활용해 신약 개발한다",2021.07.05,"獨머크 소프트웨어 ‘신시아’ 도입약물 합성 경로 다양하게 설계‘K신약’ 개발 시간 줄이고 저변 확대국내 제약·바이오 업계가 인공지능(AI)을 활용해 신약 개발에 도전한다.  4일 제약·바이오 업계에 따르면 한국제약바이오협회 산하 AI신약개발지원센터가 올해 5월 글로벌 제약사인 독일 머크 라이프사이언스의 신약 개발, 후보물질 탐색 소프트웨어 ‘신시아’를 도입해 지난달 중순부터 사용하기 시작했다. AI를 활용해 약물의 합성 경로를 다양하게 설계하고, 저렴하면서도 구하기 쉬운 시재료를 찾아내주는 소프트웨어다. 신시아는 분자 단계인 신약 개발 초기 단계에서 화학물질의 합성 방법을 빠르고 정확하게 분석해 신약 개발 시간을 단축시켜 준다. 기존 약물에 대해서는 더 저렴한 재료를 찾아내 생산 비용을 줄여준다. 신시아는 제네릭(복제약) 항바이러스제인 ‘우미페노비르’와 ‘파비피라비르’ 등 11개 의약품을 만드는 새로운 합성 방법을 찾아내기도 했다. 업계는 이를 계기로 국내 대형 제약사들이 도전하던 ‘K신약’ 개발의 저변이 업계 전반으로 확대될 수 있을 것으로 기대하고 있다. 기존 국내 제약·바이오 업계는 제네릭 위주로 성과를 올려왔다. 그러다가 몇 년 전부터 한미약품, 유한양행, 녹십자 등 국내 대형 제약사들이 ‘조 단위’의 기술 수출에 성공하면서 신약 개발에 자신감이 붙은 상태다. 최근 업계는 222개 회원사가 가입된 협회를 중심으로 정부와 함께 오픈이노베이션을 늘리는 방향으로 경쟁력을 키우고 있다. AI센터는 지난해 9월 SK㈜ C&C, 네이버 등 정보기술(IT) 기업과 협약을 맺는 등 업계가 신약 개발에 AI를 활용할 수 있도록 인프라를 구축하는 데 힘쓰고 있다. 지난달 말에는 한미약품, 에스티팜, GC녹십자 등 3곳을 주축으로 차세대 메신저리보핵산(mRNA) 백신 기술을 확보해 대량생산 체계를 만들 ‘K-mRNA’ 컨소시엄도 출발했다. 7000억 원 이상을 투자해 mRNA 플랫폼으로 항암 백신과 차세대 혁신 신약도 개발할 계획이다.  원희목 한국제약바이오협회장은 “글로벌 제약사와 경쟁하고, 블록버스터 신약을 개발하기 위해선 힘을 모아야 한다”고 했다."
225,"“2년내 토종 mRNA 백신 개발”…정부-제약사 협업, 7000억 투입",2021.06.30,"정부와 국내 제약·바이오 업계가 2년 안에 국산 신종 코로나바이러스 감염증(코로나19) 메신저리보핵산(mRNA) 백신을 개발하기 위해 7000억 원을 투입한다. 보건복지부와 한국제약바이오협회는 29일 서울 중구 코리아나호텔에서 한미약품·에스티팜·GC녹십자 3개 주축 기업 및 한국혁신의약품컨소시엄(KIMCo) 등과 ‘차세대 mRNA 백신 플랫폼 기술 컨소시엄’ 출범식을 열었다. 국내 업체들이 협업해 mRNA 코로나19 백신 플랫폼 기술을 확보하고 대량생산 체계를 갖춰 백신 자급화와 수출 기반을 마련하겠다는 취지다.  ‘K-mRNA 컨소시엄’은 내년까지 국산 mRNA 기술을 확보해 1억 도스 분량의 코로나19 백신을 생산할 계획이다. 비임상 단계의 후보물질을 임상 단계로 진입시켜 국산 백신 개발을 빠르게 진행할 예정이다. 2023년까지는 백신 대량생산 체계를 확립하고 연간 10억 도스 이상을 생산해 국내 공급뿐만 아니라 수출도 추진할 예정이다.  이를 위해 컨소시엄에 참여한 한미약품, 에스티팜, GC녹십자는 임상·핵심 원료·생산설비 구축 등에 7000억 원 이상을 투자한다. 향후 컨소시엄 참여 범위도 확대하고 2025년까지 mRNA 플랫폼으로 항암 백신과 차세대 혁신 신약도 개발할 계획이다."
226,서브원 “B2B 영업망 활용 ‘코로나19 자가 검사 키트’ 대량 유통”,2021.05.10,"신속 항원진단키트에 이어, 자가검사키트 기업고객에 공급 기업운영자재(MRO) 구매 솔루션 전문 기업 서브원(대표이사 김동철)은 기업체를 대상으로  코로나19 자가 검사 키트 대량 유통에 나선다고 10일 밝혔다.서브원에 따르면 지난 1월 한미약품과 업무협약을 통해 ‘HANMI COVID-19 Quick TEST 신속 항원진단키트’를 독점 공급하기 시작했다. 이번에도 한미약품과 손잡고 5월 10일부터 ‘HANMI COVID-19 Home Test’를 자체 B2B 영업망을 활용해 대량 구매가 필요한 기업고객을 대상으로 유통한다.자가 검사 키트는 지난 4월 식품의약품안전처에서 조건부 허가를 획득한 제품으로, 사용자가 직접 콧속(비강)에서 채취한 검체를 키트에 떨어뜨려 검사 결과를 15~30분 안에 육안으로 확인할 수 있다. 키트에 붉은색 두 줄(대조선C, 시험선T)이 나타나는 양성이 나오면 반드시 선별진료소를 방문해 표준검사인 유전자 증폭(PCR) 방식 진단 검사를 받아야 한다. 붉은색 한 줄(대조선C)이 나타나는 음성이 나오더라도 감염이 의심되거나 증상이 있으면 PCR 검사를 받아야 한다.김동철 대표이사는 “서브원이 거래하고 있는 700여 개의 기업체를 대상으로 수요 조사를 하고, 사전 물량을 대량으로 확보하겠다”며 “이를 통해 긴급으로 필요한 기업고객에게 합리적인 가격으로 공급할 예정이다”라고 말했다.한미약품은 “서브원과 업무협약을 통해 신속 항원진단키트뿐만 아니라 금번 자가검사키트까지 공급하게 되었다”면서 “코로나19 검사의 보조적 수단으로서, 이번 ‘HANMI COVID-19 Home Test’의 기업체 유통의 코로나19 감염 확산 방지에 큰 도움을 줄 수 있을 것으로 기대하고 있다”고 말했다.박해식 동아닷컴 기자 pistols@donga.com▶ 네이버에서 [동아일보] 채널 구독하기▶ 당신의 소중한 순간을 신문으로 만들어 드립니다▶ 멀티미디어 스토리텔링 ‘The Original’ⓒ 동아일보 & donga.com, 무단 전재 및 재배포 금지"
227,"코로나19 자가검사키트, 오늘부터 약국 등 전국 유통",2021.04.29,"가격은 2개입 1만6000원식품의약품안전처는 품목 허가가 내려진 SD바이오센서의 신종 코로나바이러스 감염증(코로나19) 자가검사키트를 한미약품이 유통해 약국 등에서 구매할 수 있다고 밝혔다. 한미약품은 29일 온라인팜을 통해 코로나19 자가검사키트의 전국 유통을 시작했다. 이에 따라 소비자들은 빠르면 이날부터 약국에서 제품을 구매할 수 있다. 한미약품은 일반 고객용 온라인팜 쇼핑몰 사이트인 프로-캄 홈페이지에서도 자가검사키트를 판매할 예정이다. 가격은 2개입 1만6000원이다. 자가검사키트의 사용법은 간단하다. 사용자가 직접 콧속에서 채취한 검체를 키트에 떨어뜨려 15~30분 안에 양성 여부를 확인할 수 있다. 키트에 붉은색 두 줄(대조선C, 시험선T)이 나타나는 ‘양성’ 반응이 나오면 반드시 선별진료소를 방문해 표준검사인 유전자 증폭(PCR) 방식 진단 검사를 받아야 한다.다만 정식 검사법에 비해 정확성이 다소 떨어진다는 것이 단점이다. 정은경 질병관리청장은 이날 브리핑에서 “개인이 신속한 확진 검사가 어려울 경우에 보조적 수단으로 사용하는 것이 원칙”이라고 했다.이어 “무증상자에 대해선 검증이 돼 있지는 않은 상황”이라며 “결과가 음성일 경우라도 가짜음성이 있을 수 있기 때문에 방역수칙은 반드시 준수하고 감염이 의심될 경우 별도로 PCR 검사를 받으시는 게 필요하다”고 강조했다. 조혜선 동아닷컴 기자 hs87cho@donga.com▶ 네이버에서 [동아일보] 채널 구독하기▶ 당신의 소중한 순간을 신문으로 만들어 드립니다▶ 멀티미디어 스토리텔링 ‘The Original’ⓒ 동아일보 & donga.com, 무단 전재 및 재배포 금지"
