,title,date,content
142,취준생들이 가고 싶은 제약사 1위는...,2020.11.19,"제약·바이오 회사 취업을 준비하는 취업준비생들이 가장 취업하고 싶은 회사는 ‘셀트리온’이었다.										취업포털 잡코리아가 제약·바이오 회사 취업을 준비하는 취업준비생 874명을 대상으로 <제약·바이오 회사 취업 선호도>조사를 실시했다. 이번 조사는 시가총액 순위 상위 1000위권 내 제약·바이오사 44개사 중 복수 회사를 선택하는 방식으로 진행됐다(시가총액 순위, 11월 10일(화) 오전 10시 기준).제약·바이오 회사 취업을 준비하는 구직자들이 꼽은 ‘가장 취업하고 싶은 제약·바이오 회사’ 1위는 ‘셀트리온(21.1%)’이었다. 2위는 ‘삼성바이오로직스(16.4%)’가 차지했고, ‘녹십자(15.7%)’와 ‘광동제약(15.4%)’은 근소한 차이로 3, 4위에 올랐다. 이 외에는 △유한양행(10.5%), △종근당(9.3%), △SK바이오팜(7.2%), △한미약품(5.3%), △대웅제약(4.9%), △삼성제약(4.3%) 순이었다.취업하고 싶은 제약·바이오 회사 순위는 취준생들의 전공계열에 따라 다소 차이를 보였다. 먼저 경상계열 전공자(1위 셀트리온-23.4%)와 이공계열 전공자(1위 셀트리온-24.0%)등 대다수 전공 그룹에서 취업 선호 1위 기업으로 셀트리온을 꼽은 반면, 인문계열 전공자들은 취업 선호 회사 1위에 ‘녹십자(19.0%)’를 꼽아 차이를 보였다. 인문계열 전공자들이 뽑은 취업하고 싶은 제약·바이오 회사 TOP3는 ‘녹십자(19.0%)’, ‘광동제약(16.9%)’, ‘셀트리온(16.4%)’이었다.제약·바이오사 취준생들이 취업선호 기업 선택 시 가장 영향을 받은 요인은 ‘연봉’이었다. 선택한 제약·바이오사에 취업하고 싶은 이유를 조사한 결과 ‘연봉이 높을 것 같아서(31.5%)’란 답변이 1위에 오른 것. 다음으로 ‘직원 복지제도가 좋을 것 같아서(28.3%)’와 ‘평소 기업 이미지가 좋아서(28.0%)’, ‘가장 성장성 있는 기업으로 보여서(17.2%)’등도 취업선호 기업 선정에 영향을 준 주요 요인이었다[김강한 기자 kimstrong@chosun.com] 		▶ 코로나19 현황 바로가기		▶ 당신의 맞춤뉴스 '뉴스레터' 신청하세요 		▶ 조선일보 로그인하고 영화 공짜로 보자!"
143,"신풍제약 미스터리, 영업이익 20억인데 주가 2895% 폭등",2020.09.21,"시가총액 10조, 코스피 30위로							코로나 충격으로 증시가 급락했던 지난 3월 이후 주가가 가장 많이 오른 신풍제약이 지난 18일 하루에 2조원 이상 거래되며 또다시 상한가를 찍었다. 증권업계에선 신풍제약이 ‘수익률 킹’에 올랐지만 영업이익이 20억원에 불과한데 시가총액이 10조원에 달해 미스터리 현상으로 주목하고 있다.20일 한국거래소에 따르면, 코스피와 코스닥 지수가 연중 최저치로 떨어졌던 지난 3월 19일 이후 이달 18일까지 2300여 상장 종목 중 가장 높은 주가 상승률을 기록한 종목은 신풍제약이었다. 신풍제약의 주가는 해당 기간 6610원에서 19만8000원으로 급등해 2895% 수익률을 올렸다.										신풍제약은 지난 1962년 설립된 의약품 제조업체다. 혈압약이나 소염진통제 같은 복제약을 여러 종류 파는 회사로 알려져 있다. 지난 5월 식품의약품안전처가 신풍제약의 말라리아 치료제인 ‘피라맥스’에 대해 코로나 치료 효과를 확인하는 임상 2상 시험을 승인해주면서 반전이 생겼다. 임상 3상까지 끝내려면 아직도 갈 길이 멀지만, 코로나 치료제로 주목받으면서 주가가 가파르게 올랐다. 시가총액이 불어나자 지난 8월 미국 모건스탠리캐피털인터내셔널(MSCI) 한국 지수에 편입됐고 이달에는 영국 파이낸셜타임스스톡익스체인지(FTSE) 지수에 포함됐다.지난 18일 신풍제약은 FTSE 지수 편입에 따른 외국인 매수(1879억원) 덕에 상한가(전날보다 30% 상승)를 찍어 19만8000원에 장을 마쳤다. 거래 대금은 2조512억원으로, 코스피와 코스닥을 통틀어 1위였다. 2위인 LG화학보다 거래 대금이 1조원이나 많았다.종가 기준 시가총액은 10조4910억원으로, 코스피 시총 기준 30위였다. 지난해 3조2600억원의 영업이익을 거둔 하나금융지주나 2조8000억원의 영업이익을 올린 우리금융지주보다도 시총이 높다. 또 국내 3대 제약사(유한양행, 한미약품, 대웅제약)의 시총을 합친 것보다도 1조3000억원이나 많다.하지만 신풍제약의 지난해 영업이익은 20억원에 불과하고, 심지어 2017년 90억원, 2018년 69억원으로 매년 줄고 있다.증권업계 관계자는 “신풍제약이 상한가를 찍으면서 10조짜리 대마(大馬)가 된 것은, 말 그대로 ‘기계’의 한계를 보여준다”면서 “코스피나 FTSE 등 지수를 따르는 펀드들은 무조건 그 지수에 포함된 종목들을 사들여야 하기 때문에 기업 가치와 상관없는 주가 급등이 나타날 수 있다”고 말했다.신풍제약은 시가총액이 10조원 넘는 초대형 종목이 됐지만 아직까지 증권사 리서치센터 분석 보고서가 하나도 없다. 증권업계 관계자는 “몇몇 증권사 애널리스트들이 신풍제약 탐방을 다녀왔지만 투자할 만한 이유를 찾지 못해 보고서를 내지 못했다고 한다”면서 “회사 실적이 가시화되려면 시간이 많이 걸릴 수 있는 만큼 뒷북 투자를 유의해야 한다”고 조언했다.전문가들은 향후 신풍제약 지분 28%를 보유하고 있는 오너 일가의 주식 매매 움직임에 주목해야 한다고 지적한다. 실적이나 가치 대비 주가가 과대 평가되었다면 대량 매도에 나설 수 있기 때문이다. 작년 말 1000억원대였던 오너 일가의 지분 가치는 현재 3조원에 육박한다.[이경은 기자 diva@chosun.com] 		▶ 코로나19 현황 바로가기		▶ 당신의 맞춤뉴스 '뉴스레터' 신청하세요 		▶ 조선일보 로그인하고 영화 공짜로 보자!"
144,[부음] 기갑순씨 별세 외,2020.08.13,"▲기갑순 별세, 김선희·김현숙 의정부 녹양초 교사·김숙희·김혜경 서울 잠원초 교사·김용성 JPC엔지니어링 대표·김홍성 화성 봉담고 교사 모친상, 강홍구 한미약품 총괄팀장·이민종 문화일보 산업부장·이현배 메니인소프트 솔루션개발팀장·이경용 제이종합개발 대표 장모상=11일19시40분 서울아산병원, 발인 13일6시, (02)3010-2000▲김도규 기독교 대한성결교회 증경 부총회장 별세, 김영민·김영란 부친상=12일9시1분 신촌세브란스병원, 발인 14일7시20분, (02) 2227-7590▲김병곤 별세, 김성영 금강유리 부사장·김대영 85서울정형외과 원장 부친상, 임환수 前 국세청장 장인상=12일 2시 삼성서울병원, 발인 14일7시30분, (02)3410-6917▲김정분 별세, 조도연 충북 옥천군 기획감사실 기획팀장 모친상=12일13시35분 옥천 성모장례식장, 발인 14일9시, (043)733-0808▲김화연 별세, 오현주 남편상, 김현우·김가은 KB스타즈 여자프로농구단 선수 부친상, 노현영 시부상=11일 22시2분 신촌세브란스병원, 발인 14일6시20분, (02)2227-7547▲류영우 前 풍산 부회장 별세, 변연숙 남편상, 류정 서창 대표·류현 부친상, 유선 시부상, 류태후·류승희 조부상=12일12시 서울아산병원, 발인 14일5시20분, (02)3010-2000▲신정태 별세, 김도형 울산시 중구 건설과 주무관 모친상=12일11시57분 대구 배성병원, 발인 14일9시, (053)382-1600▲이병준 별세, 이광용 주한몰타공화국 명예영사·이봉용·이길용 부친상, 이재구·이재호 조부상=12일 8시50분 서울성모병원, 발인 14일8시, (02)2258-5940 		▶ 집 있어도 없어도 스트레스, 혼돈의 부동산		▶ 유용원 군사전문기자의 밀리터리시크릿 '밀톡' 		▶ 과학이 이렇게 재밌을수가~ '사이언스카페' 	- Copyrights ⓒ 조선일보 & chosun.com, 무단 전재 및 재배포 금지 -"
145,"2200% 급등한 황제주가 순식간에 불개미 지옥으로, 왜?",2020.07.27,"대한민국 개미들의 서민 탈출구로 급부상했던 신풍제약이 27일 장중에 17% 넘게 급락하면서 8만6000원선에 거래 중이다. 개미들이 일제히 물량을 쏟아내면서 매물이 매물을 부르는 아비규환이 연출되는 모양새다.지난 1962년 설립된 신풍제약은 완제 의약품 제조업체로, 지난 5월 말라리아 치료제인 ‘피라맥스’가 코로나 치료제로 2상을 승인받으면서 주목을 받았다.올해 초만 해도 주당 7000원선에서 거래됐던 신풍제약은 지난 24일에는 장중 15만9500원을 찍으면서 약 2200%의 수익률을 기록하면서 한국 증시의 수퍼스타로 자리잡았다. 거침없는 주가 상승이 계속되자, 한국거래소는 지난 17일 신풍제약을 투자경고 종목으로 지정하고 21일엔 거래도 중지했다. 하지만 이런 경고에도 아랑곳않고 신풍제약은 22일 또다시 상한가를 기록했고, 23일 다시 거래가 정지됐다.24일 거래가 재개된 이후에도 신풍제약은 아침부터 무섭게 상승했고, 장중엔 상한가까지 찍었다. 역사적 신고가를 기록하자, 모든 개미 주주들이 기뻐하며 환호했다. 그런데 장 마감 직전, 순식간에 차트가 무너지기 시작했고 주가는 전날보다 14.6% 하락해 10만5000원에 마감했다.장중 한때 시가총액이 8조4500억원을 웃돌아 국내 3대 제약사(유한양행·한미약품·대웅제약)를 합친 것보다 더 많았던 신풍제약의 시가총액은 단 10분 만에 3조원이 사라졌다. 27일에도 주가가 폭포수처럼 흘러내리면서 시총은 약 4조6000억원선까지 쪼그라들었다. 그래도 현재의 신풍제약 시총은 공기업인 한국가스공사(시총 2조4000억)를 2개는 살 수 있을 만큼 크다.지난 2월 홍남기 부총리 겸 기획재정부장관이 코로나 관련 수출 제약바이오 기업의 애로사항을 듣기 위해 충북 오송 생명과학단지 내에 있는 신풍제약 3공장을 둘러보고 있다. 한국거래소에 따르면, 이달 신풍제약의 주가를 급등시킨 것은 사실상 개인들이다. 7월 주식 거래 비중의 약 96%를 개인이 차지했고, 외국인은 3.2%이고 기관은 0.3% 정도로 미미하다. 또 주도 세력인 개인들의 순매수 규모는 많아봤자 하루에 100억원 정도여서 방망이를 매우 짧게 쥐고 사고 팔고 한다는 점도 눈에 띈다.증권업계 관계자는 “회사가 앞으로 성장해서 배당도 많이 줄 테니 주주가 되겠다는 것이 아니라, 앞으로는 어떨지 잘 모르겠고 거래가 많이 붙은 급등 그래프에 잠깐 들어가서 배불리 먹고 나와야지 라는 탐욕에 눈이 멀어 진입한 개미들이 많은 것 같다”고 말했다. 개미들은 주식 투자를 하면서 이른바 ‘작전 세력’에 얹혀서 쉽게 먹고 탈출할 수 있을 것이라고 자만하지만, 현실은 그렇게 쉽지 않다는 얘기다.공매도(주가 하락에 베팅하는 것)가 금지된 틈을 타서 세력들이 주가를 크게 끌어 올린 뒤에 수백억원대의 차익을 챙기고 떠난 것이란 의견도 나온다. 공매도 제도가 있었다면 가치에 비해 지나치게 오르는 주가를 진정시켜 개미들의 참사를  막는 효과가 있었을 것이란 얘기다.[이경은 기자 diva@chosun.com] 		▶ 유용원 군사전문기자의 밀리터리시크릿 '밀톡' 		▶ 과학이 이렇게 재밌을수가~ '사이언스카페' 		▶ TOP7의 비하인드 스토리 '트롯맨 열전' 받으세요	- Copyrights ⓒ 조선일보 & chosun.com, 무단 전재 및 재배포 금지 -"
146,2020 소비자가 뽑은 올해의 브랜드대상 (4),2020.07.16,"사포닌이 타 제품보다 3~4배 많아 '네배홍삼'으로 불려홍삼 부문 천년순수 홍삼오렌지기업 제공천년순수 홍삼은 '3대 순수ㆍ11대 경쟁력'을 슬로건으로 내세운 홍삼 제품을 선보이고 있다. 면역력 향상, 혈류 개선, 노화방지, 피로회복, 기억력 증진 등에 좋은 홍삼의 주요 성분인 진세노사이드(사포닌)가 다른 홍삼 브랜드 제품에 비해 3~4배 이상 함유되어 '네배홍삼'이라고도 불린다. 타 제품에 사용되는 산화방지제, 산도조절제, 고결방지제, 안정제, 응고제, 증점제, 향미증진제, 감미료, 영양강화제, 향료 등 첨가물과 식물혼합농축액을 일체 사용하지 않는다. 홍삼, 흑삼, 녹용, 사포닌, 유기농원료를 강화하여 품질과   효능이 뛰어나다. 천년순수 홍삼은 다섯 개의 자체 홍삼특허를 보유한 뛰어난 기술력을 바탕으로 벤처기업인증을 받았다. '천년순수 홍삼'이라는 이름에서 알 수 있듯이 순수하고 바르게 진함을 강조하는 브랜드다. 주요 면세점에서 판매하고 있다. 천년순수 홍삼 관계자는 ""이번 수상을 계기로 앞으로도 소비자를 만족시킬 수 있는 고품질의 홍삼브랜드가 되겠다""고 말했다.마스크 유해 세균 99.9% 소멸시키는 마스크 케이스소비재/생활용품 부문 이노레스오토켐코리아 제공㈜오토켐코리아의 '이노레스 항균 마스크 케이스 마스키퍼'는 마스크가 케이스의 항균제에 접촉했을 때 바이러스의 숙주가 되는 슈퍼 박테리아, 대장균, 폐렴균 등 유해 세균을 99.9% 소멸시킨다.마스크 보관 중 다양한 오염균 제거가 가능하다. 잘못된 마스크 휴대로 인한 섬유 손상 및 성능 저하도 막아준다. 마스크 케이스와 내부는 미국 위생재단 NSF의 승인과 FDA 기준을 통과한 소재로 만들어졌다. 탈취제 사용 없이 냄새의 원인균을 없애고 여름철 땀, 화장품, 노폐물로 인한 오염으로부터 마스크를 위생적으로 보관할 수 있다. ㈜오토켐코리아는 항  균제품 제조 15년의 노하우로 이번 제품을 개발하게 되었다. 제품의 구조를 고안하여 생산하는 바이코, 디자인을 담당한 몰드센세이션과 공동개발·공동특허로 출시했다. 블랙, 화이트, 민트, 핑크 4색으로 출시됐다. 오토켐코리아 박용현 대표는 ""소비자가 직접 이노레스의 항균력을 체험하고 위생적으로 마스크를 보관해 코로나를 슬기롭게 대처하기를 기원한다""고 말했다.로열티 50% 감면, 착한 프랜차이즈에 뽑혀코다리프랜차이즈 부문 코다리밥상올댓컴퍼니 제공빠르게 변하는 세상 속에서도 옛 맛의 '추억'을 찾는 사람들이 늘어나고 있다. 올댓컴퍼니 '코다리밥상'에는 마치 고향에 온 듯 편안한 맛과 멋이 있다. 단순히 맛있는 한 끼 식사를 넘어 일상을 풍요롭게 하는 경험을 제공한다. 좋은 공간에서 좋은 사람들과 최고의 음식이 어우러져 좋은 시간을 공유하는 것, 그것이 바로 '코다리밥상'이 시작된 이유이다. 올댓컴퍼니는 코로나19 상황에서 가맹점이 겪는 어려움을 동반자의 입장에서 함께 하고자 로열티 50%를 감면하는 정책을 펼쳤다. 그 결과 한국공정거래조정원의 코로나19 파급영향 최소화와 조기   극복을 위한 민생경제종합대책과 관련해 '가맹점주의 비용분담 가맹본부(착한프랜차이즈)'로 뽑혔다. 또 외식·프랜차이즈진흥원과 맥세스컨설팅이 진행한 '공정거래위원회에 등록된 정보공개서 빅데이터 기반 프랜차이즈 본부 실적 평가'(2019년 12월 31일 기준)에서 6087개 프랜차이즈 브랜드 중 상위 5%에 선정돼 '가맹하고 싶은 프랜차이즈' 인증서를 받았다.코로나19 여파로 협업도구 수요 급증, 사용자 130만명IT서비스(협업툴) 부문 팀업(teamUP)이스트소프트 제공인공지능 서비스 전문기업 이스트소프트의 기업용 협업툴 '팀업(team UP)'은 원격 근무 등 디지털 업무 환경에서 구성원의 일을 더욱 빠르고 편리하게 해주는 기업용 협업 솔루션이다. 주요 기능으로는 대용량 파일 및 이미지 캡처 전송이 가능한 ▲업무용 메신저 ▲그룹 피드(게시판) ▲일정 및 할 일 관리 ▲클라우드 기반 파일 공유 ▲인공지능 챗봇 등이 있다. 윈도 PC는 물론 스마트폰, 태블릿, 리눅스 OS 등 멀티 플랫폼을 지원한다. 외근, 출장 등 이동 중이라도 협업을 이어갈 수 있다. 최근 코로나 19 확산으로 재택근무 문화가 정착돼   업무 협업 도구의 필요성이 증가하며 팀업에 대한 국내 기업의 관심이 뜨겁다. 실제로 5월에는 지난 3월과 비교해 유료 상품인 프리미엄 버전 기업 고객이 약 20배 가량 증가했다. 일반, 프리미엄 버전 고객사는 약 1만 8000여 개이며 총 사용자는 130만 명에 달한다. 한미약품, 모두투어, 가톨릭재단(성모병원) 등 대규모 기업 구축 사례도 보유하고 있다.국내서만 1000만명 사용, 연간 1억 건 이상 탐지IT서비스(보안) 부문 알약(ALYac)이스트시큐리티 제공이스트시큐리티는 국내에서만 1000만 명 이상의 사용자를 보유한 컴퓨터 전용 백신 '알약' 서비스를 제공한다. 알약을 통해 연간 약 1억 건 이상의 악성코드 탐지와 분기별 130만 건 이상의 랜섬웨어 차단 등으로 개인과 기업의 소중한 정보와 자산을 지키고 있다. 2007년 12월 '알약' 정식 출시와 함께 편리한 사용성과 가벼운 구동으로 폭발적인 반응을 이끌어냈다. 2012년 4월 대한민국 대표 브랜드 대상을 수상, 대한민국 넘버원 안티바이러스 제품으로 인정 받았다. 국내 최다 악성코드 데이터베이스를 보유하고, 세가지 멀티엔진으로 악성코드를   정확하게 식별해낸다. 알약이 신종ㆍ변종 랜섬웨어까지 공격 행위를 미리 탐지하고 차단해 사용자 PC의 문서와 파일이 공격자에 의해 암호화되는 것을 막아준다. 알약의 '실시간 감시'는 켜두기만 하면 각종 악성코드의 활동을 알약이 알아서 모니터링한다. 또 이스트시큐리티의 ESRC(시큐리티대응센터)에서 24시간 탐지 및 분석한 패턴을 업데이트해 위협에 대응한다.고기능성 프로바이오틱스, 국내 최초 식약처 허가 받아건강식품 부문 지큐랩일동제약 제공'지큐랩'은 국내 최초로 유산균 의약품의 식품의약품안전처 허가를 받은 일동제약이 개발한 고기능성 프로바이오틱스 브랜드다. 장(腸) 건강 지수를 의미하는 GQ(Gut Quotient)와 연구소를 뜻하는 lab을 조합한 이름이다. 지난달에는 신제품 ▲지큐랩 100억 생유산균 골드 ▲지큐랩 우리아이 유산균 ▲지큐랩 장 건강 프리바이오틱스 ▲지큐랩 콜라겐 유산균C가 출시됐다. 가족과 아이용 유산균 제품은 물론 장내 프리바이오틱스 제품과 여성들을 위해 비타민C가 함유된 3중 멀티 콜라겐 유산균 제품을 선보였다. 대표 제품인 '지큐랩 10  0억 생유산균 골드'는 보장균수 100억 프로바이오틱스 제품으로 유해균 억제 및 유산균 증식, 원활한 배변활동 등에 도움을 줄 수 있는 프로바이오틱스와 아연, 셀레늄을 포함하고 있다. 식품의약품안전처 허가를 취득한 '면역 과민반응에 의한 피부상태 개선에 도움을 줄 수 있는 건강기능식품 개별인정형 기능성 원료'인 RHT-3201 제품도 연내 출시할 계획이다. 흔들리고 죽어가는 치아 살리기위한 연구 20년·치료 10년치아살리는치과 부문 임플란티아치과임플란티아치과 제공치과에서 임플란트 시술을 할 때는 일단 치아를 뽑고 임플란트를 하는 게 일반적이다. 하지만 임플란티아치과 광명점과 강남점의 원장들이 하는 방식은 다르다. 환자에게 무조건 임플란트를 권하기 보다는 흔들리고 죽어가는 치아를 살리기 위한 연구를 20년 넘게 하고 10년 동안 치아를 살리는 치료에 전념했다. 교정으로 무너진 잇몸뼈의 아치를 재건해 틈이 벌어지는 치아를 통째로 살린다거나, 환자의 혈액에서 추출한 성장인자를 활용하기도 한다. 또 기능이 없는 환자의 사랑니를 치아 뽑은 자리에 옮겨 심는 등 환자   자신의 이를 살리는 데 최대한 주력하고 있다. 전 의료진이 참여하는 세미나를 매주 개최하는 것도 임플란티아치과의 전통이다. 보다 정확한 진단과 치료를 위해 물방울레이저와 대학병원급 덴탈CT기를 사용한다. 치아만 살리는 것이 아니라 환자의 마음도 살펴야 한다는 그들의 신념처럼 치료 중은 물론이고 치료가 끝난 후에도 상담을 통해 환자의 만족도를 체크하고 있다.[김민정 객원기자] 		▶ 네이버에서 조선일보 구독 / 미스터트롯 티켓 받자 		▶ 임영웅 영탁 이찬원 콘서트 공짜로 보러 갈래? 		▶ 유용원 군사전문기자의 밀리터리시크릿 '밀톡'	- Copyrights ⓒ 조선일보 & chosun.com, 무단 전재 및 재배포 금지 -"
147,亞太 제약사 신약개발부문서 국내 기업 중 최고 점수,2020.06.26,"대웅제약은 지난해 글로벌 시장조사기관 클래리베이트 애널리틱스사가 선정한 아시아태평양지역(APAC) 혁신 제약사 12위에 선정됐다. 국내 제약사 중에 20위권에 들어간 곳은 대웅제약과 한미약품 2곳뿐이다.클래리베이트는 매년 아시아태평양 지역에 있는 4만6509개 제약사 중 신약을 개발할 가능성이 있는 14국 929기업을 대상으로 혁신 제약사를 선정, 보고서로 발표하고 있다. 제약·바이오 업계에서 처음으로 기업의 성장 가능성에 초점을 두고 평가해 분석해 업계에선 권위 있는 보고서로 통한다. 특허, 제품 출시 건수나 판매 수익 같은 전통적인 평가 지표 대신 신약 개발 초기 파트너십 활동, 신약 개발 정도, 기업 성숙도 등을 주요 지표로 삼아 평가한다.대웅제약은 보고서 지표 중 연구·개발(R&D) 능력 평가에 해당하는 '신약 개발 초기 파트너십 활동'과 '신약 개발 정도' 지표에서 모두 300점 이상을 받아 경쟁력을 인정받았다. 특히 신약 개발 부문에서는 한국 제약사 중 유일하게 300점을 넘기며 1위를 기록했다. 대웅제약 관계자는 ""올해 주요 신약 파이프라인(신약 후보 물질)을 비롯한 임상 진행 건수가 창립 이래 최고를 달성했다""며 ""신약 파이프라인 연구·개발에 역량을 집중해 글로벌 50위권 제약사로 도약하겠다""고 밝혔다.대웅제약은 이 같은 신약 개발 경쟁력을 살려 해외 다른 기업들과 협력하는 '오픈 컬래버레이션'을 추진하고 있다. 올 초에는 영국 바이오 기업 '아박타'와 파트너십 계약을 맺고 조인트 벤처인 '아피셀테라퓨틱스'를 설립했다. 아피셀테라퓨틱스는 대웅제약과 아박타 양 사의 기술을 융합해 새로운 세포 치료제를 개발하고 있다. 인공지능(AI)을 접목한 신약 설계 플랫폼을 보유한 미국 바이오 기업 'A2A 파마'와도 파트너십 계약을 맺고, AI 기술을 활용해 항암 신약을 공동 연구 개발하고 있다. 전승호 대웅제약 사장은 ""올해는 대웅제약이 추진 중인 R&D 성과가 가시화되는 중요한 한 해가 될 것""이라며 ""다양한 혁신 신약 파이프라인 연구 개발에 역량을 집중해 세계 최고의 신약을 개발해내겠다""고 말했다.[최원우 기자 sure@chosun.com] 		▶ 유용원 군사전문기자의 밀리터리시크릿 '밀톡' 		▶ 과학이 이렇게 재밌을수가~ '사이언스카페' 		▶ 조선일보 뉴스를 네이버에서 확인하세요	- Copyrights ⓒ 조선일보 & chosun.com, 무단 전재 및 재배포 금지 -"
