,title,date,content
79,"한미약품그룹 JVM, 캐나다 월마트 약국에 ‘병 포장 제조기’ 납품",2020.02.06,"한미사이언스 계열 의약품 자동조제 및 자동화 전문업체 ‘제이브이엠(JVM)’이 캐나다 약국시장 공략을 본격적으로 추진한다.JVM은 최근 캐나다 월마트에 입점한 약국에 의약품 자동 병(바이알, vial) 포장 조제기인 ‘JV-CA40(현지명 카운트어시스트)’을 납품하는 계약을 체결했다고 6일 밝혔다. 월마트는 현재 캐나다에서 약 400여개 점포를 보유하고 있는 북미권 최대 규모 소매 유통업체다. 각 점포에는 약국이 입점해 있다. 이번 계약에 따라 JVM은 올해 1분기에 월마트 내 10여개 약국에 1~3대씩 제품을 납품하고 순차적으로 입점처를 확대해 나간다. 주력 품목인 전자동 의약품 분류·포장 시스템(ATDPS) 공급 확대도 추진한다는 방침이다.월마트 내 약국에 도입되는 이번 제품은 JVM이 독자적으로 개발한 장비다. 환자별 처방에 따라 캐니스터(의약품을 담는 통)에 저장된 약을 자동으로 계수한 뒤 플라스틱 병에 담아준다. 복용 시기와 일자별로 각각 약포지에 소분 포장하는 국내와 달리 북미 등 지역에서는 플라스틱 병에 의약품을 담아주는 방식이 일반적이다. JVM에 따르면 카운트어시스트는 인터페이스가 직관적으로 설계돼 사용이 편리하다. 또한 캐나다에서 사용되는 모든 약국 소프트웨어 시스템과 연동된다. 장비의 폭이 좁고 여러 장비를 연결할 수 있기 때문에 규모가 작은 약국에도 설치가 용이하다. 독립된 18개 캐니스터로 구성돼 교차 오염 우려를 최소화했고 잠금장치가 있어 마약성 의약품도 안전하게 보관할 수 있는 것이 특징이다. 최대 10개의 캐비넷을 하나의 컨트롤러에 연결해 총 180개의 캐니스터를 사용할 수 있다.JVM 관계자는 “JVM은 지속적인 연구·개발 투자와 진취적인 해외 진출 전략을 바탕으로 글로벌 의약품 자동조제 분야를 선도하는 기업으로 자리잡고 있다”며 “캐나다 월마트 입점을 시작으로 북미 및 글로벌 시장 점유율 확대를 적극적으로 추진할 것”이라고 말했다.동아닷컴 김민범 기자 mbkim@donga.com▶ 네이버 홈에서 [동아일보] 채널 구독하기▶ 트롯가수 응원은 '트롯픽'에서 / 집 볼 때 쓰는 메모장 '집보장'ⓒ 동아일보 & donga.com, 무단 전재 및 재배포 금지"
80,"한미약품그룹, 신임 회장으로 ‘송영숙 고문’ 추대… “현 경영진 중심 신약개발 매진할 것”",2020.08.10,"한미약품그룹은 10일 송영숙 가현문화재단 이사장을 신임 그룹 회장으로 추대했다고 밝혔다. 송 신임 회장은 고(故) 임성기 전 한미약품그룹 회장의 부인이다. 지난 2017년부터 한미약품 고문(CSR 담당)을 맡아왔다. 송영숙 신임 회장은 “임 전 회장 유지를 받들어 현 경영진을 중심으로 중단 없이 신약개발에 매진하고 해외 파트너들과 지속적인 관계 증진을 통해 지속적으로 제약강국을 이룩하는데 기여하겠다”고 말했다.송 신임 회장은 그동안 그룹 및 계열사 설립과 발전 과정에서 임 전 회장과 주요 경영 판단 사항을 협의하는 등 임 회장을 지근거리에서 보좌하면서 그룹 성장에 힘을 보탰다. 특히 북경한미약품 설립 당시 한국과 중국의 정치·문화적 차이 때문에 발생한 어려움을 극복하는데 많은 기여를 했다는 평가다. 또한 국내 공장과 연구소 설립 및 확대, 주요 투자 관련 사항 등에 대해서 임 전 회장의 판단을 도운 것으로 전해졌다.동아닷컴 김민범 기자 mbkim@donga.com▶ 네이버에서 [동아일보] 채널 구독하기▶ 집 볼 때 쓰는 메모장 '집보장'ⓒ 동아일보 & donga.com, 무단 전재 및 재배포 금지"
81,코로나 불황에도… 대기업 R&D;투자 8000억 늘었다,2020.12.10,"217곳 9월까지 총 40조1561억원삼성전자 16조-LG전자 3조원 등매출 60조 줄었지만 공격적 경영삼성전자, 현대·기아자동차 등 대기업들이 신종 코로나바이러스 감염증(코로나19) 확산 가운데 연구개발(R&D) 투자를 확대한 것으로 나타났다. 기업평가 사이트 CEO스코어는 9일 국내 500대 기업 중 분기보고서를 제출하고 R&D 비용을 공시하는 217개 기업의 1∼9월 누적 R&D 비용을 조사한 결과 총 40조1561억 원으로, 지난해 같은 기간 R&D 비용(39조3561억 원)보다 8000억 원(2.03%) 늘어난 것으로 확인됐다고 밝혔다. 이 기업들의 1∼9월 매출은 총 1178조6822억 원으로 지난해 같은 기간(1238조7595억 원)보다 60조773억 원(4.85%) 감소했다. 삼성전자와 LG전자 등 전기전자 기업과 현대·기아차 등 자동차 기업이 R&D 투자를 견인했다. 삼성전자는 올 1월부터 9월까지 15조8971억 원을 투자하며 큰 격차로 1위를 차지했다. 삼성전자는 같은 기간 누적매출(175조2555억 원) 중 9.1%가량을 R&D에 썼다. 이어 LG전자(3조25억 원), SK하이닉스(2조6281억 원), 현대차(2조871억 원)가 2조 원 이상 투자했고, LG디스플레이(1조3287억 원)와 기아차(1조2408억 원)도 1조 원 이상을 R&D 비용으로 사용했다. 이들 6개 기업의 R&D 투자액이 조사 대상 217개 기업 전체 R&D 투자액의 65.2%를 차지했다. 매출 대비 R&D 비중은 네이버가 25.5%로 가장 컸다. 그 뒤를 한미약품(23.4%) 넷마블(20.6%) 셀트리온(18.5%) 엔씨소프트(17.6%) 대웅제약(15.6%) 카카오(13.2%) 등이 이었다. 주로 정보기술(IT)과 제약바이오 업종이다. 특히 제약바이오 업종 중 조사 대상 기업 7곳의 매출 대비 연구개발비 비중이 13.2%에 달했다. 조선·기계·설비업종의 R&D 비용은 지난해보다 1630억 원 줄어드는 등 감소 규모가 가장 컸다. 서비스(―749억 원) 공기업(―354억 원) 철강(―288억 원) 건설 및 건자재(―170억 원) 업종도 100억 원 이상 R&D 비용을 줄였다.홍석호 기자 will@donga.com▶ 네이버에서 [동아일보] 채널 구독하기▶ 증발에 운다…그렇게 부모가 되지 못했다▶ “말이 안 통해”… 극과 극이 만난다면?ⓒ 동아일보 & donga.com, 무단 전재 및 재배포 금지"
82,"한미약품그룹, 두유 20만팩 적십자사에 기부… ‘헌혈 참여 독려’ 지원",2020.05.07,"신종 코로나바이러스감염증(코로나19) 장기화로 혈액 보유량이 급감하는 상황 속에서 한미약품그룹이 작은 나눔을 실천했다.한미약픔그룹 계열사 한미헬스케어는 최근 헌혈 참여 독려를 지원하기 위해 1억8000만 원 상당 완전두유 20만 팩을 대한적십자사에 기증했다고 7일 밝혔다.한미헬스케어 관계자는 “코로나19 확산으로 헌혈자와 국가 보유 혈액량이 지속 감소하고 있다는 소식을 전해 듣고 이번 기부를 결정하게 됐다”며 “적십자사가 전국적으로 추진하고 있는 헌혈 독려 캠페인에 고영양 식품인 완전두유가 조금이나마 도움이 되길 기대한다”고 말했다.대한적십자사에 따르면 지난달 기준 헌혈자수는 전년 대비 8만 명 이상 감소했다. 혈액 보유량은 적정 보유량인 5일을 밑도는 3.7일분에 불과한 상황이라는 설명이다. 한미헬스케어가 기증한 완전두유는 전국 15개 혈액원으로 전달될 예정이다. 헌혈 독려 이벤트와 지역사회 헌혈 행사, 다음 달 14일 열리는 세계 헌혈자의 날 행사 등에 사용될 예정이다.한미헬스케어 관계자는 “이번 대한적십자사 기증에 이어 불균형한 식사 등으로 어려움을 겪는 ‘이웃돕기 릴레이 기부’도 계획하고 있다”며 “기업 차원의 기부가 건강한 헌혈 문화 활성화에 조금이나마 도움이 되길 희망한다”고 말했다. 이어 “한미헬스케어는 현재 기아대책기구와 어린이재단, 사랑의열매 등 다양한 사회복지단체들과 완전두유 기부 규모 등을 논의하고 있다”며 “사회적 책임을 다하기 위해 앞으로도 도움이 필요한 곳을 지원할 수 있도록 다양한 방안을 추진할 것”이라고 덧붙였다.한편 한미약품은 창업주 임성기 회장이 지난 1980년 11월 국내 첫 ‘헌혈의 집’ 개소를 적극적으로 추진한 것을 계기로 1981년부터 꾸준히 임직원 헌혈 캠페인(사랑의 헌혈 캠페인)을 진행하고 있다. 캠페인에 참여한 누적 헌혈자 수는 8218명, 혈액량은 262만9760cc에 이른다.동아닷컴 김민범 기자 mbkim@donga.com▶ 네이버에서 [동아일보] 채널 구독하기▶ 집 볼 때 쓰는 메모장 '집보장'ⓒ 동아일보 & donga.com, 무단 전재 및 재배포 금지"
83,"한미사이언스, 포항 펜타시티 ‘스마트 헬스케어 시티’ 건립… 총 3000억 원 투입",2020.06.15,"포항융합기술산업지구(펜타시티) 부지 매입R&D;센터·교육센터·제조시설 등 3개 시설물 구축한미 6대 비전 ‘싸이디오시그마’ 실현 첫 걸음관련 기능 집약된 바이오클러스터 구현한미약품그룹 지주회사 한미사이언스가 포항융합기술산업지구(펜타시티)에 그룹 미래비전 실현의 주춧돌이 될 ‘스마트 헬스케어 시티’ 조성에 나선다.한미사이언스는 15일 포항시청에서 경상북도와 포항시, 대구경북경제자유구역청 등과 관련 투자협정에 관한 양해각서(MOU)를 체결했다. 이번 MOU에 따라 펜타시티 내 5만1846㎡ 규모 부지에 ‘한미 스마트 헬스케어 씨티(HSHC)’ 건립을 추진할 계획이다.이날 MOU 체결식에는 임종윤 한미사이언스 대표와 이관순 한미약품 부회장, 임종철 자문위원, 이철우 경북도지사, 이강덕 포항시장, 김진현 대구경북경제자유구역청장(대리), 안성일 산업통상자원부 경제자유구역기획단장 등 주요 관계자 30여명이 참석했다. 한미사이언스는 이번 투자 결정이 포스트 코로나 시대를 맞아 혁신을 통한 지속가능성장을 주도해 나간다는 6대 혁신성장 비전 계획의 일환으로 결정됐다고 설명했다. 체결식에 앞서 임종윤 한미사이언스 대표는 그룹 6대 사업과제(싸이디오시그마, Cydio Cigma)를 발표하고 글로벌 바이오기업으로서 거시적 비전을 공개했다.임 대표가 직접 작명한 싸이디오시그마는 사이버교육과 디지털바이오, 오럴바이오, 시티바이오, 그린바이오, 마린바이오 등 6개 비전으로 구성됐다. 해당 과제를 토대로 각 분야에서 혁신을 주도해 나간다는 것이 중점 내용이다.이번 MOU 체결은 한미사이언스와 경상북도, 포항시, 대구경북경제자유구역청이 3000억 원에 달하는 HSHC 건립 사업에 참여하는 첫 걸음이다. HSHC에는 향후 한미그룹 6대 비전을 실현할 연구·개발(R&D)센터를 비롯해 교육센터와 제조 및 지원시설 등이 조성될 예정이다. 이번 MOU는 지난해 11월 25일 한미사이언스와 경북도, 포항시, 포스텍 등이 ‘K-바이오’ 경쟁력 제고를 위해 체결한 상호 업무협약의 성과로 꼽힌다. 해당 상호 업무협약 이후 한미사이언스는 방사광가속기와 극저온 전자현미경 등을 활용한 세포막단백질 구조연구, 표적 단백질 구조에 기반한 신약 개발 연구 등을 위해 관계 기관과 긴밀한 협력을 이어가고 있다.임종윤 한미사이언스 대표이사는 “그동안 병원에서 산업화할 수 없는 R&D를 하거나 산업에서 의료에 적용하기 어려운 R&D를 하는 등 연구와 의료, 산업화가 비효율적으로 운영되면서 혁신의 속도가 더디게 진행된 경향이 있다”며 “의료 서비스와 R&D, 제조 등 모든 관련 기능이 한 곳에 모인 바이오클러스터 조성으로 글로벌 의료산업을 선도하고 인류의 건강한 삶을 위해 공헌할 것”이라고 말했다.동아닷컴 김민범 기자 mbkim@donga.com▶ 네이버에서 [동아일보] 채널 구독하기▶ 집 볼 때 쓰는 메모장 '집보장'ⓒ 동아일보 & donga.com, 무단 전재 및 재배포 금지"
84,"한미헬스케어, 취약계층 어린이 위해 ‘완전두유’ 15만6000팩 기부",2020.05.28,"초록우산 등 어린이단체 3곳에 완전두유 전달최근 한 달간 두유 35만6000팩 지원“복지 사각지대 지원 지속 이어갈 것”한미약품 계열사 한미헬스케어가 신종 코로나바이러스감염증(코로나19) 장기화로 균형 잡힌 영양 섭취에 어려움을 겪고 있는 취약계층 어린이 돕기에 나섰다.한미헬스케어는 지난 25일과 26일 이틀에 걸쳐 최근 새롭게 출시한 ‘완전두유’ 등 두유 제품 15만6000팩을 불우 어린이 지원단체 세 곳에 전달했다고 28일 밝혔다. 이달 초 대한적십자사에 두유 20만 팩을 전달한 데 이어 최근 한 달 동안 두유 35만6000팩을 기부한 것이다.이번에 지원한 두유는 희망친구기아대책(6만 팩)과 초록우산어린이재단(3만 팩), 희망을나누는사람들(6만 팩) 등 지원단체 3곳에 사랑의열매 사회복지공동모금회를 통해 전달됐다. 전달된 두유는 전국 46개 홈스쿨 어린이 1400여명과 중증장애영유아 치료보호시설인 한사랑장애영아원 아동 415명, 전국 아동시설(한 부모 자녀, 다문화 가정 포함) 3500명 등에게 보내진다.한미헬스케어는 어린이단체 지원에 더해 불균형한 식사 등으로 어려움을 겪는 독거노인 및 조손 가정 등 도움이 필요한 곳에 순차적으로 지원하는 ‘이웃돕기 릴레이 기부’를 지속해 나간다는 계획이다.한미헬스케어 관계자는 “코로나19 장기화로 복지 사각지대에 놓인 아이들의 균형 잡힌 영양섭취가 어렵다는 소식을 듣게 돼 두유 추가 기부를 결정했다”며 “일회성 기부로 끝내지 않고 아이들이 건강하고 밝게 성장해 나갈 수 있도록 지속적인 지원을 이어갈 것”이라고 말했다. 동아닷컴 김민범 기자 mbkim@donga.com▶ 네이버에서 [동아일보] 채널 구독하기▶ 집 볼 때 쓰는 메모장 '집보장'ⓒ 동아일보 & donga.com, 무단 전재 및 재배포 금지"
85,"의과대 설립 최적지, 포항[기고/이강덕]",2020.07.22,"전 세계를 휩쓸고 있는 신종 코로나바이러스 감염증(코로나19)이 여전히 매섭다. 이런 가운데 경북은 코로나19 직격탄을 맞아 의료인력, 병상, 장비 등의 절대 부족 사태를 겪었다. 취약한 의료 환경이 여실히 드러난 것이다.  이 때문에 공공의료 확충뿐만 아니라 의료인력 양성 등 대응 체계 구축이 새로운 이슈로 떠올랐다. 정부도 의과대 정원 확대를 추진하고 있다. 각 지방자치단체별로 의과대 유치와 설립을 위한 열기가 뜨겁다. 우리나라는 의과대를 통한 교육 및 연구, 성과의 사업화, 국가경쟁력 강화로 이어지는 선순환 구조를 갖췄다고 본다. 의과대와 의학 산업의 발전과도 밀접하다. 미국의 샌디에이고, 보스턴 등이 의과대 중심의 바이오산업을 육성해 세계적인 경쟁력을 갖춘 것은 좋은 사례다. 세계 바이오산업 시장은 지난해 1400조 원에서 2024년 2800조 원으로 증가할 것으로 예상돼 미래 먹거리로 그 중요성이 부각되고 있다. 정부는 지난해 바이오·헬스를 미래 신성장동력으로 삼고 글로벌 강국으로 도약하기 위한 혁신 전략을 발표했다. 국내 제조업의 경쟁력이 약화되는 상황에서 바이오산업은 새로운 경제 버팀목이 될 것이다. 이에 발맞춰 포항시도 바이오산업을 미래전략 5대 핵심 사업으로 선정하고 모든 역량을 집중하고 있다. 이 전략에는 의과대 설립도 포함시켰다. 포항에는 바이오 관련 연구를 활발하게 진행하고 있는 포스텍(포항공대)을 비롯해 생명공학연구센터, 나노융합기술원 등 10개 이상의 연구소가 운영 중이다. 강소연구개발특구를 통한 공동연구 등 우수한 연구개발(R&D) 인프라 및 전문 인력 역량을 보유해 의과대 설립의 최적지로 꼽힌다. 특히 최근 국내 굴지의 제약사인 한미약품㈜의 지주회사 한미사이언스㈜와 3000억 원 규모의 ‘스마트 헬스케어(건강관리)’ 인프라 구축을 위한 업무 협약을 체결했다. 현재 건립 중인 바이오오픈이노베이션센터, 세포막 단백질 연구소, 식물백신기업 지원 시설 등 최첨단 바이오·헬스 기반들이 올해 준공되면 클러스터를 형성할 것으로 보인다. 포항의 연구중심 의과대와 함께 다양한 시너지 효과를 창출해 낼 것으로 기대하고 있다. 포항을 비롯한 경북 동부권역은 상급 병원 부재, 전국 평균 이하의 의사 수(서울의 51.4%, 대구의 70.4% 수준) 등 부족한 의료 인프라로 인해 지역 환자들이 대도시로 가고 있다. 여기에 치료비, 교통비 등 추가 비용 지출로 이중고를 겪고 있다. 고령 인구 및 중증질환자의 비중도 늘고 있어 의료 수요는 매년 늘고 있다. 포항에 연구중심의 의과대를 설립하는 것은 지역민들의 의료서비스 수준 및 접근성 향상뿐만 아니라 국가 균형발전과 지역 간 의료 격차 해소의 첩경이다. 또 우리나라 바이오산업이 확실한 성장 동력으로 자리매김할 수 있는 중요한 거점 역할을 할 것이다. 따라서 최근 논의되고 있는 정부의 의과대 설립 후보지는 정치적 논리와 셈법에서 벗어나야 한다. 국민의 건강 증진과 의료복지 향상을 최우선으로 고려하고 명확한 기준과 절차에 따라 국가의 균형 발전 차원에서 추진해야 한다. 이강덕 포항시장▶ 네이버에서 [동아일보] 채널 구독하기▶ 집 볼 때 쓰는 메모장 '집보장'ⓒ 동아일보 & donga.com, 무단 전재 및 재배포 금지"
86,佛 사노피 잇단 ‘좌충우돌’ 행보… 세계적 제약기업 명성 ‘흔들’,2020.05.18,"허드슨 CEO “코로나 백신, 미국 우선 공급” 언급프랑스·유럽 전역 ‘발칵’… 총리·장관 나서 경고사노피 측 진화… “모든 사람에게 혜택 돌아갈 것”고수익 신약 개발 중심 기조 변화에 한미약품 ‘뒤통수’임상 중인 환자 방치 우려 불구 권리 반환 통보한미약품 측 “명성에 걸맞은 결정과 판단 기대한다”글로벌 제약기업 사노피가 작년 말 부임한 신임 CEO 폴 허드슨 사장으로부터 시작된 구설로 곤욕을 치르고 있다. 사노피는 최근 한국 제약업체 한미약품이 기술 수출한 당뇨신약을 임상 도중 반환하겠다고 통보해 논란을 일으킨 프랑스 소재 세계적인 제약기업이기도 하다.특히 프랑스를 비롯한 유럽 전역은 폴 허드슨 사노피 사장의 미국 언론과의 인터뷰로 발칵 뒤집혔다. 허드슨 사장이 인터뷰에서 미국 정부가 위험을 감수하는 일에 많이 투자했기 때문에 사노피가 개발 중인 신종 코로나바이러스감염증(코로나19) 백신을 미국에 우선 공급하겠다고 밝혔기 때문이다. 프랑스는 총리와 장관이 나서 사노피에 경고 메시지를 던졌다. 유럽연합(EU)은 백신의 공평한 사용을 주장하는 논평을 통해 사노피를 압박했다. 아네스 파티에 뤼나셰 프랑스 재정경제부 국무장관은 현지 라디오에서 “금전적 이유를 근거로 특정 국가에 백신 제공 우선권을 부여하는 것은 용납할 수 없다”고 했다. 사노피의 ‘미국 우선 공급’ 언급에 분노한 마크롱 프랑스 대통령은 사노피 경영진을 불러들였다는 소식도 전해졌다. 세계적인 제약업체로 성장한 사노피는 그동안 프랑스 정부로부터 연구·개발(R&D) 명목의 각종 지원이 있었다는 점에서 프랑스 국민들은 배신감까지 느끼는 분위기다. 사태가 일파만파 커지면서 비난이 거세지자 사노피 측은 진화에 나섰다. 올리비에 보질로 사노피 프랑스법인장은 방송에 나와 “사노피가 백신 개발에 성공하면 모든 사람에게 혜택이 돌아갈 것”이라고 말했다. 허드슨 CEO도 본인이 언급한 미국 우선 공급 발언에 대해 유감을 표했다.그동안 글로벌 제약바이오 업계에서 점잖기로 소문났던 사노피가 구설에 오르내리는 건 예상됐던 일이라는 시각도 있다. 작년 허드슨 사장 취임 이후 사노피 회사 기조가 급변했기 때문이다. 특히 지금까지 의사 출신 연구원들이 사노피를 이끌면서 글로벌 임상에 대규모 투자를 망설이지 않았던 전통과 달리 허드슨 사장 취임 직후부터는 수익성에 초점을 맞춘 기조 변화가 감지됐다. 취임 시기와 맞물려 500여명 규모 연구조직 일부가 해체됐고 일본 등 일부 지역에서는 구조조정을 단행하기도 했다.폴 허드슨 사노피 CEO작년 말 허드슨 사장이 직접 발표한 사노피 R&D 개편안은 그동안 주력해 온 당뇨 치료제 등 분야를 접고 항암제 중심으로 사업 구조를 재편하는 것을 주요 내용으로 한다. 사노피의 R&D 기조 변화는 한국 기업에 직접적인 피해로도 나타났다. 최근 사노피는 한미약품으로부터 기술을 이전 받은 당뇨신약 ‘에페글레나타이드’의 권리 반환 의사를 통보한 것. 문제는 현재 진행 중인 에페글레나타이드 글로벌 임상 3상에 참여 중인 환자 수가 5000여명에 달한다는 점이다.일반적으로 신약 기술을 이전 받은 글로벌 제약업체들이 약물의 지속 개발 여부를 판단할 때는 임상을 종료한 뒤 객관적 평가와 분석을 근거로 결정한다. 반면 이번 사노피의 결정은 환자가 걸린 임상을 그대로 두고 권리 반환 의사를 표명한 것으로 이례적이라는 평가다. 일부에서는 윤리적·도의적으로 책임 있는 제약사로서의 의무를 다하지 않았다는 비판에 직면할 수 있다고 경고했다.사노피와 한미약품 양측 모두 에페글레나타이드의 약물 유효성이나 안전성과는 무관하다고 표명하고 있다. 이에 대해 한미약품 관계자는 말을 아끼면서도 “사노피가 회사 명성에 걸맞은 결정과 판단을 내려주길 기대한다”고 전했다. 사노피의 행보를 두고 국내 의료진들로부터 우려의 목소리도 나온다. 서울의 한 내과 전문의는 “사노피는 란투스 등 당뇨치료제를 전 세계에서 판매해 글로벌 제약사로 성장한 대표적인 당뇨 전문 제약기업인데 향후 해당 분야 발전을 위한 투자를 멈추겠다고 한 결정은 이율배반적인 태도로 보인다”고 지적했다.동아닷컴 김민범 기자 mbkim@donga.com▶ 네이버에서 [동아일보] 채널 구독하기▶ 집 볼 때 쓰는 메모장 '집보장'ⓒ 동아일보 & donga.com, 무단 전재 및 재배포 금지"
