,title,date,content
0,지치지 않는 R&D;로 제약업계 이끈 선구자…임성기 한미약품 회장 별세,2020.08.02,"혁신 신약 개발에 과감한 투자로한국 첫 항생제 제조기술 수출 등글로벌 제약 국가의 초석 다져 한국 제약업계를 이끌어온 한미약품그룹 임성기 회장이 2일 새벽 숙환으로 별세했다. 향년 80세.임 회장은 중앙대 약학과를 졸업하고 1967년 서울 동대문에서 ‘임성기약국’을 열었다. 1973년 ‘임성기제약’을 설립했고, 그해 상호를 한미약품으로 바꾼 뒤 지금까지 48년간 경영해왔다.임 회장은 성장 가능성이 큰 후보물질에 과감하게 투자하는 한국형 연구·개발(R&D) 방식을 통해 한미약품을 신약 개발 회사로 이끌어왔다. 한미약품은 매년 매출액의 최대 20%에 이르는 금액을 혁신 신약 개발에 투자하고 있으며, 한미약품이 최근 20여년간 R&D에 투자한 누적 금액은 약 2조원에 달한다. 이는 “R&D 없는 제약기업은 죽은 기업, R&D는 나의 목숨과도 같다”는 임 회장의 확고한 신념에서 나온 것이다. 이 같은 노력으로 한미약품은 1987년 한국 제약업계 최초로 글로벌 제약기업 로슈에 항생제 제조기술을 수출했으며, 1997년에는 또 다른 글로벌 제약기업 노바티스에 ‘마이크로에멀젼’ 제제 기술을 역대 최고 규모인 6300만달러에 이전했다. 노바티스와의 계약 성과는 당시 외환위기로 고통받던 대한민국에 큰 희망을 주었다.2000년 의약분업 시행 직후 국내 대부분의 제약회사들이 투자를 축소할 때도 임 회장은 과감한 투자를 계속했다. 결국 2003년 국내 최초의 개량 신약 고혈압치료제 ‘아모디핀’을 출시했으며, 2009년에는 국내 최초의 복합신약 고혈압치료제 ‘아모잘탄’을 기반으로 글로벌 혁신 신약 개발의 초석을 닦았다.그러나 2010년에는 창사 이래 첫 적자를 경험하며 위기에 빠지기도 했다. 이 과정에서 단기 성과에 영향을 받을 수밖에 없는 투자자들은 물론 회사 내부에서도 한미약품의 R&D 투자를 줄여야 한다는 주장이 강력히 제기됐다. 그러나 임 회장은 R&D 투자를 향한 의지를 굽히지 않았다. 2015년에는 한 해 동안 총 7건의 대형 신약 라이선스 계약을 글로벌 제약기업과 잇따라 성사하며 한국을 역동적인 제약 국가로 탈바꿈시켰다. 그해 계약을 체결했던 여러 신약이 반환되는 아픔도 겪었지만, 임 회장은 전체 임원회의에서 “남들이 가지 않는 길은 외롭고 힘들지만, 그 길에 창조와 혁신이 있다”며 도전을 멈추지 않았다. 임 회장은 2016년에는 그동안의 성과를 바탕으로 2800여명에 이르는 그룹사 전 임직원에게 1100억원 규모의 개인 소유 한미사이언스 주식을 무상으로 증여하기도 했다.유족으로는 부인 송영숙씨와 아들 종윤·종훈씨, 딸 주현씨가 있다. 장례는 고인과 유족의 뜻에 따라 가족장으로 치른다. 빈소는 미정이다. 발인은 오는 6일 오전이다. 유족 측은 조문과 조화는 정중히 사양한다는 뜻을 밝혔다.박효재 기자 mann616@kyunghyang.com▶ 장도리 | 그림마당 보기▶ 경향신문 바로가기▶ 경향신문 구독신청하기©경향신문(www.khan.co.kr), 무단전재 및 재배포 금지"
1,"FDA, 한미약품 개발 비알코올성 지방간염 신약 '패스트트랙' 지정",2020.07.16," 한미약품이 개발 중인 비알코올성 지방간염(NASH) 치료제 랩스트리플아고니스트가 16일 미국 식품의약국(FDA)으로부터 패스트트랙으로 지정됐다. 한미약품은 이날 랩스트리플아고니스트가 개발 각 단계마다 FDA로부터 지원을 받아 신속하게 신약을 개발할 수 있는 패스트트랙 제도 시행 대상으로 선정됐다고 밝혔다. NASH는 술을 전혀 마시지 않는데도 간에 5% 이상의 지방이 쌓이는 지방간이 악화해 간세포 손상을 유발하는 질병이다. 현재 효능을 보이는 신약이 없어 패스트트랙 지정으로 신약 허가가 이른 시일 안에 이뤄질 경우 수십조원 규모의 시장을 선점할 수 있을 것으로 기대된다.한미약품은 자사 제품이 타사 개발 신약과 달리 적응증이 다양하고, 약효가 더욱 오랜 시간 지속되도록 하는 자체 기술 ‘랩스커버리’를 적용한 덕분에 FDA로부터 경쟁력을 인정받은 것으로 보인다고 말했다. 한미약품은 랩스트리플아고니스트 구성 성분 중 하나인 클루카곤은 직접 지방간을 줄이고 섬유화를 억제하며, GLP-1과 GIP는 각각 식욕 억제·항염증 작용을 한다고 설명했다. 또 자체 기술 랩스커버리는 약제 분자 크기를 키워 체내 주입시 혈관 내 상피세포로 흡수돼 분해되는 약물량을 줄이고, 신장여과로 인한 약물 감소 효과를 줄여 성분이 체내 오래 남아 있게 한다고 설명했다. FDA는 심각하거나 생명에 위협을 가하는 질환에 우수한 효능을 보이는 신약에 대해 면밀히 심사한 후, 신속하게 개발될 필요가 있다고 판단하면 해당 의약품을 패스트트랙으로 지정한다. 성공 가능성이 높은 신약의 개발을 적극 도와주는 제도로 대상 제약사로 선정되면 각 개발 단계마다 FDA와 협의하고 필요한 지원을 받을 수 있어 신속하게 제품 상용화를 진행할 수 있다. 한미약품은 임상 1상에서 빠른 지방간 감소 효과를 입증하고 현재 NASH 및 간섬유화 개선 확인을 위한 임상 2상을 FDA 허가를 받아 진행 중이다.한미약품 대표이사 권세창 사장은 “랩스트리플아고니스는 현재 전세계에서 개발되고 있는 NASH 치료제 중 혁신신약으로 가장 앞서 있다고 확신한다”며 “이번 FDA의 패스트트랙 지정으로 상용화가 빨라지게 됐다. 이 분야의 게임 체인저가 될 수 있도록 최선을 다해 개발하겠다”고 말했다.박효재 기자 mann616@kyunghyang.com▶ 장도리 | 그림마당 보기▶ 경향신문 바로가기▶ 경향신문 구독신청하기©경향신문(www.khan.co.kr), 무단전재 및 재배포 금지"
2,한미약품그룹 송영숙 회장…지주사 한미사이언스 대표이사에,2020.09.28," 한미약품그룹 지주회사인 한미사이언스는 28일 이사회를 열고 고(故) 임성기 회장의 부인 송영숙 한미약품그룹 회장(사진)을 대표이사로 선임했다고 밝혔다.  송 신임 대표이사는 가현문화재단 이사장과 한미약품 고문을 맡아오다 임 회장 별세 이후인 지난달 10일 한미약품그룹 회장으로 선임됐다. 이번에 한미사이언스 대표이사가 되면서 지주회사와 사업회사를 총괄 경영하게 됐다. 한미사이언스는 장남인 임종윤 대표이사와 공동 경영하게 된다.  한미사이언스는 이날 이사회에 앞서 임시 주주총회를 열어 송 회장과 장녀인 임주현 한미약품 부사장을 한미사이언스 등기이사로 선임했다. 이로써 임성기 회장의 직계가족이 한미약품그룹의 지주회사인 한미사이언스와 주요 사업회사인 한미약품의 이사회에 모두 합류했다. 차남 임종훈 한미약품 부사장은 2017년 한미약품 사내이사에 선임됐다.박효재 기자 mann616@kyunghyang.com▶ 장도리 | 그림마당 보기▶ 경향신문 바로가기▶ 경향신문 구독신청하기©경향신문(www.khan.co.kr), 무단전재 및 재배포 금지"
3,한미약품그룹 신임 회장에 송영숙 가현문화재단 이사장,2020.08.10,"고 임성기 전 회장의 부인 한미약품그룹은 신임 회장으로 송영숙 가현문화재단 이사장(사진)을 선임했다고 10일 밝혔다. 송 신임 회장은 최근 작고한 임성기 전 한미약품그룹 회장의 부인이다. 2002년부터 가현문화재단 이사장을 맡아왔으며 2017년부터는 한미약품에서 고문도 겸하고 있다. 그동안 임 전 회장의 지근거리에서 한미약품 성장에 공헌해왔다는 게 회사의 설명이다.송 회장은 작품활동을 하는 사진작가이자 한미사진미술관 관장으로 지내면서 부실하게 방치된 한국 근대 사진 수집과 연구 등 한국 사진문화 발전에 크게 이바지했다는 평가도 받고 있다. 사진작품을 포함한 현대미술의 컬렉터이기도 하다.송 회장은 이날 현 경영진을 중심으로 신약 개발에 지속해서 매진하고 해외 파트너들과의 관계 증진 등을 통해 제약 강국을 이루는 데 기여하겠다고 밝혔다. 이에 따라 한미약품그룹은 전문경영인과 오너 일가가 협력하는 현재의 경영 체제를 유지할 것으로 전망된다.현재 한미약품그룹의 사업회사인 한미약품은 우종수·권세창 대표이사 사장이 이끌고 있다. 임 전 회장의 장남 임종윤 사장과 차남 임종훈 부사장, 딸인 임주현 부사장도 한미약품 경영에 참여하고 있다. 한미약품 지주회사인 한미사이언스는 임종윤 대표이사 사장이 경영을 총괄하고 있다.박효재 기자 mann616@kyunghyang.com▶ 장도리 | 그림마당 보기▶ 경향신문 바로가기▶ 경향신문 구독신청하기©경향신문(www.khan.co.kr), 무단전재 및 재배포 금지"
4,국내외 여성·인권 상징들의 영면…남은 과제는 우리 몫이다 [2020년 우리 곁을 떠난 사람들],2020.12.29,"경제 올해도 다사다난했다. 국내외 다양한 분야에서 큰 발자취를 남긴 이들이 세상을 떠나며 안타까움을 줬다. 특히 이이효재와 루스 베이더 긴즈버그 등 여성, 인권 분야의 상징적인 인물들이 영면했다. 일본군 위안부 피해자나 근로정신대 생존자들이 하나둘 떠나가면서 과거사 청산의 빚은 더욱 커졌다. 어떤 죽음은 진실규명과 해결해야 할 과제를 남겼다.■문화‘여성운동 1세대’ 이이효재·‘역사 대중화’이이화‘성추행 의혹’ 김기덕은 추모 없이 떠나학술계에선 굵직한 학문적 자취를 남긴 학자들이 타계했다. ‘역사 대중화’를 이끈 원로 역사학자 이이화는 3월18일 84세의 나이로 별세했다. 고인은 대학에서 사학을 공부하진 않았지만, 철저한 고증 작업을 바탕으로 일반인 눈높이에 맞춰 이야기 형식으로 역사를 풀어냈다. 역사학의 높은 장벽을 허물어 ‘재야 사학계의 별’로 불렸다. 그는 고대사부터 현대사까지 자유롭게 오가며 연구했고, 문헌사와 생활사 간 경계도 뛰어넘고자 했다. ‘동학농민전쟁’에 천착하는 등 알려지지 않은 인물과 사건을 드러내는 데 힘썼다.‘녹색평론’ 발행인 김종철한국 사회 담론의 지평을 확장하고 생태운동에 앞장선 김종철 ‘녹색평론’ 발행인은 6월25일 73세를 일기로 세상을 떠났다. 1991년 격월간지 ‘녹색평론’을 창간한 고인은 폭주하는 자본주의 문명에서 생태문명으로의 전환을 강하게 촉구했다. 기본소득제 도입, 숙의민주주의 등 사회 변혁을 위한 대안도 선도적으로 제안했다. 고인은 마지막이 된 ‘녹색평론’ 172호 권두언에서 다음과 같이 썼다. “이 세상에서 가장 무서운 바이러스는, 공생의 윤리를 부정하는, 그리하여 우리 모두의 면역력을 끊임없이 갉아먹는 ‘탐욕’이라는 바이러스다.”한국 여성운동 1세대 지도자 이이효재한국 여성운동 1세대 지도자 이이효재 이화여대 명예교수는 10월4일 96세의 나이로 영면했다. 이 교수는 한국에 여성학을 처음 도입했다. 이화여대 사회학과 교수로 재직하며 ‘여성’을 연구했고, 한국 최초의 여성학과 설치를 주도했다. 그의 <여성 해방의 이론과 현실>은 ‘여성운동의 교과서’로 꼽힌다. 이론 연구뿐 아니라 직접 행동으로 실천했다. 한국여성민우회 초대 회장과 한국여성단체연합 회장 등을 지냈으며 부모 성 같이 쓰기, 호주제 폐지, 동일노동 동일임금 운동, 국회의원 비례대표 50% 여성 할당 등을 이끌었다. 한국정신대문제대책협의회를 만들어 일본군 위안부 문제 해결에 나섰으며 한반도 평화운동에 큰 관심을 쏟았다. 1997년 고향인 마산으로 돌아가 지역 여성들과 ‘기적의 도서관’을 운영했다.대중문화계에서는 코미디언 박지선씨가 11월2일 36세의 나이에 스스로 세상을 등졌다. 2007년 KBS 22기 공채 코미디언으로 데뷔해 13년간 타인에 대한 비하나 조롱 없는 따뜻한 유머를 전해온 고인의 갑작스러운 죽음은 안타까움을 샀다. 스스로를 “멋쟁이 희극인”으로 칭했던 고인은 KBS <개그콘서트> 등에서 코미디언으로서 두각을 나타냈다. 최근에는 가수 쇼케이스·영화 시사회 등 행사 MC로 활발하게 활동했다. 누군가를 열렬히 좋아하는 팬의 마음에 적극적으로 공감할 줄 아는 MC로 큰 사랑을 받았다.김기덕 감독은 지난 11일(현지시간) 코로나19 합병증으로 동유럽 라트비아의 한 병원에서 60세를 일기로 세상을 떠났다. 김 감독은 칸, 베니스, 베를린 등 이른바 ‘세계 3대 영화제’ 모두에서 본상을 수상한 유일한 한국 감독이다. 정규 영화교육을 받지 못했지만 저예산 영화로 ‘작가주의 감독’이란 명성을 쌓았다. 2018년 성추행 의혹 등이 언론에 보도되면서 평판에 금이 갔고, 이후 해외에서 활동했다. 김 감독의 죽음이 알려진 뒤 국내에선 어떤 공식적인 추모행사도 열리지 않았다.■경제‘글로벌 삼성’ 이끈 이건희한국형 신약 연구·개발 임성기삼성그룹을 글로벌 기업으로 이끈 이건희 회장(왼쪽 사진)이 10월26일 78세로 별세했다. 이병철 창업주가 세상을 떠난 1987년 삼성그룹 회장에 취임한 고인은 1993년 삼성전자 임원들을 독일 프랑크푸르트에 소집해 ‘마누라와 자식만 빼고 다 바꾸라’라며 신경영선언을 했다. 이후 핵심 계열사인 삼성전자는 TV, 반도체, 스마트폰 사업 등에서 글로벌 1위 자리에 올랐다. 고인은 1996년 국제올림픽위원회(IOC) 위원에 선임되는 등 스포츠 분야에서도 유의미한 족적을 남겼다. 그러나 경영권 편법 승계와 불법 비자금 조성 등으로 재판에 넘겨져 홍역을 치르기도 했다.한국 제약업계를 이끌어온 한미약품그룹 임성기 회장(오른쪽)도 8월2일 80세의 나이로 유명을 달리했다. 임 회장은 성장 가능성이 큰 신약 후보물질에 과감하게 투자하는 한국형 연구·개발(R&D) 방식을 통해 한미약품을 국내 대표적인 신약 개발 회사로 자리매김하게 했다. 2010년 창사 이래 첫 적자를 기록하며 위기에 빠지기도 했지만, 2015년에는 한 해에만 글로벌 제약사들과 총 7건의 대형 신약 라이선스 계약을 체결하는 저력을 보였다. ■사회4명의 위안부 피해자 할머니들박원순 시장 극단 선택일본군 위안부 피해자인 이막달 할머니(왼쪽 사진)가 8월29일 97세를 일기로 부산에서 별세했다. 1923년 태어난 고인은 17세이던 1940년 “좋은 곳에 취직시켜주겠다”는 일본인을 따라갔다가 피해를 당했다. 해방 후 귀국해 피해자로 신고했으며, 수요시위에 참가하고 피해를 증언하는 활동을 벌였다. 이밖에 위안부 피해자 세 분이 더 돌아가시면서 정부에 등록된 ‘위안부’ 피해자 중 생존자는 16명으로 줄었다. 5월6일에는 일제강점기 조선여자근로정신대로 강제동원됐던 이동련 할머니가 90세로 별세했다. 이 할머니는 1944년 일본 미쓰비시중공업 나고야 항공기 제작소에 강제동원됐다.7월9일 박원순 서울시장(64·오른쪽)이 극단적 선택을 했다. 박 전 시장이 사망하기 직전 그가 시장 비서실에서 근무했던 비서를 성추행한 혐의로 피소됐다는 사실이 알려졌다. 박 전 시장은 부천경찰서 성고문 사건, 서울대 조교 성희롱 사건 등에서 큰 역할을 하며 인권변호사이자 시민활동가로 입지를 굳혔다. 2011년 서울시장 보궐선거에서 당선되면서 행정가로 변신했다. 2018년 서울시장 3선에 성공하면서 역대 최장수 서울시장에 이름을 올렸다. ■국제‘미국 사회 진보 아이콘’ 긴즈버그의 죽음, 긴 정치적 여운‘원조 제임스 본드’ 숀 코너리·‘축구의 신’ 마라도나“고마워요(Thank you) RBG.”미국 연방대법관 루스 베이더 긴즈버그(RBG)가 9월18일(현지시간) 향년 87세를 일기로 세상을 떠났다. 미 연방대법원은 긴즈버그의 사인을 췌장암 전이에 따른 합병증이라고 밝혔다. 그는 떠났지만 차별에 반대하며 평생 여성·소수자를 위해 싸워 온 그의 발자취는 미국인들의 가슴에 남았다. 미 연방대법원 앞에는 그를 추모하려는 시민들의 행렬이 이어졌다.1993년 미국 역사상 두 번째 여성 연방대법관으로 임명된 그는 미국 사회에서 ‘진보의 아이콘’으로 불렸다. 1996년 버지니아 군사학교 여성 입학 불허에 대한 위헌 결정부터 2015년 동성결혼 합법화에 이르기까지 미국 역사를 새로 쓴 연방대법원의 판결 뒤에는 항상 그가 있었다. 대법원의 판결이 보수적으로 기울 때면 ‘나는 반대한다’는 외침과 함께 적극적으로 소수의견을 내며 균형추 역할을 하기도 했다. 긴즈버그의 죽음은 정치적 파장으로 이어졌다. 11월3일 대선을 앞둔 공화·민주 양당 사이에 후임 대법관 지명 시기를 놓고 이견이 표출된 것이다. 도널드 트럼프 대통령이 긴즈버그가 떠난 지 8일 만에 보수 성향의 에이미 코니 배럿을 후임 대법관으로 지명하면서 미 연방대법원은 보수 6명, 진보 3명의 구도로 재편됐다. ‘가장 큰 소망은 새 대통령이 취임할 때까지 내 자리가 채워지지 않는 것’이라는 그의 마지막 바람은 이뤄지지 못한 것이다. 미국에선 또 하나의 별이 졌다. 미국 흑인 인권운동의 ‘살아있는 전설’로 불렸던 존 루이스 하원의원이 췌장암을 앓다 7월17일 80세를 일기로 숨졌다. 루이스 의원은 마틴 루서 킹 목사와 함께 ‘빅 식스(Big Six)’로 불리며 1960년대 미국 흑인 인권운동을 이끌었던 6명 중 한 명이다. 이로써 빅 식스는 모두 세상을 떠났다. 루이스 의원은 숨지기 직전 뉴욕타임스에 기고한 글에서 “평화와 사랑, 비폭력이 더 훌륭한 길이라는 것을 보여주기 위해 내 인생에서 할 수 있는 모든 것을 다 했다. 이제 여러분이 자유의 종을 울릴 차례”라고 했다. 한 시대를 풍미했던 많은 정치인과 거장들도 사라졌다. 사에브 에레카트 팔레스타인 자치정부 사무총장은 코로나19에 감염돼 11월11일 65세를 일기로 숨졌다. 그는 1991년 스페인 마드리드에서 열린 중동평화회담, 1993년 팔레스타인과 이스라엘이 평화적 공존을 모색하며 맺은 ‘오슬로 협정’ 등을 이끌었던 팔레스타인의 대표적 협상가였다. 8월3일에는 북아일랜드 평화 정착에 기여한 공로로 1998년 노벨 평화상을 수상한 아일랜드 정치인 존 흄(83)이 숙환으로 별세했다. 흄은 북아일랜드에서 아일랜드와의 통일을 바라는 가톨릭 민족주의자들과 영국의 일부로 남길 원하는 개신교 통합주의자들 사이에 30년 넘게 이어진 분쟁을 종식시키는 데 기여했다. 대만에서는 국민당 독재를 끝내고 첫 직선제 총통으로 민주화를 이끌었다는 평가를 받는 리덩후이(李登輝·97)가 7월30일 별세했다. 오만의 ‘개혁군주’ 카부스 빈 사이드 알사이드 국왕(술탄)도 1월10일 79세를 일기로 세상을 떠났다. 독재자의 죽음은 권력도 삶도 누구에게나 유한한 것임을 상기시켰다. 케냐의 ‘철권 통치자’ 대니얼 아랍 모이 전 대통령이 2월4일 95세를 일기로 숨졌다. 그는 1978년부터 24년간 대통령직을 유지하며 억압적 권력을 행사했다. 30년 독재자 호스니 무바라크 전 이집트 대통령도 2월25일 91세를 일기로 사망했다. 무바라크 전 대통령은 1981년 취임한 뒤 2011년 ‘아랍의 봄’으로 불린 민주화 시위에 의해 쫓겨나기 전까지 폭압적인 독재자로 군림했다. 1970년대 캄보디아에서 벌어진 대량 학살사건 ‘킬링필드’의 주범 중 한 명인 카잉 구엑 에아브(77)도 9월1일 숨을 거뒀다. 숀 코너리문화예술계에서도 큰 별들이 저물었다. 파리 패션계에서 성공을 거뒀으며, 유명 브랜드 ‘겐조’를 만든 일본인 디자이너 다카다 겐조가 코로나19에 감염돼 81세의 나이로 세상을 떠났다. 10월31일엔 영화 <007> 시리즈의 ‘원조 제임스 본드’였던 영국 배우 숀 코너리가 향년 90세로 숨졌다. <OK목장의 결투>에 출연한 커크 더글러스도 2월5일 103세의 나이로 생을 마감했다. 미국의 전설적 기타리스트 에디 반 헤일런(65·10월6일 사망), 이탈리아 출신의 영화음악 거장 엔니오 모리코네(93·7월6일 사망), 미국 컨트리 음악의 대부 케니 로저스(81·3월20일 사망)도 유명을 달리했다.마라도나체육계에선 디에고 마라도나(아르헨티나)가 11월26일 심장마비로 향년 60세에 급작스럽게 세상을 떠나자 전 세계 축구팬들이 슬픔에 빠졌다. 마라도나는 1986년 멕시코 월드컵 8강 잉글랜드와의 경기에서 왼손으로 골을 넣은 ‘신의 손’ 사건과 뒤이어 50ｍ를 질주하며 상대 선수 7명을 제친 결승골 등 신기에 가까운 드리블 능력으로 ‘축구의 신’으로 불렸다.2000년대를 풍미했던 미국프로농구(NBA) 스타 코비 브라이언트가 1월27일 헬리콥터 사고로 세상을 떠났다. 브라이언트는 1996년 데뷔해 2016년 은퇴할 때까지 20년을 LA 레이커스에서만 뛴 NBA 역대 최고의 프랜차이즈 스타다. 5번의 챔피언결정전 우승을 레이커스에 안겼고, 통산 3만3643점으로 NBA 역대 4위에 올라 있을 정도로 개인 업적 역시 뛰어났다.이종섭·배문규·구교형·고희진 기자 nomad@kyunghyang.com▶ 인터랙티브:자낳세에 묻다▶ 경향신문 바로가기▶ 경향신문 구독신청하기©경향신문(www.khan.co.kr), 무단전재 및 재배포 금지"
