,date,title,content,refine_content,Senti_Score
0,2020.09.03,화장품 식품 용기에 쓰이는  재생 폴리프로필렌  롯데케미칼  국내 첫  미 FDA 인증  받아," 롯데케미칼이 국내 최초로 화장품이나 식품 용기에 사용 가능한 재생 폴리프로필렌(PCR-PP) 소재를 개발했다. 롯데케미칼은 미국 식품의약국(FDA) 인증을 완료한 재생 폴리프로필렌 소재를 개발해 올 4분기부터 본격 공급한다고 3일 밝혔다. 폴리프로필렌은 내열성이 있고 가벼워 플라스틱 중 식품 용기로 가장 많이 쓰이는 소재다. 재생 폴리프로필렌이 식품이나 화장품 용기에 사용하기 위해 필요한 FDA 인증을 받은 것은 국내에서 처음이다.롯데케미칼은 소비자가 사용한 화장품 용기를 수거해 재활용 원료를 만들고 FDA 안전기준에 적합한 가공 공정을 거쳐 새 용기로 재탄생시켰다고 설명했다. 고객사의 요청에 따라 플라스틱 재활용 원료를 30%, 50% 함유한 등급으로 개발했으며 국내 화장품 용기 제작업체들과 함께 테스트도 완료했다.최근 환경에 대한 관심이 늘면서 국내외 화장품 업계가 재활용 원료로 만든 화장품 포장재를 늘리고 있는 추세라 재생 폴리프로필렌 소재의 활용도는 갈수록 높아질 것으로 보인다. 국내 화장품 용기 중 약 60%가 플라스틱이고, 이 중 30%는 폴리프로필렌으로 만들어진 것으로 추산된다. 김교현 롯데케미칼 대표는 “이번 개발로 화장품 용기뿐 아니라 식품 용기, 기타 산업 분야에서도 재활용 플라스틱 시장이 확대될 것”이라며 “재생 플라스틱 소재 개발을 확대해 플라스틱 순환경제를 만드는 데 기여하고 사회적 가치를 만들어내겠다”고 말했다.남지원 기자 somnia@kyunghyang.com▶ 장도리 | 그림마당 보기▶ 경향신문 바로가기▶ 경향신문 구독신청하기©경향신문(www.khan.co.kr), 무단전재 및 재배포 금지",롯데케미칼이 국내 최초로 화장품이나 식품 용기에 사용 가능한 재생 폴리프로필렌 PCR PP  소재를 개발했다. 롯데케미칼은 미국 식품의약국 FDA  인증을 완료한 재생 폴리프로필렌 소재를 개발해 올 4분기부터 본격 공급한다고 3일 밝혔다. 폴리프로필렌은 내열성이 있고 가벼워 플라스틱 중 식품 용기로 가장 많이 쓰이는 소재다. 재생 폴리프로필렌이 식품이나 화장품 용기에 사용하기 위해 필요한 FDA 인증을 받은 것은 국내에서 처음이다.롯데케미칼은 소비자가 사용한 화장품 용기를 수거해 재활용 원료를 만들고 FDA 안전기준에 적합한 가공 공정을 거쳐 새 용기로 재탄생시켰다고 설명했다. 고객사의 요청에 따라 플라스틱 재활용 원료를 30   50  함유한 등급으로 개발했으며 국내 화장품 용기 제작업체들과 함께 테스트도 완료했다.최근 환경에 대한 관심이 늘면서 국내외 화장품 업계가 재활용 원료로 만든 화장품 포장재를 늘리고 있는 추세라 재생 폴리프로필렌 소재의 활용도는 갈수록 높아질 것으로 보인다. 국내 화장품 용기 중 약 60 가 플라스틱이고  이 중 30 는 폴리프로필렌으로 만들어진 것으로 추산된다. 김교현 롯데케미칼 대표는  이번 개발로 화장품 용기뿐 아니라 식품 용기  기타 산업 분야에서도 재활용 플라스틱 시장이 확대될 것 이라며  재생 플라스틱 소재 개발을 확대해 플라스틱 순환경제를 만드는 데 기여하고 사회적 가치를 만들어내겠다 고 말했다.  장도리   그림마당 보기            및  금지,0.20000000298023224
1,2020.09.04,여수국가산업단지 롯데케미칼 구내식당 여성 조리원 확진판정," 전남 여수국가산업단지에 입주한 롯데케미칼 구내식당에서 일하는 50대 아르바이트 여성 조리원이 코로나19 확진 판정을 받았다고 여수시가 4일 밝혔다.여수시 보건소는 롯데케미칼 구내식당 주방에서 이 여성과 함께 일했던 직원 등 관계자 15명을 대상으로 진단 검사를 했다. 롯데케미칼 측은 구내식당을 폐쇄하고 방역을 했다.확진자가 발생한 구내식당은 200여명을 수용할 수 있으며 식사를 하는 공간과 주방은 분리돼 있어 다른 접촉자는 없는 것으로 알려졌다.확진 판정을 받은 조리원도 근무 당시 마스크를 착용하고 있었으며 공장 출입 때 발열 체크에서도 문제가 없었다.공장 측은 필수인원을 제외하고 재택근무를 하는 방안도 검토하고 있다.박용근 기자 yk21@kyunghyang.com▶ 장도리 | 그림마당 보기▶ 경향신문 바로가기▶ 경향신문 구독신청하기©경향신문(www.khan.co.kr), 무단전재 및 재배포 금지",전남 여수국가산업단지에 입주한 롯데케미칼 구내식당에서 일하는 50대 아르바이트 여성 조리원이 코로나19 확진 판정을 받았다고 여수시가 4일 밝혔다.여수시 보건소는 롯데케미칼 구내식당 주방에서 이 여성과 함께 일했던 직원 등 관계자 15명을 대상으로 진단 검사를 했다. 롯데케미칼 측은 구내식당을 폐쇄하고 방역을 했다.확진자가 발생한 구내식당은 200여명을 수용할 수 있으며 식사를 하는 공간과 주방은 분리돼 있어 다른 접촉자는 없는 것으로 알려졌다.확진 판정을 받은 조리원도 근무 당시 마스크를 착용하고 있었으며 공장 출입 때 발열 체크에서도 문제가 없었다.공장 측은 필수인원을 제외하고 재택근무를 하는 방안도 검토하고 있다.  장도리   그림마당 보기            및  금지,0.0
2,2020.03.30,롯데케미칼  버리는 페트병 모아  옷 가방  만든다,"ㆍ롯데월드몰 등 7개 업체 참여ㆍ“플라스틱 순환경제 문화 기여”롯데케미칼이 놀이공원과 쇼핑몰 등에서 모은 폐플라스틱으로 섬유 원사를 뽑아 옷과 신발 등을 만드는 프로젝트를 진행한다.롯데케미칼은 30일 서울 잠실 롯데월드타워에서 김교현 롯데케미칼 대표를 비롯한 관련 업체 대표, 임직원들이 참석한 가운데 ‘프로젝트 루프(LOOP)’ 협약식을 열고 플라스틱 순환환경 구축 프로젝트를 실시한다고 밝혔다. 롯데그룹이 그룹 자원 선순환 프로젝트 3대 중점 실천과제 중 하나인 플라스틱 선순환 체계 구축을 위해 만든 ‘5RE(Reduce, Replace, Redesign, Reuse, Recycle)’ 모델이 적용된 프로젝트다.이번 프로젝트에 참여하는 7개 업체는 지난 1월부터 폐페트병을 자동으로 선별해 처리하는 자동수거기 네프론을 잠실 롯데월드몰, 롯데월드, 롯데마트에 각각 2대씩 총 6대 설치했다. 이렇게 수거된 폐페트병을 세척하고 분쇄해 만든 섬유 원사로 신발, 의류, 가방 등 제품을 제작한다. 롯데케미칼과 소셜벤처 육성기업 임팩트스퀘어가 프로젝트 코디네이션을 맡고, 재활용 로봇 전문 스타트업인 수퍼빈이 수거기를 설치한다. 금호석유공업은 폐페트병 분쇄를, 한국섬유개발원은 섬유 원사 제작을 맡기로 했다. 재활용 섬유 원사를 활용한 제품 제작은 소셜벤처인 LAR과 프로젝트비욘드, 리벨롭이 맡을 예정이다.김교현 대표는 “환경 문제에 대한 지속적 관심과 전문성을 가지고 있는 집단이 모여 만든 첫 번째 프로젝트”라며 “자원을 올바르게 사용하고 플라스틱 순환경제 문화를 만드는 데 기여해 사회적 가치를 함께 실현하는 기업이 되겠다”고 말했다.남지원 기자 somnia@kyunghyang.com▶ 장도리 | 그림마당 보기▶ 경향신문 바로가기▶ 경향신문 구독신청하기©경향신문(www.khan.co.kr), 무단전재 및 재배포 금지",롯데월드몰 등 7개 업체 참여  플라스틱 순환경제 문화 기여 롯데케미칼이 놀이공원과 쇼핑몰 등에서 모은 폐플라스틱으로 섬유 원사를 뽑아 옷과 신발 등을 만드는 프로젝트를 진행한다.롯데케미칼은 30일 서울 잠실 롯데월드타워에서 김교현 롯데케미칼 대표를 비롯한 관련 업체 대표  임직원들이 참석한 가운데  프로젝트 루프 LOOP   협약식을 열고 플라스틱 순환환경 구축 프로젝트를 실시한다고 밝혔다. 롯데그룹이 그룹 자원 선순환 프로젝트 3대 중점 실천과제 중 하나인 플라스틱 선순환 체계 구축을 위해 만든  5RE Reduce  Replace  Redesign  Reuse  Recycle   모델이 적용된 프로젝트다.이번 프로젝트에 참여하는 7개 업체는 지난 1월부터 폐페트병을 자동으로 선별해 처리하는 자동수거기 네프론을 잠실 롯데월드몰  롯데월드  롯데마트에 각각 2대씩 총 6대 설치했다. 이렇게 수거된 폐페트병을 세척하고 분쇄해 만든 섬유 원사로 신발  의류  가방 등 제품을 제작한다. 롯데케미칼과 소셜벤처 육성기업 임팩트스퀘어가 프로젝트 코디네이션을 맡고  재활용 로봇 전문 스타트업인 수퍼빈이 수거기를 설치한다. 금호석유공업은 폐페트병 분쇄를  한국섬유개발원은 섬유 원사 제작을 맡기로 했다. 재활용 섬유 원사를 활용한 제품 제작은 소셜벤처인 LAR과 프로젝트비욘드  리벨롭이 맡을 예정이다.김교현 대표는  환경 문제에 대한 지속적 관심과 전문성을 가지고 있는 집단이 모여 만든 첫 번째 프로젝트 라며  자원을 올바르게 사용하고 플라스틱 순환경제 문화를 만드는 데 기여해 사회적 가치를 함께 실현하는 기업이 되겠다 고 말했다.  장도리   그림마당 보기            및  금지,0.10000000149011612
3,2020.03.05,롯데케미칼 대산공장 폭발 화재 합동감식 돌입,"경찰 등이 충남 서산시 롯데케미칼 대산공장 폭발 화재의 원인을 규명을 위한 합동 감식에 돌입했다.충남지방경찰청은 5일 오전 11시부터 경찰, 소방, 국립과학수사연구원, 대전지방노동청, 산업안전관리공단, 가스안전공사 등의 합동 감식을 진행하고 있다고 밝혔다.합동감식단은 압축공정 배관에서 폭발이 발생한 것으로 보인다는 롯데케미칼 측의 설명에 따라 해당 배관의 기계적 이상 여부, 화학적 요인 등을 집중적으로 조사할 계획이다.4일 오전 3시쯤 대산석유화학단지 롯데케미칼 ‘납사분해공정동’(NCC)에서 폭발과 함께 불이 났다.이 불로 롯데케미칼 직원 ㄱ씨(38) 등 4명과 대산단지 내 또 다른 회사 직원 3명이 부상했고, 대산단지 주변 주민 49명이 병원에서 진료를 받았다.또 폭발 충격으로 주변 마을 상가와 집 등 수십곳이 부서지는 피해를 입었다.권순재 기자 sjkwon@kyunghyang.com▶ 장도리 | 그림마당 보기▶ 경향신문 바로가기▶ 경향신문 구독신청하기©경향신문(www.khan.co.kr), 무단전재 및 재배포 금지",경찰 등이 충남 서산시 롯데케미칼 대산공장 폭발 화재의 원인을 규명을 위한 합동 감식에 돌입했다.충남지방경찰청은 5일 오전 11시부터 경찰  소방  국립과학수사연구원  대전지방노동청  산업안전관리공단  가스안전공사 등의 합동 감식을 진행하고 있다고 밝혔다.합동감식단은 압축공정 배관에서 폭발이 발생한 것으로 보인다는 롯데케미칼 측의 설명에 따라 해당 배관의 기계적 이상 여부  화학적 요인 등을 집중적으로 조사할 계획이다.4일 오전 3시쯤 대산석유화학단지 롯데케미칼  납사분해공정동  NCC 에서 폭발과 함께 불이 났다.이 불로 롯데케미칼 직원  씨 38  등 4명과 대산단지 내 또 다른 회사 직원 3명이 부상했고  대산단지 주변 주민 49명이 병원에서 진료를 받았다.또 폭발 충격으로 주변 마을 상가와 집 등 수십곳이 부서지는 피해를 입었다.  장도리   그림마당 보기            및  금지,0.0
4,2020.03.04,서산 롯데케미칼 공장 폭발사고 주변 마을 상가 집까지  와장창,"직원 7명·주민 49명도 다쳐“하늘이 불바다로…벼락인 줄” 납사 압축 중 원료 누출 추정충남 서산시 롯데케미칼 대산공장에서 폭발과 함께 큰불이 나 직원 7명이 부상하고, 인근 주민 수십명이 다치는 사고가 발생했다. 폭발 충격으로 주변 마을 상가와 집 등이 부서지는 피해도 입었다.4일 오전 3시쯤 대산석유화학단지 롯데케미칼 ‘납사분해공정동’(NCC)에서 폭발과 함께 불이 났다. 이 불로 롯데케미칼 직원 ㄱ씨(38) 등 4명과 대산단지 내 또 다른 회사 직원 3명이 부상했다. ㄱ씨 등은 폭발 장소에서 50m 정도 떨어진 사무실에서 근무하던 중 폭발 충격으로 떨어진 천장 파편 등에 맞아 다친 것으로 알려졌다. 서산시는 이날 오후 5시 기준 대산단지 주변 주민 49명이 인근 병원에서 진료를 받고 귀가한 것으로 집계했다. 다행히 이들 주민 대부분은 경상이지만 피해를 호소하는 주민이 있어 부상자는 더 늘 수 있다.불이 나자 소방당국은 인근 지역 소방서와 소방인력 등을 동원하는 경보령인 대응 2단계를 발령하고 인력 274명과 장비 66대를 투입했다. 경기소방본부(화학차)와 육군 32사단까지 사고 수습에 나섰다. 불은 공장 내부와 시설물 등을 태우고 6시간 만인 오전 9시쯤 진화됐다.폭발 충격으로 대산공단 주변 상가·주택 수십 곳이 파손되는 피해를 입었다. 창문 등 유리 파손이 많았고, 일부 건물은 기둥 등이 휘어지기도 했다. 대산공단 주변 주민들은 “주변 하늘이 불바다처럼 보일 정도로 큰 화재였다”고 전했다. 주민 김기태씨(70)는 “군대에서도 들어보지 못한 큰 폭발음에 놀랐다”며 “집에 벼락이 떨어진 줄 알았다”고 말했다. 폭발 진동은 대산공단에서 10㎞ 정도 떨어진 당진시와 태안군에서도 감지된 것으로 전해졌다.경찰과 소방당국은 납사 압축분해 공정 중 폭발이 발생한 것으로 보고 있다. 원유에서 뽑아내는 납사는 화학제품 원료를 만드는 데 쓰인다. 1200도 이상 고온으로 납사를 열분해하면 에틸렌·프로필렌·열분해 가솔린 등을 생산할 수 있다. 롯데케미칼 관계자는 “납사 압축분해 공정 중 일부 파이프에서 폭발이 발생했다”며 “순간적으로 (원료 일부가) 누출된 것으로 보인다”고 말했다.경찰은 서산경찰서 강력팀과 충남지방경찰청 광역수사대 등으로 폭발사고 전담 수사팀을 꾸리고 사고 원인 등을 조사하고 있다. 금강유역환경청과 서산 화학재난합동방재센터 등은 대산공단 주변에 대한 환경오염 등을 조사하고 있다.권순재 기자 sjkwon@kyunghyang.com▶ 장도리 | 그림마당 보기▶ 경향신문 바로가기▶ 경향신문 구독신청하기©경향신문(www.khan.co.kr), 무단전재 및 재배포 금지",직원 7명 주민 49명도 다쳐 하늘이 불바다로 벼락인 줄  납사 압축 중 원료 누출 추정충남 서산시 롯데케미칼 대산공장에서 폭발과 함께 큰불이 나 직원 7명이 부상하고  인근 주민 수십명이 다치는 사고가 발생했다. 폭발 충격으로 주변 마을 상가와 집 등이 부서지는 피해도 입었다.4일 오전 3시쯤 대산석유화학단지 롯데케미칼  납사분해공정동  NCC 에서 폭발과 함께 불이 났다. 이 불로 롯데케미칼 직원  씨 38  등 4명과 대산단지 내 또 다른 회사 직원 3명이 부상했다.  씨 등은 폭발 장소에서 50m 정도 떨어진 사무실에서 근무하던 중 폭발 충격으로 떨어진 천장 파편 등에 맞아 다친 것으로 알려졌다. 서산시는 이날 오후 5시 기준 대산단지 주변 주민 49명이 인근 병원에서 진료를 받고 귀가한 것으로 집계했다. 다행히 이들 주민 대부분은 경상이지만 피해를 호소하는 주민이 있어 부상자는 더 늘 수 있다.불이 나자 소방당국은 인근 지역 소방서와 소방인력 등을 동원하는 경보령인 대응 2단계를 발령하고 인력 274명과 장비 66대를 투입했다. 경기소방본부 화학차 와 육군 32사단까지 사고 수습에 나섰다. 불은 공장 내부와 시설물 등을 태우고 6시간 만인 오전 9시쯤 진화됐다.폭발 충격으로 대산공단 주변 상가 주택 수십 곳이 파손되는 피해를 입었다. 창문 등 유리 파손이 많았고  일부 건물은 기둥 등이 휘어지기도 했다. 대산공단 주변 주민들은  주변 하늘이 불바다처럼 보일 정도로 큰 화재였다 고 전했다. 주민 김기태씨 70 는  군대에서도 들어보지 못한 큰 폭발음에 놀랐다 며  집에 벼락이 떨어진 줄 알았다 고 말했다. 폭발 진동은 대산공단에서 10  정도 떨어진 당진시와 태안군에서도 감지된 것으로 전해졌다.경찰과 소방당국은 납사 압축분해 공정 중 폭발이 발생한 것으로 보고 있다. 원유에서 뽑아내는 납사는 화학제품 원료를 만드는 데 쓰인다. 1200도 이상 고온으로 납사를 열분해하면 에틸렌 프로필렌 열분해 가솔린 등을 생산할 수 있다. 롯데케미칼 관계자는  납사 압축분해 공정 중 일부 파이프에서 폭발이 발생했다 며  순간적으로  원료 일부가  누출된 것으로 보인다 고 말했다.경찰은 서산경찰서 강력팀과 충남지방경찰청 광역수사대 등으로 폭발사고 전담 수사팀을 꾸리고 사고 원인 등을 조사하고 있다. 금강유역환경청과 서산 화학재난합동방재센터 등은 대산공단 주변에 대한 환경오염 등을 조사하고 있다.  장도리   그림마당 보기            및  금지,-0.10000000149011612
5,2020.03.04,서산 롯데케미칼 폭발사고로 31명 부상   주변 상가 민가도 피해,"4일 오전 2시59분쯤 충남 서산시 대산읍 롯데케미칼 대산공장에서 폭발과 함께 불이나 노동자와 인근 주민 등이 부상을 입었다.노동자와 인근 주민 등 31명이 다쳐 인근 병원으로 옮겨져 치료를 받고 있다.이 중 2명은 중상을 입은 것으로 확인됐다.소방당국은 인접 소방서 가용 인력과 장비까지 출동하는 대응 광역 2단계를 발령해 소방관 240여명과 차량 38대를 동원해 2시간여 만인 오전 5시12분쯤 큰 불길을 잡았다.대응 단계를 1단계로 하향하고 화재 진압을 이어가고 있다.경찰과 소방당국은 납사(나프타) 분해 센터에서 폭발 사고가 난 것으로 보고 있다.경찰 관계자는 “납사 분해 공정 중 압축 라인에서 폭발이 생겼다는 공장 측 설명을 토대로 정확한 경위를 조사하고 있다”고 말했다.원유에서 뽑아내는 납사는 화학제품 원료를 만드는 데 쓰인다.이날 폭발은 대산공장 주변 마을의 창문이 깨지거나 지붕이 내려앉는 사고로도 이어졌다.진동은 대산공단에서 수십㎞ 떨어진 당진과 태안에서도 느껴질 만큼 컸던 것으로 전해졌다.서산시 관계자는 “유해 화학물질이 누출되거나 한 상황은 아니어서 대피령까지 내리지는 않았다”고 말했다.권순재 기자 sjkwon@kyunghyang.com▶ 장도리 | 그림마당 보기▶ 경향신문 바로가기▶ 경향신문 구독신청하기©경향신문(www.khan.co.kr), 무단전재 및 재배포 금지",4일 오전 2시59분쯤 충남 서산시 대산읍 롯데케미칼 대산공장에서 폭발과 함께 불이나 노동자와 인근 주민 등이 부상을 입었다.노동자와 인근 주민 등 31명이 다쳐 인근 병원으로 옮겨져 치료를 받고 있다.이 중 2명은 중상을 입은 것으로 확인됐다.소방당국은 인접 소방서 가용 인력과 장비까지 출동하는 대응 광역 2단계를 발령해 소방관 240여명과 차량 38대를 동원해 2시간여 만인 오전 5시12분쯤 큰 불길을 잡았다.대응 단계를 1단계로 하향하고 화재 진압을 이어가고 있다.경찰과 소방당국은 납사 나프타  분해 센터에서 폭발 사고가 난 것으로 보고 있다.경찰 관계자는  납사 분해 공정 중 압축 라인에서 폭발이 생겼다는 공장 측 설명을 토대로 정확한 경위를 조사하고 있다 고 말했다.원유에서 뽑아내는 납사는 화학제품 원료를 만드는 데 쓰인다.이날 폭발은 대산공장 주변 마을의 창문이 깨지거나 지붕이 내려앉는 사고로도 이어졌다.진동은 대산공단에서 수십  떨어진 당진과 태안에서도 느껴질 만큼 컸던 것으로 전해졌다.서산시 관계자는  유해 화학물질이 누출되거나 한 상황은 아니어서 대피령까지 내리지는 않았다 고 말했다.  장도리   그림마당 보기            및  금지,0.0
6,2020.08.31,롯데케미칼 샤롯데봉사단  8월 이웃돕기 구슬땀  동부서주," 여수산단 롯데케미칼 여수공장(본부장 박현철) 샤롯데봉사단이 코로나19와 수해로 힘겨워하는 이웃 돕기에 나서고 있다.이 봉사단체는 31일 전남동부보훈지청을 방문, 코로나 19와 수해로 어려움을 겪는 보훈가족 50가구 기부용 생활필수품 선물 50상자를 전달했다. 이들 상자는 치약·치솔·비누·손세정제 등 생활필수품 10여가지로 채웠다.이 단체는 지난 24일에도 여수시내 지역아동센터 10곳에 학용품 상자(500만원 어치)를 전달했다. 센터 이용학생들의 개학준비를 돕기 위해 매학기마다 이어지는 자선행사다. 지난 12일과 13일엔 전남 구례와 경남 하동 수해지역을 찾아 복구인력 위한 식사와 구호용품을 전달했다. 직원부인회가 손수 마련한 김밥 600인분씩을 각각 전하고, 마스크 2000장, 일회용 구호작업복 1000벌도 건넸다.이 봉사단체는 여수지역 안에서 희망하우스 짓기, 집수리, 빨간밥차, 김장담그기, 연탄배달 등 이웃돕기를 연중 펼치고 있다. 샤롯데 관계자는 “태풍과 수해, 코로나 19 등이 겹치면서 어려운 가정이 더욱 늘어나고 있어 봉사단 활동도 더욱 넓게 이뤄지고 있다”면서 “사회복지제도가 미처 적극적으로 살피지못하는 이웃들을 찾아 그 간극을 메우려 하고 있다”고 말했다.배명재 기자 ninaplus@kyunghyang.com▶ 장도리 | 그림마당 보기▶ 경향신문 바로가기▶ 경향신문 구독신청하기©경향신문(www.khan.co.kr), 무단전재 및 재배포 금지",여수산단 롯데케미칼 여수공장 본부장 박현철  샤롯데봉사단이 코로나19와 수해로 힘겨워하는 이웃 돕기에 나서고 있다.이 봉사단체는 31일 전남동부보훈지청을 방문  코로나 19와 수해로 어려움을 겪는 보훈가족 50가구 기부용 생활필수품 선물 50상자를 전달했다. 이들 상자는 치약 치솔 비누 손세정제 등 생활필수품 10여가지로 채웠다.이 단체는 지난 24일에도 여수시내 지역아동센터 10곳에 학용품 상자 500만원 어치 를 전달했다. 센터 이용학생들의 개학준비를 돕기 위해 매학기마다 이어지는 자선행사다. 지난 12일과 13일엔 전남 구례와 경남 하동 수해지역을 찾아 복구인력 위한 식사와 구호용품을 전달했다. 직원부인회가 손수 마련한 김밥 600인분씩을 각각 전하고  마스크 2000장  일회용 구호작업복 1000벌도 건넸다.이 봉사단체는 여수지역 안에서 희망하우스 짓기  집수리  빨간밥차  김장담그기  연탄배달 등 이웃돕기를 연중 펼치고 있다. 샤롯데 관계자는  태풍과 수해  코로나 19 등이 겹치면서 어려운 가정이 더욱 늘어나고 있어 봉사단 활동도 더욱 넓게 이뤄지고 있다 면서  사회복지제도가 미처 적극적으로 살피지못하는 이웃들을 찾아 그 간극을 메우려 하고 있다 고 말했다.  장도리   그림마당 보기            및  금지,0.20000000298023224
