,date,title,content,refine_content,Senti_Score
0,2020-12-21,포스코  그룹사 첫 여성 사장 선임," 포스코그룹 사상 최초 여성 사장이 나왔다. 철강부문에서는 그룹 2인자인 장인화 사장이 물러나고 김학동 생산기술본부장이 사장에 오르는 등 세대교체도 추진됐다. 포스코는 21일 조직개편과 정기 임원인사를 단행하면서 그룹내 동반성장 활동을 주도한 이유경 설비자재구매실장을 구매·공급 전문 그룹 계열사 엔투비 사장으로 보임해 그룹 사상 첫 여성 사장이 탄생했다고 밝혔다. 여성임원 확대 기조에 따라 오지은 생산기술전략실 상무보도 기술연구원 상무급 연구위원으로 승진했다. 김학동 신임 포스코 철강부문장(사장)철강부문에서는 장인화 철강부문장이 자문역으로 물러나고, 철강부문장에 김학동 생산기술본부장이 승진·보임됐다. 생산기술본부장에는 이시우 광양제철소장, 구매투자본부장에는 이주태 경영전략실장이 승진·보임되는 등 최고경영진의 세대교체가 이뤄졌다. 광양제철소장에는 인도네시아 제철소 PT.KP의 경영정상화를 이끈 김지용 법인장이 보임됐다. 포스코 관계자는 “올해 어려운 경영 여건에서도 조기에 철강부문 실적 반등을 이끈 데 이어 최정우 회장 2기 체제에서 혁신을 주도해 현장의 경쟁력을 강화할 인물들로 평가된다”고 전했다. 이외 전중선 글로벌인프라부문장, 정탁 마케팅본부장, 정창화 경영지원본부장 등 대부분 본부장들은 유임됐다. 포스코는 최고경영자(CEO) 직속으로 산업가스·수소사업부와 물류사업부를 신설하고 산업가스·수소사업부장에 구매투자본부장인 유병옥 부사장, 물류사업부장에 미국 대표법인장인 김광수 부사장을 선임했다. 두 사업부 산하에는 총 5개의 임원단위 실 조직을 신설해 그룹 내 우수 인력들을 대거 전진 배치했다.양극재·음극재 등 이차전지소재사업을 추진하는 포스코케미칼 에너지소재본부도 에너지소재사업부로 개편하면서 조직과 인력을 확충했다. 사업부장에는 그동안 음극재 사업을 진두지휘해 온 정대헌 포스코케미칼 음극소재실장이 승진·보임됐으며, 산하에 신설된 전략실과 마케팅실에는 포스코와 포스코인터내셔널의 임원과 우수인력들이 배치됐다.박효재 기자 mann616@kyunghyang.com▶ 인터랙티브:자낳세에 묻다▶ 경향신문 바로가기▶ 경향신문 구독신청하기©경향신문(www.khan.co.kr), 무단전재 및 재배포 금지",포스코그룹 사상 최초 여성 사장이 나왔다. 철강부문에서는 그룹 2인자인 장인화 사장이 물러나고 김학동 생산기술본부장이 사장에 오르는 등 세대교체도 추진됐다. 포스코는 21일 조직개편과 정기 임원인사를 단행하면서 그룹내 동반성장 활동을 주도한 이유경 설비자재구매실장을 구매 공급 전문 그룹 계열사 엔투비 사장으로 보임해 그룹 사상 첫 여성 사장이 탄생했다고 밝혔다. 여성임원 확대 기조에 따라 오지은 생산기술전략실 상무보도 기술연구원 상무급 연구위원으로 승진했다. 김학동 신임 포스코 철강부문장 사장 철강부문에서는 장인화 철강부문장이 자문역으로 물러나고  철강부문장에 김학동 생산기술본부장이 승진 보임됐다. 생산기술본부장에는 이시우 광양제철소장  구매투자본부장에는 이주태 경영전략실장이 승진 보임되는 등 최고경영진의 세대교체가 이뤄졌다. 광양제철소장에는 인도네시아 제철소 PT.KP의 경영정상화를 이끈 김지용 법인장이 보임됐다. 포스코 관계자는  올해 어려운 경영 여건에서도 조기에 철강부문 실적 반등을 이끈 데 이어 최정우 회장 2기 체제에서 혁신을 주도해 현장의 경쟁력을 강화할 인물들로 평가된다 고 전했다. 이외 전중선 글로벌인프라부문장  정탁 마케팅본부장  정창화 경영지원본부장 등 대부분 본부장들은 유임됐다. 포스코는 최고경영자 CEO  직속으로 산업가스 수소사업부와 물류사업부를 신설하고 산업가스 수소사업부장에 구매투자본부장인 유병옥 부사장  물류사업부장에 미국 대표법인장인 김광수 부사장을 선임했다. 두 사업부 산하에는 총 5개의 임원단위 실 조직을 신설해 그룹 내 우수 인력들을 대거 전진 배치했다.양극재 음극재 등 이차전지소재사업을 추진하는 포스코케미칼 에너지소재본부도 에너지소재사업부로 개편하면서 조직과 인력을 확충했다. 사업부장에는 그동안 음극재 사업을 진두지휘해 온 정대헌 포스코케미칼 음극소재실장이 승진 보임됐으며  산하에 신설된 전략실과 마케팅실에는 포스코와 포스코인터내셔널의 임원과 우수인력들이 배치됐다.  인터랙티브 자낳세에 묻다            및  금지,0.2000000029802322
1,2020-12-09,포스코케미칼  LG GM 합작사에  양극재  공급,"‘전기차 배터리 핵심소재’ 납품 계약 포스코케미칼이 LG에너지솔루션(옛 LG화학 전지사업부문)과 미국 제너럴모터스(GM)의 합작 회사인 얼티엄셀즈에 전기차 배터리 핵심소재인 양극재를 공급한다. 친환경 기업으로 전환하기 위한 포스코그룹 차원의 이차전지(배터리) 소재 사업 투자가 성과를 내는 모습이다.포스코케미칼은 9일 얼티엄셀즈의 생산시점에 맞춰 양극재를 공급하기로 했다고 밝혔다. 양산된 배터리셀은 GM에서 생산하는 얼티엄 전기차 플랫폼에 적용될 예정이다. 포스코케미칼은 음극재 공급도 별도 협의를 진행하고 있다고 설명했다.얼티엄셀즈는 세계 1위 배터리사인 LG에너지솔루션과 미국 1위 자동차 제조사인 GM이 지난해 50 대 50 지분으로 설립한 배터리셀(전기차 배터리의 기본단위) 합작 법인이다. 현재 미국 오하이오주 로즈타운에 공장이 건설 중인데, 양사는 총 2조7000억원을 투자해 30GWh(기가와트시) 이상의 생산 능력을 확보한다는 계획이다. 포스코케미칼은 이번 공급으로 글로벌 시장에 양극재를 공급해 시장 점유율을 높임으로써 본격적인 성장궤도에 들어설 것으로 기대하고 있다.포스코는 차세대 성장동력으로 육성하고 있는 이차전지 소재 사업 투자가 결실을 보기 시작하는 것이라고 자평했다. 포스코는 지난달 포스코케미칼에 그룹 계열사로는 사상 최대인 1조원의 유상증자를 결정하면서, 이차전지 소재 사업을 집중 육성하겠다고 밝혔다. 포스코케미칼은 현재 전남 광양·경북 구미 공장 합계 연간 4만t인 양극재 생산량을 10만t까지 늘리기 위해 올해 광양공장 증설에 약 6000억원을 투자했다. 2023년 완공 예정인 증설 설비에서는 하이니켈 NCMA(니켈·코발트·망간·알루미늄) 양극재 등 차세대 전기차용 소재를 생산한다.박효재 기자 mann616@kyunghyang.com▶ 인터랙티브:자낳세에 묻다▶ 경향신문 바로가기▶ 경향신문 구독신청하기©경향신문(www.khan.co.kr), 무단전재 및 재배포 금지",전기차 배터리 핵심소재  납품 계약 포스코케미칼이 LG에너지솔루션 옛 LG화학 전지사업부문 과 미국 제너럴모터스 GM 의 합작 회사인 얼티엄셀즈에 전기차 배터리 핵심소재인 양극재를 공급한다. 친환경 기업으로 전환하기 위한 포스코그룹 차원의 이차전지 배터리  소재 사업 투자가 성과를 내는 모습이다.포스코케미칼은 9일 얼티엄셀즈의 생산시점에 맞춰 양극재를 공급하기로 했다고 밝혔다. 양산된 배터리셀은 GM에서 생산하는 얼티엄 전기차 플랫폼에 적용될 예정이다. 포스코케미칼은 음극재 공급도 별도 협의를 진행하고 있다고 설명했다.얼티엄셀즈는 세계 1위 배터리사인 LG에너지솔루션과 미국 1위 자동차 제조사인 GM이 지난해 50 대 50 지분으로 설립한 배터리셀 전기차 배터리의 기본단위  합작 법인이다. 현재 미국 오하이오주 로즈타운에 공장이 건설 중인데  양사는 총 2조7000억원을 투자해 30GWh 기가와트시  이상의 생산 능력을 확보한다는 계획이다. 포스코케미칼은 이번 공급으로 글로벌 시장에 양극재를 공급해 시장 점유율을 높임으로써 본격적인 성장궤도에 들어설 것으로 기대하고 있다.포스코는 차세대 성장동력으로 육성하고 있는 이차전지 소재 사업 투자가 결실을 보기 시작하는 것이라고 자평했다. 포스코는 지난달 포스코케미칼에 그룹 계열사로는 사상 최대인 1조원의 유상증자를 결정하면서  이차전지 소재 사업을 집중 육성하겠다고 밝혔다. 포스코케미칼은 현재 전남 광양 경북 구미 공장 합계 연간 4만t인 양극재 생산량을 10만t까지 늘리기 위해 올해 광양공장 증설에 약 6000억원을 투자했다. 2023년 완공 예정인 증설 설비에서는 하이니켈 NCMA 니켈 코발트 망간 알루미늄  양극재 등 차세대 전기차용 소재를 생산한다.  인터랙티브 자낳세에 묻다            및  금지,0.1000000014901161
2,2020-12-03,포스코  세계 최고  2차전지 소재 사업  확대할 것,"아르헨에서 리튬 다량 확보 바탕‘원료조달∼소재 생산’ 구축 박차 포스코가 이차전지 소재 사업을 세계 최고 수준으로 키우기 위해 그룹의 모든 역량을 집중하기로 했다. 이를 위해 이차전지 원료 조달부터 소재 생산에 이르기까지 밸류체인(가치사슬) 완성에 박차를 가한다는 계획이다.최정우 포스코 회장은 3일 “우리는 전 세계에서 유일하게 리튬, 니켈, 흑연 등 원료부터 양극재와 음극재까지 이차전지 소재 일괄공급체계를 갖추고 있다”며 “차별화된 경쟁 우위에 기반해 이차전지 소재를 세계 최고 수준 사업으로 육성하겠다”고 밝혔다.포스코는 현재 이차전지 양극재 원료로 사용되는 리튬을 다량 확보한 상태다. 지난달 미국의 리튬 컨설팅업체 몽고메리에 포스코가 보유한 아르헨티나 ‘옴브레 무에르토’ 염호(소금호수)의 최종 리튬 매장량을 평가하게 한 결과, 인수 당시 추산한 220만t보다 6배 많은 1350만t인 것으로 확인됐다. 전기차 3억7000만대 배터리에 쓰일 수 있는 규모다. 포스코는 리튬 농도가 평균 ℓ당 921㎎으로 매우 높아 적은 염수에서 많은 리튬을 추출할 수 있을 것이라고 설명했다.포스코는 고용량 배터리 양극재 제조의 필수 원료인 고순도의 니켈 생산도 추진한다. 철강 생산 공정의 쇳물 생산 및 불순물 제거 기술을 바탕으로 친환경 고순도 니켈 제련 공정을 개발하는 데 투자를 확대할 예정이다.현재 전량 중국으로부터 수입에 의존하고 있는 음극재 원료인 흑연의 수급 다변화를 위해 아프리카, 호주 등의 흑연 광산을 확보한다는 계획도 밝혔다. 이를 통해 중장기적으로 중국 의존도를 50% 이하로 낮춘다는 계획이다.포스코는 차세대 이차전지로 조명받는 전고체전지 소재 개발에도 나선다. 포스코케미칼은 지난달 이차전지 소재 투자를 위해 1조원 규모의 유상증자를 단행했다.포스코는 소재 밸류체인을 완성해 2030년까지 연간 리튬 22만t, 니켈 10만t을 자체 공급해 양극재 40만t, 음극재 26만t 생산체제를 구축할 계획이다. 이를 통해 이차전지 소재 부문에서 글로벌 시장 점유율 20%, 매출액 연 23조원을 달성하겠다는 목표도 제시했다.박효재 기자 mann616@kyunghyang.com▶ 인터랙티브:자낳세에 묻다▶ 경향신문 바로가기▶ 경향신문 구독신청하기©경향신문(www.khan.co.kr), 무단전재 및 재배포 금지",아르헨에서 리튬 다량 확보 바탕 원료조달 소재 생산  구축 박차 포스코가 이차전지 소재 사업을 세계 최고 수준으로 키우기 위해 그룹의 모든 역량을 집중하기로 했다. 이를 위해 이차전지 원료 조달부터 소재 생산에 이르기까지 밸류체인 가치사슬  완성에 박차를 가한다는 계획이다.최정우 포스코 회장은 3일  우리는 전 세계에서 유일하게 리튬  니켈  흑연 등 원료부터 양극재와 음극재까지 이차전지 소재 일괄공급체계를 갖추고 있다 며  차별화된 경쟁 우위에 기반해 이차전지 소재를 세계 최고 수준 사업으로 육성하겠다 고 밝혔다.포스코는 현재 이차전지 양극재 원료로 사용되는 리튬을 다량 확보한 상태다. 지난달 미국의 리튬 컨설팅업체 몽고메리에 포스코가 보유한 아르헨티나  옴브레 무에르토  염호 소금호수 의 최종 리튬 매장량을 평가하게 한 결과  인수 당시 추산한 220만t보다 6배 많은 1350만t인 것으로 확인됐다. 전기차 3억7000만대 배터리에 쓰일 수 있는 규모다. 포스코는 리튬 농도가 평균  당 921 으로 매우 높아 적은 염수에서 많은 리튬을 추출할 수 있을 것이라고 설명했다.포스코는 고용량 배터리 양극재 제조의 필수 원료인 고순도의 니켈 생산도 추진한다. 철강 생산 공정의 쇳물 생산 및 불순물 제거 기술을 바탕으로 친환경 고순도 니켈 제련 공정을 개발하는 데 투자를 확대할 예정이다.현재 전량 중국으로부터 수입에 의존하고 있는 음극재 원료인 흑연의 수급 다변화를 위해 아프리카  호주 등의 흑연 광산을 확보한다는 계획도 밝혔다. 이를 통해 중장기적으로 중국 의존도를 50  이하로 낮춘다는 계획이다.포스코는 차세대 이차전지로 조명받는 전고체전지 소재 개발에도 나선다. 포스코케미칼은 지난달 이차전지 소재 투자를 위해 1조원 규모의 유상증자를 단행했다.포스코는 소재 밸류체인을 완성해 2030년까지 연간 리튬 22만t  니켈 10만t을 자체 공급해 양극재 40만t  음극재 26만t 생산체제를 구축할 계획이다. 이를 통해 이차전지 소재 부문에서 글로벌 시장 점유율 20   매출액 연 23조원을 달성하겠다는 목표도 제시했다.  인터랙티브 자낳세에 묻다            및  금지,0.2000000029802322
3,2020-06-25,포스코그룹  힘내라 우리동네  전 세계 임직원 곳곳서 재능 봉사," 포스코(회장 최정우)는 코로나19로 위축된 지역경제를 활성화하고 6·25전쟁 70주년을 기념해 ‘힘내라 우리동네, 기억하자 전쟁영웅(Cheer Up My Town & Remember Our Heroes)’을 테마로 ‘글로벌 모범시민 위크’를 실시하고 있다.‘글로벌 모범시민 위크’는 포스코그룹 임직원들이 보유하고 있는 재능을 활용해 사회문제 해결에 동참하고, 더 나은 지역사회 발전에 기여하는 특별 봉사 주간으로 전 세계 포스코그룹 임직원이 참여한다. 포스코가 2010년부터 매년 실시해온 ‘글로벌 볼런티어 위크’가 올해부터 글로벌 사회가 직면한 문제 해결에 자발적으로 동참하자는 취지에서 기업시민 경영이념을 연계해 ‘글로벌 모범시민 위크’로 새롭게 출발했다.‘글로벌 모범시민 위크’는 지난 19일부터 27일까지 9일간 실시하며 코로나19 생활 속 거리 두기를 철저히 준수하면서 개개인이 가진 기술, 특기, 전문지식 등 재능을 활용한 다양한 비대면(언택트) 봉사활동을 펼친다.6·25전쟁 70주년을 맞아 참전용사들의 숭고한 희생과 헌신에 깊이 감사를 표하는 다채로운 활동들도 진행했다. 포항에서는 호국보훈 기념장소인 학도의용군 전승기념관에서 조경 및 환경미화 봉사활동을 펼치고, 태국에서는 현지법인 임직원들이 함께 태국군 한국전쟁 참전 기념관에 영상 시청용 TV를 기증하고 식목·대청소 등 환경정화 활동도 실시했다.특히 포스코는 국가보훈처와 합동으로 포항과 광양에 거주하며 생활이 어려운 6·25 참전용사 가정 40가구를 선발해 주거환경 개선을 지원한다. 이번 지원활동은 도배, 전기수리 등 포스코 재능봉사단이 직접 참여하는 집 고쳐주기 사업의 일환으로 지난 20일 광양지역 4가구를 시작으로 10월까지 40가구를 완료할 예정이다.올해 행사에는 사회문제 해결을 위한 협력을 지속해오고 있는 SK가 동참해 의미를 더했다. 작년 12월 ‘2019 기업시민 포스코 성과공유의 장’에서 최태원 SK 회장은 특별강연 초청을 받아 SK의 사회적 가치 활동을 소개하고 그 중요성을 역설한 바 있다.포스코는 25일 사각지대 아동 복지 증진을 위해 결식아동에게 도시락을 지원하는 ‘행복얼라이언스’ 사업에 SK와 함께 참여하기로 하고 협약식을 개최했다. 협약식에 이어 포스코와 SK 임직원들은 함께 서울지역 저소득 및 노인계층 70가구에 직접 만든 음식과 식품 등을 넣은 도시락 가방을 제작해 전달했다.포스코그룹사들도 기업시민 경영이념 실천활동에 적극 나서고 있다.포스코인터내셔널은 22일 인천지역 중도입국청소년과 함께하는 꽃꽂이 활동 봉사를 했다. 이번 꽃꽂이 활동은 코로나19 장기화와 사회적 거리 두기 일상화로 움츠러든 중도입국청소년들의 정서적 안정을 도모하고 경제적 어려움을 겪고 있는 인천지역 소상공인을 지원하고자 계획됐다. 중도입국청소년은 한국인 배우자와 재혼한 이민자의 자녀로, 한국에 거주하는 청소년을 말한다. 코로나19에 따른 대면 접촉 최소화를 위해 본사 사옥 대강당과 학생들이 다니는 인천 새꿈학교 두 곳에서 동시에 이뤄졌다.포스코건설은 지난 21일 연일 코로나19 방역과 진료에 힘쓰는 지역 의료진과 공무원에게 화분을 전달하고 감사를 표시했다. 이번 행사는 ‘화훼농가 돕기 릴레이 캠페인’의 일환으로, 포스코건설은 인천시 코로나19 방역대책반과 인천시 산하 31개 지역선별진료소에 해피트리·파키라 등 대형 화분을 전달했다. 화훼농가 돕기 릴레이는 코로나19 확산으로 어려움을 겪는 화훼농가를 지원하고자 지난 2월부터 SNS를 통해 릴레이로 진행되고 있는 공익 캠페인이다.포스코케미칼은 19일 중국 화유코발트와 ‘포스코케미칼 화유코발트 공생펀드’ 조성 사업 협약을 체결했다. 이번 공생펀드 체결은 양사가 배터리 양극재의 원료인 코발트와 전구체 공급 등의 사업분야 협력을 기반으로, 지역사회 기여를 통한 지속 가능성 확보 등 사업 프로세스 전반에 걸쳐 협업을 확대하고 파트너십을 강화하는 차원이다.▶ 장도리 | 그림마당 보기▶ 경향신문 바로가기▶ 경향신문 구독신청하기©경향신문(www.khan.co.kr), 무단전재 및 재배포 금지",포스코 회장 최정우 는 코로나19로 위축된 지역경제를 활성화하고 6 25전쟁 70주년을 기념해  힘내라 우리동네  기억하자 전쟁영웅 Cheer Up My Town   Remember Our Heroes  을 테마로  글로벌 모범시민 위크 를 실시하고 있다. 글로벌 모범시민 위크 는 포스코그룹 임직원들이 보유하고 있는 재능을 활용해 사회문제 해결에 동참하고  더 나은 지역사회 발전에 기여하는 특별 봉사 주간으로 전 세계 포스코그룹 임직원이 참여한다. 포스코가 2010년부터 매년 실시해온  글로벌 볼런티어 위크 가 올해부터 글로벌 사회가 직면한 문제 해결에 자발적으로 동참하자는 취지에서 기업시민 경영이념을 연계해  글로벌 모범시민 위크 로 새롭게 출발했다. 글로벌 모범시민 위크 는 지난 19일부터 27일까지 9일간 실시하며 코로나19 생활 속 거리 두기를 철저히 준수하면서 개개인이 가진 기술  특기  전문지식 등 재능을 활용한 다양한 비대면 언택트  봉사활동을 펼친다.6 25전쟁 70주년을 맞아 참전용사들의 숭고한 희생과 헌신에 깊이 감사를 표하는 다채로운 활동들도 진행했다. 포항에서는 호국보훈 기념장소인 학도의용군 전승기념관에서 조경 및 환경미화 봉사활동을 펼치고  태국에서는 현지법인 임직원들이 함께 태국군 한국전쟁 참전 기념관에 영상 시청용 TV를 기증하고 식목 대청소 등 환경정화 활동도 실시했다.특히 포스코는 국가보훈처와 합동으로 포항과 광양에 거주하며 생활이 어려운 6 25 참전용사 가정 40가구를 선발해 주거환경 개선을 지원한다. 이번 지원활동은 도배  전기수리 등 포스코 재능봉사단이 직접 참여하는 집 고쳐주기 사업의 일환으로 지난 20일 광양지역 4가구를 시작으로 10월까지 40가구를 완료할 예정이다.올해 행사에는 사회문제 해결을 위한 협력을 지속해오고 있는 SK가 동참해 의미를 더했다. 작년 12월  2019 기업시민 포스코 성과공유의 장 에서 최태원 SK 회장은 특별강연 초청을 받아 SK의 사회적 가치 활동을 소개하고 그 중요성을 역설한 바 있다.포스코는 25일 사각지대 아동 복지 증진을 위해 결식아동에게 도시락을 지원하는  행복얼라이언스  사업에 SK와 함께 참여하기로 하고 협약식을 개최했다. 협약식에 이어 포스코와 SK 임직원들은 함께 서울지역 저소득 및 노인계층 70가구에 직접 만든 음식과 식품 등을 넣은 도시락 가방을 제작해 전달했다.포스코그룹사들도 기업시민 경영이념 실천활동에 적극 나서고 있다.포스코인터내셔널은 22일 인천지역 중도입국청소년과 함께하는 꽃꽂이 활동 봉사를 했다. 이번 꽃꽂이 활동은 코로나19 장기화와 사회적 거리 두기 일상화로 움츠러든 중도입국청소년들의 정서적 안정을 도모하고 경제적 어려움을 겪고 있는 인천지역 소상공인을 지원하고자 계획됐다. 중도입국청소년은 한국인 배우자와 재혼한 이민자의 자녀로  한국에 거주하는 청소년을 말한다. 코로나19에 따른 대면 접촉 최소화를 위해 본사 사옥 대강당과 학생들이 다니는 인천 새꿈학교 두 곳에서 동시에 이뤄졌다.포스코건설은 지난 21일 연일 코로나19 방역과 진료에 힘쓰는 지역 의료진과 공무원에게 화분을 전달하고 감사를 표시했다. 이번 행사는  화훼농가 돕기 릴레이 캠페인 의 일환으로  포스코건설은 인천시 코로나19 방역대책반과 인천시 산하 31개 지역선별진료소에 해피트리 파키라 등 대형 화분을 전달했다. 화훼농가 돕기 릴레이는 코로나19 확산으로 어려움을 겪는 화훼농가를 지원하고자 지난 2월부터 SNS를 통해 릴레이로 진행되고 있는 공익 캠페인이다.포스코케미칼은 19일 중국 화유코발트와  포스코케미칼 화유코발트 공생펀드  조성 사업 협약을 체결했다. 이번 공생펀드 체결은 양사가 배터리 양극재의 원료인 코발트와 전구체 공급 등의 사업분야 협력을 기반으로  지역사회 기여를 통한 지속 가능성 확보 등 사업 프로세스 전반에 걸쳐 협업을 확대하고 파트너십을 강화하는 차원이다.  장도리   그림마당 보기            및  금지,0.2000000029802322
